quality_attribute,keyword,matched_word,sentence,source,filename,author,repo,version,wiki,url
Availability,error,error,"; None; """"""; """"""Compose a SAM style comment string that encodes a key-value pair; Args:; key: key string; value: value string. Returns:; A SAM style comment representing the key-value pair. """"""; """"""Parse a SAM style comment. Args:; comment_line: a comment string. Returns:; Key-value pair represented by a SAM style comment; """"""; """"""Reads a vector or matrix ndarray from .tsv file. Args:; input_file: input .tsv file; comment: comment character; delimiter: delimiter character. Returns:; ndarray; """"""; """"""Extracts the variable-to-linear-array of a PyMC mean-field approximation. Args:; approx: an instance of PyMC mean-field approximation. Returns:; A list of VarMap; """"""; # Originally, with PyMC3 3.5, this simply returned a List[pymc3.blocking.VarMap]:; # return approx.bij.ordering.vmap; # However, changes were made to the API and the VarMap class was obviated by the use of Xarray, see:; # https://discourse.pymc.io/t/how-to-get-named-means-and-sds-from-advi-fit/11073; # Unfortunately, this new functionality appears to be somewhat brittle and yields an error in our use case.; # We instead bring the old VarMap class into this module and recreate the old functionality to; # preserve our preexisting interfaces.; """"""Extracts mean-field posterior parameters in the right shape and dtype from an instance; of PyMC mean-field approximation. Args:; approx: an instance of PyMC mean-field approximation. Returns:; A tuple (set of variable names,; map from variable names to their respective Gaussian means,; map from variable names to their respective Gaussian standard deviations); """"""; """"""Writes a dictionary to JSON file. Args:; output_file: output .json file; dict_to_write: dictionary to write to file; ignored_keys: a set of keys to ignore; """"""; # json.dump does not add newline to end of file; """"""Reads gcnvkernel version from a JSON file and issues a warning if it is created with a different; version of the module. Args:; gcnvkernel_version_json_file: input .json file containing gcnvkern",MatchSource.CODE_COMMENT,src/main/python/org/broadinstitute/hellbender/gcnvkernel/io/io_commons.py,broadinstitute,gatk,4.6.0.0,https://software.broadinstitute.org/gatk,https://github.com/broadinstitute/gatk/tree/4.6.0.0/src/main/python/org/broadinstitute/hellbender/gcnvkernel/io/io_commons.py
Deployability,update,updated,"ame_set: set of all variable names in the model; approx_mu_map: a map from variable names to their respective Gaussian means; approx_std_map: a map from variable names to their respective Gaussian standard deviations; model: the generalized model corresponding to the provided mean-field approximation; extra_comment_lines: (optional) additional comment lines to write to the header of each output file; """"""; """"""Writes global parameters contained in an instance of PyMC mean-field approximation to disk. Args:; output_path: output path (must be writable); approx: an instance of PyMC mean-field approximation; model: the generalized model corresponding to the provided mean-field approximation; """"""; # parse mean-field posterior parameters; """"""Reads global parameters of a given model from saved mean-field posteriors and injects them; into a provided mean-field instance. Args:; input_model_path: input model path; approx: an instance of PyMC mean-field approximation to be updated; model: the generalized model corresponding to the provided mean-field approximation and the saved; instance; """"""; # convert std to rho, see pymc.dist_math.sd2rho; """"""Reads sample-specific parameters of a given sample from saved mean-field posteriors and injects them; into a provided mean-field instance. Args:; input_sample_calls_path: path to saved sample-specific posteriors; sample_index: index of the sample in the current instance of model/approximation; sample_name: name of the sample in the current instance of model/approximation; (used to check whether `input_sample_calls_path` actually corresponds to the sample); approx: an instance of PyMC mean-field approximation corresponding to the provided model; model: the generalized model corresponding to the provided mean-field approximation. Returns:; None; """"""; """"""Updates the ndarray buffer of the shared parameter tensor according to a given sample-specific; parameter for a given sample index. Args:; _param: ndarray buffer of the shared parameter tenso",MatchSource.CODE_COMMENT,src/main/python/org/broadinstitute/hellbender/gcnvkernel/io/io_commons.py,broadinstitute,gatk,4.6.0.0,https://software.broadinstitute.org/gatk,https://github.com/broadinstitute/gatk/tree/4.6.0.0/src/main/python/org/broadinstitute/hellbender/gcnvkernel/io/io_commons.py
Integrability,interface,interfaces,"omment representing the key-value pair. """"""; """"""Parse a SAM style comment. Args:; comment_line: a comment string. Returns:; Key-value pair represented by a SAM style comment; """"""; """"""Reads a vector or matrix ndarray from .tsv file. Args:; input_file: input .tsv file; comment: comment character; delimiter: delimiter character. Returns:; ndarray; """"""; """"""Extracts the variable-to-linear-array of a PyMC mean-field approximation. Args:; approx: an instance of PyMC mean-field approximation. Returns:; A list of VarMap; """"""; # Originally, with PyMC3 3.5, this simply returned a List[pymc3.blocking.VarMap]:; # return approx.bij.ordering.vmap; # However, changes were made to the API and the VarMap class was obviated by the use of Xarray, see:; # https://discourse.pymc.io/t/how-to-get-named-means-and-sds-from-advi-fit/11073; # Unfortunately, this new functionality appears to be somewhat brittle and yields an error in our use case.; # We instead bring the old VarMap class into this module and recreate the old functionality to; # preserve our preexisting interfaces.; """"""Extracts mean-field posterior parameters in the right shape and dtype from an instance; of PyMC mean-field approximation. Args:; approx: an instance of PyMC mean-field approximation. Returns:; A tuple (set of variable names,; map from variable names to their respective Gaussian means,; map from variable names to their respective Gaussian standard deviations); """"""; """"""Writes a dictionary to JSON file. Args:; output_file: output .json file; dict_to_write: dictionary to write to file; ignored_keys: a set of keys to ignore; """"""; # json.dump does not add newline to end of file; """"""Reads gcnvkernel version from a JSON file and issues a warning if it is created with a different; version of the module. Args:; gcnvkernel_version_json_file: input .json file containing gcnvkernel version; """"""; """"""Reads gcnvkernel version from a path that contains `io_consts.default_gcnvkernel_version_json_filename`,; reads the gcnvkernel ver",MatchSource.CODE_COMMENT,src/main/python/org/broadinstitute/hellbender/gcnvkernel/io/io_commons.py,broadinstitute,gatk,4.6.0.0,https://software.broadinstitute.org/gatk,https://github.com/broadinstitute/gatk/tree/4.6.0.0/src/main/python/org/broadinstitute/hellbender/gcnvkernel/io/io_commons.py
Modifiability,variab,variable-to-linear-array,"array to .tsv file. Note:; Shape and dtype information are stored in the header. Args:; output_file: output .tsv file; array: array to write to .tsv; comment: comment character; delimiter: delimiter character; extra_comment_lines: (optional) list of extra comment lines to add to the header; column_name_str: header line (e.g. for representing the ndarray as a table with named columns); write_shape_info: if True, ndarray shape info will be written to the header. Returns:; None; """"""; """"""Compose a SAM style comment string that encodes a key-value pair; Args:; key: key string; value: value string. Returns:; A SAM style comment representing the key-value pair. """"""; """"""Parse a SAM style comment. Args:; comment_line: a comment string. Returns:; Key-value pair represented by a SAM style comment; """"""; """"""Reads a vector or matrix ndarray from .tsv file. Args:; input_file: input .tsv file; comment: comment character; delimiter: delimiter character. Returns:; ndarray; """"""; """"""Extracts the variable-to-linear-array of a PyMC mean-field approximation. Args:; approx: an instance of PyMC mean-field approximation. Returns:; A list of VarMap; """"""; # Originally, with PyMC3 3.5, this simply returned a List[pymc3.blocking.VarMap]:; # return approx.bij.ordering.vmap; # However, changes were made to the API and the VarMap class was obviated by the use of Xarray, see:; # https://discourse.pymc.io/t/how-to-get-named-means-and-sds-from-advi-fit/11073; # Unfortunately, this new functionality appears to be somewhat brittle and yields an error in our use case.; # We instead bring the old VarMap class into this module and recreate the old functionality to; # preserve our preexisting interfaces.; """"""Extracts mean-field posterior parameters in the right shape and dtype from an instance; of PyMC mean-field approximation. Args:; approx: an instance of PyMC mean-field approximation. Returns:; A tuple (set of variable names,; map from variable names to their respective Gaussian means,; map from variable ",MatchSource.CODE_COMMENT,src/main/python/org/broadinstitute/hellbender/gcnvkernel/io/io_commons.py,broadinstitute,gatk,4.6.0.0,https://software.broadinstitute.org/gatk,https://github.com/broadinstitute/gatk/tree/4.6.0.0/src/main/python/org/broadinstitute/hellbender/gcnvkernel/io/io_commons.py
Security,inject,injects,"ssues a warning if it is created with a different version of the module. Args:; input_path:; """"""; """"""Writes sample-specific parameters contained in an instance of PyMC mean-field approximation; to disk. Args:; sample_index: sample integer index; sample_posterior_path: output path (must be writable); approx_var_name_set: set of all variable names in the model; approx_mu_map: a map from variable names to their respective Gaussian means; approx_std_map: a map from variable names to their respective Gaussian standard deviations; model: the generalized model corresponding to the provided mean-field approximation; extra_comment_lines: (optional) additional comment lines to write to the header of each output file; """"""; """"""Writes global parameters contained in an instance of PyMC mean-field approximation to disk. Args:; output_path: output path (must be writable); approx: an instance of PyMC mean-field approximation; model: the generalized model corresponding to the provided mean-field approximation; """"""; # parse mean-field posterior parameters; """"""Reads global parameters of a given model from saved mean-field posteriors and injects them; into a provided mean-field instance. Args:; input_model_path: input model path; approx: an instance of PyMC mean-field approximation to be updated; model: the generalized model corresponding to the provided mean-field approximation and the saved; instance; """"""; # convert std to rho, see pymc.dist_math.sd2rho; """"""Reads sample-specific parameters of a given sample from saved mean-field posteriors and injects them; into a provided mean-field instance. Args:; input_sample_calls_path: path to saved sample-specific posteriors; sample_index: index of the sample in the current instance of model/approximation; sample_name: name of the sample in the current instance of model/approximation; (used to check whether `input_sample_calls_path` actually corresponds to the sample); approx: an instance of PyMC mean-field approximation corresponding to the pro",MatchSource.CODE_COMMENT,src/main/python/org/broadinstitute/hellbender/gcnvkernel/io/io_commons.py,broadinstitute,gatk,4.6.0.0,https://software.broadinstitute.org/gatk,https://github.com/broadinstitute/gatk/tree/4.6.0.0/src/main/python/org/broadinstitute/hellbender/gcnvkernel/io/io_commons.py
Usability,simpl,simply,"limiter character; extra_comment_lines: (optional) list of extra comment lines to add to the header; column_name_str: header line (e.g. for representing the ndarray as a table with named columns); write_shape_info: if True, ndarray shape info will be written to the header. Returns:; None; """"""; """"""Compose a SAM style comment string that encodes a key-value pair; Args:; key: key string; value: value string. Returns:; A SAM style comment representing the key-value pair. """"""; """"""Parse a SAM style comment. Args:; comment_line: a comment string. Returns:; Key-value pair represented by a SAM style comment; """"""; """"""Reads a vector or matrix ndarray from .tsv file. Args:; input_file: input .tsv file; comment: comment character; delimiter: delimiter character. Returns:; ndarray; """"""; """"""Extracts the variable-to-linear-array of a PyMC mean-field approximation. Args:; approx: an instance of PyMC mean-field approximation. Returns:; A list of VarMap; """"""; # Originally, with PyMC3 3.5, this simply returned a List[pymc3.blocking.VarMap]:; # return approx.bij.ordering.vmap; # However, changes were made to the API and the VarMap class was obviated by the use of Xarray, see:; # https://discourse.pymc.io/t/how-to-get-named-means-and-sds-from-advi-fit/11073; # Unfortunately, this new functionality appears to be somewhat brittle and yields an error in our use case.; # We instead bring the old VarMap class into this module and recreate the old functionality to; # preserve our preexisting interfaces.; """"""Extracts mean-field posterior parameters in the right shape and dtype from an instance; of PyMC mean-field approximation. Args:; approx: an instance of PyMC mean-field approximation. Returns:; A tuple (set of variable names,; map from variable names to their respective Gaussian means,; map from variable names to their respective Gaussian standard deviations); """"""; """"""Writes a dictionary to JSON file. Args:; output_file: output .json file; dict_to_write: dictionary to write to file; ignored_k",MatchSource.CODE_COMMENT,src/main/python/org/broadinstitute/hellbender/gcnvkernel/io/io_commons.py,broadinstitute,gatk,4.6.0.0,https://software.broadinstitute.org/gatk,https://github.com/broadinstitute/gatk/tree/4.6.0.0/src/main/python/org/broadinstitute/hellbender/gcnvkernel/io/io_commons.py
Deployability,configurat,configurations,"# interval list .tsv file column names; # prefix for saving posteriors for multiple samples; # log copy number posterior matrix column name prefix for each integer copy number state; # generic column prefix; # ploidy prior table header column names; # column names for ploidy and depth .tsv outputs; # column names for copy-number segments file; # column name for baseline copy-number file; # column name for denoised copy-number files; # regular expression for matching sample name from header comment line; # prefix for adding sample name as a header comment line; # SAM header comment tag; # regular expression for matching key value pair from SAM comment line; # SAM style comment characters; # key values for storing array type in shape information; # dtype dictionaries giving types of mandatory columns whose names are known ahead of time; # (some of these dictionaries are not currently used, but we define their formats for future reference); # default file names for loading and saving models, posteriors, and configurations; # default exit code that indicates that inference diverged; # note that it needs to be in sync with the corresponding constant in GermlineCNVCaller",MatchSource.CODE_COMMENT,src/main/python/org/broadinstitute/hellbender/gcnvkernel/io/io_consts.py,broadinstitute,gatk,4.6.0.0,https://software.broadinstitute.org/gatk,https://github.com/broadinstitute/gatk/tree/4.6.0.0/src/main/python/org/broadinstitute/hellbender/gcnvkernel/io/io_consts.py
Modifiability,config,configurations,"# interval list .tsv file column names; # prefix for saving posteriors for multiple samples; # log copy number posterior matrix column name prefix for each integer copy number state; # generic column prefix; # ploidy prior table header column names; # column names for ploidy and depth .tsv outputs; # column names for copy-number segments file; # column name for baseline copy-number file; # column name for denoised copy-number files; # regular expression for matching sample name from header comment line; # prefix for adding sample name as a header comment line; # SAM header comment tag; # regular expression for matching key value pair from SAM comment line; # SAM style comment characters; # key values for storing array type in shape information; # dtype dictionaries giving types of mandatory columns whose names are known ahead of time; # (some of these dictionaries are not currently used, but we define their formats for future reference); # default file names for loading and saving models, posteriors, and configurations; # default exit code that indicates that inference diverged; # note that it needs to be in sync with the corresponding constant in GermlineCNVCaller",MatchSource.CODE_COMMENT,src/main/python/org/broadinstitute/hellbender/gcnvkernel/io/io_consts.py,broadinstitute,gatk,4.6.0.0,https://software.broadinstitute.org/gatk,https://github.com/broadinstitute/gatk/tree/4.6.0.0/src/main/python/org/broadinstitute/hellbender/gcnvkernel/io/io_consts.py
Performance,load,loading,"# interval list .tsv file column names; # prefix for saving posteriors for multiple samples; # log copy number posterior matrix column name prefix for each integer copy number state; # generic column prefix; # ploidy prior table header column names; # column names for ploidy and depth .tsv outputs; # column names for copy-number segments file; # column name for baseline copy-number file; # column name for denoised copy-number files; # regular expression for matching sample name from header comment line; # prefix for adding sample name as a header comment line; # SAM header comment tag; # regular expression for matching key value pair from SAM comment line; # SAM style comment characters; # key values for storing array type in shape information; # dtype dictionaries giving types of mandatory columns whose names are known ahead of time; # (some of these dictionaries are not currently used, but we define their formats for future reference); # default file names for loading and saving models, posteriors, and configurations; # default exit code that indicates that inference diverged; # note that it needs to be in sync with the corresponding constant in GermlineCNVCaller",MatchSource.CODE_COMMENT,src/main/python/org/broadinstitute/hellbender/gcnvkernel/io/io_consts.py,broadinstitute,gatk,4.6.0.0,https://software.broadinstitute.org/gatk,https://github.com/broadinstitute/gatk/tree/4.6.0.0/src/main/python/org/broadinstitute/hellbender/gcnvkernel/io/io_consts.py
Testability,log,log,"# interval list .tsv file column names; # prefix for saving posteriors for multiple samples; # log copy number posterior matrix column name prefix for each integer copy number state; # generic column prefix; # ploidy prior table header column names; # column names for ploidy and depth .tsv outputs; # column names for copy-number segments file; # column name for baseline copy-number file; # column name for denoised copy-number files; # regular expression for matching sample name from header comment line; # prefix for adding sample name as a header comment line; # SAM header comment tag; # regular expression for matching key value pair from SAM comment line; # SAM style comment characters; # key values for storing array type in shape information; # dtype dictionaries giving types of mandatory columns whose names are known ahead of time; # (some of these dictionaries are not currently used, but we define their formats for future reference); # default file names for loading and saving models, posteriors, and configurations; # default exit code that indicates that inference diverged; # note that it needs to be in sync with the corresponding constant in GermlineCNVCaller",MatchSource.CODE_COMMENT,src/main/python/org/broadinstitute/hellbender/gcnvkernel/io/io_consts.py,broadinstitute,gatk,4.6.0.0,https://software.broadinstitute.org/gatk,https://github.com/broadinstitute/gatk/tree/4.6.0.0/src/main/python/org/broadinstitute/hellbender/gcnvkernel/io/io_consts.py
Deployability,update,update,"""""""Writes global denoising model parameters to disk.""""""; # write gcnvkernel version; # write denoising config; # write calling config; # write global variables in the workspace; # write global variables in the posterior; """"""Reads global denoising model parameters from disk.""""""; # check if the model is created with the same gcnvkernel version; # read global workspace variables; # read global posterior parameters; """"""Writes sample-specific model parameters and associated workspace variables to disk.""""""; # write gcnvkernel version; # write denoising config; # write calling config; # extract mean-field parameters; # compute approximate denoised copy ratios; # write sample-specific posteriors in the approximation; # write sample name; # write copy number log posterior; # write copy number log emission; # write baseline copy numbers; # write denoised copy ratio means; # write denoised copy ratio standard deviations; """"""Reads sample-specific model parameters and associated workspace variables from disk.""""""; """"""Reads a TSV-formatted dim-2 (intervals x copy-number) ndarray from a sample posterior path.""""""; # assert that the interval list is the same; # read sample-specific posteriors and update approximation; # read copy number posterior and emission and update workspace; # update auxiliary workspace variables",MatchSource.CODE_COMMENT,src/main/python/org/broadinstitute/hellbender/gcnvkernel/io/io_denoising_calling.py,broadinstitute,gatk,4.6.0.0,https://software.broadinstitute.org/gatk,https://github.com/broadinstitute/gatk/tree/4.6.0.0/src/main/python/org/broadinstitute/hellbender/gcnvkernel/io/io_denoising_calling.py
Modifiability,config,config,"""""""Writes global denoising model parameters to disk.""""""; # write gcnvkernel version; # write denoising config; # write calling config; # write global variables in the workspace; # write global variables in the posterior; """"""Reads global denoising model parameters from disk.""""""; # check if the model is created with the same gcnvkernel version; # read global workspace variables; # read global posterior parameters; """"""Writes sample-specific model parameters and associated workspace variables to disk.""""""; # write gcnvkernel version; # write denoising config; # write calling config; # extract mean-field parameters; # compute approximate denoised copy ratios; # write sample-specific posteriors in the approximation; # write sample name; # write copy number log posterior; # write copy number log emission; # write baseline copy numbers; # write denoised copy ratio means; # write denoised copy ratio standard deviations; """"""Reads sample-specific model parameters and associated workspace variables from disk.""""""; """"""Reads a TSV-formatted dim-2 (intervals x copy-number) ndarray from a sample posterior path.""""""; # assert that the interval list is the same; # read sample-specific posteriors and update approximation; # read copy number posterior and emission and update workspace; # update auxiliary workspace variables",MatchSource.CODE_COMMENT,src/main/python/org/broadinstitute/hellbender/gcnvkernel/io/io_denoising_calling.py,broadinstitute,gatk,4.6.0.0,https://software.broadinstitute.org/gatk,https://github.com/broadinstitute/gatk/tree/4.6.0.0/src/main/python/org/broadinstitute/hellbender/gcnvkernel/io/io_denoising_calling.py
Testability,log,log,"""""""Writes global denoising model parameters to disk.""""""; # write gcnvkernel version; # write denoising config; # write calling config; # write global variables in the workspace; # write global variables in the posterior; """"""Reads global denoising model parameters from disk.""""""; # check if the model is created with the same gcnvkernel version; # read global workspace variables; # read global posterior parameters; """"""Writes sample-specific model parameters and associated workspace variables to disk.""""""; # write gcnvkernel version; # write denoising config; # write calling config; # extract mean-field parameters; # compute approximate denoised copy ratios; # write sample-specific posteriors in the approximation; # write sample name; # write copy number log posterior; # write copy number log emission; # write baseline copy numbers; # write denoised copy ratio means; # write denoised copy ratio standard deviations; """"""Reads sample-specific model parameters and associated workspace variables from disk.""""""; """"""Reads a TSV-formatted dim-2 (intervals x copy-number) ndarray from a sample posterior path.""""""; # assert that the interval list is the same; # read sample-specific posteriors and update approximation; # read copy number posterior and emission and update workspace; # update auxiliary workspace variables",MatchSource.CODE_COMMENT,src/main/python/org/broadinstitute/hellbender/gcnvkernel/io/io_denoising_calling.py,broadinstitute,gatk,4.6.0.0,https://software.broadinstitute.org/gatk,https://github.com/broadinstitute/gatk/tree/4.6.0.0/src/main/python/org/broadinstitute/hellbender/gcnvkernel/io/io_denoising_calling.py
