quality_attribute,keyword,matched_word,sentence,source,author,repo,version,url
Usability,simpl,simple,"I also had a request to test this “across the ocean”, so if you could try to compare before/after by running something simple using data at CERN (or let me know of a file publicly avaiable via XRootD in Fermilab or other location in the US), I would appreciate it.",MatchSource.ISSUE_COMMENT,root-project,root,v6-32-06,https://github.com/root-project/root/pull/11644#issuecomment-1308989870
Usability,simpl,simple,> so if you could try to compare before/after by running something simple using data at CERN,MatchSource.ISSUE_COMMENT,root-project,root,v6-32-06,https://github.com/root-project/root/pull/11644#issuecomment-1309267711
Usability,simpl,simply,The test can simply check whether the output of `createNLL` is `0`.,MatchSource.ISSUE_COMMENT,root-project,root,v6-32-06,https://github.com/root-project/root/pull/11650#issuecomment-1330379864
Usability,clear,clear,"If we enable ORCV2 asynchronous compilation, it is clear we have to enable threading support in LLVM.",MatchSource.ISSUE_COMMENT,root-project,root,v6-32-06,https://github.com/root-project/root/issues/11699#issuecomment-1312791296
Usability,clear,clear,It makes it clear that `main()` already exists.,MatchSource.ISSUE_COMMENT,root-project,root,v6-32-06,https://github.com/root-project/root/issues/11707#issuecomment-1315410117
Usability,clear,clear,It makes it clear that `main()` already exists.,MatchSource.ISSUE_COMMENT,root-project,root,v6-32-06,https://github.com/root-project/root/issues/11707#issuecomment-1315414134
Usability,clear,clear,Maybe it can be made more clear but the message comes from [here](https://github.,MatchSource.ISSUE_COMMENT,root-project,root,v6-32-06,https://github.com/root-project/root/issues/11707#issuecomment-1315426448
Usability,clear,clearer,So it will not be easy to make it clearer there.,MatchSource.ISSUE_COMMENT,root-project,root,v6-32-06,https://github.com/root-project/root/issues/11707#issuecomment-1315426448
Usability,simpl,simple,"Of course, that would break views on simple types with read callback.",MatchSource.ISSUE_COMMENT,root-project,root,v6-32-06,https://github.com/root-project/root/pull/11731#issuecomment-1334547546
Usability,simpl,simply,One way to deal with it is to simply not allow creating a view on a field with a mappable type and a read callback.,MatchSource.ISSUE_COMMENT,root-project,root,v6-32-06,https://github.com/root-project/root/pull/11731#issuecomment-1334547546
Usability,simpl,simply,Can't you simply use the `-Dbuiltin_xrootd=ON` option?,MatchSource.ISSUE_COMMENT,root-project,root,v6-32-06,https://github.com/root-project/root/issues/11750#issuecomment-1339375009
Usability,feedback,feedback,"This will fix issues happening with fits using the `G` option (external gradient) and in addition, will give us more feedback on using an external Hessian computation.",MatchSource.ISSUE_COMMENT,root-project,root,v6-32-06,https://github.com/root-project/root/pull/11755#issuecomment-1357810874
Usability,simpl,simpler,I think that the suggestion should also fix it (and is simpler) 🙂.,MatchSource.ISSUE_COMMENT,root-project,root,v6-32-06,https://github.com/root-project/root/pull/11782#issuecomment-1327938951
Usability,simpl,simpler,I think that the suggestion should also fix it (and is simpler) slightly_smiling_face.,MatchSource.ISSUE_COMMENT,root-project,root,v6-32-06,https://github.com/root-project/root/pull/11782#issuecomment-1327939751
Usability,simpl,simpler,I think that the suggestion should also fix it (and is simpler) slightly_smiling_face.,MatchSource.ISSUE_COMMENT,root-project,root,v6-32-06,https://github.com/root-project/root/pull/11782#issuecomment-1327943698
Usability,simpl,simple,> behavior and also not so simple to implement rigorously.,MatchSource.ISSUE_COMMENT,root-project,root,v6-32-06,https://github.com/root-project/root/pull/11789#issuecomment-1329220374
Usability,clear,clear,I've also changed `LogTimings` to `TimingAnalysis` to it is clear that it is different to the existing profiling and allows for a bit more of an in-depth analysis.,MatchSource.ISSUE_COMMENT,root-project,root,v6-32-06,https://github.com/root-project/root/pull/11791#issuecomment-1354447607
Usability,simpl,simply,I did not add the test that you requested yet since I noticed it required some more changes to the `RooFit::MultiProcessing` then simply implementing the test.,MatchSource.ISSUE_COMMENT,root-project,root,v6-32-06,https://github.com/root-project/root/pull/11791#issuecomment-1354447607
Usability,simpl,simplify,- At this point you could simplify the build configuration to:,MatchSource.ISSUE_COMMENT,root-project,root,v6-32-06,https://github.com/root-project/root/issues/11797#issuecomment-1339057027
Usability,clear,clear,"And to be clear, for `SearchInstalledSoftware` I would leave everything as proposed in Attila's commit but the change to `target_include_directories` with the two generator expressions.",MatchSource.ISSUE_COMMENT,root-project,root,v6-32-06,https://github.com/root-project/root/issues/11797#issuecomment-1339660363
Usability,simpl,simpler,Also this simpler reproducer never causes a segfault:,MatchSource.ISSUE_COMMENT,root-project,root,v6-32-06,https://github.com/root-project/root/issues/11823#issuecomment-1337020095
Usability,simpl,simpler,"the simpler reproducer does not throw any errors, and removing the extra outfile.",MatchSource.ISSUE_COMMENT,root-project,root,v6-32-06,https://github.com/root-project/root/issues/11823#issuecomment-1347823222
Usability,learn,learned,That's a lesson usually learned the hard way with CMake :-),MatchSource.ISSUE_COMMENT,root-project,root,v6-32-06,https://github.com/root-project/root/pull/11844#issuecomment-1339205080
Usability,usab,usable,"I've seen similar configurations being used for header-only libraries in the past, but never for anything that needed an actual build before becoming usable.",MatchSource.ISSUE_COMMENT,root-project,root,v6-32-06,https://github.com/root-project/root/pull/11844#issuecomment-1339364132
Usability,simpl,simply,Also notice that the issue with the first reproducer might simply be some issue with my attempt to swap the arrow buffers for the std::vector.,MatchSource.ISSUE_COMMENT,root-project,root,v6-32-06,https://github.com/root-project/root/issues/11853#issuecomment-1343199135
Usability,simpl,simpler,An even simpler example which doesn't depend on RDF:,MatchSource.ISSUE_COMMENT,root-project,root,v6-32-06,https://github.com/root-project/root/issues/11854#issuecomment-1341802449
Usability,simpl,simple,"Another very simple example, less serious because at least it fails, but still problematic because it makes debugging very difficult.",MatchSource.ISSUE_COMMENT,root-project,root,v6-32-06,https://github.com/root-project/root/issues/11854#issuecomment-1410720055
Usability,simpl,simply,Would it be an option to simply repeat the lookup without the RAII in case of failure to find an overload?,MatchSource.ISSUE_COMMENT,root-project,root,v6-32-06,https://github.com/root-project/root/issues/11854#issuecomment-1455544084
Usability,simpl,simplifies,"It's only in the error case, where performance isn't as crucial anyway, and simplifies the interplay between PyROOT/cppyy and cling.",MatchSource.ISSUE_COMMENT,root-project,root,v6-32-06,https://github.com/root-project/root/issues/11854#issuecomment-1455544084
Usability,simpl,simple,xx:422:54: warning: using value of simple assignment with ‘volatile’-qualified left operand is deprecated [-Wvolatile],MatchSource.ISSUE_COMMENT,root-project,root,v6-32-06,https://github.com/root-project/root/pull/11874#issuecomment-1361406497
Usability,simpl,simple,xx:422:54: warning: using value of simple assignment with ‘volatile’-qualified left operand is deprecated [-Wvolatile],MatchSource.ISSUE_COMMENT,root-project,root,v6-32-06,https://github.com/root-project/root/pull/11874#issuecomment-1366467620
Usability,simpl,simple,xx:422:54: warning: using value of simple assignment with ‘volatile’-qualified left operand is deprecated [-Wvolatile],MatchSource.ISSUE_COMMENT,root-project,root,v6-32-06,https://github.com/root-project/root/pull/11874#issuecomment-1368960482
Usability,simpl,simple,xx:422:54: warning: using value of simple assignment with ‘volatile’-qualified left operand is deprecated [-Wvolatile],MatchSource.ISSUE_COMMENT,root-project,root,v6-32-06,https://github.com/root-project/root/pull/11874#issuecomment-1376839076
Usability,simpl,simply,"Otherwise I will simply make another PR, so I'm sure not to screw up ;-)",MatchSource.ISSUE_COMMENT,root-project,root,v6-32-06,https://github.com/root-project/root/pull/11892#issuecomment-1351098247
Usability,clear,clearing,"For compatibility with older versions of CMake, option is clearing the",MatchSource.ISSUE_COMMENT,root-project,root,v6-32-06,https://github.com/root-project/root/issues/11920#issuecomment-1370394653
Usability,clear,clearing,"For compatibility with older versions of CMake, option is clearing the",MatchSource.ISSUE_COMMENT,root-project,root,v6-32-06,https://github.com/root-project/root/issues/11920#issuecomment-1370394653
Usability,clear,clearing,"For compatibility with older versions of CMake, option is clearing the",MatchSource.ISSUE_COMMENT,root-project,root,v6-32-06,https://github.com/root-project/root/issues/11920#issuecomment-1370394653
Usability,clear,clearing,"For compatibility with older versions of CMake, option is clearing the",MatchSource.ISSUE_COMMENT,root-project,root,v6-32-06,https://github.com/root-project/root/issues/11920#issuecomment-1370394653
Usability,simpl,simple,In case simple `-m profile` can be helpful:,MatchSource.ISSUE_COMMENT,root-project,root,v6-32-06,https://github.com/root-project/root/issues/11927#issuecomment-1361002552
Usability,clear,clearly,om/OstapHEP/ostap/actions)  tests for my real project clearly show  a jump in bad direction for CPU performance - from something a bit smaller than 2 hours to something exceeding 6 hours with fails due to timeover,MatchSource.ISSUE_COMMENT,root-project,root,v6-32-06,https://github.com/root-project/root/issues/11927#issuecomment-1361014198
Usability,pause,pause,"after very long pause (sorry), I've rerun my tests  with dev3 LCG nightly slot and I see that performance is close  to values  from the start of December.",MatchSource.ISSUE_COMMENT,root-project,root,v6-32-06,https://github.com/root-project/root/issues/11927#issuecomment-1399911161
Usability,simpl,simpler,a simpler reproducer:,MatchSource.ISSUE_COMMENT,root-project,root,v6-32-06,https://github.com/root-project/root/issues/11938#issuecomment-1372092925
Usability,simpl,simple,In the following simple benchmark targeting the `hpx` 1D histogram in `tutorials/hsimple.,MatchSource.ISSUE_COMMENT,root-project,root,v6-32-06,https://github.com/root-project/root/pull/11949#issuecomment-1361867780
Usability,simpl,simpler,"I suggest looking at RCsvDS, RNTupleDS or RArrowDS (ordered from simpler to more complex) for existing implementations of data sources.",MatchSource.ISSUE_COMMENT,root-project,root,v6-32-06,https://github.com/root-project/root/issues/11971#issuecomment-1371082629
Usability,simpl,simple,imple.,MatchSource.ISSUE_COMMENT,root-project,root,v6-32-06,https://github.com/root-project/root/pull/12018#issuecomment-1380358995
Usability,simpl,simple,elector/simple/roottest_root_selector_simple_runtestLoadingSelector/),MatchSource.ISSUE_COMMENT,root-project,root,v6-32-06,https://github.com/root-project/root/pull/12018#issuecomment-1380358995
Usability,simpl,simple,imple.,MatchSource.ISSUE_COMMENT,root-project,root,v6-32-06,https://github.com/root-project/root/pull/12018#issuecomment-1380875995
Usability,simpl,simple,elector/simple/roottest_root_selector_simple_runtestLoadingSelector/),MatchSource.ISSUE_COMMENT,root-project,root,v6-32-06,https://github.com/root-project/root/pull/12018#issuecomment-1380875995
Usability,simpl,simple,imple.,MatchSource.ISSUE_COMMENT,root-project,root,v6-32-06,https://github.com/root-project/root/pull/12018#issuecomment-1380914798
Usability,simpl,simple,elector/simple/roottest_root_selector_simple_runtestLoadingSelector/),MatchSource.ISSUE_COMMENT,root-project,root,v6-32-06,https://github.com/root-project/root/pull/12018#issuecomment-1380914798
Usability,undo,undocumented,"Instead of `-Wl,-w` (which suppress all warnings), an undocumented options seems to be `-Xlinker -no_fixup_chains` (humm I guess actually maybe `-Wl,-no_fixup_chains`)",MatchSource.ISSUE_COMMENT,root-project,root,v6-32-06,https://github.com/root-project/root/pull/12045#issuecomment-1385813529
Usability,undo,undocumented,"> Instead of -Wl,-w (which suppress all warnings), an undocumented options seems to be -Xlinker -no_fixup_chains (humm I guess actually maybe -Wl,-no_fixup_chains)",MatchSource.ISSUE_COMMENT,root-project,root,v6-32-06,https://github.com/root-project/root/pull/12045#issuecomment-1386778190
Usability,simpl,simple,"This made me think that maybe TRef is the problem, and indeed replacind the TRef with simple indices solved the problem.",MatchSource.ISSUE_COMMENT,root-project,root,v6-32-06,https://github.com/root-project/root/pull/12061#issuecomment-1397463096
Usability,simpl,simplified,"* The problem of `histhistdrawv7testUnit` can be simplified, in some approximation, to:",MatchSource.ISSUE_COMMENT,root-project,root,v6-32-06,https://github.com/root-project/root/pull/12062#issuecomment-1419006181
Usability,simpl,simpler,"* Even simpler, just trying to create an object of that template instantiation fails:",MatchSource.ISSUE_COMMENT,root-project,root,v6-32-06,https://github.com/root-project/root/pull/12062#issuecomment-1419006181
Usability,simpl,simplified,">     * The problem of `histhistdrawv7testUnit` can be simplified, in some approximation, to:",MatchSource.ISSUE_COMMENT,root-project,root,v6-32-06,https://github.com/root-project/root/pull/12062#issuecomment-1419265262
Usability,simpl,simpler,">     * Even simpler, just trying to create an object of that template instantiation fails:",MatchSource.ISSUE_COMMENT,root-project,root,v6-32-06,https://github.com/root-project/root/pull/12062#issuecomment-1419265262
Usability,simpl,simple,I've been stumbling upon these before: this is not simple as it has some template parameter pack expansion as part of the class inheritance chain.,MatchSource.ISSUE_COMMENT,root-project,root,v6-32-06,https://github.com/root-project/root/pull/12062#issuecomment-1419265262
Usability,simpl,simple,It can be reproduced with this simple excerpt (compile with `g++ -Werror=dangling-reference`).,MatchSource.ISSUE_COMMENT,root-project,root,v6-32-06,https://github.com/root-project/root/pull/12085#issuecomment-1403615900
Usability,clear,clearer,+1 as it make `diffs` clearer in case of change to the member initialization.,MatchSource.ISSUE_COMMENT,root-project,root,v6-32-06,https://github.com/root-project/root/pull/12102#issuecomment-1419337842
Usability,learn,learned,Just because I learned to not trust the lifetime of GitHub comments: this refers to the comment,MatchSource.ISSUE_COMMENT,root-project,root,v6-32-06,https://github.com/root-project/root/issues/12116#issuecomment-1405620021
Usability,clear,clearer,"I've updated the text, I believe it is now clearer and more to the point.",MatchSource.ISSUE_COMMENT,root-project,root,v6-32-06,https://github.com/root-project/root/pull/12121#issuecomment-1405524377
Usability,usab,usability,So this changeset is mainly about broadening the usability of these types.,MatchSource.ISSUE_COMMENT,root-project,root,v6-32-06,https://github.com/root-project/root/pull/12140#issuecomment-1410407239
Usability,clear,clear,"Not clear why, investigating.",MatchSource.ISSUE_COMMENT,root-project,root,v6-32-06,https://github.com/root-project/root/pull/12149#issuecomment-1661811809
Usability,clear,clear,"Not clear why, investigating.",MatchSource.ISSUE_COMMENT,root-project,root,v6-32-06,https://github.com/root-project/root/pull/12149#issuecomment-1661819517
Usability,simpl,simple,It is really simple to check what gets linked in with a debugger if you have the setup done already.,MatchSource.ISSUE_COMMENT,root-project,root,v6-32-06,https://github.com/root-project/root/issues/12156#issuecomment-1665604004
Usability,simpl,simple,> It is really simple to check what gets linked in with a debugger if you have the setup done already.,MatchSource.ISSUE_COMMENT,root-project,root,v6-32-06,https://github.com/root-project/root/issues/12156#issuecomment-1666915077
Usability,simpl,simple,"I created a simple example that links against ROOT and a different LLVM version, that worked without issue.",MatchSource.ISSUE_COMMENT,root-project,root,v6-32-06,https://github.com/root-project/root/issues/12156#issuecomment-1666915077
Usability,simpl,simple,"sounds both plausible and simple :-) Let us know, please!",MatchSource.ISSUE_COMMENT,root-project,root,v6-32-06,https://github.com/root-project/root/issues/12156#issuecomment-1666916384
Usability,simpl,simple,"> sounds both plausible and simple :-) Let us know, please!",MatchSource.ISSUE_COMMENT,root-project,root,v6-32-06,https://github.com/root-project/root/issues/12156#issuecomment-1666920625
Usability,simpl,simple,"As it turns out, it is a ""simple"" 2 line fix:",MatchSource.ISSUE_COMMENT,root-project,root,v6-32-06,https://github.com/root-project/root/issues/12156#issuecomment-1666954709
Usability,simpl,simple,"As it turns out, it is a ""simple"" 2 line fix: [stephanlachnit@65ae229](https://github.",MatchSource.ISSUE_COMMENT,root-project,root,v6-32-06,https://github.com/root-project/root/issues/12156#issuecomment-1668344363
Usability,simpl,simple,A simple workaround is to use different variable names for the function-local constants.,MatchSource.ISSUE_COMMENT,root-project,root,v6-32-06,https://github.com/root-project/root/issues/12164#issuecomment-1410380142
Usability,simpl,simple,This is another simple reproducible example:,MatchSource.ISSUE_COMMENT,root-project,root,v6-32-06,https://github.com/root-project/root/issues/12164#issuecomment-1410442720
Usability,clear,clear,"Just to be clear, that applies only to RooEffGenContex.",MatchSource.ISSUE_COMMENT,root-project,root,v6-32-06,https://github.com/root-project/root/pull/12178#issuecomment-1410285135
Usability,simpl,simple,But there is a simple workaround: you can just use `TPython::Exec()` and bring the string to the C++ world with an output variable.,MatchSource.ISSUE_COMMENT,root-project,root,v6-32-06,https://github.com/root-project/root/issues/12182#issuecomment-2270986830
Usability,clear,clearing,":131:24: warning: ‘void* memset(void*, int, size_t)’ clearing an object of type ‘struct tbb::interface5::internal::hash_map_base::bucket’ with no trivial copy-assignment; use value-initialization instead [-Wclass-memaccess]",MatchSource.ISSUE_COMMENT,root-project,root,v6-32-06,https://github.com/root-project/root/pull/12187#issuecomment-1412117260
Usability,simpl,simple,"I understand that the CI workflow can be maliciously changed - but a change to the CI workflow is a very visible change, more than a simple addition of `print some credential file` as part of the build system.",MatchSource.ISSUE_COMMENT,root-project,root,v6-32-06,https://github.com/root-project/root/pull/12201#issuecomment-1412357738
Usability,simpl,simple,"I understand that the CI workflow can be maliciously changed - but a change to the CI workflow is a very visible change, more than a simple addition of `print some credential file` as part of the build system.",MatchSource.ISSUE_COMMENT,root-project,root,v6-32-06,https://github.com/root-project/root/pull/12201#issuecomment-1412402025
Usability,simpl,simple,"I think it may be nicer to make a simple wrapper class `LikelihoodOffset` that holds the shared_ptrs to the vectors, does the swapping, and a few other things.",MatchSource.ISSUE_COMMENT,root-project,root,v6-32-06,https://github.com/root-project/root/pull/12202#issuecomment-2091419386
Usability,simpl,simply,I think much of this would cause churn without much benefit on the users' side: they would simply hate us for littering them with deprecation warnings that they just don't care about.,MatchSource.ISSUE_COMMENT,root-project,root,v6-32-06,https://github.com/root-project/root/issues/12208#issuecomment-1413764933
Usability,clear,clearing,":131:24: warning: ‘void* memset(void*, int, size_t)’ clearing an object of type ‘struct tbb::interface5::internal::hash_map_base::bucket’ with no trivial copy-assignment; use value-initialization instead [-Wclass-memaccess]",MatchSource.ISSUE_COMMENT,root-project,root,v6-32-06,https://github.com/root-project/root/pull/12211#issuecomment-1414055652
Usability,clear,clear,The commit message seems pretty clear to me.,MatchSource.ISSUE_COMMENT,root-project,root,v6-32-06,https://github.com/root-project/root/pull/12276#issuecomment-1427114379
Usability,simpl,simply,I simply wanted to add an explanation why Philippe suggests the inclusion of the actual diagnostic (and why I found it convincing and do it ever since he propose it to me).,MatchSource.ISSUE_COMMENT,root-project,root,v6-32-06,https://github.com/root-project/root/pull/12276#issuecomment-1429251757
Usability,simpl,simply,I simply wanted to add an explanation why Philippe suggests the inclusion of the actual diagnostic (and why I found it convincing and do it ever since he propose it to me).,MatchSource.ISSUE_COMMENT,root-project,root,v6-32-06,https://github.com/root-project/root/pull/12276#issuecomment-1430019305
Usability,clear,clearer,I am not sure if pasting a diagnostic from a random system makes this clearer in any form.,MatchSource.ISSUE_COMMENT,root-project,root,v6-32-06,https://github.com/root-project/root/pull/12276#issuecomment-1430019305
Usability,simpl,simple,"This should been just a simple ""approve"" as I thought we needed a quick fix which I developed in between travels and a business trip.",MatchSource.ISSUE_COMMENT,root-project,root,v6-32-06,https://github.com/root-project/root/pull/12276#issuecomment-1430019305
Usability,simpl,simple,This was obviously much more than this seemingly simple fix required.,MatchSource.ISSUE_COMMENT,root-project,root,v6-32-06,https://github.com/root-project/root/pull/12276#issuecomment-1430326540
Usability,simpl,simply,"So instead I thought to ask for a very low cost, straight forward solution: simply copy/pasting the error with no additional effort to explain in detail.",MatchSource.ISSUE_COMMENT,root-project,root,v6-32-06,https://github.com/root-project/root/pull/12276#issuecomment-1430326540
Usability,simpl,simply,It appears that while forcing the use of `RooFoamGenerator` I simply skipped that code path.,MatchSource.ISSUE_COMMENT,root-project,root,v6-32-06,https://github.com/root-project/root/issues/12286#issuecomment-1425901083
Usability,clear,clear,So it is pretty clear that there NaNs in the data.,MatchSource.ISSUE_COMMENT,root-project,root,v6-32-06,https://github.com/root-project/root/issues/12296#issuecomment-1431275163
Usability,clear,clear,Right - @smuzaffar was quite clear that we should separate build failures from test failures.,MatchSource.ISSUE_COMMENT,root-project,root,v6-32-06,https://github.com/root-project/root/issues/12307#issuecomment-1542423864
Usability,clear,clear,I personally don't think the added complexity and less clear ownership when using `shared_ptr` + `weak_ptr` is justified in this case.,MatchSource.ISSUE_COMMENT,root-project,root,v6-32-06,https://github.com/root-project/root/pull/12348#issuecomment-1439898961
Usability,simpl,simplify,I add commit to fix compiler warning and simplify a bit code.,MatchSource.ISSUE_COMMENT,root-project,root,v6-32-06,https://github.com/root-project/root/pull/12349#issuecomment-1479066603
Usability,simpl,simply,"Oh yes, my bad, I simply copied from the line above which is for Apple / macOS.",MatchSource.ISSUE_COMMENT,root-project,root,v6-32-06,https://github.com/root-project/root/pull/12353#issuecomment-1437462950
Usability,clear,clearer,"I have addressed all of them and updated the commits accordingly, also splitting them in smaller commits to make intentions clearer.",MatchSource.ISSUE_COMMENT,root-project,root,v6-32-06,https://github.com/root-project/root/pull/12363#issuecomment-1581162133
Usability,simpl,simple,This helps making the logic in DistRDF more simple (i.,MatchSource.ISSUE_COMMENT,root-project,root,v6-32-06,https://github.com/root-project/root/pull/12363#issuecomment-1581162133
Usability,simpl,simplified,"Added tests for the C++ mechanisms, and attempt at fixing the ubuntu18 failure (see last commit) with a much more simplified approach w.",MatchSource.ISSUE_COMMENT,root-project,root,v6-32-06,https://github.com/root-project/root/pull/12363#issuecomment-1585596942
Usability,simpl,simple,Can you provide a simple reproducer of your case?,MatchSource.ISSUE_COMMENT,root-project,root,v6-32-06,https://github.com/root-project/root/issues/12370#issuecomment-1443741367
Usability,guid,guides,h/guides/build_release/) to build Athena from scratch (on zeus.,MatchSource.ISSUE_COMMENT,root-project,root,v6-32-06,https://github.com/root-project/root/issues/12378#issuecomment-1462615809
Usability,simpl,simply,"Note also that it was simply part of my original assignment: to ensure users can trust the new parallelized methods, I built them to be bit-wise exactly equal to the old methods.",MatchSource.ISSUE_COMMENT,root-project,root,v6-32-06,https://github.com/root-project/root/pull/12389#issuecomment-1538758017
Usability,clear,clear,"""Disabling the test"" can as well be a switch from equality to equality-with-range, as long as the GitHub issue is clear which commit needs to be reverted to reprouce the original test failure.",MatchSource.ISSUE_COMMENT,root-project,root,v6-32-06,https://github.com/root-project/root/pull/12389#issuecomment-1540010898
