quality_attribute,keyword,matched_word,sentence,source,author,repo,version,url
Usability,guid,guide,If you have a step-by-step guide on how to end up with this breakage please let us know and re-open this ticket!,MatchSource.ISSUE_COMMENT,root-project,root,v6-32-06,https://github.com/root-project/root/issues/8178#issuecomment-848621017
Usability,simpl,simple,"I convert into draft, while simple member name change does not work.",MatchSource.ISSUE_COMMENT,root-project,root,v6-32-06,https://github.com/root-project/root/pull/8181#issuecomment-842273434
Usability,feedback,feedback,i/feedback?,MatchSource.ISSUE_COMMENT,root-project,root,v6-32-06,https://github.com/root-project/root/pull/8192#issuecomment-842960413
Usability,feedback,feedback,Thank you for the feedback !,MatchSource.ISSUE_COMMENT,root-project,root,v6-32-06,https://github.com/root-project/root/issues/8196#issuecomment-849462802
Usability,feedback,feedback,"* @brief Generation of pseudo-random bits using a linear feedback shift register (LFSR), until a register value is repeated (or maxPeriod is reached)",MatchSource.ISSUE_COMMENT,root-project,root,v6-32-06,https://github.com/root-project/root/issues/8199#issuecomment-843369054
Usability,simpl,simple,imple.,MatchSource.ISSUE_COMMENT,root-project,root,v6-32-06,https://github.com/root-project/root/pull/8204#issuecomment-844244254
Usability,simpl,simple,elector/simple/roottest_root_selector_simple_runtestLoadingSelector/),MatchSource.ISSUE_COMMENT,root-project,root,v6-32-06,https://github.com/root-project/root/pull/8204#issuecomment-844244254
Usability,simpl,simple,imple.,MatchSource.ISSUE_COMMENT,root-project,root,v6-32-06,https://github.com/root-project/root/pull/8204#issuecomment-844250497
Usability,simpl,simple,elector/simple/roottest_root_selector_simple_runtestLoadingSelector/),MatchSource.ISSUE_COMMENT,root-project,root,v6-32-06,https://github.com/root-project/root/pull/8204#issuecomment-844250497
Usability,simpl,simple,imple.,MatchSource.ISSUE_COMMENT,root-project,root,v6-32-06,https://github.com/root-project/root/pull/8204#issuecomment-844253147
Usability,simpl,simple,elector/simple/roottest_root_selector_simple_runtestLoadingSelector/),MatchSource.ISSUE_COMMENT,root-project,root,v6-32-06,https://github.com/root-project/root/pull/8204#issuecomment-844253147
Usability,simpl,simple,imple.,MatchSource.ISSUE_COMMENT,root-project,root,v6-32-06,https://github.com/root-project/root/pull/8204#issuecomment-844261645
Usability,simpl,simple,elector/simple/roottest_root_selector_simple_runtestLoadingSelector/),MatchSource.ISSUE_COMMENT,root-project,root,v6-32-06,https://github.com/root-project/root/pull/8204#issuecomment-844261645
Usability,learn,learned,I have learned a bunch of new concepts.,MatchSource.ISSUE_COMMENT,root-project,root,v6-32-06,https://github.com/root-project/root/pull/8225#issuecomment-858035785
Usability,usab,usable,We strive/want to have the name of the column to be usable identifiers (so that they can be used in reading code as-if they actually were identifier (See TTree::Draw syntax and RDataFrame).,MatchSource.ISSUE_COMMENT,root-project,root,v6-32-06,https://github.com/root-project/root/pull/8227#issuecomment-846080791
Usability,usab,usable,> We strive/want to have the name of the column to be usable identifiers,MatchSource.ISSUE_COMMENT,root-project,root,v6-32-06,https://github.com/root-project/root/pull/8227#issuecomment-846119670
Usability,guid,guide,"Without your change, the axis titles appear as you see on the reference guide online.",MatchSource.ISSUE_COMMENT,root-project,root,v6-32-06,https://github.com/root-project/root/pull/8235#issuecomment-847886843
Usability,guid,guide,> Without your change the axis titles appear as you see on the reference guide online.,MatchSource.ISSUE_COMMENT,root-project,root,v6-32-06,https://github.com/root-project/root/pull/8235#issuecomment-847929734
Usability,feedback,feedback,any feedback on this PR ?,MatchSource.ISSUE_COMMENT,root-project,root,v6-32-06,https://github.com/root-project/root/pull/8265#issuecomment-946554582
Usability,simpl,simple,* I do not understand why I have to make -Dsuchalognoption to make a simple basic installation,MatchSource.ISSUE_COMMENT,root-project,root,v6-32-06,https://github.com/root-project/root/issues/8292#issuecomment-864610580
Usability,simpl,simply,or simply delete the testfile on the server :-),MatchSource.ISSUE_COMMENT,root-project,root,v6-32-06,https://github.com/root-project/root/issues/8292#issuecomment-872039777
Usability,feedback,feedback,"@pamputt Cool, thanks for the feedback!",MatchSource.ISSUE_COMMENT,root-project,root,v6-32-06,https://github.com/root-project/root/issues/8292#issuecomment-880610339
Usability,simpl,simple,as for simple,MatchSource.ISSUE_COMMENT,root-project,root,v6-32-06,https://github.com/root-project/root/issues/8295#issuecomment-851783548
Usability,simpl,simple,"The root cause is that `TTree::CopyAddresses` has an implicit assumption that the input and output branches are of the same kind, while in this case we have a `TBranchElement` in input and a simple `TBranch` in output.",MatchSource.ISSUE_COMMENT,root-project,root,v6-32-06,https://github.com/root-project/root/issues/8295#issuecomment-852277296
Usability,feedback,feedback,i/feedback?,MatchSource.ISSUE_COMMENT,root-project,root,v6-32-06,https://github.com/root-project/root/pull/8301#issuecomment-851918877
Usability,feedback,feedback,i/feedback?,MatchSource.ISSUE_COMMENT,root-project,root,v6-32-06,https://github.com/root-project/root/pull/8303#issuecomment-852018288
Usability,simpl,simple,The following simple C++ code also fails to compile with a re-declaration error and I think that should be the expected behavior.,MatchSource.ISSUE_COMMENT,root-project,root,v6-32-06,https://github.com/root-project/root/issues/8304#issuecomment-1943877354
Usability,usab,usable,"Something that needs to be debugged, because I did try to make the properties be usable even when the target_include_directories command is added later.",MatchSource.ISSUE_COMMENT,root-project,root,v6-32-06,https://github.com/root-project/root/issues/8308#issuecomment-856013049
Usability,simpl,simpler,"I was rather hoping that we could evolve `ROOT_GENERATE_DICTIONARY`, at least the version that we make available to users, so that it would be simpler to use.",MatchSource.ISSUE_COMMENT,root-project,root,v6-32-06,https://github.com/root-project/root/issues/8308#issuecomment-856211883
Usability,clear,clear,"just so we are clear, I'm not suggesting to break anything for users :)",MatchSource.ISSUE_COMMENT,root-project,root,v6-32-06,https://github.com/root-project/root/issues/8308#issuecomment-856227664
Usability,clear,clear,"the rationale behind my question is that we should not have N different multi-threading behaviors for N components (because then we can't reason about how these components interact with each other because there are too many possibilities), we should not surprisingly use more cores than users might expect (and we should play well with the TBB settings of frameworks such as CMSSW, but it's not clear to me how we do that now, actually)",MatchSource.ISSUE_COMMENT,root-project,root,v6-32-06,https://github.com/root-project/root/pull/8334#issuecomment-854489805
Usability,clear,clear,"> and we should play well with the TBB settings of frameworks such as CMSSW, but it's not clear to me how we do that now, actually",MatchSource.ISSUE_COMMENT,root-project,root,v6-32-06,https://github.com/root-project/root/pull/8334#issuecomment-854977563
Usability,simpl,simpler,"Yes, I think it will be simpler",MatchSource.ISSUE_COMMENT,root-project,root,v6-32-06,https://github.com/root-project/root/issues/8357#issuecomment-946590814
Usability,simpl,simplest,The simplest solution though is to always create the fTimers (i.,MatchSource.ISSUE_COMMENT,root-project,root,v6-32-06,https://github.com/root-project/root/pull/8379#issuecomment-857765612
Usability,simpl,simplest,>  The simplest solution though is to always create the fTimers,MatchSource.ISSUE_COMMENT,root-project,root,v6-32-06,https://github.com/root-project/root/pull/8379#issuecomment-857772652
Usability,clear,clear,"So, long story, I hope it is clear.",MatchSource.ISSUE_COMMENT,root-project,root,v6-32-06,https://github.com/root-project/root/pull/8385#issuecomment-870411730
Usability,clear,clear,"Hope I'm making myself clear, sorry for the confusion.",MatchSource.ISSUE_COMMENT,root-project,root,v6-32-06,https://github.com/root-project/root/pull/8385#issuecomment-870471097
Usability,simpl,simple,"The timeline for including `ppoll` into libzmq would be a liability, because even though I'm not worried it will not be accepted (it is actually quite a simple addition, especially in the way that [a libzmq maintainer suggests here](https://github.",MatchSource.ISSUE_COMMENT,root-project,root,v6-32-06,https://github.com/root-project/root/pull/8385#issuecomment-870483338
Usability,clear,clear,"> So, long story, I hope it is clear.",MatchSource.ISSUE_COMMENT,root-project,root,v6-32-06,https://github.com/root-project/root/pull/8385#issuecomment-870570029
Usability,guid,guidance,Hi - this is breaking some more or less urgent ATLAS analyses - if there is any guidance as to what we could test that'd be much appreciated.,MatchSource.ISSUE_COMMENT,root-project,root,v6-32-06,https://github.com/root-project/root/issues/8387#issuecomment-861315969
Usability,simpl,simply,"If we remove the default value, set `event` to 0 in the method itself and simply warn the user that he/she has not provided a value for `event`, the user will know and other classes that rely on the default value of 0 still work.",MatchSource.ISSUE_COMMENT,root-project,root,v6-32-06,https://github.com/root-project/root/pull/8425#issuecomment-861618831
Usability,simpl,simply,Then maybe one could simply check if entry is undefined.,MatchSource.ISSUE_COMMENT,root-project,root,v6-32-06,https://github.com/root-project/root/pull/8425#issuecomment-861667463
Usability,learn,learn,I learn something new with every PR :D,MatchSource.ISSUE_COMMENT,root-project,root,v6-32-06,https://github.com/root-project/root/pull/8425#issuecomment-865182237
Usability,simpl,simplify,Also we tend to prefer to simplify the history by keeping only the effective commits.,MatchSource.ISSUE_COMMENT,root-project,root,v6-32-06,https://github.com/root-project/root/pull/8425#issuecomment-865184527
Usability,simpl,simplify,Also we tend to prefer to simplify the history by keeping only the effective commits.,MatchSource.ISSUE_COMMENT,root-project,root,v6-32-06,https://github.com/root-project/root/pull/8425#issuecomment-865186362
Usability,learn,learned,"I recently learned what rebase -i is, so I'll use that next time.",MatchSource.ISSUE_COMMENT,root-project,root,v6-32-06,https://github.com/root-project/root/pull/8425#issuecomment-865186362
Usability,learn,learn,Interactive rebase is awesome once you learn how to use it!,MatchSource.ISSUE_COMMENT,root-project,root,v6-32-06,https://github.com/root-project/root/pull/8426#issuecomment-862436129
Usability,learn,learn,Interactive rebase is awesome once you learn how to use it!,MatchSource.ISSUE_COMMENT,root-project,root,v6-32-06,https://github.com/root-project/root/pull/8426#issuecomment-862436434
Usability,learn,learning,Thanks for the learning opportunity,MatchSource.ISSUE_COMMENT,root-project,root,v6-32-06,https://github.com/root-project/root/pull/8426#issuecomment-862486337
Usability,usab,usable,"so, my proposal was from a point of view of code (common code base, maybe also usable programatically in macros, as part maybe of some generic ROOT toolbox) and the second point of view was of actual usage where maybe `root -verb verb_args` could be easier and clearer to use than `root[verb] args` .",MatchSource.ISSUE_COMMENT,root-project,root,v6-32-06,https://github.com/root-project/root/issues/8447#issuecomment-862518127
Usability,clear,clearer,"so, my proposal was from a point of view of code (common code base, maybe also usable programatically in macros, as part maybe of some generic ROOT toolbox) and the second point of view was of actual usage where maybe `root -verb verb_args` could be easier and clearer to use than `root[verb] args` .",MatchSource.ISSUE_COMMENT,root-project,root,v6-32-06,https://github.com/root-project/root/issues/8447#issuecomment-862518127
Usability,simpl,simple,Note that for simple models I have no problems.,MatchSource.ISSUE_COMMENT,root-project,root,v6-32-06,https://github.com/root-project/root/issues/8474#issuecomment-864062658
Usability,guid,guidelines,"Even better of course with the data, but I understand if you can't share it because of the guidelines of your experiment.",MatchSource.ISSUE_COMMENT,root-project,root,v6-32-06,https://github.com/root-project/root/issues/8474#issuecomment-864089572
Usability,simpl,simple,my PDF is just  a simple 3D functon in each dimenstion is is just a Gaussian + linear polynomial.,MatchSource.ISSUE_COMMENT,root-project,root,v6-32-06,https://github.com/root-project/root/issues/8474#issuecomment-864243565
Usability,simpl,simple,Possibly even on Monday because it is a simple change.,MatchSource.ISSUE_COMMENT,root-project,root,v6-32-06,https://github.com/root-project/root/issues/8474#issuecomment-864414030
Usability,feedback,feedback,thanks a lot for the feedback!,MatchSource.ISSUE_COMMENT,root-project,root,v6-32-06,https://github.com/root-project/root/issues/8504#issuecomment-866145966
Usability,guid,guide,I can improve that to make the comments appear in the reference guide.,MatchSource.ISSUE_COMMENT,root-project,root,v6-32-06,https://github.com/root-project/root/issues/8507#issuecomment-865994950
Usability,guid,guide,"I also found what you were saying in the manual (so it is present somewhere in the documentation, though I usually read the reference guide).",MatchSource.ISSUE_COMMENT,root-project,root,v6-32-06,https://github.com/root-project/root/issues/8517#issuecomment-867417636
Usability,simpl,simple,"I submitted  an issue, with a simple reproducer,  in the doxygen repository:",MatchSource.ISSUE_COMMENT,root-project,root,v6-32-06,https://github.com/root-project/root/issues/8533#issuecomment-868348530
Usability,feedback,feedback,Any feedback to my observations on https://github.,MatchSource.ISSUE_COMMENT,root-project,root,v6-32-06,https://github.com/root-project/root/pull/8546#issuecomment-1895306674
Usability,simpl,simply,`RooAbsMinimizerFcn` simply factors that stuff out into one class.,MatchSource.ISSUE_COMMENT,root-project,root,v6-32-06,https://github.com/root-project/root/pull/8569#issuecomment-874002788
Usability,clear,clear,It is not clear to me whether we can close it as clarified or if some feature is still needed.,MatchSource.ISSUE_COMMENT,root-project,root,v6-32-06,https://github.com/root-project/root/issues/8582#issuecomment-1925302611
Usability,feedback,feedback,OK closing then - thanks for the feedback @mxxo and @eguiraud .,MatchSource.ISSUE_COMMENT,root-project,root,v6-32-06,https://github.com/root-project/root/pull/8587#issuecomment-873050997
Usability,clear,clear,"I agree that making the RooAbsMinimizer a templated class is not the best solution, but I still think we can even avoid the templated constructor, making the code more clear and reducing compile time/binary size.",MatchSource.ISSUE_COMMENT,root-project,root,v6-32-06,https://github.com/root-project/root/pull/8596#issuecomment-879770741
Usability,simpl,simply,I am temped to simply comment the line but that's weird as fAxis is [a member of TGLAxisPainterBox](https://github.,MatchSource.ISSUE_COMMENT,root-project,root,v6-32-06,https://github.com/root-project/root/issues/8618#issuecomment-875425406
Usability,clear,clearly,"so that's clearly a bug in that case, the 3D viewer should not change the axis attributes silently .",MatchSource.ISSUE_COMMENT,root-project,root,v6-32-06,https://github.com/root-project/root/issues/8618#issuecomment-875477436
Usability,simpl,simple,# Let's create a simple dataframe with ten rows and two columns,MatchSource.ISSUE_COMMENT,root-project,root,v6-32-06,https://github.com/root-project/root/issues/8622#issuecomment-889485521
Usability,simpl,simple,"I *think* it's fairly hard to break the file given that it's generated by a script; I also dislike the pile of dependencies of `cffconvert` for a simple thing like validation, IMO it's too heavy to add it to the script producing `CITATION.",MatchSource.ISSUE_COMMENT,root-project,root,v6-32-06,https://github.com/root-project/root/pull/8626#issuecomment-876311455
Usability,undo,undocumented,"> Even if find_package() were only redefined once though, it would still be relying on **undocumented** CMake behavior which may be modified or removed completely in a future version.",MatchSource.ISSUE_COMMENT,root-project,root,v6-32-06,https://github.com/root-project/root/issues/8633#issuecomment-898355331
Usability,undo,undocumented,"As for the undocumented nature of the feature, it's sad but, like the [CDash test measurements](https://cmake.",MatchSource.ISSUE_COMMENT,root-project,root,v6-32-06,https://github.com/root-project/root/issues/8633#issuecomment-898406007
Usability,undo,undocumented,"additional-test-measurements) that were undocumented for a long time, if you offer it, people will try to use it.",MatchSource.ISSUE_COMMENT,root-project,root,v6-32-06,https://github.com/root-project/root/issues/8633#issuecomment-898406007
Usability,resume,resumed,@mxxo @jblomer This work will be resumed soon as we suspect that not reusing addresses is affecting RDMA data transfers (which has an impact on the measured throughput in the DAOS backend).,MatchSource.ISSUE_COMMENT,root-project,root,v6-32-06,https://github.com/root-project/root/pull/8634#issuecomment-1300054951
Usability,resume,resumed,> @mxxo @jblomer This work will be resumed soon as we suspect that not reusing addresses is affecting RDMA data transfers (which has an impact on the measured throughput in the DAOS backend).,MatchSource.ISSUE_COMMENT,root-project,root,v6-32-06,https://github.com/root-project/root/pull/8634#issuecomment-1424850942
Usability,simpl,simpler,It seems simpler to ask users to explicitly do the conversion in a `Redefine` if they need/want to.,MatchSource.ISSUE_COMMENT,root-project,root,v6-32-06,https://github.com/root-project/root/issues/8644#issuecomment-883552286
Usability,simpl,simplified,> I understand this will be simplified when we can pass a configuration object to RDataFrame where we specify the range,MatchSource.ISSUE_COMMENT,root-project,root,v6-32-06,https://github.com/root-project/root/pull/8646#issuecomment-895318380
Usability,simpl,simplification,"t feels like some simplification is possible, if they are relative to the task-specific chain can't they be calculated from the rest?",MatchSource.ISSUE_COMMENT,root-project,root,v6-32-06,https://github.com/root-project/root/pull/8646#issuecomment-895350585
Usability,simpl,simplification,"t feels like some simplification is possible, if they are relative to the task-specific chain can't they be calculated from the rest?",MatchSource.ISSUE_COMMENT,root-project,root,v6-32-06,https://github.com/root-project/root/pull/8646#issuecomment-895362702
Usability,progress bar,progress bar,Although the ProgressBar won't be a progress bar when we don't know the number of events .,MatchSource.ISSUE_COMMENT,root-project,root,v6-32-06,https://github.com/root-project/root/pull/8675#issuecomment-880514090
Usability,undo,undocumented,"OK, I had a look, and it would actually be amazing if I could get access to the LoopManager, because then I could just register the callback using `RLoopManager::RegisterCallback` (cannot link to docs because undocumented functions don't get an anchor in doxygen, any more 🤷‍♂️ ).",MatchSource.ISSUE_COMMENT,root-project,root,v6-32-06,https://github.com/root-project/root/pull/8675#issuecomment-880524867
Usability,progress bar,progress bar,> Although the ProgressBar won't be a progress bar when we don't know the number of events .,MatchSource.ISSUE_COMMENT,root-project,root,v6-32-06,https://github.com/root-project/root/pull/8675#issuecomment-880538021
Usability,progress bar,progress bar,"- probably the biggest: we wouldn't have to do any magic to make sure that the method is called _on the head node_ (because if you call it on a `Filter`, now you are updating the progress bar every N _filtered_ entries)",MatchSource.ISSUE_COMMENT,root-project,root,v6-32-06,https://github.com/root-project/root/pull/8675#issuecomment-880538021
Usability,progress bar,progress bar,"(as per the discussion above, this will not get merged as is because we rather prefer an implementation that can estimate the remaining number of entries/time without having to check all input files beforehand, but the logic to create and update the progress bar, including colors, windows support etc.",MatchSource.ISSUE_COMMENT,root-project,root,v6-32-06,https://github.com/root-project/root/pull/8675#issuecomment-880833581
Usability,usab,usable,is still directly re-usable and super useful),MatchSource.ISSUE_COMMENT,root-project,root,v6-32-06,https://github.com/root-project/root/pull/8675#issuecomment-880833581
Usability,feedback,feedback,@couet any feedback on this PR?,MatchSource.ISSUE_COMMENT,root-project,root,v6-32-06,https://github.com/root-project/root/pull/8681#issuecomment-946557019
Usability,clear,clear,lear();,MatchSource.ISSUE_COMMENT,root-project,root,v6-32-06,https://github.com/root-project/root/pull/8688#issuecomment-883396155
Usability,simpl,simpler,"@Axel-Naumann, @couet pointed out that my read file was basically a simpler version of h1draw.",MatchSource.ISSUE_COMMENT,root-project,root,v6-32-06,https://github.com/root-project/root/pull/8699#issuecomment-884186832
Usability,learn,learned,"For instance, Manos' mini computation library I have only learned about in the last few months and don't know it in enough detail to make any kind of sensible estimate of how to do it, let alone how much time this would take.",MatchSource.ISSUE_COMMENT,root-project,root,v6-32-06,https://github.com/root-project/root/pull/8700#issuecomment-884045031
Usability,guid,guidelines,in the Google C++ guidelines.,MatchSource.ISSUE_COMMENT,root-project,root,v6-32-06,https://github.com/root-project/root/pull/8700#issuecomment-915217168
Usability,simpl,simply,"Not quite, I meant simply an overall average, i.",MatchSource.ISSUE_COMMENT,root-project,root,v6-32-06,https://github.com/root-project/root/pull/8703#issuecomment-920229853
Usability,simpl,simply,simply keeping `total_number_of_bytes` and `total_number_of_compressed_bytes` for each column and then average compression ration is a simple division.,MatchSource.ISSUE_COMMENT,root-project,root,v6-32-06,https://github.com/root-project/root/pull/8703#issuecomment-920229853
Usability,simpl,simple,simply keeping `total_number_of_bytes` and `total_number_of_compressed_bytes` for each column and then average compression ration is a simple division.,MatchSource.ISSUE_COMMENT,root-project,root,v6-32-06,https://github.com/root-project/root/pull/8703#issuecomment-920229853
Usability,simpl,simply,"closer to the original proposal is simply the ""total_number_of_bytes_in_all_flushed_clusters"" and ""corresponding_compressed_size"" (i.",MatchSource.ISSUE_COMMENT,root-project,root,v6-32-06,https://github.com/root-project/root/pull/8703#issuecomment-920229853
Usability,simpl,simply,l) project simply uses a `.,MatchSource.ISSUE_COMMENT,root-project,root,v6-32-06,https://github.com/root-project/root/issues/8706#issuecomment-914136123
Usability,simpl,simply,"And no, simply forking is good enough",MatchSource.ISSUE_COMMENT,root-project,root,v6-32-06,https://github.com/root-project/root/pull/8717#issuecomment-885523144
Usability,simpl,simply,"My thoughts: If the function is added to ROOT as is, I'd implement it in the header and simply `return a==b`.",MatchSource.ISSUE_COMMENT,root-project,root,v6-32-06,https://github.com/root-project/root/pull/8719#issuecomment-886443983
Usability,simpl,simply,"> My thoughts: If the function is added to ROOT as is, I'd implement it in the header and simply `return a==b`.",MatchSource.ISSUE_COMMENT,root-project,root,v6-32-06,https://github.com/root-project/root/pull/8719#issuecomment-886482916
Usability,simpl,simple,"Yeah, this wont be as simple as I thought it would be 😅 .",MatchSource.ISSUE_COMMENT,root-project,root,v6-32-06,https://github.com/root-project/root/pull/8732#issuecomment-886601097
Usability,simpl,simply,"One solution for a general derivative function could be to simply pass ""Function->Derivative(x)"" in the second TF1.",MatchSource.ISSUE_COMMENT,root-project,root,v6-32-06,https://github.com/root-project/root/issues/8735#issuecomment-887360425
Usability,usab,usable,Probably using the same filename for multiple tests leads to a recreation/deletion of the file that is then not usable by the new test?,MatchSource.ISSUE_COMMENT,root-project,root,v6-32-06,https://github.com/root-project/root/pull/8740#issuecomment-895859603
Usability,simpl,simply,"Well, no, you can simply unplug (or disable) the internet connection.",MatchSource.ISSUE_COMMENT,root-project,root,v6-32-06,https://github.com/root-project/root/issues/8742#issuecomment-887583333
Usability,simpl,simply,"> Well, no, you can simply unplug (or disable) the internet connection.",MatchSource.ISSUE_COMMENT,root-project,root,v6-32-06,https://github.com/root-project/root/issues/8742#issuecomment-887610171
Usability,simpl,simply,You can simply disable `imt` (`-Dimt=OFF`) and `builtin_tbb` (-D`builtin_tbb=OFF`).,MatchSource.ISSUE_COMMENT,root-project,root,v6-32-06,https://github.com/root-project/root/issues/8742#issuecomment-888087500
Usability,simpl,simple,"It's actually an _array_ ds, not the arrow ds :smile: it's a simple datasource used for testing",MatchSource.ISSUE_COMMENT,root-project,root,v6-32-06,https://github.com/root-project/root/pull/8754#issuecomment-888908741
