id,quality_attribute,keyword,matched_word,match_idx,sentence,source,filename,author,repo,version,wiki,url
https://github.com/scipipe/scipipe/tree/v0.12.0/docs/index.md:9403,Testability,log,logs,9403,"for; the second process, like so:. ```go; package main. import (; // Import the SciPipe package, aliased to 'sp'; sp ""github.com/scipipe/scipipe""; ). func main() {; // Init workflow with a name, and max concurrent tasks; wf := sp.NewWorkflow(""hello_world"", 4). // Initialize processes and set output file paths; hello := wf.NewProc(""hello"", ""echo 'Hello ' > {o:out}""); hello.SetOut(""out"", ""hello.txt""). world := wf.NewProc(""world"", ""echo $(cat {i:in}) World >> {o:out}""); world.SetOut(""out"", ""{i:in|%.txt}_world.txt""). // Connect network; world.In(""in"").From(hello.Out(""out"")). // Run workflow; wf.Run(); }; ```. In the `{i:in...` part, we are re-using the file path from the file received on; the in-port named 'in', and then running a Bash-style trim-from-end command on; it to remove the `.txt` extension. Now, if we run this, the file names get a little cleaner:. ```bash; $ ls -1 hello*; hello.txt; hello.txt.audit.json; hello_world.go; hello_world.txt; hello_world.txt.audit.json; ```. ## The audit logs. Finally, we could have a look at one of those audit file created:. ```bash; $ cat hello_world.txt.audit.json; {; ""ID"": ""99i5vxhtd41pmaewc8pr"",; ""ProcessName"": ""world"",; ""Command"": ""echo $(cat hello.txt) World \u003e\u003e hello_world.txt.tmp/hello_world.txt"",; ""Params"": {},; ""Tags"": {},; ""StartTime"": ""2018-06-15T19:10:37.955602979+02:00"",; ""FinishTime"": ""2018-06-15T19:10:37.959410102+02:00"",; ""ExecTimeNS"": 3000000,; ""Upstream"": {; ""hello.txt"": {; ""ID"": ""w4oeiii9h5j7sckq7aqq"",; ""ProcessName"": ""hello"",; ""Command"": ""echo 'Hello ' \u003e hello.txt.tmp/hello.txt"",; ""Params"": {},; ""Tags"": {},; ""StartTime"": ""2018-06-15T19:10:37.950032676+02:00"",; ""FinishTime"": ""2018-06-15T19:10:37.95468214+02:00"",; ""ExecTimeNS"": 4000000,; ""Upstream"": {}; }; }; ```. Each such audit-file contains a hierarchic JSON-representation of the full; workflow path that was executed in order to produce this file. On the first; level is the command that directly produced the corresponding file, and then,; indexe",MatchSource.DOCS,docs/index.md,scipipe,scipipe,v0.12.0,https://scipipe.org,https://github.com/scipipe/scipipe/tree/v0.12.0/docs/index.md
https://github.com/scipipe/scipipe/tree/v0.12.0/docs/index.md:4298,Usability,usab,usable,4298,"cs.it/posts/first-production-workflow-run-with-scipipe"">First production workflow run with SciPipe</a>; </div>. ## Introduction. SciPipe is a library for writing [Scientific Workflows](https://en.wikipedia.org/wiki/Scientific_workflow_system),; sometimes also called ""pipelines"", in the [Go programming language](http://golang.org). When you need to run many commandline programs that depend on each other in; complex ways, SciPipe helps by making the process of running these programs; flexible, robust and reproducible. SciPipe also lets you restart an interrupted; run without over-writing already produced output and produces an audit report; of what was run, among many other things. SciPipe is built on the proven principles of [Flow-Based Programming](https://en.wikipedia.org/wiki/Flow-based_programming); (FBP) to achieve maximum flexibility, productivity and agility when designing; workflows. Compared to plain dataflow, FBP provides the benefits that; processes are fully self-contained, so that a library of re-usable components; can be created, and plugged into new workflows ad-hoc. Similar to other FBP systems, SciPipe workflows can be likened to a network of; assembly lines in a factory, where items (files) are flowing through a network; of conveyor belts, stopping at different independently running stations; (processes) for processing, as depicted in the picture above. SciPipe was initially created for problems in bioinformatics and; cheminformatics, but works equally well for any problem involving pipelines of; commandline applications. **Project status:** SciPipe pretty stable now, and only very minor API changes; might still occur. We have successfully used SciPipe in a handful of both real; and experimental projects, and it has had occasional use outside the research; group as well. ## Known limitations. - There are still a number of missing good-to-have features for workflow; design. See the [issue tracker](https://github.com/scipipe/scipipe/issues); for detai",MatchSource.DOCS,docs/index.md,scipipe,scipipe,v0.12.0,https://scipipe.org,https://github.com/scipipe/scipipe/tree/v0.12.0/docs/index.md
https://github.com/scipipe/scipipe/tree/v0.12.0/docs/index.md:6481,Usability,simpl,simple,6481,"r quick getting started steps, you can do:. 1. [Download](https://golang.org/dl/) and [install](https://golang.org/doc/install) Go; 2. Run the following command, to install the scipipe Go library (don't miss the; trailing dots!), and create a Go module for your script:. ```bash; go install github.com/scipipe/scipipe/...@latest; go mod init myfirstworkflow-module; ```. ## Hello World example. Let's look at an example workflow to get a feel for what writing workflows in; SciPipe looks like:. ```go; package main. import (; // Import SciPipe, aliased to sp; sp ""github.com/scipipe/scipipe""; ). func main() {; // Init workflow and max concurrent tasks; wf := sp.NewWorkflow(""hello_world"", 4). // Initialize processes, and file extensions; hello := wf.NewProc(""hello"", ""echo 'Hello ' > {o:out|.txt}""); world := wf.NewProc(""world"", ""echo $(cat {i:in}) World > {o:out|.txt}""). // Define data flow; world.In(""in"").From(hello.Out(""out"")). // Run workflow; wf.Run(); }; ```. To create a file with a similar simple example, you can run:. ```; scipipe new hello_world.go; ```. ## Running the example. Let's put the code in a file named `hello_world.go` and run it. First you need to make sure that the dependencies (SciPipe in this case) is; installed in your local Go module. This you can do with:. ```bash; go mod tidy; ```. Then you can go ahead and run the workflow:. ```bash; $ go run hello_world.go; AUDIT 2018/07/17 21:42:26 | workflow:hello_world | Starting workflow (Writing log to log/scipipe-20180717-214226-hello_world.log); AUDIT 2018/07/17 21:42:26 | hello | Executing: echo 'Hello ' > hello.out.txt; AUDIT 2018/07/17 21:42:26 | hello | Finished: echo 'Hello ' > hello.out.txt; AUDIT 2018/07/17 21:42:26 | world | Executing: echo $(cat ../hello.out.txt) World > hello.out.txt.world.out.txt; AUDIT 2018/07/17 21:42:26 | world | Finished: echo $(cat ../hello.out.txt) World > hello.out.txt.world.out.txt; AUDIT 2018/07/17 21:42:26 | workflow:hello_world | Finished workflow (Log written to log/s",MatchSource.DOCS,docs/index.md,scipipe,scipipe,v0.12.0,https://scipipe.org,https://github.com/scipipe/scipipe/tree/v0.12.0/docs/index.md
https://github.com/scipipe/scipipe/tree/v0.12.0/docs/install.md:954,Availability,avail,available,954,"# Installing SciPipe. Installing SciPipe means first installing the Go programming langauge, and then; using Go's `go install` command to install the SciPipe library. After this, you will; be able to use Go's `go run` command to run SciPipe workflows. ## Install Go. Install Go by following the instructions [on this page](https://golang.org/doc/install#install), for your operating system. To make sure that everything is installed, run the `go` command in your; terminal, and make sure that it outputs something. To be specific, you can try exetuging `go version`, which sould output something; like the below:. ```bash; $ go version; go version go1.17 linux/amd64; ```; ; ## Install SciPipe. There are two main ways of installing SciPipe, one which is super-easy, and one; which is recommended if you want to make sure that your workflow will never; break because of API changes in SciPipe, and that you always have a copy of the; SciPipe source code available. ### Easy: Using go install. The easiest way to intsall SciPipe is by using the `go install` tool in the Go; tool chain. To install scipipe with `go install`, run the following command in; your terminal:. ```bash; go install github.com/scipipe/scipipe/...@latest; ```. **N.B:** Don't miss the `...`, as otherwise the `scipipe` helper tool will not be installed. ## Initialize a new workflow file. Now, you should be able to write code like in the example below, in files; ending with `.go`. The easiest way to get started is to let the scipipe tool generate a starting point for you:. ```bash; scipipe new myfirstworkflow.go; ```. ... which you can then edit to your liking. ## Create a Go module. Before you can run the workflow, you need to also create a [go module](https://golang.org/ref/mod#introduction). To do this, you can run the following command, in the directory where you; created your first workflow:. ```bash; go mod init <package-name>; ```. For `<module-name>`, you have to replace it with a name of the package.; For a ",MatchSource.DOCS,docs/install.md,scipipe,scipipe,v0.12.0,https://scipipe.org,https://github.com/scipipe/scipipe/tree/v0.12.0/docs/install.md
https://github.com/scipipe/scipipe/tree/v0.12.0/docs/install.md:3187,Availability,avail,available,3187,"orresponding GitHub repo, e.g.; `github.com/<your-username>/<your-repository>`. By doing this, two files will be created:. ```; go.mod; go.sum; ```. Make sure to add them to your git repository, with:. ```; git add go.mod go.sum; git commit -m ""Add Go module files""; ```. Now, to make sure that scipipe is included as a dependency in the go.mod file,; run the `go mod tidy` command:. ```bash; go mod tidy; ```. The `go.mod` file should now look something like:. ```; module mylittlemodule. go 1.17. require github.com/scipipe/scipipe v0.10.2; ```. ... and the go.sum file might look something like:. ```; github.com/scipipe/scipipe v0.10.2 h1:crXD1gGh/LuBfWfT4CdXcRFtPjem5weyXN03BDfVOuU=; github.com/scipipe/scipipe v0.10.2/go.mod h1:Nwof+Uimtam7GTpkU6cAf/EOnqvxcOVFytjnYU5I3vY=; ```. ### Optional extra step: Use a copy of SciPipe's source code in your own code. In order to make sure that your workflow will never break because of API; changes in SciPipe, and that you always have a copy of the SciPipe source; code available, we recommend to always include a copy of the SciPipe source; code in your workflow's source code repository. The SciPipe source code is; only around 1500 lines of code, with no external dependencies except Go and; Bash, so this should not increase the size of your repository too much. A simple way to do this, is to use Go's `vendor` tool, which stores a local; copy of the source code of packages used, inside the local directory, in; a sub-directory called ""vendor"". To do this, execute the following command:. ```; go mod vendor; ```. Then, to make sure the code is included in your git history, make sure to add it; to git:. ```bash; git add vendor; git commit -m ""Add vendored version of SciPipe""; ```. ## Run your workflow. Now youa re ready to run the workflow. To run a `.go` file, just use `go run <script-file>`, e.g:; ; ```bash; go run myfirstworkflow.go; ```. ## Some tips about editors. In order to be productive with SciPipe, you will also need a Go editor",MatchSource.DOCS,docs/install.md,scipipe,scipipe,v0.12.0,https://scipipe.org,https://github.com/scipipe/scipipe/tree/v0.12.0/docs/install.md
https://github.com/scipipe/scipipe/tree/v0.12.0/docs/install.md:4888,Availability,robust,robust,4888,"you always have a copy of the SciPipe source; code available, we recommend to always include a copy of the SciPipe source; code in your workflow's source code repository. The SciPipe source code is; only around 1500 lines of code, with no external dependencies except Go and; Bash, so this should not increase the size of your repository too much. A simple way to do this, is to use Go's `vendor` tool, which stores a local; copy of the source code of packages used, inside the local directory, in; a sub-directory called ""vendor"". To do this, execute the following command:. ```; go mod vendor; ```. Then, to make sure the code is included in your git history, make sure to add it; to git:. ```bash; git add vendor; git commit -m ""Add vendored version of SciPipe""; ```. ## Run your workflow. Now youa re ready to run the workflow. To run a `.go` file, just use `go run <script-file>`, e.g:; ; ```bash; go run myfirstworkflow.go; ```. ## Some tips about editors. In order to be productive with SciPipe, you will also need a Go editor or IDE; with support for auto-completion, sometimes also called ""intellisense"". We can warmly recommend to use one of these editors, sorted by level of endorsement:. 1. [Visual Studio Code](http://code.visualstudio.com) with the [Go plugin](https://github.com/Microsoft/vscode-go) - If you want a very powerful almost IDE-like editor; 2. The [vim-go](https://github.com/fatih/vim-go) plugin by [Fatih](https://twitter.com/fatih) - if you are a Vim power-user, or need a terminal-only complement to VSCode.; 3. JetBrain's [GoLand IDE](https://www.jetbrains.com/go/), if you are ready to pay for maximum code intelligence in a professional IDE.; 4. [LiteIDE](https://github.com/visualfc/liteide) - if you want a simple, robust and fast standalone Go-editor. There are also popular Go-plugins for [Sublime text](https://www.sublimetext.com), [Atom](https://atom.io/) and [IntelliJ IDEA](https://www.jetbrains.com/idea/), and an upcoming Go IDE from JetBrains,; called; ",MatchSource.DOCS,docs/install.md,scipipe,scipipe,v0.12.0,https://scipipe.org,https://github.com/scipipe/scipipe/tree/v0.12.0/docs/install.md
https://github.com/scipipe/scipipe/tree/v0.12.0/docs/install.md:53,Deployability,install,installing,53,"# Installing SciPipe. Installing SciPipe means first installing the Go programming langauge, and then; using Go's `go install` command to install the SciPipe library. After this, you will; be able to use Go's `go run` command to run SciPipe workflows. ## Install Go. Install Go by following the instructions [on this page](https://golang.org/doc/install#install), for your operating system. To make sure that everything is installed, run the `go` command in your; terminal, and make sure that it outputs something. To be specific, you can try exetuging `go version`, which sould output something; like the below:. ```bash; $ go version; go version go1.17 linux/amd64; ```; ; ## Install SciPipe. There are two main ways of installing SciPipe, one which is super-easy, and one; which is recommended if you want to make sure that your workflow will never; break because of API changes in SciPipe, and that you always have a copy of the; SciPipe source code available. ### Easy: Using go install. The easiest way to intsall SciPipe is by using the `go install` tool in the Go; tool chain. To install scipipe with `go install`, run the following command in; your terminal:. ```bash; go install github.com/scipipe/scipipe/...@latest; ```. **N.B:** Don't miss the `...`, as otherwise the `scipipe` helper tool will not be installed. ## Initialize a new workflow file. Now, you should be able to write code like in the example below, in files; ending with `.go`. The easiest way to get started is to let the scipipe tool generate a starting point for you:. ```bash; scipipe new myfirstworkflow.go; ```. ... which you can then edit to your liking. ## Create a Go module. Before you can run the workflow, you need to also create a [go module](https://golang.org/ref/mod#introduction). To do this, you can run the following command, in the directory where you; created your first workflow:. ```bash; go mod init <package-name>; ```. For `<module-name>`, you have to replace it with a name of the package.; For a ",MatchSource.DOCS,docs/install.md,scipipe,scipipe,v0.12.0,https://scipipe.org,https://github.com/scipipe/scipipe/tree/v0.12.0/docs/install.md
https://github.com/scipipe/scipipe/tree/v0.12.0/docs/install.md:118,Deployability,install,install,118,"# Installing SciPipe. Installing SciPipe means first installing the Go programming langauge, and then; using Go's `go install` command to install the SciPipe library. After this, you will; be able to use Go's `go run` command to run SciPipe workflows. ## Install Go. Install Go by following the instructions [on this page](https://golang.org/doc/install#install), for your operating system. To make sure that everything is installed, run the `go` command in your; terminal, and make sure that it outputs something. To be specific, you can try exetuging `go version`, which sould output something; like the below:. ```bash; $ go version; go version go1.17 linux/amd64; ```; ; ## Install SciPipe. There are two main ways of installing SciPipe, one which is super-easy, and one; which is recommended if you want to make sure that your workflow will never; break because of API changes in SciPipe, and that you always have a copy of the; SciPipe source code available. ### Easy: Using go install. The easiest way to intsall SciPipe is by using the `go install` tool in the Go; tool chain. To install scipipe with `go install`, run the following command in; your terminal:. ```bash; go install github.com/scipipe/scipipe/...@latest; ```. **N.B:** Don't miss the `...`, as otherwise the `scipipe` helper tool will not be installed. ## Initialize a new workflow file. Now, you should be able to write code like in the example below, in files; ending with `.go`. The easiest way to get started is to let the scipipe tool generate a starting point for you:. ```bash; scipipe new myfirstworkflow.go; ```. ... which you can then edit to your liking. ## Create a Go module. Before you can run the workflow, you need to also create a [go module](https://golang.org/ref/mod#introduction). To do this, you can run the following command, in the directory where you; created your first workflow:. ```bash; go mod init <package-name>; ```. For `<module-name>`, you have to replace it with a name of the package.; For a ",MatchSource.DOCS,docs/install.md,scipipe,scipipe,v0.12.0,https://scipipe.org,https://github.com/scipipe/scipipe/tree/v0.12.0/docs/install.md
https://github.com/scipipe/scipipe/tree/v0.12.0/docs/install.md:138,Deployability,install,install,138,"# Installing SciPipe. Installing SciPipe means first installing the Go programming langauge, and then; using Go's `go install` command to install the SciPipe library. After this, you will; be able to use Go's `go run` command to run SciPipe workflows. ## Install Go. Install Go by following the instructions [on this page](https://golang.org/doc/install#install), for your operating system. To make sure that everything is installed, run the `go` command in your; terminal, and make sure that it outputs something. To be specific, you can try exetuging `go version`, which sould output something; like the below:. ```bash; $ go version; go version go1.17 linux/amd64; ```; ; ## Install SciPipe. There are two main ways of installing SciPipe, one which is super-easy, and one; which is recommended if you want to make sure that your workflow will never; break because of API changes in SciPipe, and that you always have a copy of the; SciPipe source code available. ### Easy: Using go install. The easiest way to intsall SciPipe is by using the `go install` tool in the Go; tool chain. To install scipipe with `go install`, run the following command in; your terminal:. ```bash; go install github.com/scipipe/scipipe/...@latest; ```. **N.B:** Don't miss the `...`, as otherwise the `scipipe` helper tool will not be installed. ## Initialize a new workflow file. Now, you should be able to write code like in the example below, in files; ending with `.go`. The easiest way to get started is to let the scipipe tool generate a starting point for you:. ```bash; scipipe new myfirstworkflow.go; ```. ... which you can then edit to your liking. ## Create a Go module. Before you can run the workflow, you need to also create a [go module](https://golang.org/ref/mod#introduction). To do this, you can run the following command, in the directory where you; created your first workflow:. ```bash; go mod init <package-name>; ```. For `<module-name>`, you have to replace it with a name of the package.; For a ",MatchSource.DOCS,docs/install.md,scipipe,scipipe,v0.12.0,https://scipipe.org,https://github.com/scipipe/scipipe/tree/v0.12.0/docs/install.md
https://github.com/scipipe/scipipe/tree/v0.12.0/docs/install.md:346,Deployability,install,install,346,"# Installing SciPipe. Installing SciPipe means first installing the Go programming langauge, and then; using Go's `go install` command to install the SciPipe library. After this, you will; be able to use Go's `go run` command to run SciPipe workflows. ## Install Go. Install Go by following the instructions [on this page](https://golang.org/doc/install#install), for your operating system. To make sure that everything is installed, run the `go` command in your; terminal, and make sure that it outputs something. To be specific, you can try exetuging `go version`, which sould output something; like the below:. ```bash; $ go version; go version go1.17 linux/amd64; ```; ; ## Install SciPipe. There are two main ways of installing SciPipe, one which is super-easy, and one; which is recommended if you want to make sure that your workflow will never; break because of API changes in SciPipe, and that you always have a copy of the; SciPipe source code available. ### Easy: Using go install. The easiest way to intsall SciPipe is by using the `go install` tool in the Go; tool chain. To install scipipe with `go install`, run the following command in; your terminal:. ```bash; go install github.com/scipipe/scipipe/...@latest; ```. **N.B:** Don't miss the `...`, as otherwise the `scipipe` helper tool will not be installed. ## Initialize a new workflow file. Now, you should be able to write code like in the example below, in files; ending with `.go`. The easiest way to get started is to let the scipipe tool generate a starting point for you:. ```bash; scipipe new myfirstworkflow.go; ```. ... which you can then edit to your liking. ## Create a Go module. Before you can run the workflow, you need to also create a [go module](https://golang.org/ref/mod#introduction). To do this, you can run the following command, in the directory where you; created your first workflow:. ```bash; go mod init <package-name>; ```. For `<module-name>`, you have to replace it with a name of the package.; For a ",MatchSource.DOCS,docs/install.md,scipipe,scipipe,v0.12.0,https://scipipe.org,https://github.com/scipipe/scipipe/tree/v0.12.0/docs/install.md
https://github.com/scipipe/scipipe/tree/v0.12.0/docs/install.md:354,Deployability,install,install,354,"# Installing SciPipe. Installing SciPipe means first installing the Go programming langauge, and then; using Go's `go install` command to install the SciPipe library. After this, you will; be able to use Go's `go run` command to run SciPipe workflows. ## Install Go. Install Go by following the instructions [on this page](https://golang.org/doc/install#install), for your operating system. To make sure that everything is installed, run the `go` command in your; terminal, and make sure that it outputs something. To be specific, you can try exetuging `go version`, which sould output something; like the below:. ```bash; $ go version; go version go1.17 linux/amd64; ```; ; ## Install SciPipe. There are two main ways of installing SciPipe, one which is super-easy, and one; which is recommended if you want to make sure that your workflow will never; break because of API changes in SciPipe, and that you always have a copy of the; SciPipe source code available. ### Easy: Using go install. The easiest way to intsall SciPipe is by using the `go install` tool in the Go; tool chain. To install scipipe with `go install`, run the following command in; your terminal:. ```bash; go install github.com/scipipe/scipipe/...@latest; ```. **N.B:** Don't miss the `...`, as otherwise the `scipipe` helper tool will not be installed. ## Initialize a new workflow file. Now, you should be able to write code like in the example below, in files; ending with `.go`. The easiest way to get started is to let the scipipe tool generate a starting point for you:. ```bash; scipipe new myfirstworkflow.go; ```. ... which you can then edit to your liking. ## Create a Go module. Before you can run the workflow, you need to also create a [go module](https://golang.org/ref/mod#introduction). To do this, you can run the following command, in the directory where you; created your first workflow:. ```bash; go mod init <package-name>; ```. For `<module-name>`, you have to replace it with a name of the package.; For a ",MatchSource.DOCS,docs/install.md,scipipe,scipipe,v0.12.0,https://scipipe.org,https://github.com/scipipe/scipipe/tree/v0.12.0/docs/install.md
