id,quality_attribute,keyword,matched_word,match_idx,sentence,source,filename,author,repo,version,wiki,url
https://github.com/scipipe/scipipe/tree/v0.12.0/docs/basic_concepts.md:2210,Integrability,depend,dependencies,2210,"one; particular shell command execution. `Task` objects are executed via their; [`Execute()`](https://godoc.org/github.com/scipipe/scipipe#Task.Execute); method, or `CustomExecute()`, if custom Go code is supposed to be; executed instead of a shell command. The distinction between processes and tasks is important to understand, for; example when doing more advanced configuration of file naming strategies, since; the custom anonymous functions used to format paths are taking a `Task` as; input, even though these functions are saved on the process object. To understand the difference between processes and tasks, it is helpful to; remember that processes are long-running, and typically fixed during the course; of a workflow, while tasks are transient objects, created temporarily as a; container for all data and code needed for each execution of a concrete shell; command. * See [GoDoc for Task](https://godoc.org/github.com/scipipe/scipipe#Task). ## Ports. Central to the way data dependencies are defined in SciPipe, is ports. Ports; are fields on processes, which are connected to other ports via channels (see; separate section on this page). In SciPipe, each port must have a unique name within its process (there can't; be an in-port and out-port named the same), and this name will be used in shell; command patterns, when connecting dependencies / dataflow networks, and when; configuring file naming strategies. In `Process` objects, in-ports are are accessed with; `myProcess.In(""my_port"")`, and out-ports are similarly accessed with; `myProcess.Out(""my_other_port"")`. They are of type; [`InPort`](https://godoc.org/github.com/scipipe/scipipe#InPort) and; [`OutPort`](https://godoc.org/github.com/scipipe/scipipe#OutPort) respectively. Some pre-made components might have ports bound to custom field names though,; such as `myFastaReader.InFastaFile`, or `myZipComponent.OutZipFile`. Port objects have some methods bound to them, most importantly the `From()`; method (for in-ports. ",MatchSource.DOCS,docs/basic_concepts.md,scipipe,scipipe,v0.12.0,https://scipipe.org,https://github.com/scipipe/scipipe/tree/v0.12.0/docs/basic_concepts.md
https://github.com/scipipe/scipipe/tree/v0.12.0/docs/basic_concepts.md:2569,Integrability,depend,dependencies,2569," and tasks is important to understand, for; example when doing more advanced configuration of file naming strategies, since; the custom anonymous functions used to format paths are taking a `Task` as; input, even though these functions are saved on the process object. To understand the difference between processes and tasks, it is helpful to; remember that processes are long-running, and typically fixed during the course; of a workflow, while tasks are transient objects, created temporarily as a; container for all data and code needed for each execution of a concrete shell; command. * See [GoDoc for Task](https://godoc.org/github.com/scipipe/scipipe#Task). ## Ports. Central to the way data dependencies are defined in SciPipe, is ports. Ports; are fields on processes, which are connected to other ports via channels (see; separate section on this page). In SciPipe, each port must have a unique name within its process (there can't; be an in-port and out-port named the same), and this name will be used in shell; command patterns, when connecting dependencies / dataflow networks, and when; configuring file naming strategies. In `Process` objects, in-ports are are accessed with; `myProcess.In(""my_port"")`, and out-ports are similarly accessed with; `myProcess.Out(""my_other_port"")`. They are of type; [`InPort`](https://godoc.org/github.com/scipipe/scipipe#InPort) and; [`OutPort`](https://godoc.org/github.com/scipipe/scipipe#OutPort) respectively. Some pre-made components might have ports bound to custom field names though,; such as `myFastaReader.InFastaFile`, or `myZipComponent.OutZipFile`. Port objects have some methods bound to them, most importantly the `From()`; method (for in-ports. Out-ports have a corresponding `To()` method), which; takes another port, and connects to it, by stitching a channel between the; ports. On `Process` objects, there is also a third port type, `InParamPort` (and the; accompanying `OutParamPort`), which is used when it is needed to send a; s",MatchSource.DOCS,docs/basic_concepts.md,scipipe,scipipe,v0.12.0,https://scipipe.org,https://github.com/scipipe/scipipe/tree/v0.12.0/docs/basic_concepts.md
https://github.com/scipipe/scipipe/tree/v0.12.0/docs/basic_concepts.md:1588,Modifiability,config,configuration,1588,"which is specialized for executing commandline applications. New; `Process`-es are typically created using the `scipipe.NewProc(procName,; shellPattern)` command. * See [GoDoc for Process](https://godoc.org/github.com/scipipe/scipipe#Process). ## Tasks. The ""long-running"" processes mentioned above, will receive input files on its; in-ports, and for each complete set of input files it receives, it will create; a new **task**. Specifically, `scipipe.Process` will create; [`scipipe.Task`](https://godoc.org/github.com/scipipe/scipipe#Task) objects, and populate it with all data needed for one; particular shell command execution. `Task` objects are executed via their; [`Execute()`](https://godoc.org/github.com/scipipe/scipipe#Task.Execute); method, or `CustomExecute()`, if custom Go code is supposed to be; executed instead of a shell command. The distinction between processes and tasks is important to understand, for; example when doing more advanced configuration of file naming strategies, since; the custom anonymous functions used to format paths are taking a `Task` as; input, even though these functions are saved on the process object. To understand the difference between processes and tasks, it is helpful to; remember that processes are long-running, and typically fixed during the course; of a workflow, while tasks are transient objects, created temporarily as a; container for all data and code needed for each execution of a concrete shell; command. * See [GoDoc for Task](https://godoc.org/github.com/scipipe/scipipe#Task). ## Ports. Central to the way data dependencies are defined in SciPipe, is ports. Ports; are fields on processes, which are connected to other ports via channels (see; separate section on this page). In SciPipe, each port must have a unique name within its process (there can't; be an in-port and out-port named the same), and this name will be used in shell; command patterns, when connecting dependencies / dataflow networks, and when; configuring fil",MatchSource.DOCS,docs/basic_concepts.md,scipipe,scipipe,v0.12.0,https://scipipe.org,https://github.com/scipipe/scipipe/tree/v0.12.0/docs/basic_concepts.md
https://github.com/scipipe/scipipe/tree/v0.12.0/docs/basic_concepts.md:2613,Modifiability,config,configuring,2613," and tasks is important to understand, for; example when doing more advanced configuration of file naming strategies, since; the custom anonymous functions used to format paths are taking a `Task` as; input, even though these functions are saved on the process object. To understand the difference between processes and tasks, it is helpful to; remember that processes are long-running, and typically fixed during the course; of a workflow, while tasks are transient objects, created temporarily as a; container for all data and code needed for each execution of a concrete shell; command. * See [GoDoc for Task](https://godoc.org/github.com/scipipe/scipipe#Task). ## Ports. Central to the way data dependencies are defined in SciPipe, is ports. Ports; are fields on processes, which are connected to other ports via channels (see; separate section on this page). In SciPipe, each port must have a unique name within its process (there can't; be an in-port and out-port named the same), and this name will be used in shell; command patterns, when connecting dependencies / dataflow networks, and when; configuring file naming strategies. In `Process` objects, in-ports are are accessed with; `myProcess.In(""my_port"")`, and out-ports are similarly accessed with; `myProcess.Out(""my_other_port"")`. They are of type; [`InPort`](https://godoc.org/github.com/scipipe/scipipe#InPort) and; [`OutPort`](https://godoc.org/github.com/scipipe/scipipe#OutPort) respectively. Some pre-made components might have ports bound to custom field names though,; such as `myFastaReader.InFastaFile`, or `myZipComponent.OutZipFile`. Port objects have some methods bound to them, most importantly the `From()`; method (for in-ports. Out-ports have a corresponding `To()` method), which; takes another port, and connects to it, by stitching a channel between the; ports. On `Process` objects, there is also a third port type, `InParamPort` (and the; accompanying `OutParamPort`), which is used when it is needed to send a; s",MatchSource.DOCS,docs/basic_concepts.md,scipipe,scipipe,v0.12.0,https://scipipe.org,https://github.com/scipipe/scipipe/tree/v0.12.0/docs/basic_concepts.md
https://github.com/scipipe/scipipe/tree/v0.12.0/docs/basic_concepts.md:5225,Modifiability,config,configured,5225,"he OutPort struct type](https://godoc.org/github.com/scipipe/scipipe#OutPort); * See [GoDoc for the InParamPort struct type](https://godoc.org/github.com/scipipe/scipipe#InParamPort); * See [GoDoc for the OutParamPort struct type](https://godoc.org/github.com/scipipe/scipipe#OutParamPort). ## Channels. Ports in SciPipe are connected via channels. Channels are [plain Go channels](https://tour.golang.org/concurrency/2); and nothing more. Most of the time, one will not need to deal with the channels; directly though, since the port objects (see separate section for ports) have; all the logic to connect to other ports via channels, but it can be good to; know that they are there, in case you need to do something more advanced. ## Workflow. The [`Workflow`](https://godoc.org/github.com/scipipe/scipipe#Workflow); is a special object in SciPipe, that just takes care of running a set of; components making up a workflow. There is not much to say about the workflow component, other than that it is; created with `scipipe.NewWorkflow(workflowName, maxConcurrentTasks)`, that all processes need to be added; to it with `wf.AddProc(proc)` while the ""last"", or ""driving"" process needs to be specified with `wf.SetDriver(driverProcess)`, and that it should be run with; `wf.Run()`. But this is already covered in the other examples and; tutorials. * See [GoDoc for Workflow](https://godoc.org/github.com/scipipe/scipipe#Workflow). ## Shell command pattern. The `Process` has the speciality that it can be configured using a special; shell command pattern, supplied to the [`NewProc()`](https://godoc.org/github.com/scipipe/scipipe#NewProc); factory function. It is already explained in the section ""writing workflows"",; but in brief, it is a normal shell command, with placeholders for in-ports,; out-ports and parameter ports, on the form `{i:inportname}`, `{o:outportname}`,; and `{p:paramportname}`, respectively. * See [GoDoc for NewProc()](https://godoc.org/github.com/scipipe/scipipe#NewProc); ",MatchSource.DOCS,docs/basic_concepts.md,scipipe,scipipe,v0.12.0,https://scipipe.org,https://github.com/scipipe/scipipe/tree/v0.12.0/docs/basic_concepts.md
https://github.com/scipipe/scipipe/tree/v0.12.0/docs/basic_concepts.md:4126,Performance,concurren,concurrency,4126,"some methods bound to them, most importantly the `From()`; method (for in-ports. Out-ports have a corresponding `To()` method), which; takes another port, and connects to it, by stitching a channel between the; ports. On `Process` objects, there is also a third port type, `InParamPort` (and the; accompanying `OutParamPort`), which is used when it is needed to send a; stream of parameter values (in string format) to be supplied to as arguments; to shell commands. * See [GoDoc for the InPort struct type](https://godoc.org/github.com/scipipe/scipipe#InPort); * See [GoDoc for the OutPort struct type](https://godoc.org/github.com/scipipe/scipipe#OutPort); * See [GoDoc for the InParamPort struct type](https://godoc.org/github.com/scipipe/scipipe#InParamPort); * See [GoDoc for the OutParamPort struct type](https://godoc.org/github.com/scipipe/scipipe#OutParamPort). ## Channels. Ports in SciPipe are connected via channels. Channels are [plain Go channels](https://tour.golang.org/concurrency/2); and nothing more. Most of the time, one will not need to deal with the channels; directly though, since the port objects (see separate section for ports) have; all the logic to connect to other ports via channels, but it can be good to; know that they are there, in case you need to do something more advanced. ## Workflow. The [`Workflow`](https://godoc.org/github.com/scipipe/scipipe#Workflow); is a special object in SciPipe, that just takes care of running a set of; components making up a workflow. There is not much to say about the workflow component, other than that it is; created with `scipipe.NewWorkflow(workflowName, maxConcurrentTasks)`, that all processes need to be added; to it with `wf.AddProc(proc)` while the ""last"", or ""driving"" process needs to be specified with `wf.SetDriver(driverProcess)`, and that it should be run with; `wf.Run()`. But this is already covered in the other examples and; tutorials. * See [GoDoc for Workflow](https://godoc.org/github.com/scipipe/scipipe#W",MatchSource.DOCS,docs/basic_concepts.md,scipipe,scipipe,v0.12.0,https://scipipe.org,https://github.com/scipipe/scipipe/tree/v0.12.0/docs/basic_concepts.md
https://github.com/scipipe/scipipe/tree/v0.12.0/docs/basic_concepts.md:2688,Security,access,accessed,2688," paths are taking a `Task` as; input, even though these functions are saved on the process object. To understand the difference between processes and tasks, it is helpful to; remember that processes are long-running, and typically fixed during the course; of a workflow, while tasks are transient objects, created temporarily as a; container for all data and code needed for each execution of a concrete shell; command. * See [GoDoc for Task](https://godoc.org/github.com/scipipe/scipipe#Task). ## Ports. Central to the way data dependencies are defined in SciPipe, is ports. Ports; are fields on processes, which are connected to other ports via channels (see; separate section on this page). In SciPipe, each port must have a unique name within its process (there can't; be an in-port and out-port named the same), and this name will be used in shell; command patterns, when connecting dependencies / dataflow networks, and when; configuring file naming strategies. In `Process` objects, in-ports are are accessed with; `myProcess.In(""my_port"")`, and out-ports are similarly accessed with; `myProcess.Out(""my_other_port"")`. They are of type; [`InPort`](https://godoc.org/github.com/scipipe/scipipe#InPort) and; [`OutPort`](https://godoc.org/github.com/scipipe/scipipe#OutPort) respectively. Some pre-made components might have ports bound to custom field names though,; such as `myFastaReader.InFastaFile`, or `myZipComponent.OutZipFile`. Port objects have some methods bound to them, most importantly the `From()`; method (for in-ports. Out-ports have a corresponding `To()` method), which; takes another port, and connects to it, by stitching a channel between the; ports. On `Process` objects, there is also a third port type, `InParamPort` (and the; accompanying `OutParamPort`), which is used when it is needed to send a; stream of parameter values (in string format) to be supplied to as arguments; to shell commands. * See [GoDoc for the InPort struct type](https://godoc.org/github.com/scip",MatchSource.DOCS,docs/basic_concepts.md,scipipe,scipipe,v0.12.0,https://scipipe.org,https://github.com/scipipe/scipipe/tree/v0.12.0/docs/basic_concepts.md
https://github.com/scipipe/scipipe/tree/v0.12.0/docs/basic_concepts.md:2758,Security,access,accessed,2758,"e saved on the process object. To understand the difference between processes and tasks, it is helpful to; remember that processes are long-running, and typically fixed during the course; of a workflow, while tasks are transient objects, created temporarily as a; container for all data and code needed for each execution of a concrete shell; command. * See [GoDoc for Task](https://godoc.org/github.com/scipipe/scipipe#Task). ## Ports. Central to the way data dependencies are defined in SciPipe, is ports. Ports; are fields on processes, which are connected to other ports via channels (see; separate section on this page). In SciPipe, each port must have a unique name within its process (there can't; be an in-port and out-port named the same), and this name will be used in shell; command patterns, when connecting dependencies / dataflow networks, and when; configuring file naming strategies. In `Process` objects, in-ports are are accessed with; `myProcess.In(""my_port"")`, and out-ports are similarly accessed with; `myProcess.Out(""my_other_port"")`. They are of type; [`InPort`](https://godoc.org/github.com/scipipe/scipipe#InPort) and; [`OutPort`](https://godoc.org/github.com/scipipe/scipipe#OutPort) respectively. Some pre-made components might have ports bound to custom field names though,; such as `myFastaReader.InFastaFile`, or `myZipComponent.OutZipFile`. Port objects have some methods bound to them, most importantly the `From()`; method (for in-ports. Out-ports have a corresponding `To()` method), which; takes another port, and connects to it, by stitching a channel between the; ports. On `Process` objects, there is also a third port type, `InParamPort` (and the; accompanying `OutParamPort`), which is used when it is needed to send a; stream of parameter values (in string format) to be supplied to as arguments; to shell commands. * See [GoDoc for the InPort struct type](https://godoc.org/github.com/scipipe/scipipe#InPort); * See [GoDoc for the OutPort struct type](https",MatchSource.DOCS,docs/basic_concepts.md,scipipe,scipipe,v0.12.0,https://scipipe.org,https://github.com/scipipe/scipipe/tree/v0.12.0/docs/basic_concepts.md
https://github.com/scipipe/scipipe/tree/v0.12.0/docs/basic_concepts.md:4310,Testability,log,logic,4310,"ts to it, by stitching a channel between the; ports. On `Process` objects, there is also a third port type, `InParamPort` (and the; accompanying `OutParamPort`), which is used when it is needed to send a; stream of parameter values (in string format) to be supplied to as arguments; to shell commands. * See [GoDoc for the InPort struct type](https://godoc.org/github.com/scipipe/scipipe#InPort); * See [GoDoc for the OutPort struct type](https://godoc.org/github.com/scipipe/scipipe#OutPort); * See [GoDoc for the InParamPort struct type](https://godoc.org/github.com/scipipe/scipipe#InParamPort); * See [GoDoc for the OutParamPort struct type](https://godoc.org/github.com/scipipe/scipipe#OutParamPort). ## Channels. Ports in SciPipe are connected via channels. Channels are [plain Go channels](https://tour.golang.org/concurrency/2); and nothing more. Most of the time, one will not need to deal with the channels; directly though, since the port objects (see separate section for ports) have; all the logic to connect to other ports via channels, but it can be good to; know that they are there, in case you need to do something more advanced. ## Workflow. The [`Workflow`](https://godoc.org/github.com/scipipe/scipipe#Workflow); is a special object in SciPipe, that just takes care of running a set of; components making up a workflow. There is not much to say about the workflow component, other than that it is; created with `scipipe.NewWorkflow(workflowName, maxConcurrentTasks)`, that all processes need to be added; to it with `wf.AddProc(proc)` while the ""last"", or ""driving"" process needs to be specified with `wf.SetDriver(driverProcess)`, and that it should be run with; `wf.Run()`. But this is already covered in the other examples and; tutorials. * See [GoDoc for Workflow](https://godoc.org/github.com/scipipe/scipipe#Workflow). ## Shell command pattern. The `Process` has the speciality that it can be configured using a special; shell command pattern, supplied to the [`NewProc()`](",MatchSource.DOCS,docs/basic_concepts.md,scipipe,scipipe,v0.12.0,https://scipipe.org,https://github.com/scipipe/scipipe/tree/v0.12.0/docs/basic_concepts.md
https://github.com/scipipe/scipipe/tree/v0.12.0/docs/contributing.md:899,Availability,down,down,899,"# Contributing to SciPipe. ## Working with forked repository. Unlike other languages like C++/Python, Go requires modules being referenced,; to be placed in a specific location for the import to work. Forking via GitHub; provides a pull request workflow that is well documented but does not work well; with Go import. Documented here is one approach utilizing go modules. First, fork and clone SciPipe the usual way via GitHub to a local file system,; lets call it `<cloned-scipipe-dir>`. To work on and test the changes made to scipipe in the cloned location, create; a directory for your scipipe workflows, lets call it `<workflow-dev-dir>`. In; that directory, you can create a simple `main.go` file with a `package main` so; that you can run your code that exercises the changes you are making at; `<cloned-scipipe-dir>`. Note that if you were to run your code in `main.go` as-is, it would pull down; the code from the repository and cache them and you will not actually be able; to test any local changes in scipipe. To do so, you need to create a file call; `go.mod`. In `<workflow-dev-dir>` run the following:. ```; go mod init <some package name>; ```. Note: The actual name of the package is not critical. Next, define the modules required by your main.go:. ```; go mod edit -require=github.com/scipipe/scipipe@v0.9.10; ```. Note: A the time of this writing, v0.9.10 is the latest published version, this; will change over time and you need to adapt. Next, replace any reference to the previous URL with reference to the; `<cloned-scipipe-dir>` location:. ```; go mod edit -replace=github.com/scipipe/scipipe@v0.9.10=<cloned-scipipe-dir>; ```. Now when you do:. ```; go run main.go; ```. ... it will not be pulling the code from GitHub but references the code you; have cloned locally. Do your development work and push to your forked repository and do a pull; request for the author to review and optionally merge the contribution.; ",MatchSource.DOCS,docs/contributing.md,scipipe,scipipe,v0.12.0,https://scipipe.org,https://github.com/scipipe/scipipe/tree/v0.12.0/docs/contributing.md
https://github.com/scipipe/scipipe/tree/v0.12.0/docs/contributing.md:1453,Energy Efficiency,adapt,adapt,1453,"# Contributing to SciPipe. ## Working with forked repository. Unlike other languages like C++/Python, Go requires modules being referenced,; to be placed in a specific location for the import to work. Forking via GitHub; provides a pull request workflow that is well documented but does not work well; with Go import. Documented here is one approach utilizing go modules. First, fork and clone SciPipe the usual way via GitHub to a local file system,; lets call it `<cloned-scipipe-dir>`. To work on and test the changes made to scipipe in the cloned location, create; a directory for your scipipe workflows, lets call it `<workflow-dev-dir>`. In; that directory, you can create a simple `main.go` file with a `package main` so; that you can run your code that exercises the changes you are making at; `<cloned-scipipe-dir>`. Note that if you were to run your code in `main.go` as-is, it would pull down; the code from the repository and cache them and you will not actually be able; to test any local changes in scipipe. To do so, you need to create a file call; `go.mod`. In `<workflow-dev-dir>` run the following:. ```; go mod init <some package name>; ```. Note: The actual name of the package is not critical. Next, define the modules required by your main.go:. ```; go mod edit -require=github.com/scipipe/scipipe@v0.9.10; ```. Note: A the time of this writing, v0.9.10 is the latest published version, this; will change over time and you need to adapt. Next, replace any reference to the previous URL with reference to the; `<cloned-scipipe-dir>` location:. ```; go mod edit -replace=github.com/scipipe/scipipe@v0.9.10=<cloned-scipipe-dir>; ```. Now when you do:. ```; go run main.go; ```. ... it will not be pulling the code from GitHub but references the code you; have cloned locally. Do your development work and push to your forked repository and do a pull; request for the author to review and optionally merge the contribution.; ",MatchSource.DOCS,docs/contributing.md,scipipe,scipipe,v0.12.0,https://scipipe.org,https://github.com/scipipe/scipipe/tree/v0.12.0/docs/contributing.md
