quality_attribute,sentence,source,author,repo,version,id,keyword,matched_word,match_idx,wiki,url,total_similar,target_keywords,target_matched_words
Deployability,"6.0 release:**; --------------------------------------. * Important bug fixes for the joint calling tools (GenotypeGVCFs / GenomicsDB); * GATK 4.2.5.0 contained two joint genotyping bugs that are now fixed in GATK 4.2.6.0:; * `GenotypeGVCFs` can throw NullPointerExceptions in some cases with many alternate alleles. ; * The expectation-maximization component of the QUAL calculation was disabled, leading to false positive, low quality alleles at some multi-allelic sites.; * **If you are running these tools in 4.2.5.0 we strongly recommend updating to 4.2.6.0**. * Fixed a ""Bucket is a requester pays bucket but no user project provided"" error that occurred when accessing requester pays buckets in Google Cloud Storage even when the `--gcs-project-for-requester-pays` argument was specified; * **If you continue to encounter problems accessing requester pays Google Cloud Storage buckets in 4.2.6.0, please let us know by filing a Github issue!**. * Two new tools for the Structural Variation calling pipeline: `SVAnnotate` and `PrintSVEvidence`. * Some fixes to genotype-given-alleles mode in `HaplotypeCaller` and `Mutect2`. **Full list of changes:**; -------------------------. * **Joint Calling (GenotypeGVCFs / GenomicsDB)**; * GATK 4.2.5.0 contained two joint genotyping bugs which are now fixed in 4.2.6.0:; * `GenotypeGVCFs` can throw NullPointerExceptions in some cases with many alternate alleles.; * Fixed in:; * Fix for `NullPointerException` when GenomicsDB has more ALT alleles than specified maximum and many GQ0 hom-ref genotypes allow variants to pass the QUAL filter (#7738) ; * The expectation-maximization component of the QUAL calculation was disabled, leading to false positive, low quality alleles at some multi-allelic sites.; * Fixed in: ; * Fix multi-allelic QUAL calculation and restore some missing ALT annotation data in `ReblockGVCFs` (#7670); * Mention acceptable compressed VCF file extensions in `GenomicsDBImport` error message (#7692). * **SV Calling**; * Added ",MatchSource.RELEASES,broadinstitute,gatk,4.6.0.0,https://github.com/broadinstitute/gatk/releases/tag/4.2.6.0:1268,pipeline,pipeline,1268,https://software.broadinstitute.org/gatk,https://github.com/broadinstitute/gatk/releases/tag/4.2.6.0,1,['pipeline'],['pipeline']
Deployability,"65); * Small performance improvement in GVCF mode (#5470). * `CNV Tools`; * Out of beta, as mentioned above! (#5596); * Added per-sample denoised coverage output to gCNV (#5584); * `ModelSegments`: Added separate allele-count thresholds for the normal and tumor (#5556); * `ModelSegments`: Added `MinibatchSliceSampler` and replaced naive subsampling (#5575); * Restored array output in gCNV WDLs for efficient postprocessing. (#5490). * Changed tagged argument syntax from `--argument tag:value` to `--argument:tag value` (#5526); * For example, `--resource known,known=true,prior=10.0:myFile` becomes `--resource:known,known=true,prior=10.0 myFile`; * This change affects `VariantRecalibrator`, `VariantEval`, `VariantFiltration`, and `VariantAnnotator`. * `Funcotator`; * Out of beta, as mentioned above! (#5621); * New datasource release that fixes many issues and adds `gnomAD` support (#5614); * VCF Data Sources now preserve the FILTER field (#5598); * Funcotator now gets the NCBI build version from the datasource config file (#5522); * Funcotator now ignores transcript version numbers when matching on transcript ID (#5557); * Funcotator now uses the GATK-wide version number (#5520); * Updated Funcotator tool documentation (#5620). * `MarkDuplicatesSpark`; * Out of beta, as mentioned above! (#5603); * Added the ability for MarkDuplicatesSpark to accept multiple bam inputs (#5430); * Fixed MarkDuplicateSpark mutex argument references (#5538). * Spark tools; * Support for distributed BAI index creation, and option for enabling or disabling writing BAI and SBI files on Spark (#5485); * Get `HaplotypeCallerSpark` ""strict mode"" running on an exome (#5475); * Added an option for enabling or disabling writing tabix indexes for bgzipped VCF files from Spark (#5574); * Fixed overflow bug in `GatkSparkTool.getRecommendedNumReducers()` (#5586). * `GenomicsDB`; * Migrated from `com.intel.genomicsdb` to `org.genomicsdb` (#5587) (#5608); * GenomicsDB now matches CombineGVCFs with input ",MatchSource.RELEASES,broadinstitute,gatk,4.6.0.0,https://github.com/broadinstitute/gatk/releases/tag/4.1.0.0:12565,release,release,12565,https://software.broadinstitute.org/gatk,https://github.com/broadinstitute/gatk/releases/tag/4.1.0.0,1,['release'],['release']
Deployability,"821); * Made the `HaplotypeCaller`/`Mutect2` adaptive pruner smarter in complex graphs, resulting in modest improvements to indel sensitivity when using the adaptive pruning option (#6520) ; * Fixed a bug in variation event detection code that could sometimes lead to mistreating indel assembly windows as SNP assembly windows (#6661); * Fixed a bug in `FragmentUtils` where insertion quals were used instead of deletion quals when adjusting base qualities for two overlapping reads from the same fragment (#6815); * Fixed a concurrent modification exception error for local runs of `HaplotypeCallerSpark` (#6741); * Marked the `--linked-de-bruijn-graph` argument as Advanced rather than Hidden (#6737); * Made a small tweak to `Mutect2`'s callable sites count (#6791); * Added a ""requester pays"" option to `Mutect2` WDL tasks that access bams for use with Google Cloud ""requester pays"" buckets (#6879). * **Funcotator**; * A major set of updates to `Funcotator` (#6660); * Updated to the latest Gencode release; * Fixed the contig naming compatibility issue with dbSNP reported in https://github.com/broadinstitute/gatk/issues/6564 (""hg38 dbSNP has incorrect contig names""); * Now both hg19 and hg38 have the contig names translated to ""chr__""; * Added 'lncRNA' to GeneTranscriptType.; * Added ""TAGENE"" gene tag.; * Added the MANE_SELECT tag to FeatureTag.; * Added the STOP_CODON_READTHROUGH tag to FeatureTag.; * Updated the GTF versions that are parseable.; * Fixed a parsing error with new versions of gencode and the remap positions (for liftover files).; * Added test for indexing new lifted over gencode GTF.; * Added Gencode_34 entries to MAF output map.; * Pointed data source downloader at new data sources URL.; * Minor updates to workflows to point at new data sources.; * Updated retrieval scripts for dbSNP and Gencode.; * Added required field to gencode config file generation.; * Now gencode retrieval script enforces double hash comments at top of gencode GTF files.; * Fixed an err",MatchSource.RELEASES,broadinstitute,gatk,4.6.0.0,https://github.com/broadinstitute/gatk/releases/tag/4.1.9.0:4020,update,updates,4020,https://software.broadinstitute.org/gatk,https://github.com/broadinstitute/gatk/releases/tag/4.1.9.0,2,"['release', 'update']","['release', 'updates']"
Deployability,"://gatk.broadinstitute.org/hc/en-us/articles/10064202674971-Introducing-NVIDIA-s-NVScoreVariants-a-new-deep-learning-tool-for-filtering-variants) has more of the story from when we first made the tool available for testing.; * New `Funcotator` argument `--prefer-mane-transcripts` which improves transcript selection and lays groundwork for upcoming improvements.; * New argument `--variant-output-filtering` which lets you restrict output variants based on the input intervals. This replaces and imrpoves on `--only-output-calls-starting-in-interval` and works with `SelectVariants` and other VariantWalkers. This is useful to prevent duplicating variants when splitting an input VCF into multiple shards. **Full list of changes:**; -------------------------; * **CNNScoreVariants -> NVScoreVariants** (https://github.com/broadinstitute/gatk/pull/8004, https://github.com/broadinstitute/gatk/pull/9010, https://github.com/broadinstitute/gatk/pull/9009); * CNNScore variants has been replaced by NVScoreVariants, scripts that use it should be updated to use NVScoreVariants instead.; * The training tools (CNNVariantTrain, CNNVariantWriteTensors)have been removed. If you need to retrain the model for your data type you should continue to use GATK 4.6.0.0. New training tools are in development to work alongside NVScoreVariants and will be added in subsequent releases. ; ; * **New Tools** ; * New tool `GtfToBed` to convert Gencode GTF files to BED files (#7159, https://github.com/broadinstitute/gatk/pull/8942); * New tool for internal use `VcfComparator` (https://github.com/broadinstitute/gatk/pull/8933, https://github.com/broadinstitute/gatk/pull/8973) . * **Joint Calling GVS**; * Adds QD and AS_QD emission from VariantAnnotator on GVS input (https://github.com/broadinstitute/gatk/pull/8978). * **GenomicsDB**; * Switch to logging a warning instead of an exception for intervals in query that were not part of GenomicsDBImport (https://github.com/broadinstitute/gatk/pull/8987); ; * **Func",MatchSource.RELEASES,broadinstitute,gatk,4.6.0.0,https://github.com/broadinstitute/gatk/releases/tag/4.6.1.0:1995,update,updated,1995,https://software.broadinstitute.org/gatk,https://github.com/broadinstitute/gatk/releases/tag/4.6.1.0,1,['update'],['updated']
Deployability,"Changed cr.igv.seg output of ModelSegments to give log2 Segment_Mean. (#5976); * Fixed CNV plotting script to allow spaces in input filenames. (#5983). * **GenomicsDBImport**; * Added support for making incremental updates to existing workspaces (#5970); * This can be done using the new `--genomicsdb-update-workspace-path` argument; * Fixed a crash in `GenomicsDBImport` on queries at positions inside deletions (#5899); * Treat AS_QUALapprox and AS_VarDP strings as array of int vectors (#5933). * **Mitochondrial Calling Pipeline**; * Added NIO support and updated to WDL 1.0 (#6074). * **Spark Tools**; * Removed the beta label from many simple Spark tools (#5991); * Bug fix for reading references from GCS on Spark (#6070); * Eliminated an unnecessary sort step in `HaplotypeCallerSpark` (#5909); * Fixed `BaseRecalibratorSpark` failure on a cluster due to system classloader issue (#5979); * Added a WDL for `ReadsPipelineSpark` (#5904); * Added a command-line argument to toggle using NIO on reading for Spark (#6010); * Added advanced arguments to `MarkDuplicatesSpark` to allow non-queryname sorted inputs when specifying multiple input bams and to treat unsorted inputs as queryGroup-sorted (#5974); * Clarified the behavior of `MarkDuplicatesSpark` when given multiple input bams, and improved the sorting behavior if given a mix of queryname-sorted and query-grouped bams (#5901); * Changed `spark.yarn.executor.memoryOverhead` to `spark.executor.memoryOverhead` as promoted by Spark 2.3 (#6032); * Handle newly-added arguments in `ApplyBQSRUniqueArgumentCollection` (#5949). * **Miscellaneous Changes**; * Added a new `BaseQualityHistogram` variant annotation to generate base quality histograms (#5986); * Added a new `SoftClippedReadFilter` that can filter out reads where the ratio of soft-clipped bases to total bases exceeds some given value (#5995); * Fixed a serious bug in `ValidateVariants` where the tool would silently do no validation in the default case when a DBSNP file ",MatchSource.RELEASES,broadinstitute,gatk,4.6.0.0,https://github.com/broadinstitute/gatk/releases/tag/4.1.3.0:5142,toggle,toggle,5142,https://software.broadinstitute.org/gatk,https://github.com/broadinstitute/gatk/releases/tag/4.1.3.0,1,['toggle'],['toggle']
Deployability,"DRAGEN-GATK** (#6634) (#7063); * With this release we've worked closely with Illumina to make improvements to the GATK `HaplotypeCaller` to allow it to output germline short variant calls that are functionally equivalent to the calls made by their DRAGEN 3.4.12 pipeline. See [our blog post on DRAGEN-GATK](https://gatk.broadinstitute.org/hc/en-us/articles/360039984151-DRAGEN-GATK-Update-Let-s-get-more-specific) for more details on these improvements. A full `DRAGEN-GATK` pipeline that leverages these new features will be released in the near future as a WDL workflow script in the [WARP](https://github.com/broadinstitute/warp) repo on GitHub as well as a featured workspace in [Terra](https://terra.bio/). ; * Below is a summary of the improvements we've ported from DRAGEN in this release. We recommend that most users wait until the complete `DRAGEN-GATK` pipeline is released as a WDL workflow before evaluating these features, though advanced users comfortable with building their own pipelines are welcome to try them out now:; * **DragSTR**: a port of DRAGEN's model for STRs (Short Tandem Repeats) that adjusts HMM indel priors based on empirical reference contexts for better indel calling.; * Using DragSTR involves running two new tools prior to the `HaplotypeCaller`: ; * `ComposeSTRTableFile`: scans a reference for STR sites and outputs a table file with a subsample of the available STR sites across the genome. ; * `CalibrateDragstrModel`: given the STR table for a reference produced by `ComposeSTRTableFile` and the reads for a specific sample, generates a model for potential sequencing errors for STR sites of various sizes for that sample.; * After running these tools, you then run `HaplotypeCaller` with the **`--dragstr-params-path`** argument to pass it the DragSTR model generated by `CalibrateDragstrModel`.; * **BQD (Base Quality Dropout)** and **FRD (Foreign Read Detection)**: two new genotyper error models ported from DRAGEN; * The `Base Quality Dropout (BQD)` mo",MatchSource.RELEASES,broadinstitute,gatk,4.6.0.0,https://github.com/broadinstitute/gatk/releases/tag/4.2.0.0:1849,pipeline,pipeline,1849,https://software.broadinstitute.org/gatk,https://github.com/broadinstitute/gatk/releases/tag/4.2.0.0,3,"['pipeline', 'release']","['pipeline', 'pipelines', 'released']"
Deployability,"Fv4.2 spec; * Size similarity linkage and bug fixes for SV matching tools (#8257); * Added size similarity criterion to the `SVConcordance` and `SVCluster` tools. This is particularly useful for accurately matching smaller SVs that have a high degree of breakpoint uncertainty, in which case reciprocal overlap does not work well. PESR/mixed variant types must have size similarity, reciprocal overlap, and breakend window criteria met. Depth-only variants may have either size similarity + reciprocal overlap OR breakend window criteria met (or both).; * Updated SV split-read strand validation and clustering (#8378); * Adds some flexibility to the allowed split-read strand annotations on SV records:; * Allow INS -+ strands; * Allow INV null strands; * When clustering, only require that strands match for INV/BND records; * Sample set and annotation improvements for `SVConcordance` (#8211). * **Mitochondrial pipeline** ; * Added a variable for the user to specify the java heap size in Picard in the MT pipeline (#8406); * Exposed runtime attributes as arguments in the MT pipeline (#8413) (#8417). * **Flow-based Calling**; * New/updated flow-based read tools (#8579); * Added a new `GroundTruthScorer` tool to score reads against a reference/ground truth; * Updated `FlowFeatureMapper`; * Created an `AddFlowBaseQuality` tool that writes reads from flow-based SAM/BAM/CRAM files that pass criteria to a new file while adding a base-quality attribute (BQ) (#8235); * Added an experimental tool `FlowPairHMMAlignReadsToHaplotypes` that aligns flow-based reads to set of haplotypes / templates (#8305); * Fixed an issue with reads that contain the tp tag sometimes being incorrectly identified as flow-based (#8337); * Minor changes and fixes to flow-based annotations (#8442); * Removed a line in `FlowBasedAnnotation` that contained a bug and thus was meaningless (#8421); * Additional annotation in FeatureMap (#8347); * Removed unnecessary flow-based argument and option (#8342); * `GroundTr",MatchSource.RELEASES,broadinstitute,gatk,4.6.0.0,https://github.com/broadinstitute/gatk/releases/tag/4.5.0.0:7856,pipeline,pipeline,7856,https://software.broadinstitute.org/gatk,https://github.com/broadinstitute/gatk/releases/tag/4.5.0.0,3,['pipeline'],['pipeline']
Deployability,"Highlights of this release include fixes to the GATK4 `HaplotypeCaller` to bring it closer to the output of the GATK3 `HaplotypeCaller` (although many of these fixes still need to be applied to `HaplotypeCallerSpark`), fixes for longstanding indexing and CRAM-related bugs in htsjdk, bash tab completion support for GATK commands, and many improvements to `Mutect2` and the SV tools. A docker image for this release can be found in the `broadinstitute/gatk` repository on dockerhub. Within the image, cd into `/gatk` then run `gatk-launch` commands as usual. *Note:* Due to our current dependency on a snapshot of `google-cloud-java`, this release cannot be published to maven central. Changes in this release:. * `HaplotypeCaller`: a number of important updates and fixes to bring it closer to GATK 3.x's output (most of these fixes apply only to `HaplotypeCaller`, not `HaplotypeCallerSpark`) (#3519); * reduce memory usage of the `AssemblyRegion` traversal by an order of magnitude; * create empty pileup objects for uncovered loci internally (fixes occasional gaps between GVCF blocks as well as some calling artifacts); * when determining active regions, only consider loci within the user's intervals; * port some additional changes to the GATK 3.x `HaplotypeCaller` to GATK4; * fix bug with handling of the `MQ` annotation; * Added bash tab completion support for GATK commands (#3424); * Updated to `Intel GKL` 0.5.8, which fixes bug in AVX detection, which was behaving incorrectly on some AMD systems (#3513); * Upgrade `htsjdk` to 2.11.0-4-g958dc6e-SNAPSHOT to pick up an important VCF header performance fix. (#3504); * Updated `google-cloud-nio` dependency to 0.20.4-alpha-20170727.190814-1:shaded (#3373); * Fix tabix indexing bugs in htsjdk, and reenable the `IndexFeatureFile` tool (#3425); * Fix longstanding issue with CRAM MD5 slice calculation in htsjdk (#3430); * Started publishing nightly builds; * Performance improvements to allow MD+BQSR+HC Spark pipeline to scale to a full ",MatchSource.RELEASES,broadinstitute,gatk,4.6.0.0,https://github.com/broadinstitute/gatk/releases/tag/4.beta.4:19,release,release,19,https://software.broadinstitute.org/gatk,https://github.com/broadinstitute/gatk/releases/tag/4.beta.4,5,"['release', 'update']","['release', 'updates']"
Deployability,"Highlights of this release include the ability to emit MNPs in `Mutect2` and `HaplotypeCaller` via a new `--max-mnp-distance` argument, much better active region detection for low allele fractions in `Mutect2`, new priors for variants sites and homRef blocks in `HaplotypeCaller`, a new tool `FilterAlignmentArtifacts` to filter false positive alignment artifacts in the `Mutect2` pipeline, performance improvements to `CNNScoreVariants` and `Funcotator`, and a new `--sites-only-vcf-output` GATK engine argument to suppress genotypes when writing VCFs. As usual, a docker image for this release can be downloaded from https://hub.docker.com/r/broadinstitute/gatk/. Full list of changes in this release:. * `Mutect2`; * Made `Mutect2` active region determination much better for low allele fractions (#4832); * In particular, this makes `Mutect2` vastly better for mitochondrial and cfDNA calling; * `Mutect2` can now emit MNPs according to adjustable distance threshold specified via `--max-mnp-distance` (#4650); * Tweaked `Mutect2` read position filter to handle non-biological (eg FFPE) insertions better (#4851); * Fixed `Mutect2` bug where triallelic normal artifacts were sometimes hidden from filtering engine (#4809); * `Mutect2` STR filter now also looks at insertions (#4845); * This lowers the indel false positive rate dramatically.; * `Mutect2 WDL`: ; * now outputs MAF segmentation (#4837); * now runs `FilterAlignmentArtifacts` (#4848); * now uses lenient validation in `SortSam` (#4844). * Added new tool `FilterAlignmentArtifacts` (#4698); * Filters false positive alignment artifacts (that is, apparent variants due to reads being mapped to the wrong genomic locus) from a VCF callset by checking variant-supporting reads and their mates.; * By considering the realignment of the read and its mate, it saves a lot of variants, especially in low-complexity regions, from being filtered as mapping errors. * `HaplotypeCaller`; * `HaplotypeCaller` can now emit MNPs according to adjust",MatchSource.RELEASES,broadinstitute,gatk,4.6.0.0,https://github.com/broadinstitute/gatk/releases/tag/4.0.5.0:19,release,release,19,https://software.broadinstitute.org/gatk,https://github.com/broadinstitute/gatk/releases/tag/4.0.5.0,4,"['pipeline', 'release']","['pipeline', 'release']"
Deployability,"It's been a year since the GATK `4.0.0.0` release in January 2018, and we decided that it was time to package up the past year's worth of GATK improvements into a new major release, which we're calling version `4.1.0.0`!. To commemorate this milestone, we'll be publishing a series of in-depth technical articles and blog posts covering the major new features in version `4.1.0.0` on the [official GATK blog](https://software.broadinstitute.org/gatk/blog). Below we've compiled the highlights of the new features added between versions `4.0.0.0` and `4.1.0.0`. If you're interested in seeing *only* the changes between the last release (`4.0.12.0`) and this release (`4.1.0.0`), click [here](#previous-version-diff) instead. Official docker image is here: [https://hub.docker.com/r/broadinstitute/gatk/](https://hub.docker.com/r/broadinstitute/gatk/). ## Major changes between versions 4.0.0.0 and 4.1.0.0 (January 2018 to January 2019):; ------. * **Next-Gen VQSR Replacement For Single-Sample**; * New suite of tools `CNNScoreVariants`, `CNNVariantTrain`, `CNNVariantWriteTensors`, and `FilterVariantTranches`; * `CNNScoreVariants` is now out of beta and ready for production use; * Performs variant training and scoring using a convolutional neural network. ; * Single-sample only; * Produces better results than the legacy `VariantRecalibrator` (VQSR) and comparable or better results to third-party tools like `DeepVariant`; * Sophisticated 2D model that uses the reads. * **Major HaplotypeCaller Improvements**; * Now genotypes and outputs spanning deletions; * Now outputs VCF spec-compliant phased variants; * Can emit MNPs via a new `--max-mnp-distance` argument; * Important fix to the reference confidence calculation upstream of indels; * New `HaplotypeCaller` priors for variants sites and homRef blocks; * Added new `--population-callset` argument allowing an external panel of variants to be specified to inform the frequency distribution underlying the genotype priors; * Added new `--",MatchSource.RELEASES,broadinstitute,gatk,4.6.0.0,https://github.com/broadinstitute/gatk/releases/tag/4.1.0.0:42,release,release,42,https://software.broadinstitute.org/gatk,https://github.com/broadinstitute/gatk/releases/tag/4.1.0.0,4,['release'],['release']
Deployability,"Mutect2.java Documentation (https://github.com/broadinstitute/gatk/pull/8999); * Add more detailed conda setup instructions to the GATK README (https://github.com/broadinstitute/gatk/pull/9001); * Adding small warning messages to not to feed any GVCF files to these tools (https://github.com/broadinstitute/gatk/pull/9008). * **Refactoring**; * Swapped mito mode in Mutect to use the mode argument utils (https://github.com/broadinstitute/gatk/pull/8986). * **Tests**; * Adding a test to capture an expected edge case in Reblocking (https://github.com/broadinstitute/gatk/pull/8928); * Update the large CRAM files to v3.0 (https://github.com/broadinstitute/gatk/pull/8832); * Update CRAM detector output files (https://github.com/broadinstitute/gatk/pull/8971); * Add dependency submission workflow so we can monitor vulnerabilities (https://github.com/broadinstitute/gatk/pull/9002). * **Dependencies**; Updating dependencies to make use of modern frameworks with fewer vulnerabilities was a focus of this release. ; * Updated Python and PyMC, removed TensorFlow, and added PyTorch in conda environment. (https://github.com/broadinstitute/gatk/pull/8561); ; * Rebuild gatk-base docker image (3.3.1) in order to pull in recent patches (https://github.com/broadinstitute/gatk/pull/9005); * Updates to java build and dependencies (https://github.com/broadinstitute/gatk/pull/8998, https://github.com/broadinstitute/gatk/pull/9006, https://github.com/broadinstitute/gatk/pull/9016); * Update to the Gralde 8.10.2; * Improvements to `build.gradle` to use of features like consuming publishes Bills of Materials (BOMs) ; * Update many direct and transitive java dependencies to fix security vulnerabilities.; * Update [Htsjdk 4.1.1 to 4.1.3](https://github.com/samtools/htsjdk/compare/4.1.1...4.1.3) ; * Update [Picard 3.2.0 to 3.3.0](https://github.com/broadinstitute/picard/releases/tag/3.3.0) ; * Update hdf5-java-bindings to version 1.2.0-hdf5_2.11.0 (https://github.com/broadinstitute/gatk/pull/8908)",MatchSource.RELEASES,broadinstitute,gatk,4.6.0.0,https://github.com/broadinstitute/gatk/releases/tag/4.6.1.0:5560,patch,patches,5560,https://software.broadinstitute.org/gatk,https://github.com/broadinstitute/gatk/releases/tag/4.6.1.0,2,"['patch', 'release']","['patches', 'releases']"
