quality_attribute,sentence,source,author,repo,version,id,keyword,matched_word,match_idx,wiki,url,total_similar,target_keywords,target_matched_words
Safety,"nd a reference confidence of 90 in the eval GVCF.; ; * **HaplotypeCaller/Mutect2**; * Fixed a bug in `HaplotypeCaller` and `Mutect2` where we were losing insertion events that immediately followed a deletion (#6696); * Added a workaround for an issue with multiallelics in the `CreateSomaticPanelOfNormals` pipeline (#6871); * This fixes the ""CreateSomaticPanelOfNormals output PoN has much less variants in 4.1.8.0 than before"" issue reported in https://github.com/broadinstitute/gatk/issues/6744; * Made improvements to the `Mutect2` active region detection code that resulted in recovering some low-AF calls that we were missing (#6821); * Made the `HaplotypeCaller`/`Mutect2` adaptive pruner smarter in complex graphs, resulting in modest improvements to indel sensitivity when using the adaptive pruning option (#6520) ; * Fixed a bug in variation event detection code that could sometimes lead to mistreating indel assembly windows as SNP assembly windows (#6661); * Fixed a bug in `FragmentUtils` where insertion quals were used instead of deletion quals when adjusting base qualities for two overlapping reads from the same fragment (#6815); * Fixed a concurrent modification exception error for local runs of `HaplotypeCallerSpark` (#6741); * Marked the `--linked-de-bruijn-graph` argument as Advanced rather than Hidden (#6737); * Made a small tweak to `Mutect2`'s callable sites count (#6791); * Added a ""requester pays"" option to `Mutect2` WDL tasks that access bams for use with Google Cloud ""requester pays"" buckets (#6879). * **Funcotator**; * A major set of updates to `Funcotator` (#6660); * Updated to the latest Gencode release; * Fixed the contig naming compatibility issue with dbSNP reported in https://github.com/broadinstitute/gatk/issues/6564 (""hg38 dbSNP has incorrect contig names""); * Now both hg19 and hg38 have the contig names translated to ""chr__""; * Added 'lncRNA' to GeneTranscriptType.; * Added ""TAGENE"" gene tag.; * Added the MANE_SELECT tag to FeatureTag.; * Adde",MatchSource.RELEASES,broadinstitute,gatk,4.6.0.0,https://github.com/broadinstitute/gatk/releases/tag/4.1.9.0:2996,detect,detection,2996,https://software.broadinstitute.org/gatk,https://github.com/broadinstitute/gatk/releases/tag/4.1.9.0,3,"['detect', 'recover']","['detection', 'recovering']"
Safety,"pair (PE), split-read (SR), or B-allele frequency (BAF) (#7026); * This tool is used frequently in the GATK-SV pipeline for retrieving subsets of evidence records from a bucket over specific intervals. Evidence file formats comply with the current specifications in the existing GATK-SV pipeline. * **GenomicsDB**; * Introduced a new feature for `GenomicsDBImport` that allows merging multiple contigs into fewer GenomicsDB partitions (#6681); * Controlled via the new `--merge-contigs-into-num-partitions` argument to `GenomicsDBImport` ; * This should produce a huge performance boost in cases where users have a very large number of contigs. Prior to this change, GenomicsDB would create a separate folder/partition for each contig, which slowed down import to a crawl when there were many contigs.; ; * **Funcotator**; * Added sorting by strand order for transcript subcomponents (#7065); * This fixes an issue where the coding sequence, protein prediction, and other annotations could be incorrect for the hg19 version of Gencode, due to the individual elements of each transcript appearing in numerical order, rather than the order in which they appear in the transcript at transcription time.; * Updated the Funcotator tutorial link in the tool documentation. (#6920) (#6925). * **Mitochondrial pipeline** ; * Simplified the max_reads_per_alignment_start argument in mitochondria_m2_wdl/AlignAndCall.wdl (#6904); * Remove the unused ""autosomal_coverage"" parameter from the Filter task in mitochondria_m2_wdl/AlignAndCall.wdl (#6888). * **Notable Enhancements**; * Add a `-O` option to save the output to a file in the following tools: `FlagStat`, `CountBases`, `CountReads`, `CountVariants`, and `CountBasesInReference` (#7072); * `DepthOfCoverage`: added a new gene_statistics output file (#7025); * `ReblockGVCF`: allow reblocking with no PLs (#6757). * **Bug Fixes**; * Fixed a `ClosedChannelException` error when doing multiple queries on remote CRAM files, and added a test to verify prop",MatchSource.RELEASES,broadinstitute,gatk,4.6.0.0,https://github.com/broadinstitute/gatk/releases/tag/4.2.0.0:8708,predict,prediction,8708,https://software.broadinstitute.org/gatk,https://github.com/broadinstitute/gatk/releases/tag/4.2.0.0,1,['predict'],['prediction']
Safety,"some performance caveats); * Support for sites-only queries; * Support for returning the GT field in queries; * New protobuf-based API to allow configuration without editing JSON files; * Added in machinery to allow per-annotation combine operations to be specified; * Allow for hdfs and gcs URI's to be passed to GenomicsDB; * Migrated from `com.intel.genomicsdb` to `org.genomicsdb`. * **""Goodies"" Worth Mentioning**; * Added fasta.gz support to the `-R/--reference` argument in walker tools; * `SelectVariants` can now drop specific annotation fields from the output vcf; * `CalculateGenotypePosteriors` now supports indels; * New tool `ReblockGVCF` to merge reference blocks in single-sample GVCFs for smaller filesizes; * Improved MQ calculation accuracy, especially at sites with many uninformative reads; concomitant with new annotation tag and format; * The `-L` argument now supports GCS (Google Cloud Storage) for interval list files / bed / vcf files in walker tools; * Added support for ""Requester Pays"" GCS (Google Cloud Storage) buckets via new `--gcs-project-for-requester-pays` argument; * Added GCS (Google Cloud Storage) output (-O) support to more tools; * Improved Python integration (eliminated timeouts and reliance on prompt synchronization) means fewer glitches during runs of ML-based tools; * A significantly (~33%) smaller GATK docker image; * Changed argument tagging syntax from ""--arg tag:value"" to ""--arg:tag value""; * Affects command-line interface for `VariantRecalibrator`, `VariantEval`, `VariantFiltration`, and `VariantAnnotator`. ## <a id=""previous-version-diff"">Changes between versions 4.0.12.0 and 4.1.0.0 *only*:</a>; ------. * Many tools are now out of beta and ready for production use!; * `CNNScoreVariants` is out of beta (#5548); * `Funcotator` and `FuncotatorDataSourceDownloader` are out of beta (#5621); * `MarkDuplicatesSpark` is out of beta (#5603); * CNV tools are out of beta (#5596). This includes: `AnnotateIntervals`, `CallCopyRatioSegments`, `",MatchSource.RELEASES,broadinstitute,gatk,4.6.0.0,https://github.com/broadinstitute/gatk/releases/tag/4.1.0.0:9014,timeout,timeouts,9014,https://software.broadinstitute.org/gatk,https://github.com/broadinstitute/gatk/releases/tag/4.1.0.0,1,['timeout'],['timeouts']
Safety,"t-use-softclipped-bases` argument (#8271). * **Mutect2**; * Added a `--base-qual-correction-factor` to allow a scale factor to be provided to modify the base qualities reported by the sequencer and used in the `Mutect2` substitution error model (#8447); * Set to zero to turn off the error model changes introduced in GATK 4.1.9.0; * Fixed a bug in `FilterMutectCalls` for GVCFs (#8458); * When using GVCFs with `Mutect2` (for example with the Mitochondria mode), in the filtering step ADs for symbolic alleles are set to 0 so it doesn't contribute to overall AD. There was an off-by-one error that removed the alt allele AD rather than the `<NON_REF>` allele AD. This led to NaNs and errors when a site had no ref reads (for example a GT of `[ref,alt,<NON_REF>]` and AD of `[0,300,0]` would accidentally be changed to an AD of `[0,0,0]` if the alt index was removed instead of the `<NON_REF>` index). * **DRAGEN-GATK**; * Added implementations of the ""columnwise detection"" and ""PDHMM"" (partially-determined HMM) features from DRAGEN to bring us much closer to functional equivalence with DRAGEN v3.7.8 (#8083); * Development work to prepare the way for the final missing DRAGEN 3.7.8 feature, ""joint detection"":; * Graph method for PDHMM event groups that unifies finding/merging and overlap/mutual exclusion (#8366); * Rewrote haplotype construction methods in `PartiallyDeterminedHaplotypeComputationEngine` (#8367); * More refactoring in `PartiallyDeterminedHaplotypeComputationEngine` and preparing for joint detection (#8492); * Innocuous housekeeping changes in the partially-determined haplotypes code (#8361); * Clarify cryptic bitwise operations in the partially-determined haplotype `EventGroup` subclass (#8400); ; * **Joint Calling**; * Added haploid support to `GnarlyGenotyper` (#7750); * Fix to allow `GenotypeGVCFs` to properly handle events not in minimal representation (#8567); * `ReblockGVCF`: added a `--keep-site-filters` argument to keep site-level filters (#8304) (#8308); * ",MatchSource.RELEASES,broadinstitute,gatk,4.6.0.0,https://github.com/broadinstitute/gatk/releases/tag/4.5.0.0:3656,detect,detection,3656,https://software.broadinstitute.org/gatk,https://github.com/broadinstitute/gatk/releases/tag/4.5.0.0,1,['detect'],['detection']
Safety,"ument.; * Added a new variant QUAL score model that reports the variant QUAL score as the posterior of the reference genotype based on the sample-dependent DRAGEN STR and flat SNP priors. * **HaplotypeCaller**; * We now add physical phasing information (PGT/PID/PS attributes) to genotypes with spanning deletion alleles (#6937); * Fixed two phasing bugs (#7019); * Fixed ""HaplotypeCaller emitting incorrect phasing when genotyping hom-het-het"" (https://github.com/broadinstitute/gatk/issues/6463); * Fixed ""Phased variants do not have the same phase set identifier"" (https://github.com/broadinstitute/gatk/issues/6845); * Fixed quality score calculation for sites with spanning deletions (#6859); * This fixes a bug in the AlleleFrequencyCalculator that was causing quality to be overestimated for sites with * alleles representing spanning deletions.; * Added the ability for indels to be recovered from dangling heads in the assembly graph, and a new `--num-matching-bases-in-dangling-end-to-recover` argument for filtering dangling ends (#6113) (#7086); * Improved handling of indels/spanning deletions in the cigar base quality adjustment code. (#6886); * This aims to better handle the edge cases that come up when mates have mismatching numbers of bases at the start or end of the reads relative to each-other. ; * Fixed a bug where overlapping reads in subsequent assembly regions could have invalid base qualities (#6943); * Convert non-ACGT IUPAC bases to N in HaplotypeCaller prior to assembly to prevent a crash (#6868); * Renamed the `--mapping-quality-threshold` argument to `--mapping-quality-threshold-for-genotyping`, and updated its documentation to be less confusing (#7036); * Added an option for `HaplotypeCaller` and `Mutect2` to produce a bamout without artificial haplotypes (#6991); * Updated the `--debug-graph-transformations` argument to emit the assembly graph both before and after chain pruning (#7049). * **Mutect2** ; * Fixed the `--dont-use-soft-clipped-bases` argume",MatchSource.RELEASES,broadinstitute,gatk,4.6.0.0,https://github.com/broadinstitute/gatk/releases/tag/4.2.0.0:4435,recover,recovered,4435,https://software.broadinstitute.org/gatk,https://github.com/broadinstitute/gatk/releases/tag/4.2.0.0,2,['recover'],"['recover', 'recovered']"
Security," * Added a `--output-shard-tmp-dir` argument to specify the parts directory for un-sharded BAM writing (#4666). * `MarkDuplicatesSpark`; * Fixed `MarkDuplicatesSpark` so it handles supplementary reads with unmapped mates properly (#4785); * Added a distinction between PCR orientation and Optical Duplicates orientation in `MarkDuplicatesSpark` (#4752); * Fixed serialization crash in `MarkDuplicatesSpark` (#4778); * Fixed queryname partitioning bug where asking for queryname sort would result in reads with the same name being split between partitions (#4765); * Changed `MarkDuplicatesSpark` to sort non-queryname sorted bams before processing to ensure marking is consistent across shards (#4732); * Renamed some `MarkDuplicatesSpark` arguments to follow the ""kabob-style"" convention (#4715); * `MarkDuplicatesSpark` now uses the Picard `OpticalDuplicatesFinder` directly (#4750); * `MarkDuplicatesSpark` now uses Picard metrics code directly (#4779). * `BwaSpark`: disable sequence dictionary validation when aligning reads #4131 (#4308). * `Funcotator`; * Major performance improvements due to added caching and other optimizations (#4740); * Various fixes (#4783) (#4817) (#4770); * Sanitize special characters when outputting VCF so that VCF validation passes; * Ordering specified in the header did not match the variants and hg19/b37 - VCF datasources were being inconsistently processed, inducing a lot of missed annotations.; * Added Funcotator tests for Clinvar and Gencode v28 in hg38, and mixed chr/no-chr GENCODE.; * Eased restrictions so that Gencode v28 would be recognized as a valid gtf. Future versions of Gencode will not fail just based on the version number and warning will be emitted instead.; * Refining handling of transcripts with missing sequence info.; * Refactored UTR VariantClassification handling.; * Added warning statement when a transcript in the UTR has no sequence info (now is the same behavior as in protein coding regions).; * Added tests to prevent regres",MatchSource.RELEASES,broadinstitute,gatk,4.6.0.0,https://github.com/broadinstitute/gatk/releases/tag/4.0.5.0:4683,validat,validation,4683,https://software.broadinstitute.org/gatk,https://github.com/broadinstitute/gatk/releases/tag/4.0.5.0,1,['validat'],['validation']
Security," Added a distinction between PCR orientation and Optical Duplicates orientation in `MarkDuplicatesSpark` (#4752); * Fixed serialization crash in `MarkDuplicatesSpark` (#4778); * Fixed queryname partitioning bug where asking for queryname sort would result in reads with the same name being split between partitions (#4765); * Changed `MarkDuplicatesSpark` to sort non-queryname sorted bams before processing to ensure marking is consistent across shards (#4732); * Renamed some `MarkDuplicatesSpark` arguments to follow the ""kabob-style"" convention (#4715); * `MarkDuplicatesSpark` now uses the Picard `OpticalDuplicatesFinder` directly (#4750); * `MarkDuplicatesSpark` now uses Picard metrics code directly (#4779). * `BwaSpark`: disable sequence dictionary validation when aligning reads #4131 (#4308). * `Funcotator`; * Major performance improvements due to added caching and other optimizations (#4740); * Various fixes (#4783) (#4817) (#4770); * Sanitize special characters when outputting VCF so that VCF validation passes; * Ordering specified in the header did not match the variants and hg19/b37 - VCF datasources were being inconsistently processed, inducing a lot of missed annotations.; * Added Funcotator tests for Clinvar and Gencode v28 in hg38, and mixed chr/no-chr GENCODE.; * Eased restrictions so that Gencode v28 would be recognized as a valid gtf. Future versions of Gencode will not fail just based on the version number and warning will be emitted instead.; * Refining handling of transcripts with missing sequence info.; * Refactored UTR VariantClassification handling.; * Added warning statement when a transcript in the UTR has no sequence info (now is the same behavior as in protein coding regions).; * Added tests to prevent regression on data source date comparison bug.; * Fixed DNA Repair Genes getter script.; * Fixed an issue in COSMIC to make it robust to bad COSMIC data.; * Gencode no longer crashes when given an indel that starts just before an exon.; * Fixed th",MatchSource.RELEASES,broadinstitute,gatk,4.6.0.0,https://github.com/broadinstitute/gatk/releases/tag/4.0.5.0:4935,validat,validation,4935,https://software.broadinstitute.org/gatk,https://github.com/broadinstitute/gatk/releases/tag/4.0.5.0,1,['validat'],['validation']
Security," Added resource usage section to the `GermlineCNVCaller` java doc (#8064); ; * **SV Calling**; * Added support for breakend replacement alleles in `SVCluster` (#8408); * Implements allele collapsing for ""breakend replacement"" BND alleles, as described in section 5.4 of the VCFv4.2 spec; * Size similarity linkage and bug fixes for SV matching tools (#8257); * Added size similarity criterion to the `SVConcordance` and `SVCluster` tools. This is particularly useful for accurately matching smaller SVs that have a high degree of breakpoint uncertainty, in which case reciprocal overlap does not work well. PESR/mixed variant types must have size similarity, reciprocal overlap, and breakend window criteria met. Depth-only variants may have either size similarity + reciprocal overlap OR breakend window criteria met (or both).; * Updated SV split-read strand validation and clustering (#8378); * Adds some flexibility to the allowed split-read strand annotations on SV records:; * Allow INS -+ strands; * Allow INV null strands; * When clustering, only require that strands match for INV/BND records; * Sample set and annotation improvements for `SVConcordance` (#8211). * **Mitochondrial pipeline** ; * Added a variable for the user to specify the java heap size in Picard in the MT pipeline (#8406); * Exposed runtime attributes as arguments in the MT pipeline (#8413) (#8417). * **Flow-based Calling**; * New/updated flow-based read tools (#8579); * Added a new `GroundTruthScorer` tool to score reads against a reference/ground truth; * Updated `FlowFeatureMapper`; * Created an `AddFlowBaseQuality` tool that writes reads from flow-based SAM/BAM/CRAM files that pass criteria to a new file while adding a base-quality attribute (BQ) (#8235); * Added an experimental tool `FlowPairHMMAlignReadsToHaplotypes` that aligns flow-based reads to set of haplotypes / templates (#8305); * Fixed an issue with reads that contain the tp tag sometimes being incorrectly identified as flow-based (#8337); *",MatchSource.RELEASES,broadinstitute,gatk,4.6.0.0,https://github.com/broadinstitute/gatk/releases/tag/4.5.0.0:7526,validat,validation,7526,https://software.broadinstitute.org/gatk,https://github.com/broadinstitute/gatk/releases/tag/4.5.0.0,1,['validat'],['validation']
Security," Handle newly-added arguments in `ApplyBQSRUniqueArgumentCollection` (#5949). * **Miscellaneous Changes**; * Added a new `BaseQualityHistogram` variant annotation to generate base quality histograms (#5986); * Added a new `SoftClippedReadFilter` that can filter out reads where the ratio of soft-clipped bases to total bases exceeds some given value (#5995); * Fixed a serious bug in `ValidateVariants` where the tool would silently do no validation in the default case when a DBSNP file was not provided (#5984); * Fixed a ""Record covers a position previously traversed"" error in `ValidateVariants` for GVCFS with multiple contigs (#6028); * The `RMSMappingQuality` annotation now requires the `--allow-old-rms-mapping-quality-annotation-data` argument to run with GVCFs created by older versions of the GATK (#6060); * Added a simple TSV/CSV/XSV writer with cloud write support as an alternative to TableWriter (#5930); * `Funcotator`: added Funcotator stand-alone WDL to supported area (#5999); * Extracted the `GenotypeGVCFs` engine into publicly accessible class/function (#6004); * Refactored `VariantEval` methods to allow subclasses to override (#5998); * `AnalyzeSaturationMutagenesis`: arbitrarily choose 1 read for disjoint pairs, dump rejected reads, and various other improvements (#5926) (#6043); * Normalized some AssemblyRegion args in `HaplotypeCallerSpark` (#5977); * Don't redundantly delete temporary directories in `RSCriptExecutor` (#5894); * Treat all source files as UTF-8 for java, javadoc (#5946); * Updated an out-of-date argument name in an error message for the `CycleCovariate`; * Changed an error about ""duplicate feature inputs"" to be a UserException (#5951); * Got rid of `ExpandingArrayList` in favor of `ArrayList` (#6069); * Disabled Codecov for now on travis due to spurious errors (#6052); * Lowered the Xms value in the test JVM (#6087); * Updated the travis installed R version to 3.2.5, matching our base docker image (#6073); * Fixed an erroneous warning abo",MatchSource.RELEASES,broadinstitute,gatk,4.6.0.0,https://github.com/broadinstitute/gatk/releases/tag/4.1.3.0:6112,validat,validation,6112,https://software.broadinstitute.org/gatk,https://github.com/broadinstitute/gatk/releases/tag/4.1.3.0,2,"['access', 'validat']","['accessible', 'validation']"
Security," for when tree-score-threshold is set but the TREE_SCORE annotation is not present (#8218); * `TransferReadTags`: allow empty unaligned bams as input (#8198); * Refactored `JointVcfFiltering` WDL and expanded tests. (#8074); * Updated the carrot github action workflow to the most recent version, which supports using `#carrot_pr` to trigger branch vs master comparison runs (#8084); * Replaced uses of `File.createTempFile()` with `IOUtils.createTempFile()` to ensure that temp files are deleted on shutdown (#6780); * Don't require python just to instantiate the `CNNScoreVariants` tool classes. (#8128); * Made several `Funcotator` methods and fields protected so it is easier to extend the tool (#8124) (#8166); * Test for presence of ack result message and simplify `ProcessControllerAckResult` API (#7816); * Fixed the path reported by the gatkbot when there are test failures (#8069); * Fixed incorrect boolean value in `DirichletAlleleDepthAndFractionIntegrationTest` (#7963); * Removed two ancient and unused `HaplotypeCaller` test files that are no longer needed (#7634); * Added scattered gCNV case WDL to dockstore file (#8217); ; * **Documentation**; * Updated instructions for installing Java in the README (#8089); * Added documentation on `OMP_NUM_THREADS` and `MKL_NUM_THREADS` to `GermlineCNVCaller` and `DetermineGermlineContigPloidy` (#8223); * Improvements to `PileupDetectionArgumentCollection` documentation (#8050); * Fixed typo in documentation for `VariantAnnotator` (#8145); ; * **Dependencies**; * Moved to `Java 17`, the latest LTS Java release, for building/running GATK (#8035); * Updated `Gradle` to 7.5.1 (#8098); * Updated the GATK base docker image to 3.0.0 (#8228); * Updated `HTSJDK` to 3.0.5 (#8035); * Updated `Picard` to 3.0.0 (#8035); * Updated `Barclay` to 5.0.0 (#8035); * Updated `GenomicsDB` to 1.4.4 (#7978); * Updated `Spark` to 3.3.1 (#8035); * Updated `Hadoop` to 3.3.1. (#8102); * Require `commons-text` 1.10.0 to fix a security vulnerability (#8071)",MatchSource.RELEASES,broadinstitute,gatk,4.6.0.0,https://github.com/broadinstitute/gatk/releases/tag/4.4.0.0:7292,secur,security,7292,https://software.broadinstitute.org/gatk,https://github.com/broadinstitute/gatk/releases/tag/4.4.0.0,1,['secur'],['security']
Security," the new non-standard annotation in `HaplotypeCaller` you need to add `-A AllelePseudoDepth`; * We now track the source of variants in `MultiVariantWalkers`, which is important for some tools such as `VariantEval` (#7219). * **Bug Fixes**; * Fixed key ordering bugs in the implementations of `Histogram.median()` and `CompressedDataList.iterator()` (#7131); * These bugs could result in incorrect RankSumTest annotations in some cases; * Fixed the `DepthPerSampleHC` and `StrandBiasBySample` annotations to not spam the logs with ""Annotation will not be calculated"" warnings (#7357); * `VariantEval`: fixed contig stratification to defer to user-defined intervals (#7238). * **Miscellaneous Changes**; * The `ProgressMeter` can now be completely disabled for all tools / traversals by overriding `GATKTool.disableProgressMeter()` (#7354); * We now authenticate with Dockerhub in our Travis builds, to help avoid tests failing due to quota issues (#7204) (#7256); * Migrated `VariantEval` to be a `MultiVariantWalkerGroupedOnStart` (#6973); * `VariantEval`: added an argument to specify the `PedigreeValidationType` (#7240); * Converted `InfoFieldAnnotation`/`GenotypeAnnotation` into interfaces. (#7041); * Allow `MultiVariantWalkerGroupedOnStart` subclasses to view/set `ignoreIntervalsOutsideStart` (#7301); * `PedigreeAnnotation`: consolidate code, provide getters, and allow `PedigreeValidationType` to be set (#7277); * `ASEReadCounter`: added a warning for variants lacking GT fields (#7326); * Added filters to `dockstore.yml` so that only the master branch and the releases get synced to Dockstore (#7217); * Fixed a compatibility issue between Java 11 and `log4j2` (#7339); * We now update the gcloud package signing key at the start of every docker build (#7180); * Updated our Artifactory key (#7208); * Disabled some Spark dataproc tests because of dependency issues. (#7170); * Removed some embedded licenses from scripts (#7340); ; * **Documentation**; * Variant annotation documentation",MatchSource.RELEASES,broadinstitute,gatk,4.6.0.0,https://github.com/broadinstitute/gatk/releases/tag/4.2.1.0:8076,authenticat,authenticate,8076,https://software.broadinstitute.org/gatk,https://github.com/broadinstitute/gatk/releases/tag/4.2.1.0,1,['authenticat'],['authenticate']
