quality_attribute,sentence,source,author,repo,version,id,keyword,matched_word,match_idx,wiki,url,total_similar,target_keywords,target_matched_words
Deployability,"ttps://github.com/sofa-framework/sofa/blob/v21.06/CHANGELOG.md#v210602; Diff with v21.06.01: https://github.com/sofa-framework/sofa/compare/v21.06.01...v21.06.02. ## Required dependencies. ### Windows. 1. Install **[Microsoft Visual C++ 2017 Redistributable](https://aka.ms/vs/15/release/vc_redist.x64.exe)**.; 2. OPTIONAL; &nbsp;&nbsp;&nbsp; Install **Python 3.7 + Numpy + Scipy** if you want to use the SofaPython3 plugin or any of its dependers. ; &nbsp;&nbsp;&nbsp; Download and install [Python 3.7 (amd64)](https://www.python.org/ftp/python/3.7.9/python-3.7.9-amd64.exe). ; &nbsp;&nbsp;&nbsp; Make sure to enable PIP installation and addition to PATH. ; &nbsp;&nbsp;&nbsp; Then, open a console and run `python -V && python -m pip install numpy scipy`. ### Linux. 1. Install **libopengl0** ; &nbsp;&nbsp;&nbsp; `sudo apt install libopengl0`; 2. OPTIONAL; &nbsp;&nbsp;&nbsp; Install **Python 3.7 + Numpy + Scipy** if you want to use the SofaPython3 plugin or any of its dependers. ; &nbsp;&nbsp;&nbsp; `sudo apt install python3.7-dev python3-pip` ; &nbsp;&nbsp;&nbsp; `python3.7 -m pip install numpy scipy`. ### MacOS. 1. All core dependencies are included in the binaries.; 2. OPTIONAL; &nbsp;&nbsp;&nbsp; Install **Python 3.9 + Numpy + Scipy** if you want to use the SofaPython3 plugin or any of its dependers. ; &nbsp;&nbsp;&nbsp; `brew install python@3.9` ; &nbsp;&nbsp;&nbsp; `python3.9 -m pip install numpy scipy`. ## Info. Binaries were generated using the following libraries:; | . | Qt | Boost | Eigen | Python | pybind11 | Glew | Zlib | libPNG | libJPEG | libTIFF |; |----------------|----------|----------|----------|------------|------------|---------|---------|------------|----------|---------|; | **Windows** | 5.12.6 | 1.69.0 | 3.3.7 | 3.7.9 | 2.4.3 | 1.13 | 1.2.8 | 1.6.18 | 6b | 4.0.9 |; | **Linux** | 5.12.6 | 1.67.0 | 3.3.4 | 3.7.5 | 2.4.3 | 2.0.0 | 1.2.11 | 1.6.34 | 8c | 4.0.9 |; | **MacOS** | 5.12.6 | 1.76.0 | 3.3.7 | 3.9.5 | 2.6.2 | 2.1.0 | 1.2.11 | 1.6.36 | 9c | 4.0.10 |",MatchSource.RELEASES,sofa-framework,sofa,v24.06.00,https://github.com/sofa-framework/sofa/releases/tag/v21.06.02:1039,install,install,1039,https://www.sofa-framework.org,https://github.com/sofa-framework/sofa/releases/tag/v21.06.02,5,"['Install', 'install']","['Install', 'install']"
Deployability,"ttps://github.com/sofa-framework/sofa/blob/v21.06/CHANGELOG.md#v210603; Diff with v21.06.02: https://github.com/sofa-framework/sofa/compare/v21.06.02...v21.06.03. ## Required dependencies. ### Windows. 1. Install **[Microsoft Visual C++ 2017 Redistributable](https://aka.ms/vs/15/release/vc_redist.x64.exe)**.; 2. OPTIONAL; &nbsp;&nbsp;&nbsp; Install **Python 3.7 + Numpy + Scipy** if you want to use the SofaPython3 plugin or any of its dependers. ; &nbsp;&nbsp;&nbsp; Download and install [Python 3.7 (amd64)](https://www.python.org/ftp/python/3.7.9/python-3.7.9-amd64.exe). ; &nbsp;&nbsp;&nbsp; Make sure to enable PIP installation and addition to PATH. ; &nbsp;&nbsp;&nbsp; Then, open a console and run `python -V && python -m pip install numpy scipy`. ### Linux. 1. Install **libopengl0** ; &nbsp;&nbsp;&nbsp; `sudo apt install libopengl0`; 2. OPTIONAL; &nbsp;&nbsp;&nbsp; Install **Python 3.7 + Numpy + Scipy** if you want to use the SofaPython3 plugin or any of its dependers. ; &nbsp;&nbsp;&nbsp; `sudo apt install python3.7-dev python3-pip` ; &nbsp;&nbsp;&nbsp; `python3.7 -m pip install numpy scipy`. ### MacOS. 1. All core dependencies are included in the binaries.; 2. OPTIONAL; &nbsp;&nbsp;&nbsp; Install **Python 3.9 + Numpy + Scipy** if you want to use the SofaPython3 plugin or any of its dependers. ; &nbsp;&nbsp;&nbsp; `brew install python@3.9` ; &nbsp;&nbsp;&nbsp; `python3.9 -m pip install numpy scipy`. ## Info. Binaries were generated using the following libraries:; | . | Qt | Boost | Eigen | Python | pybind11 | Glew | Zlib | libPNG | libJPEG | libTIFF |; |----------------|----------|----------|----------|------------|------------|---------|---------|------------|----------|---------|; | **Windows** | 5.12.6 | 1.69.0 | 3.3.7 | 3.7.9 | 2.4.3 | 1.13 | 1.2.8 | 1.6.18 | 6b | 4.0.9 |; | **Linux** | 5.12.6 | 1.67.0 | 3.3.4 | 3.7.5 | 2.4.3 | 2.0.0 | 1.2.11 | 1.6.34 | 8c | 4.0.9 |; | **MacOS** | 5.12.6 | 1.76.0 | 3.3.7 | 3.9.5 | 2.6.2 | 2.1.0 | 1.2.11 | 1.6.36 | 9c | 4.0.10 |",MatchSource.RELEASES,sofa-framework,sofa,v24.06.00,https://github.com/sofa-framework/sofa/releases/tag/v21.06.03:1039,install,install,1039,https://www.sofa-framework.org,https://github.com/sofa-framework/sofa/releases/tag/v21.06.03,5,"['Install', 'install']","['Install', 'install']"
Deployability,"ure to enable PIP installation and addition to PATH. ; Then, open a console and run `python -V && python -m pip install numpy scipy`. ### Linux. 1. Install **libopengl0**. sudo apt install libopengl0. 2. [OPTIONAL] Install **Python 3.8 + Numpy + Scipy** if you want to use the SofaPython3 plugin or any of its dependers. sudo apt install python3.8-dev python3-distutils; curl -L https://bootstrap.pypa.io/pip/get-pip.py --output /tmp/get-pip3.py; python3.8 /tmp/get-pip3.py; python3.8 -m pip install --upgrade pip; python3.8 -m pip install numpy scipy. ### MacOS. 1. All core dependencies are included in the binaries. 2. [OPTIONAL] Install **Python 3.9 + Numpy + Scipy** if you want to use the SofaPython3 plugin or any of its dependers. brew install python@3.9; python3.9 -m pip install numpy scipy. ## Plugins. Some plugins are now generating their own binaries :tada: ; To install a plugin, download and unzip it into the `plugins` folder of SOFA. - [STLIB](https://github.com/SofaDefrost/STLIB/releases/tag/release-v21.12); - [SoftRobots](https://github.com/SofaDefrost/SoftRobots/releases/tag/release-v21.12); - [ModelOrderReduction](https://github.com/SofaDefrost/ModelOrderReduction/releases/tag/release-v21.12); - [BeamAdapter](https://github.com/sofa-framework/BeamAdapter/releases/tag/release-v21.12); - [SofaMJEDFEM](https://github.com/sofa-framework/SofaMJEDFEM/releases/tag/release-v21.12); - [Cosserat](https://github.com/SofaDefrost/plugin.Cosserat/releases/tag/release-v21.12). If you want your plugin added to this list, feel free to [contact us](https://www.sofa-framework.org/consortium/contact/). ## Info for developers. SOFA binaries were generated using the following libraries:; | . | Qt | Boost | Eigen | Python | pybind11 | Glew | Zlib | libPNG | libJPEG | libTIFF |; |----------------|--------|--------|-------|--------|----------|-------|--------|--------|---------|---------|; | **Windows** | 5.12.6 | 1.69.0 | 3.3.7 | 3.7.9 | 2.4.3 | 1.13 | 1.2.8 | 1.6.18 | 6b | 4.0.9 |;",MatchSource.RELEASES,sofa-framework,sofa,v24.06.00,https://github.com/sofa-framework/sofa/releases/tag/v21.12.00:1561,release,releases,1561,https://www.sofa-framework.org,https://github.com/sofa-framework/sofa/releases/tag/v21.12.00,2,['release'],"['release-', 'releases']"
Deployability,"v20.12.02. ## Required dependencies. ### Windows. 1. Install **[Microsoft Visual C++ 2017 Redistributable](https://aka.ms/vs/15/release/vc_redist.x64.exe)**.; 2. OPTIONAL; &nbsp;&nbsp;&nbsp; Install **Python 3.7 + Numpy + Scipy** if you want to use the SofaPython3 plugin or any of its dependers. ; &nbsp;&nbsp;&nbsp; Download and install [Python 3.7 (amd64)](https://www.python.org/ftp/python/3.7.9/python-3.7.9-amd64.exe). ; &nbsp;&nbsp;&nbsp; Make sure to enable PIP installation and addition to PATH. ; &nbsp;&nbsp;&nbsp; Then, open a console and run `python -V && python -m pip install numpy scipy`; 3. DEPRECATED ; &nbsp;&nbsp;&nbsp; *Install Python 2.7 + Numpy + Scipy if you want to use the SofaPython plugin or any of its dependers. ; &nbsp;&nbsp;&nbsp; Download and install [Python 2.7 (amd64)](https://www.python.org/ftp/python/2.7.18/python-2.7.18.amd64.msi). ; &nbsp;&nbsp;&nbsp; Make sure to enable PIP installation and addition to PATH. ; &nbsp;&nbsp;&nbsp; Then, open a console and run `python -V && python -m pip install ""numpy < 1.17"" ""scipy < 1.3""`*. ### Linux. 1. Install **libopengl0** ; &nbsp;&nbsp;&nbsp; `sudo apt install libopengl0`; 2. OPTIONAL; &nbsp;&nbsp;&nbsp; Install **Python 3.7 + Numpy + Scipy** if you want to use the SofaPython3 plugin or any of its dependers. ; &nbsp;&nbsp;&nbsp; `sudo apt install python3.7-dev python3-pip` ; &nbsp;&nbsp;&nbsp; `python3.7 -m pip install --upgrade pip && python3.7 -m pip install numpy scipy`; 3. DEPRECATED ; &nbsp;&nbsp;&nbsp; *Install Python 2.7 + Numpy + Scipy if you want to use the deprecated SofaPython plugin or any of its dependers. ; &nbsp;&nbsp;&nbsp; `sudo apt install python2.7-dev python-pip` ; &nbsp;&nbsp;&nbsp; `python2.7 -m pip install --upgrade ""pip < 21.0"" && python2.7 -m pip install ""numpy < 1.17"" ""scipy < 1.3""`*. ### MacOS. 1. All core dependencies are included in the binaries.; 2. OPTIONAL; &nbsp;&nbsp;&nbsp; Install **Python 3.7 + Numpy + Scipy** if you want to use the SofaPython3 plugin or any of i",MatchSource.RELEASES,sofa-framework,sofa,v24.06.00,https://github.com/sofa-framework/sofa/releases/tag/v20.12.02:1206,install,install,1206,https://www.sofa-framework.org,https://github.com/sofa-framework/sofa/releases/tag/v20.12.02,1,['install'],['install']
Deployability,"v20.12.03. ## Required dependencies. ### Windows. 1. Install **[Microsoft Visual C++ 2017 Redistributable](https://aka.ms/vs/15/release/vc_redist.x64.exe)**.; 2. OPTIONAL; &nbsp;&nbsp;&nbsp; Install **Python 3.7 + Numpy + Scipy** if you want to use the SofaPython3 plugin or any of its dependers. ; &nbsp;&nbsp;&nbsp; Download and install [Python 3.7 (amd64)](https://www.python.org/ftp/python/3.7.9/python-3.7.9-amd64.exe). ; &nbsp;&nbsp;&nbsp; Make sure to enable PIP installation and addition to PATH. ; &nbsp;&nbsp;&nbsp; Then, open a console and run `python -V && python -m pip install numpy scipy`; 3. DEPRECATED ; &nbsp;&nbsp;&nbsp; *Install Python 2.7 + Numpy + Scipy if you want to use the SofaPython plugin or any of its dependers. ; &nbsp;&nbsp;&nbsp; Download and install [Python 2.7 (amd64)](https://www.python.org/ftp/python/2.7.18/python-2.7.18.amd64.msi). ; &nbsp;&nbsp;&nbsp; Make sure to enable PIP installation and addition to PATH. ; &nbsp;&nbsp;&nbsp; Then, open a console and run `python -V && python -m pip install ""numpy < 1.17"" ""scipy < 1.3""`*. ### Linux. 1. Install **libopengl0** ; &nbsp;&nbsp;&nbsp; `sudo apt install libopengl0`; 2. OPTIONAL; &nbsp;&nbsp;&nbsp; Install **Python 3.7 + Numpy + Scipy** if you want to use the SofaPython3 plugin or any of its dependers. ; &nbsp;&nbsp;&nbsp; `sudo apt install python3.7-dev python3-pip` ; &nbsp;&nbsp;&nbsp; `python3.7 -m pip install --upgrade pip && python3.7 -m pip install numpy scipy`; 3. DEPRECATED ; &nbsp;&nbsp;&nbsp; *Install Python 2.7 + Numpy + Scipy if you want to use the deprecated SofaPython plugin or any of its dependers. ; &nbsp;&nbsp;&nbsp; `sudo apt install python2.7-dev python-pip` ; &nbsp;&nbsp;&nbsp; `python2.7 -m pip install --upgrade ""pip < 21.0"" && python2.7 -m pip install ""numpy < 1.17"" ""scipy < 1.3""`*. ### MacOS. 1. All core dependencies are included in the binaries.; 2. OPTIONAL; &nbsp;&nbsp;&nbsp; Install **Python 3.7 + Numpy + Scipy** if you want to use the SofaPython3 plugin or any of i",MatchSource.RELEASES,sofa-framework,sofa,v24.06.00,https://github.com/sofa-framework/sofa/releases/tag/v20.12.03:1206,install,install,1206,https://www.sofa-framework.org,https://github.com/sofa-framework/sofa/releases/tag/v20.12.03,1,['install'],['install']
Deployability,"v201202; Diff with v20.12.01: https://github.com/sofa-framework/sofa/compare/v20.12.01...v20.12.02. ## Required dependencies. ### Windows. 1. Install **[Microsoft Visual C++ 2017 Redistributable](https://aka.ms/vs/15/release/vc_redist.x64.exe)**.; 2. OPTIONAL; &nbsp;&nbsp;&nbsp; Install **Python 3.7 + Numpy + Scipy** if you want to use the SofaPython3 plugin or any of its dependers. ; &nbsp;&nbsp;&nbsp; Download and install [Python 3.7 (amd64)](https://www.python.org/ftp/python/3.7.9/python-3.7.9-amd64.exe). ; &nbsp;&nbsp;&nbsp; Make sure to enable PIP installation and addition to PATH. ; &nbsp;&nbsp;&nbsp; Then, open a console and run `python -V && python -m pip install numpy scipy`; 3. DEPRECATED ; &nbsp;&nbsp;&nbsp; *Install Python 2.7 + Numpy + Scipy if you want to use the SofaPython plugin or any of its dependers. ; &nbsp;&nbsp;&nbsp; Download and install [Python 2.7 (amd64)](https://www.python.org/ftp/python/2.7.18/python-2.7.18.amd64.msi). ; &nbsp;&nbsp;&nbsp; Make sure to enable PIP installation and addition to PATH. ; &nbsp;&nbsp;&nbsp; Then, open a console and run `python -V && python -m pip install ""numpy < 1.17"" ""scipy < 1.3""`*. ### Linux. 1. Install **libopengl0** ; &nbsp;&nbsp;&nbsp; `sudo apt install libopengl0`; 2. OPTIONAL; &nbsp;&nbsp;&nbsp; Install **Python 3.7 + Numpy + Scipy** if you want to use the SofaPython3 plugin or any of its dependers. ; &nbsp;&nbsp;&nbsp; `sudo apt install python3.7-dev python3-pip` ; &nbsp;&nbsp;&nbsp; `python3.7 -m pip install --upgrade pip && python3.7 -m pip install numpy scipy`; 3. DEPRECATED ; &nbsp;&nbsp;&nbsp; *Install Python 2.7 + Numpy + Scipy if you want to use the deprecated SofaPython plugin or any of its dependers. ; &nbsp;&nbsp;&nbsp; `sudo apt install python2.7-dev python-pip` ; &nbsp;&nbsp;&nbsp; `python2.7 -m pip install --upgrade ""pip < 21.0"" && python2.7 -m pip install ""numpy < 1.17"" ""scipy < 1.3""`*. ### MacOS. 1. All core dependencies are included in the binaries.; 2. OPTIONAL; &nbsp;&nbsp;&nbsp; Ins",MatchSource.RELEASES,sofa-framework,sofa,v24.06.00,https://github.com/sofa-framework/sofa/releases/tag/v20.12.02:1093,install,installation,1093,https://www.sofa-framework.org,https://github.com/sofa-framework/sofa/releases/tag/v20.12.02,1,['install'],['installation']
Deployability,"v201203; Diff with v20.12.02: https://github.com/sofa-framework/sofa/compare/v20.12.02...v20.12.03. ## Required dependencies. ### Windows. 1. Install **[Microsoft Visual C++ 2017 Redistributable](https://aka.ms/vs/15/release/vc_redist.x64.exe)**.; 2. OPTIONAL; &nbsp;&nbsp;&nbsp; Install **Python 3.7 + Numpy + Scipy** if you want to use the SofaPython3 plugin or any of its dependers. ; &nbsp;&nbsp;&nbsp; Download and install [Python 3.7 (amd64)](https://www.python.org/ftp/python/3.7.9/python-3.7.9-amd64.exe). ; &nbsp;&nbsp;&nbsp; Make sure to enable PIP installation and addition to PATH. ; &nbsp;&nbsp;&nbsp; Then, open a console and run `python -V && python -m pip install numpy scipy`; 3. DEPRECATED ; &nbsp;&nbsp;&nbsp; *Install Python 2.7 + Numpy + Scipy if you want to use the SofaPython plugin or any of its dependers. ; &nbsp;&nbsp;&nbsp; Download and install [Python 2.7 (amd64)](https://www.python.org/ftp/python/2.7.18/python-2.7.18.amd64.msi). ; &nbsp;&nbsp;&nbsp; Make sure to enable PIP installation and addition to PATH. ; &nbsp;&nbsp;&nbsp; Then, open a console and run `python -V && python -m pip install ""numpy < 1.17"" ""scipy < 1.3""`*. ### Linux. 1. Install **libopengl0** ; &nbsp;&nbsp;&nbsp; `sudo apt install libopengl0`; 2. OPTIONAL; &nbsp;&nbsp;&nbsp; Install **Python 3.7 + Numpy + Scipy** if you want to use the SofaPython3 plugin or any of its dependers. ; &nbsp;&nbsp;&nbsp; `sudo apt install python3.7-dev python3-pip` ; &nbsp;&nbsp;&nbsp; `python3.7 -m pip install --upgrade pip && python3.7 -m pip install numpy scipy`; 3. DEPRECATED ; &nbsp;&nbsp;&nbsp; *Install Python 2.7 + Numpy + Scipy if you want to use the deprecated SofaPython plugin or any of its dependers. ; &nbsp;&nbsp;&nbsp; `sudo apt install python2.7-dev python-pip` ; &nbsp;&nbsp;&nbsp; `python2.7 -m pip install --upgrade ""pip < 21.0"" && python2.7 -m pip install ""numpy < 1.17"" ""scipy < 1.3""`*. ### MacOS. 1. All core dependencies are included in the binaries.; 2. OPTIONAL; &nbsp;&nbsp;&nbsp; Ins",MatchSource.RELEASES,sofa-framework,sofa,v24.06.00,https://github.com/sofa-framework/sofa/releases/tag/v20.12.03:1093,install,installation,1093,https://www.sofa-framework.org,https://github.com/sofa-framework/sofa/releases/tag/v20.12.03,1,['install'],['installation']
Deployability,"vs/15/release/vc_redist.x64.exe)**.; 2. OPTIONAL; &nbsp;&nbsp;&nbsp; Install **Python 3.7 + Numpy + Scipy** if you want to use the SofaPython3 plugin or any of its dependers. ; &nbsp;&nbsp;&nbsp; Download and install [Python 3.7 (amd64)](https://www.python.org/ftp/python/3.7.9/python-3.7.9-amd64.exe). ; &nbsp;&nbsp;&nbsp; Make sure to enable PIP installation and addition to PATH. ; &nbsp;&nbsp;&nbsp; Then, open a console and run `python -V && python -m pip install numpy scipy`; 3. DEPRECATED ; &nbsp;&nbsp;&nbsp; *Install Python 2.7 + Numpy + Scipy if you want to use the SofaPython plugin or any of its dependers. ; &nbsp;&nbsp;&nbsp; Download and install [Python 2.7 (amd64)](https://www.python.org/ftp/python/2.7.18/python-2.7.18.amd64.msi). ; &nbsp;&nbsp;&nbsp; Make sure to enable PIP installation and addition to PATH. ; &nbsp;&nbsp;&nbsp; Then, open a console and run `python -V && python -m pip install ""numpy < 1.17"" ""scipy < 1.3""`*. ### Linux. 1. Install **libopengl0** ; &nbsp;&nbsp;&nbsp; `sudo apt install libopengl0`; 2. OPTIONAL; &nbsp;&nbsp;&nbsp; Install **Python 3.7 + Numpy + Scipy** if you want to use the SofaPython3 plugin or any of its dependers. ; &nbsp;&nbsp;&nbsp; `sudo apt install python3.7-dev python3-pip` ; &nbsp;&nbsp;&nbsp; `python3.7 -m pip install --upgrade pip && python3.7 -m pip install numpy scipy`; 3. DEPRECATED ; &nbsp;&nbsp;&nbsp; *Install Python 2.7 + Numpy + Scipy if you want to use the deprecated SofaPython plugin or any of its dependers. ; &nbsp;&nbsp;&nbsp; `sudo apt install python2.7-dev python-pip` ; &nbsp;&nbsp;&nbsp; `python2.7 -m pip install --upgrade ""pip < 21.0"" && python2.7 -m pip install ""numpy < 1.17"" ""scipy < 1.3""`*. ### MacOS. 1. All core dependencies are included in the binaries.; 2. OPTIONAL; &nbsp;&nbsp;&nbsp; Install **Python 3.7 + Numpy + Scipy** if you want to use the SofaPython3 plugin or any of its dependers. ; &nbsp;&nbsp;&nbsp; `brew install python@3.7` ; &nbsp;&nbsp;&nbsp; `python3.7 -m pip install numpy scipy`. ",MatchSource.RELEASES,sofa-framework,sofa,v24.06.00,https://github.com/sofa-framework/sofa/releases/tag/v20.12.03:1260,Install,Install,1260,https://www.sofa-framework.org,https://github.com/sofa-framework/sofa/releases/tag/v20.12.03,4,"['Install', 'install']","['Install', 'install']"
Deployability,"wnload and install [Python 3.7 (amd64)](https://www.python.org/ftp/python/3.7.9/python-3.7.9-amd64.exe). ; &nbsp;&nbsp;&nbsp; Make sure to enable PIP installation and addition to PATH. ; &nbsp;&nbsp;&nbsp; Then, open a console and run `python -V && python -m pip install numpy scipy`; 3. DEPRECATED ; &nbsp;&nbsp;&nbsp; *Install Python 2.7 + Numpy + Scipy if you want to use the SofaPython plugin or any of its dependers. ; &nbsp;&nbsp;&nbsp; Download and install [Python 2.7 (amd64)](https://www.python.org/ftp/python/2.7.18/python-2.7.18.amd64.msi). ; &nbsp;&nbsp;&nbsp; Make sure to enable PIP installation and addition to PATH. ; &nbsp;&nbsp;&nbsp; Then, open a console and run `python -V && python -m pip install ""numpy < 1.17"" ""scipy < 1.3""`*. ### Linux. 1. Install **libopengl0** ; &nbsp;&nbsp;&nbsp; `sudo apt install libopengl0`; 2. OPTIONAL; &nbsp;&nbsp;&nbsp; Install **Python 3.7 + Numpy + Scipy** if you want to use the SofaPython3 plugin or any of its dependers. ; &nbsp;&nbsp;&nbsp; `sudo apt install python3.7-dev python3-pip` ; &nbsp;&nbsp;&nbsp; `python3.7 -m pip install --upgrade pip && python3.7 -m pip install numpy scipy`; 3. DEPRECATED ; &nbsp;&nbsp;&nbsp; *Install Python 2.7 + Numpy + Scipy if you want to use the deprecated SofaPython plugin or any of its dependers. ; &nbsp;&nbsp;&nbsp; `sudo apt install python2.7-dev python-pip` ; &nbsp;&nbsp;&nbsp; `python2.7 -m pip install --upgrade ""pip < 21.0"" && python2.7 -m pip install ""numpy < 1.17"" ""scipy < 1.3""`*. ### MacOS. 1. All core dependencies are included in the binaries.; 2. OPTIONAL; &nbsp;&nbsp;&nbsp; Install **Python 3.7 + Numpy + Scipy** if you want to use the SofaPython3 plugin or any of its dependers. ; &nbsp;&nbsp;&nbsp; `brew install python@3.7` ; &nbsp;&nbsp;&nbsp; `python3.7 -m pip install numpy scipy`. ## Python2 to Python3 migration. [SofaPython3](https://github.com/sofa-framework/plugin.SofaPython3/) is now included in SOFA binaries.; Thus, **these Python2-related features remain disabled**:; | ",MatchSource.RELEASES,sofa-framework,sofa,v24.06.00,https://github.com/sofa-framework/sofa/releases/tag/v20.12.03:1504,install,install,1504,https://www.sofa-framework.org,https://github.com/sofa-framework/sofa/releases/tag/v20.12.03,2,['install'],['install']
Energy Efficiency, curl -L https://bootstrap.pypa.io/pip/get-pip.py --output /tmp/get-pip3.py; python3.10 /tmp/get-pip3.py; python3.10 -m pip install --upgrade pip; python3.10 -m pip install numpy scipy pybind11==2.9.1. ### MacOS. 1. All core dependencies are included in the binaries. 2. Install **Python 3.10 + Numpy + Scipy + pybind11** if you want to use the SofaPython3 plugin or any of its dependers. brew install python@3.10; brew link --force python@3.10; python3 -m pip install --upgrade pip; python3 -m pip install numpy scipy; brew install pybind11. ## Check SHA256 checksums. Feel free to check SHA256 checksums of our official binaries:; - SOFA_v23.12.00-full_Linux.run → `33c087d8a9abbe039d474416c93a1575b0d0d9796f1980544edd61cf84c5e0dc`; - SOFA_v23.12.00-full_Linux.zip → `5a65da8630fd637432463c2afd7de765287e80a417aafafc3123ea8006de512d`; - SOFA_v23.12.00-full_MacOS.zip → `ac2e440163ce223337e72fb295c218354e261f70d6593813491fb3bc6012283e`; - SOFA_v23.12.00-full_Win64.exe → `f327655ccd00128f6b2ff590d10aac1f79ed81efeb13ea0ec81291879385d302`; - SOFA_v23.12.00-full_Win64.zip → `e56dde4f67e0fe1b38b57665793d5c87dbfad0f0af9c0c5cf3dbd956c86ef88c`. Compare these sha with yours:; - Windows : on Powershell `Get-FileHash path/to/file`; - Ubuntu : in a terminal `sha256sum path/to/file`; - MacOS : in a terminal `shasum -a 256 /path/to/file`. ## Info for developers. SOFA binaries were generated using the following libraries:; | | Qt | Boost | Eigen | Python | pybind11 | TinyXML2 | _Glew_ | _Zlib_ | _libPNG_ | _libJPEG_ | _libTIFF_ |; |----------------|--------|--------|-------|--------|----------|----------|-------|--------|--------|---------|---------|; | **Windows** | 5.12.12 | 1.74.0 | 3.4.0 | 3.10.10 | 2.9.1 | 9.0.0 | _1.13_ | _1.2.8_ | _1.6.18_ | _6b_ | _4.0.9_ |; | **Linux** | 5.12.12 | 1.71.0 | 3.3.7 | 3.8.10 | 2.9.1 | 9.0.0 | _2.2.0_ | _1.2.11_ | _1.6.37_ | _8c_ | _4.3.0_ |; | **MacOS** | 5.12.8 | 1.76.0 | 3.4.0 | 3.8.10 | 2.6.2 | 10.0.0 | _2.2.0_ | _1.2.11_ | _1.6.37_ | _9e_ | _4.3.0_ |,MatchSource.RELEASES,sofa-framework,sofa,v24.06.00,https://github.com/sofa-framework/sofa/releases/tag/v23.12.00:2167,Power,Powershell,2167,https://www.sofa-framework.org,https://github.com/sofa-framework/sofa/releases/tag/v23.12.00,1,['Power'],['Powershell']
Energy Efficiency,distutils pybind11-dev; curl -L https://bootstrap.pypa.io/pip/get-pip.py --output /tmp/get-pip3.py; python3.10 /tmp/get-pip3.py; python3.10 -m pip install --upgrade pip; python3.10 -m pip install numpy scipy pybind11==2.9.1. ### MacOS. 1. All core dependencies are included in the binaries. 2. Install **Python 3.10 + Numpy + Scipy + pybind11** if you want to use the SofaPython3 plugin or any of its dependers. brew install python@3.10; brew link --force python@3.10; python3 -m pip install --upgrade pip; python3 -m pip install numpy scipy; brew install pybind11. ## Check SHA256 checksums. Feel free to check SHA256 checksums of our official binaries:; - SOFA_v23.12.01_Linux.run → `e3872b7343918a321027b3b947b0e86e28cb76747c1654947cf5f04e3987f7f0`; - SOFA_v23.12.01_Linux.zip → `9b5811eb383994e3a465c3e7f0f3728717f7f014c9e82a9750be973f886dd82d`; - SOFA_v23.12.01_MacOS.zip → `f88906a9bdb95b26940423f3f424da83a41b50b06811349c42c507cbed4a62b5`; - SOFA_v23.12.01_Win64.exe → `3423a4bd7c40bd2c78e3ce54efa4ce304524328356c3bf8b510a75fe04078939`; - SOFA_v23.12.01_Win64.zip → `fc2cc3451a10b9e200dcde3fe08e6aaea07ea3098e3dff9e60b74878d76838af`. Compare these sha with yours:; - Windows : on Powershell `Get-FileHash path/to/file`; - Ubuntu : in a terminal `sha256sum path/to/file`; - MacOS : in a terminal `shasum -a 256 /path/to/file`. ## Info for developers. SOFA binaries were generated using the following libraries:; | | Qt | Boost | Eigen | Python | pybind11 | TinyXML2 | _Glew_ | _Zlib_ | _libPNG_ | _libJPEG_ | _libTIFF_ |; |----------------|--------|--------|-------|--------|----------|----------|-------|--------|--------|---------|---------|; | **Windows** | 5.12.12 | 1.74.0 | 3.4.0 | 3.10.10 | 2.9.1 | 9.0.0 | _1.13_ | _1.2.8_ | _1.6.18_ | _6b_ | _4.0.9_ |; | **Linux** | 5.12.12 | 1.71.0 | 3.3.7 | 3.10.10 | 2.9.1 | 9.0.0 | _2.2.0_ | _1.2.11_ | _1.6.37_ | _8c_ | _4.3.0_ |; | **MacOS** | 5.12.8 | 1.76.0 | 3.4.0 | 3.10.10 | 2.6.2 | 10.0.0 | _2.2.0_ | _1.2.11_ | _1.6.37_ | _9e_ | _4.3.0_ |,MatchSource.RELEASES,sofa-framework,sofa,v24.06.00,https://github.com/sofa-framework/sofa/releases/tag/v23.12.01:2142,Power,Powershell,2142,https://www.sofa-framework.org,https://github.com/sofa-framework/sofa/releases/tag/v23.12.01,1,['Power'],['Powershell']
