filename,type,author,repo,version,wiki,url,patterns,purpose,summary
qutip/tests/solver/test_floquet.py,FileType.FILE,qutip,qutip,v5.0.4,https://qutip.org,https://github.com/qutip/qutip/tree/v5.0.4/qutip/tests/solver/test_floquet.py,"[{'name': 'Looping Iteration', 'match_type': 'partial', 'implemented_parts': ['for loop', 'array access', 'index manipulation'], 'confidence': 0.95, 'evidence': ['loop iterates over array elements', 'index used to access elements', 'element modification within loop']}, {'name': 'Recursive Function Call', 'match_type': 'partial', 'implemented_parts': ['function call', 'self-reference', 'base case condition'], 'confidence': 0.85, 'evidence': ['function calls itself within body', 'base case defined to terminate recursion', 'recursive calls depend on previous iteration']}, {'name': 'Conditionally Controlled Flow', 'match_type': 'partial', 'implemented_parts': ['if-else statement', 'logical comparisons', 'branching logic'], 'confidence': 0.9, 'evidence': ['conditional statement based on logical test', 'different branches defined for true/false cases', 'execution flow depends on condition']}]",This code features iterative and recursive algorithms for numerical computations.,"{'constants': ['Defines mathematical constants'], 'types': ['Custom types for mathematical operations'], 'functions': ['Recursive function for numerical series', 'Iterative function for array calculations', 'Conditional branching based on numerical criteria']}"
qutip/tests/solver/test_integrator.py,FileType.FILE,qutip,qutip,v5.0.4,https://qutip.org,https://github.com/qutip/qutip/tree/v5.0.4/qutip/tests/solver/test_integrator.py,"[{'name': 'Integrator', 'match_type': 'partial', 'implemented_parts': ['integration methods', 'state setting', 'evolution equation handling'], 'confidence': 0.95, 'evidence': ['QobjEvo interaction', 'integrator class definition', 'set_state method call']}, {'name': 'Pickling', 'match_type': 'partial', 'implemented_parts': ['serialization and deserialization', 'data preservation across sessions'], 'confidence': 0.85, 'evidence': ['pickle module usage', 'dumps and loads methods call', 'recreated object functionality']}]",This code implements integrators for quantum systems and includes pickling functionality for sharing them across processes.,"{'constants': ['Accuracy and tolerance parameters'], 'types': ['Quantum systems, integrators'], 'classes': ['Integrator base class'], 'functions': ['Integration methods for time evolution']}"
qutip/tests/solver/test_mcsolve.py,FileType.FILE,qutip,qutip,v5.0.4,https://qutip.org,https://github.com/qutip/qutip/tree/v5.0.4/qutip/tests/solver/test_mcsolve.py,"[{'name': 'Feedback Measurement', 'match_type': 'partial', 'implemented_parts': ['MCSolver.ExpectFeedback', 'MCSolver.CollapseFeedback', 'qutip.num', 'qutip.qeye'], 'confidence': 0.95, 'evidence': ['Function takes expectation or collapse list as input', 'Expectation and collapse values are compared with numerical values', 'Feedback is used in Hamiltonian evolution', 'Number of particles is tracked throughout the process']}, {'name': 'Trajectory Management', 'match_type': 'partial', 'implemented_parts': ['MCSolver.step', 'solver.run'], 'confidence': 0.85, 'evidence': ['Function updates the state based on coupling information', 'Solving algorithm tracks trajectory of particles', 'Quantum numbers are measured at different steps', 'Results are compared with expected values']}]",This code utilizes quantum feedback measurements to control the dynamics of a quantum system.,"{'constants': ['Quantum numbers, coupling values'], 'types': ['Quantum states, measurement operators'], 'classes': ['MCSolver class for quantum trajectory optimization'], 'functions': ['Feedback functions manipulate quantum states', 'Solving algorithm tracks trajectory evolution']}"
qutip/tests/solver/test_mesolve.py,FileType.FILE,qutip,qutip,v5.0.4,https://qutip.org,https://github.com/qutip/qutip/tree/v5.0.4/qutip/tests/solver/test_mesolve.py,"[{'name': 'Solver Initialization', 'match_type': 'full', 'implemented_parts': ['MESolver class', 'qutip libraries', 'problem definition'], 'confidence': 1.0, 'evidence': ['qutip imports', 'MESolver constructor with problem and options']}, {'name': 'Problem Representation', 'match_type': 'partial', 'implemented_parts': ['Qubit basis states', 'Hamiltonian operator'], 'confidence': 0.9, 'evidence': ['qutip.basis function', 'Hamiltonian defined as QobjEvo']}, {'name': 'Feedback Implementation', 'match_type': 'partial', 'implemented_parts': ['Feedback function', 'measurement expectation'], 'confidence': 0.8, 'evidence': ['feedback function receives state and operator', 'ExpectFeedback method in MESolver']}, {'name': 'Evolution Operator Definition', 'match_type': 'partial', 'implemented_parts': ['Qubit destruction', 'operator evolution'], 'confidence': 0.7, 'evidence': ['QobjEvo class with destroy and operator evolution methods']}]",This code utilizes quantum simulation techniques to solve optimization problems.,"{'constants': ['Quantum operators and basis states'], 'types': ['Quantum states, operators, and solvers'], 'classes': ['MESolver class for quantum optimization'], 'functions': ['Solving optimization problems using quantum feedback']}"
qutip/tests/solver/test_nm_mcsolve.py,FileType.FILE,qutip,qutip,v5.0.4,https://qutip.org,https://github.com/qutip/qutip/tree/v5.0.4/qutip/tests/solver/test_nm_mcsolve.py,"[{'name': 'FixedRates', 'match_type': 'partial', 'implemented_parts': ['Solving algorithm updates rates dynamically', 'Rate-shifting functionality', 'Shifted rates based on coupling strength'], 'confidence': 0.9, 'evidence': ['step function updates rates based on arguments', 'rate_shift method shifts rates', 'sqrt_shifted_rate function calculates shifted rates']}, {'name': 'DynamicCollapse', 'match_type': 'partial', 'implemented_parts': ['Argument `collapse` dynamically controls collapse of the wavefunction', 'Custom function `_dynamic` returns 0 or 1 based on the collapse argument'], 'confidence': 0.8, 'evidence': ['Function `_dynamic` is referenced as an argument for collapse', '`collapse` argument controls the behavior of the solver', 'Custom function replaces the default collapse criterion']}]",This file demonstrates dynamic rate adjustments and collapse control in a quantum simulation solver.,"{'constants': ['Defined in the `args` dictionary'], 'types': ['Custom function `_dynamic`'], 'classes': ['NonMarkovianMCSolver class'], 'functions': ['step function updates the quantum state', 'rate_shift function modifies the rate of quantum jumps', '_dynamic function controls the collapse behavior']}"
qutip/tests/solver/test_options.py,FileType.FILE,qutip,qutip,v5.0.4,https://qutip.org,https://github.com/qutip/qutip/tree/v5.0.4/qutip/tests/solver/test_options.py,"[{'name': 'atol adjustment', 'match_type': 'partial', 'implemented_parts': [""solver.options['atol'] update"", 'atol impact assessment'], 'confidence': 0.9, 'evidence': ['solver.options dictionary modification', 'comparison of step values before and after update']}, {'name': 'option update handling', 'match_type': 'full', 'implemented_parts': [""handling of 'atol' option"", 'automatic method selection'], 'confidence': 1.0, 'evidence': ['code coverage of option update logic', 'successful adaptation to different tolerance levels']}]",This code demonstrates the dynamic adjustment of solver options based on specified tolerances.,"{'constants': ['Defines solver tolerance parameters'], 'types': ['Solver options object'], 'classes': ['Solver class with option handling capabilities'], 'functions': ['Solver start method with option update functionality']}"
qutip/tests/solver/test_parallel.py,FileType.FILE,qutip,qutip,v5.0.4,https://qutip.org,https://github.com/qutip/qutip/tree/v5.0.4/qutip/tests/solver/test_parallel.py,"[{'name': 'Early Termination', 'match_type': 'partial', 'implemented_parts': ['Exception handling in map function'], 'confidence': 0.9, 'evidence': ['pytest.raises assertion', 'CustomException in error message']}, {'name': 'Map Function Errors', 'match_type': 'partial', 'implemented_parts': ['Error propagation from subprocesses'], 'confidence': 0.8, 'evidence': ['MapExceptions raised during iteration', 'Error messages correlate with subprocess indices']}]",This code uses parallel map functions to perform asynchronous computations.,"{'constants': ['Defined in map_kw parameter'], 'types': ['CustomException for map errors'], 'functions': ['Parallel map functions like parallel_map, loky_pmap']}"
qutip/tests/solver/test_propagator.py,FileType.FILE,qutip,qutip,v5.0.4,https://qutip.org,https://github.com/qutip/qutip/tree/v5.0.4/qutip/tests/solver/test_propagator.py,"[{'name': 'Quantum State Evolution', 'match_type': 'partial', 'implemented_parts': ['Hamiltonian definition', 'Evolution operator construction', 'Propagation function approximation'], 'confidence': 0.9, 'evidence': ['SESolver, MESolver, BRSolver classes', 'Hamiltonian-dependent evolution operator', 'Comparison with exact propagator']}, {'name': 'Approximate Quantum Propagation', 'match_type': 'full', 'implemented_parts': ['Quantum state propagation algorithm', 'Approximate evolution operator'], 'confidence': 1.0, 'evidence': ['Propagator function with solver input', 'Comparison with exact propagator for different time steps', 'Verification of convergence to the ground state']}]",This file implements efficient quantum state propagation algorithms.,"{'constants': ['Quantum system Hamiltonian'], 'types': ['Density operators'], 'classes': ['Solver classes for different propagation methods'], 'functions': ['Approximate evolution operator construction', 'Quantum state propagation']}"
qutip/tests/solver/test_qubit_evolution.py,FileType.FILE,qutip,qutip,v5.0.4,https://qutip.org,https://github.com/qutip/qutip/tree/v5.0.4/qutip/tests/solver/test_qubit_evolution.py,"[{'name': 'Quantum State Evolution', 'match_type': 'partial', 'implemented_parts': ['Qubit interaction', 'Time evolution', 'Expectation values calculation'], 'confidence': 0.95, 'evidence': ['qubit_integrate function', 'tlist list for time points', 'Calculation of sx, sy, sz']}, {'name': 'Analytic Comparison', 'match_type': 'partial', 'implemented_parts': ['Analytical expressions derivation', 'Comparison with numerical results'], 'confidence': 0.9, 'evidence': ['Analytical expressions for sx, sy, sz', 'Maximum error comparison between numerical and analytical results']}]",This code tests the MCSolver algorithm for simulating quantum systems.,"{'constants': ['Epsilon, delta, g1, g2 represent system parameters'], 'types': ['Qubit represents quantum state'], 'classes': ['MCSolver class performs quantum simulation'], 'functions': ['qubit_integrate calculates time evolution of a qubit']}"
qutip/tests/solver/test_results.py,FileType.FILE,qutip,qutip,v5.0.4,https://qutip.org,https://github.com/qutip/qutip/tree/v5.0.4/qutip/tests/solver/test_results.py,"[{'name': 'MultiTrajResult Representation', 'match_type': 'partial', 'implemented_parts': ['Trajectories saved.', 'Number of trajectories: <number>', 'Average expectation: <list>', 'Average state: <matrix>'], 'confidence': 0.95, 'evidence': ['__repr__ method implementation', 'Trajectories saved flag', 'Number of trajectories count', 'Average expectation calculation', 'Average state representation']}, {'name': 'Merging Results', 'match_type': 'partial', 'implemented_parts': ['Number of trajectories updated', 'Average expectation alignment', 'Average state uniformity', 'Trajectories preservation control'], 'confidence': 0.9, 'evidence': ['Addition operator overloading', 'Trajectories count update', 'Expectation values averaging', 'State vector averaging', 'Control over trajectory saving']}]",This code defines a data structure for multi-trajectory results and provides utilities for merging and representing them.,"{'constants': [], 'types': ['MultiTrajResult'], 'classes': [], 'functions': ['fill_options', 'MultiTrajResult', '+ operator']}"
qutip/tests/solver/test_scattering.py,FileType.FILE,qutip,qutip,v5.0.4,https://qutip.org,https://github.com/qutip/qutip/tree/v5.0.4/qutip/tests/solver/test_scattering.py,"[{'name': 'Temporal Evolution', 'match_type': 'partial', 'implemented_parts': ['Hamiltonian evolution', 'initial state preparation', 'measurement'], 'confidence': 0.95, 'evidence': ['temporal_scattered_state function', 'temporal_basis_vector function', 'scattering_probability function with time dependence']}, {'name': 'Quantum Interaction', 'match_type': 'partial', 'implemented_parts': ['Hamiltonian coupling', 'rotation transformations'], 'confidence': 0.85, 'evidence': ['Htls list includes multiple Hamiltonians', 'lambda functions represent rotating frames', 'RabiFreq parameter controls interaction strength']}, {'name': 'Waveguide Splitting', 'match_type': 'partial', 'implemented_parts': ['Superposition of states', 'scattering process'], 'confidence': 0.9, 'evidence': ['Basis state superposition with equal weights', 'Multiple scattering paths with different operators', 'Comparison of scattering probabilities with and without splitting']}]",This code simulates quantum dynamics of interacting systems using the temporal scattering framework.,"{'constants': ['Pulse area, pulse length, Rabi frequency'], 'types': ['Hamiltonians representing quantum systems'], 'classes': ['Temporally evolving states'], 'functions': ['Temporal evolution of states', 'Measurement of scattered states']}"
qutip/tests/solver/test_sesolve.py,FileType.FILE,qutip,qutip,v5.0.4,https://qutip.org,https://github.com/qutip/qutip/tree/v5.0.4/qutip/tests/solver/test_sesolve.py,"[{'name': 'Krylov Solver', 'match_type': 'partial', 'implemented_parts': ['Initial state preparation', 'Evolution operator definition', 'Krylov subspace selection', 'Solving differential equation'], 'confidence': 0.95, 'evidence': ['qutip library usage for quantum computations', 'Hamiltonian definition with evolution operator', 'Krylov subspace selection based on minimum step', 'Differential equation solution with feedback']}, {'name': 'Feedback Mechanism', 'match_type': 'partial', 'implemented_parts': ['Function definition for feedback loop', 'Differential equation update with feedback', 'Solving differential equation with feedback'], 'confidence': 0.9, 'evidence': ['Custom function receiving feedback from solver', 'Differential equation modification based on feedback', 'Solving differential equation with feedback incorporated']}]",This code utilizes Krylov subspace selection and feedback to solve quantum differential equations.,"{'constants': ['Quantum system parameters'], 'types': ['Quantum states, operators'], 'classes': ['Solver for differential equations'], 'functions': ['Solving differential equations with feedback']}"
qutip/tests/solver/test_sode_method.py,FileType.FILE,qutip,qutip,v5.0.4,https://qutip.org,https://github.com/qutip/qutip/tree/v5.0.4/qutip/tests/solver/test_sode_method.py,"[{'name': 'StochasticSolver', 'match_type': 'partial', 'implemented_parts': ['SMESolver class', 'available integrators method', 'solve method with different integrators'], 'confidence': 0.9, 'evidence': ['Methods for various integrators like Euler, Platen, Rouchon', 'Integration of these methods with solve method', 'Error order calculation for integrators']}, {'name': 'ClosedSystemSolver', 'match_type': 'partial', 'implemented_parts': ['StochasticClosedSystem class', 'Solving with reference solver and custom solver', 'Error order comparison between solvers'], 'confidence': 0.85, 'evidence': ['Solving of closed systems with various Hamiltonians and scrambling operations', 'Comparison of different integrators for closed systems', 'Validation of error order for closed systems']}]",This file implements solvers for stochastic quantum systems.,"{'constants': ['Quantum system parameters and configurations'], 'types': ['Operators representing quantum states and transformations'], 'classes': ['SMESolver and StochasticClosedSystem classes for solving'], 'functions': ['Solving of stochastic quantum systems with different methods']}"
qutip/tests/solver/test_steadystate.py,FileType.FILE,qutip,qutip,v5.0.4,https://qutip.org,https://github.com/qutip/qutip/tree/v5.0.4/qutip/tests/solver/test_steadystate.py,"[{'name': 'Data permutation', 'match_type': 'partial', 'implemented_parts': ['Data permutation function', 'Indices permutation', 'Permutation method'], 'confidence': 0.9, 'evidence': ['Data permutation with indices', 'Custom permutation function defined', 'Permutation method applied to indices']}, {'name': 'Dominant diagonal', 'match_type': 'partial', 'implemented_parts': ['Dia dominance function', 'Matrix diagonal extraction', 'Norm calculation'], 'confidence': 0.85, 'evidence': ['Diagonal dominance measurement', 'Function iterates over matrix rows', 'Norm used for dominance calculation']}, {'name': 'Validation of diagonal dominance', 'match_type': 'partial', 'implemented_parts': ['Comparison of diagonal dominance values', 'Before and after permutation comparison', 'Error handling'], 'confidence': 0.9, 'evidence': ['Dia dominance comparison with permutation', 'Assertion for dominance improvement', 'Error handling for invalid cases']}]",This code section deals with data permutation and diagonal dominance measurement.,"{'constants': [], 'types': [], 'classes': [], 'functions': ['Data permutation function', 'Dia dominance function', 'Validation of diagonal dominance']}"
qutip/tests/solver/test_stochastic.py,FileType.FILE,qutip,qutip,v5.0.4,https://qutip.org,https://github.com/qutip/qutip/tree/v5.0.4/qutip/tests/solver/test_stochastic.py,"[{'name': 'Future Warning Suppresser', 'match_type': 'partial', 'implemented_parts': ['pytest.warns suppression', 'future warning matches', 'relevant method arguments'], 'confidence': 0.9, 'evidence': ['suppressing warnings with pytest.warns', 'matching patterns for specific future warnings', 'passing relevant arguments like map_func and progress_bar']}]",This code addresses various future warnings related to SSeolve function calls.,"{'constants': [], 'types': [], 'classes': [], 'functions': []}"
qutip/tests/solver/test_stochastic_system.py,FileType.FILE,qutip,qutip,v5.0.4,https://qutip.org,https://github.com/qutip/qutip/tree/v5.0.4/qutip/tests/solver/test_stochastic_system.py,"[{'name': 'Open System Simulation', 'match_type': 'partial', 'implemented_parts': ['Stochastic open system model', 'Hamiltonian operator', 'Scrambling operators', 'Heterodyne coupling', 'Error correction routines'], 'confidence': 0.9, 'evidence': ['StochasticOpenSystem class', '_make_oper function', 'fock_dm function', 'Heterodyne flag in test case', 'Derr routines in test case']}, {'name': 'Quantum Control Design', 'match_type': 'partial', 'implemented_parts': ['Quantum gates and circuits', 'Hamiltonian engineering', 'Scrambling techniques', 'Error correction algorithms'], 'confidence': 0.8, 'evidence': ['qeye, destroy, tridiag functions', 'rand_herm function', 'StochasticOpenSystem class', 'Hamiltonian optimization routines']}]",This file simulates open quantum systems and designs quantum control protocols.,"{'constants': ['Quantum system parameters'], 'types': ['QobjEvo representation of quantum operators'], 'classes': ['StochasticOpenSystem class for open system model'], 'functions': ['Hamiltonian engineering functions', 'Scrambling and error correction routines']}"
qutip/tests/solver/test_transfertensor.py,FileType.FILE,qutip,qutip,v5.0.4,https://qutip.org,https://github.com/qutip/qutip/tree/v5.0.4/qutip/tests/solver/test_transfertensor.py,"[{'name': 'Partial Trace Superoperator', 'match_type': 'partial', 'implemented_parts': ['Partial trace operation on initial state'], 'confidence': 0.95, 'evidence': ['qutip.tensor_contract function', 'superoperator definition with partial trace']}, {'name': 'Mesolve Algorithm', 'match_type': 'full', 'implemented_parts': ['Evolution operator definition', 'Mesolve algorithm implementation'], 'confidence': 1.0, 'evidence': ['qutip.mesolve function call', 'H Hamiltonian definition']}, {'name': 'Transfer Learning Method', 'match_type': 'partial', 'implemented_parts': ['Evolution operator approximation', 'Transfer learning update rule'], 'confidence': 0.85, 'evidence': ['ttmsolve function call', 'Liouvillian evolution operator approximation']}]",This code implements a quantum state estimation algorithm using a transfer learning approach.,"{'constants': ['Quantum operators and initial states'], 'types': ['Density matrices'], 'classes': ['Quantum systems and estimation algorithms'], 'functions': ['Partial trace operation', 'Mesolve algorithm', 'Transfer learning update']}"
qutip/tests/solver/__init__.py,FileType.FILE,qutip,qutip,v5.0.4,https://qutip.org,https://github.com/qutip/qutip/tree/v5.0.4/qutip/tests/solver/__init__.py,"[{'name': 'Mediator', 'match_type': 'partial', 'implemented_parts': ['Centralizes communication', 'Mediator role'], 'confidence': 0.75, 'evidence': ['centralizes communication between colleagues', 'methods like notify, coordinate']}, {'name': 'Memento', 'match_type': 'partial', 'implemented_parts': ['State capturing', 'Memento pattern'], 'confidence': 0.8, 'evidence': ['creation and restoration of state', 'methods like save_state, restore_state']}, {'name': 'Visitor', 'match_type': 'partial', 'implemented_parts': ['Dynamic dispatch', 'Visitor pattern'], 'confidence': 0.7, 'evidence': ['accepts different visitors', 'methods like visit']}]",This file defines core components for event management and mediation.,"{'constants': ['Defines event-related constants'], 'types': ['Event objects'], 'classes': ['Mediator centralizes communication', 'Memento captures state'], 'functions': ['send_message facilitates communication', 'visit dispatches operations']}"
qutip/tests/solver,FileType.DIR,qutip,qutip,v5.0.4,https://qutip.org,https://github.com/qutip/qutip/tree/v5.0.4/qutip/tests/solver,"[{'name': 'Quantum Algorithm', 'match_type': 'full', 'implemented_parts': ['Evolution operator definition', 'Mesolve algorithm implementation'], 'confidence': 1.0, 'evidence': ['qutip.mesolve function call', 'H Hamiltonian definition']}, {'name': 'Transfer Learning Method', 'match_type': 'partial', 'implemented_parts': ['Evolution operator approximation', 'Transfer learning update rule'], 'confidence': 0.85, 'evidence': ['ttmsolve function call', 'Liouvillian evolution operator approximation']}, {'name': 'Mediator', 'match_type': 'partial', 'implemented_parts': ['Centralizes communication', 'Mediator role'], 'confidence': 0.75, 'evidence': ['centralizes communication between colleagues', 'methods like notify, coordinate']}, {'name': 'Memento', 'match_type': 'partial', 'implemented_parts': ['State capturing', 'Memento pattern'], 'confidence': 0.8, 'evidence': ['creation and restoration of state', 'methods like save_state, restore_state']}, {'name': 'Visitor', 'match_type': 'partial', 'implemented_parts': ['Dynamic dispatch', 'Visitor pattern'], 'confidence': 0.7, 'evidence': ['accepts different visitors', 'methods like visit']}]",This code implements a quantum state estimation algorithm using a transfer learning approach.,"{'constants': ['Quantum operators and initial states'], 'types': ['Density matrices'], 'classes': ['Quantum systems and estimation algorithms'], 'functions': ['Partial trace operation', 'Mesolve algorithm', 'Transfer learning update']}"
qutip/tests/conftest.py,FileType.FILE,qutip,qutip,v5.0.4,https://qutip.org,https://github.com/qutip/qutip/tree/v5.0.4/qutip/tests/conftest.py,"[{'name': 'Testing utils', 'match_type': 'partial', 'implemented_parts': ['nose_tools', 'utils', 'build_err_msg function patching'], 'confidence': 0.9, 'evidence': ['import of nose_tools and utils modules', 'patching of build_err_msg function to prevent output truncation']}, {'name': 'Temporary directory management', 'match_type': 'full', 'implemented_parts': ['creation and usage of temporary directory'], 'confidence': 1.0, 'evidence': ['use of tempfile module for temporary directory creation', 'changing working directory to temporary directory', 'cleaning up temporary directory after test execution']}]",This file provides utility functions for testing and temporary directory management.,"{'constants': [], 'types': [], 'classes': [], 'functions': ['creation and management of temporary directory']}"
