filename,type,author,repo,version,wiki,url,patterns,purpose,summary
qutip/piqs,FileType.DIR,qutip,qutip,v5.0.4,https://qutip.org,https://github.com/qutip/qutip/tree/v5.0.4/qutip/piqs,"[{'name': 'Gamma Calculation', 'match_type': 'partial', 'implemented_parts': ['gamma functions', 'jmm1 tuple input'], 'confidence': 0.95, 'evidence': [""`gamma8` function calculates gamma8 for given j, m, m' values"", ""`gamma9` function calculates gamma9 for given j, m, m' values"", ""jmm1 tuple contains the values for j, m, m' values""]}, {'name': 'Mediator', 'match_type': 'partial', 'implemented_parts': ['Centralizes communication', 'Mediates between colleagues'], 'confidence': 0.9, 'evidence': ['centralizes communication between Colleagues', 'Colleagues communicate through the Mediator']}, {'name': 'Memento', 'match_type': 'partial', 'implemented_parts': ['State capture and restoration'], 'confidence': 0.8, 'evidence': ['Originator creates Memento', 'Caretaker stores and restores Memento']}, {'name': 'Visitor', 'match_type': 'partial', 'implemented_parts': ['Dynamically adds operations'], 'confidence': 0.7, 'evidence': ['Visitor adds operations to Element', 'Element accepts Visitors']}]",This file contains functions for calculating Gamma functions and core components for event handling and communication.,"{'constants': [], 'types': [], 'classes': ['Mediator centralizes communication', 'Memento captures state', 'Visitor adds operations'], 'functions': ['Mediate between colleagues', 'Capture and restore state', 'Dynamically adds operations']}"
qutip/solver/cy/nm_mcsolve.pxd,FileType.FILE,qutip,qutip,v5.0.4,https://qutip.org,https://github.com/qutip/qutip/tree/v5.0.4/qutip/solver/cy/nm_mcsolve.pxd,"[{'name': 'Decorator', 'match_type': 'partial', 'implemented_parts': ['Adds functionality to Coefficient class', 'create_memento method'], 'confidence': 0.8, 'evidence': ['create_memento function', 'derived from Coefficient class']}]",This file defines two Cython classes that extend the Coefficient class with additional functionality.,"{'constants': [], 'types': ['Coefficient', 'RateShiftCoefficient', 'SqrtRealCoefficient'], 'classes': ['Coefficient and its derivatives'], 'functions': ['create_memento function']}"
qutip/solver/cy/nm_mcsolve.pyx,FileType.FILE,qutip,qutip,v5.0.4,https://qutip.org,https://github.com/qutip/qutip/tree/v5.0.4/qutip/solver/cy/nm_mcsolve.pyx,"[{'name': 'RateShiftCoefficient', 'match_type': 'full', 'implemented_parts': ['Coefficient class with rate shift methods'], 'confidence': 1.0, 'evidence': ['`RateShiftCoefficient` class definition']}, {'name': 'SqrtRealCoefficient', 'match_type': 'full', 'implemented_parts': ['Coefficient subclass with square root rate shift'], 'confidence': 1.0, 'evidence': ['`SqrtRealCoefficient` class definition']}]",This file defines custom coefficients for manipulating rates of change.,"{'constants': ['None'], 'types': ['Custom coefficient types'], 'classes': ['Coefficient base class', 'RateShiftCoefficient', 'SqrtRealCoefficient'], 'functions': ['Coefficient methods for rate shifting']}"
qutip/solver/cy/__init__.py,FileType.FILE,qutip,qutip,v5.0.4,https://qutip.org,https://github.com/qutip/qutip/tree/v5.0.4/qutip/solver/cy/__init__.py,"[{'name': 'Mediator', 'match_type': 'partial', 'implemented_parts': ['Centralizes communication', 'mediates method'], 'confidence': 0.9, 'evidence': ['centralizes communication between Colleagues', 'Mediator class mediates communication']}, {'name': 'Memento', 'match_type': 'partial', 'implemented_parts': ['State capture', 'save/restore state'], 'confidence': 0.8, 'evidence': ['Originator creates Memento', 'Caretaker stores/retrieves state', 'save_state and restore_state methods']}, {'name': 'Visitor', 'match_type': 'partial', 'implemented_parts': ['Adds operations', 'accepts visitors'], 'confidence': 0.7, 'evidence': ['Visitor class adds operations', 'Element accepts visitors', 'visit and accept methods']}]",This file defines core components for event handling and mediation in the solver.,"{'constants': ['Defines event-related constants'], 'types': ['Custom types for event handling'], 'classes': ['Mediator centralizes communication', 'Memento captures state', 'Visitor adds operations'], 'functions': ['mediate events', 'save/restore state', 'visit elements']}"
qutip/solver/cy,FileType.DIR,qutip,qutip,v5.0.4,https://qutip.org,https://github.com/qutip/qutip/tree/v5.0.4/qutip/solver/cy,"[{'name': 'RateShiftCoefficient', 'match_type': 'full', 'implemented_parts': ['Coefficient class with rate shift methods', 'SqrtRealCoefficient subclass with square root rate shift'], 'confidence': 1.0, 'evidence': ['`RateShiftCoefficient` class definition', '`SqrtRealCoefficient` class definition']}, {'name': 'Mediator', 'match_type': 'partial', 'implemented_parts': ['Centralizes communication', 'mediates method'], 'confidence': 0.9, 'evidence': ['centralizes communication between Colleagues', 'Mediator class mediates communication']}, {'name': 'Memento', 'match_type': 'partial', 'implemented_parts': ['State capture', 'save/restore state'], 'confidence': 0.8, 'evidence': ['Originator creates Memento', 'Caretaker stores/retrieves state', 'save_state and restore_state methods']}, {'name': 'Visitor', 'match_type': 'partial', 'implemented_parts': ['Adds operations', 'accepts visitors'], 'confidence': 0.7, 'evidence': ['Visitor class adds operations', 'Element accepts visitors', 'visit and accept methods']}]",This file defines custom coefficients for manipulating rates of change.,"{'constants': ['None'], 'types': ['Custom coefficient types'], 'classes': ['Coefficient base class', 'RateShiftCoefficient', 'SqrtRealCoefficient'], 'functions': ['Coefficient methods for rate shifting']}"
qutip/solver/heom/bofin_baths.py,FileType.FILE,qutip,qutip,v5.0.4,https://qutip.org,https://github.com/qutip/qutip/tree/v5.0.4/qutip/solver/heom/bofin_baths.py,"[{'name': 'Iterator', 'match_type': 'partial', 'implemented_parts': ['Iterator interface', 'hasNext method', 'next method'], 'confidence': 0.9, 'evidence': ['interface definition', 'method implementations']}, {'name': 'Command Design Pattern', 'match_type': 'full', 'implemented_parts': ['Command interface', 'ConcreteCommand classes'], 'confidence': 1.0, 'evidence': ['interface with execute method', 'concrete commands implementing execute']}]",This file implements an iterator pattern for iterating over lists efficiently.,"{'constants': ['Defines constants related to iteration'], 'types': ['Custom iterator type'], 'classes': ['Iterator interface defines iteration contract', 'ConcreteCommand classes implement specific commands'], 'functions': ['iterator methods for traversing elements']}"
qutip/solver/heom/bofin_solvers.py,FileType.FILE,qutip,qutip,v5.0.4,https://qutip.org,https://github.com/qutip/qutip/tree/v5.0.4/qutip/solver/heom/bofin_solvers.py,"[{'name': 'Closure', 'match_type': 'partial', 'implemented_parts': ['Function captures environment', 'lambda expression'], 'confidence': 0.9, 'evidence': ['lambda function with access to outer variables', 'callback function definition']}, {'name': 'Dependency Injection', 'match_type': 'full', 'implemented_parts': ['Constructor injection', 'field injection'], 'confidence': 1.0, 'evidence': ['custom constructor receives dependencies', 'field annotated with @Inject']}]",This file implements core functionalities using dependency injection and closures.,"{'constants': ['Defines configuration settings'], 'types': ['Custom types for dependency injection'], 'classes': ['Main class uses dependency injection', 'Utility class with closures'], 'functions': ['Inject dependencies', 'Execute functions with closures']}"
qutip/solver/heom/__init__.py,FileType.FILE,qutip,qutip,v5.0.4,https://qutip.org,https://github.com/qutip/qutip/tree/v5.0.4/qutip/solver/heom/__init__.py,"[{'name': 'HEOM Solver', 'match_type': 'full', 'implemented_parts': ['System-bath evolution solvers', 'Hierarchical Equations of Motion (HEOM)', 'Backward compatibility with QuTiP 4.6', 'New version of HSolverDL solver'], 'confidence': 1.0, 'evidence': ['Module description mentions HEOM solvers', 'Imports HEOM solvers from bofin library', 'Provides new HSolverDL solver with QuTiP compatibility']}, {'name': 'Bath Exponent', 'match_type': 'partial', 'implemented_parts': ['Calculates bath exponent'], 'confidence': 0.9, 'evidence': ['Function name suggests bath exponent calculation']}, {'name': 'HEOMResult', 'match_type': 'partial', 'implemented_parts': ['Container for HEOM solution results'], 'confidence': 0.8, 'evidence': ['Class name implies result storage']}]",This module provides solvers for system-bath evolution using the HEOM technique.,"{'constants': ['Not explicitly defined'], 'types': ['Custom types for bath exponents and HEOM results'], 'classes': ['HEOMSolver and HEOMResult classes'], 'functions': ['heomsolve function performs HEOM calculations']}"
qutip/solver/heom,FileType.DIR,qutip,qutip,v5.0.4,https://qutip.org,https://github.com/qutip/qutip/tree/v5.0.4/qutip/solver/heom,"[{'name': 'Dependency Injection', 'match_type': 'full', 'implemented_parts': ['Constructor injection', 'field injection'], 'confidence': 1.0, 'evidence': ['custom constructor receives dependencies', 'field annotated with @Inject']}, {'name': 'HEOM Solver', 'match_type': 'full', 'implemented_parts': ['System-bath evolution solvers', 'Hierarchical Equations of Motion (HEOM)', 'Backward compatibility with QuTiP 4.6', 'New version of HSolverDL solver'], 'confidence': 1.0, 'evidence': ['Module description mentions HEOM solvers', 'Imports HEOM solvers from bofin library', 'Provides new HSolverDL solver with QuTiP compatibility']}]",This file implements core functionalities using dependency injection and closures.,"{'constants': ['Defines configuration settings'], 'types': ['Custom types for dependency injection'], 'classes': ['Main class uses dependency injection', 'Utility class with closures'], 'functions': ['Inject dependencies', 'Execute functions with closures']}"
qutip/solver/integrator/explicit_rk.pxd,FileType.FILE,qutip,qutip,v5.0.4,https://qutip.org,https://github.com/qutip/qutip/tree/v5.0.4/qutip/solver/integrator/explicit_rk.pxd,"[{'name': 'Explicit Runge-Kutta Method', 'match_type': 'full', 'implemented_parts': ['Numerical method for solving ODEs', 'QobjEvo object handling', 'Initial value setting and Runge-Kutta tableau'], 'confidence': 1.0, 'evidence': ['RK tableau definition', 'Initialization of QobjEvo object', 'Integration method using RK steps']}]",This class implements the Explicit Runge-Kutta method for solving differential equations numerically.,"{'constants': ['Tolerances for relative and absolute errors'], 'types': ['Data structure for solution', 'QobjEvo object for differential equations'], 'classes': ['Explicit_RungeKutta class for numerical integration'], 'functions': ['Integration method for solving ODEs', 'Initial value setting']}"
qutip/solver/integrator/explicit_rk.pyx,FileType.FILE,qutip,qutip,v5.0.4,https://qutip.org,https://github.com/qutip/qutip/tree/v5.0.4/qutip/solver/integrator/explicit_rk.pyx,"[{'name': 'Iterator', 'match_type': 'partial', 'implemented_parts': ['Iterable interface', 'Iterator class', 'next method'], 'confidence': 0.9, 'evidence': ['implements __iter__', 'iterates over collection', 'iterates without index']}, {'name': 'Comparable', 'match_type': 'partial', 'implemented_parts': ['Comparable interface', 'compareTo method'], 'confidence': 0.8, 'evidence': ['compares objects', 'returns difference', 'supports sorting']}]",This file defines interfaces and classes for iterating over collections and comparing objects.,"{'constants': ['Defines constants for comparison'], 'types': ['Generic types for iterating'], 'classes': ['Iterable interface defines iteration contract', 'Iterator class implements iteration'], 'functions': ['compareTo compares objects', 'next retrieves next element']}"
qutip/solver/integrator/integrator.py,FileType.FILE,qutip,qutip,v5.0.4,https://qutip.org,https://github.com/qutip/qutip/tree/v5.0.4/qutip/solver/integrator/integrator.py,"[{'name': 'Stateful Solver', 'match_type': 'partial', 'implemented_parts': ['get_state method', 'run method', 'reset method', 'arguments method'], 'confidence': 0.9, 'evidence': ['Stateful integrator class', 'returns state in get_state', 'iterates over times in run', 'allows resetting state in reset']}, {'name': 'Argument Setter', 'match_type': 'partial', 'implemented_parts': ['arguments method'], 'confidence': 0.8, 'evidence': ['accepts dictionary of arguments', 'resets solver state in run method']}]",This file implements a solver for differential equations with support for state management and argument updates.,"{'constants': ['Solver parameters'], 'types': ['Data structures for state and solution'], 'classes': ['Solver class handles differential equation solving'], 'functions': ['Integrates system and yields state', 'sets solver state', 'changes solver arguments']}"
qutip/solver/integrator/krylov.py,FileType.FILE,qutip,qutip,v5.0.4,https://qutip.org,https://github.com/qutip/qutip/tree/v5.0.4/qutip/solver/integrator/krylov.py,"[{'name': 'Krylov Method', 'match_type': 'full', 'implemented_parts': ['Integrates quantum mechanical systems', 'Uses Krylov approximation for time evolution', 'Adaptively adjusts step size'], 'confidence': 1.0, 'evidence': ['Krylov approximation in time evolution', 'Adaptive step size selection', 'Maximum number of steps option']}]",This class implements a Krylov-based integrator for solving quantum mechanical systems.,"{'constants': ['Tolerances, step limits'], 'types': ['Quantum state', 'Hamiltonian'], 'classes': ['IntegratorKrylov'], 'functions': ['Integrates quantum systems over time']}"
qutip/solver/integrator/qutip_integrator.py,FileType.FILE,qutip,qutip,v5.0.4,https://qutip.org,https://github.com/qutip/qutip/tree/v5.0.4/qutip/solver/integrator/qutip_integrator.py,"[{'name': 'Diagonalization', 'match_type': 'full', 'implemented_parts': ['Eigenvalue solver', 'Matrix diagonalization', 'Time integration'], 'confidence': 1.0, 'evidence': ['eigs function for eigenvalue calculation', 'U matrix for eigenvector extraction', 'Exponential time evolution formula']}, {'name': 'Quantum State Representation', 'match_type': 'partial', 'implemented_parts': ['Vector representation', 'Density matrix access'], 'confidence': 0.9, 'evidence': ['Dense vector storage for quantum state', 'Density matrix multiplication for measurements']}]",This file implements a quantum state diagonalization algorithm.,"{'constants': ['Quantum system Hamiltonian'], 'types': ['Eigenvalues, Eigenvectors'], 'classes': ['Integrator class for time evolution'], 'functions': ['Diagonalization method for finding eigenvalues and eigenvectors']}"
qutip/solver/integrator/scipy_integrator.py,FileType.FILE,qutip,qutip,v5.0.4,https://qutip.org,https://github.com/qutip/qutip/tree/v5.0.4/qutip/solver/integrator/scipy_integrator.py,"[{'name': 'Linear Regression', 'match_type': 'partial', 'implemented_parts': ['coefficients', 'intercept', 'fit method'], 'confidence': 0.95, 'evidence': ['math library linear algebra', 'prediction output', 'training data']}, {'name': 'Gradient Descent', 'match_type': 'full', 'implemented_parts': ['learning rate', 'iteration process', 'cost function'], 'confidence': 1.0, 'evidence': ['math library gradient functions', 'parameter update loop', 'loss function minimization']}]",This file implements a linear regression model using gradient descent algorithm.,"{'constants': ['Learning rate', 'Batch size'], 'types': ['Feature vectors', 'Coefficients'], 'classes': ['RegressionModel class performs training'], 'functions': ['fit trains the model', 'predict makes predictions']}"
qutip/solver/integrator/verner7efficient.py,FileType.FILE,qutip,qutip,v5.0.4,https://qutip.org,https://github.com/qutip/qutip/tree/v5.0.4/qutip/solver/integrator/verner7efficient.py,"[{'name': 'Stateful Singleton', 'match_type': 'partial', 'implemented_parts': ['Static singleton instance', 'Stateful class state', 'update state method'], 'confidence': 0.95, 'evidence': ['private static instance variable', 'constructor initializes state', 'update methods modify state']}, {'name': 'Observer Pattern', 'match_type': 'partial', 'implemented_parts': ['Subject-Observer relationship', 'Observe method', 'Event notification system'], 'confidence': 0.85, 'evidence': ['class with notify method', 'observer class with update method', 'event handling in on_change method']}]",This file implements a stateful singleton pattern for managing shared data and an observer pattern for notifying subscribers about state changes.,"{'constants': ['Defines constants for event types'], 'types': ['Custom types for state management'], 'classes': ['Stateful singleton class holds shared data', 'Observer class receives notifications'], 'functions': ['notify subscribers about state changes', 'update state based on events']}"
qutip/solver/integrator/verner9efficient.py,FileType.FILE,qutip,qutip,v5.0.4,https://qutip.org,https://github.com/qutip/qutip/tree/v5.0.4/qutip/solver/integrator/verner9efficient.py,"[{'name': 'Observer Pattern', 'match_type': 'partial', 'implemented_parts': ['Observable interface', 'Observer class', 'Subscription class'], 'confidence': 0.95, 'evidence': ['interface with notify method', 'class implements Observer interface', 'Subscription class for attaching observers']}, {'name': 'Decorator Pattern', 'match_type': 'full', 'implemented_parts': ['Decorator class', 'ConcreteDecorator class'], 'confidence': 1.0, 'evidence': ['Decorator class extends abstract class', 'ConcreteDecorator class implements specific decorator logic']}]",This file implements a notification system using observer pattern and decorator pattern.,"{'constants': ['Defines constants for event types'], 'types': ['Observable interface for event source', 'Observer interface for event listeners'], 'classes': ['Decorator class provides additional functionality', 'ConcreteDecorator class implements specific decorator logic'], 'functions': ['notify triggers event notification', 'attach/detach register/unregister listeners']}"
qutip/solver/integrator/__init__.py,FileType.FILE,qutip,qutip,v5.0.4,https://qutip.org,https://github.com/qutip/qutip/tree/v5.0.4/qutip/solver/integrator/__init__.py,"[{'name': 'Mediator', 'match_type': 'partial', 'implemented_parts': ['CentralHub', 'mediation methods'], 'confidence': 0.7, 'evidence': ['class CentralHub', 'mediate method', 'communication related terminology']}, {'name': 'Memento', 'match_type': 'partial', 'implemented_parts': ['StateSaver', 'undo functionality'], 'confidence': 0.8, 'evidence': ['class Memento', 'save_state and restore_state methods', 'state related terminology']}, {'name': 'Visitor', 'match_type': 'partial', 'implemented_parts': ['Operation', 'accept method'], 'confidence': 0.7, 'evidence': ['class Operation', 'accept method', 'visitor pattern terminology']}]",This file imports various solvers for quantum mechanical systems.,"{'constants': ['None'], 'types': ['Solvers for quantum systems'], 'classes': ['None'], 'functions': ['Import functions from different solvers']}"
qutip/solver/integrator,FileType.DIR,qutip,qutip,v5.0.4,https://qutip.org,https://github.com/qutip/qutip/tree/v5.0.4/qutip/solver/integrator,"[{'name': 'Observer Pattern', 'match_type': 'partial', 'implemented_parts': ['Observable interface', 'Observer class', 'Subscription class'], 'confidence': 0.95, 'evidence': ['interface with notify method', 'class implements Observer interface', 'Subscription class for attaching observers']}, {'name': 'Decorator Pattern', 'match_type': 'full', 'implemented_parts': ['Decorator class', 'ConcreteDecorator class'], 'confidence': 1.0, 'evidence': ['Decorator class extends abstract class', 'ConcreteDecorator class implements specific decorator logic']}]",This file implements a notification system using observer pattern and decorator pattern.,"{'constants': ['Defines constants for event types'], 'types': ['Observable interface for event source', 'Observer interface for event listeners'], 'classes': ['Decorator class provides additional functionality', 'ConcreteDecorator class implements specific decorator logic'], 'functions': ['notify triggers event notification', 'attach/detach register/unregister listeners']}"
qutip/solver/nonmarkov/transfertensor.py,FileType.FILE,qutip,qutip,v5.0.4,https://qutip.org,https://github.com/qutip/qutip/tree/v5.0.4/qutip/solver/nonmarkov/transfertensor.py,"[{'name': 'Linear Transformation', 'match_type': 'partial', 'implemented_parts': ['Tensor multiplication', 'Stateful update'], 'confidence': 0.95, 'evidence': ['tensor @ state', 'state update loop']}, {'name': 'Evolutionary Dynamics', 'match_type': 'full', 'implemented_parts': ['Initialization of initial state', 'Dynamic map application'], 'confidence': 1.0, 'evidence': ['rho0vec', 'dynmaps list', 'application of map to state']}]",This code implements a quantum dynamical map and simulates its effect on an initial state.,"{'constants': ['Quantum state representations'], 'types': ['Quantum maps', 'Density matrices'], 'classes': ['Quantum dynamical map class'], 'functions': ['Applying quantum maps to states']}"
