filename,type,author,repo,version,wiki,url,patterns,purpose,summary
hail/src/test/resources/backward_compatability/1.6.0/matrix_table/6.hmt/rows/README.txt,FileType.FILE,hail-is,hail,0.2.133,https://hail.is,https://github.com/hail-is/hail/tree/0.2.133/hail/src/test/resources/backward_compatability/1.6.0/matrix_table/6.hmt/rows/README.txt,"[{'name': 'Memento', 'match_type': 'partial', 'implemented_parts': ['Originator', 'Memento'], 'confidence': 0.7, 'evidence': ['create_memento method', 'get_memento method']}, {'name': 'Visitor', 'match_type': 'partial', 'implemented_parts': ['Visitor', 'Element'], 'confidence': 0.8, 'evidence': ['visit method', 'accept method']}]",This file provides backward compatibility with older versions of Hail.,"{'constants': [], 'types': [], 'classes': ['Table or MatrixTable'], 'functions': []}"
hail/src/test/resources/backward_compatability/1.6.0/matrix_table/6.hmt/rows/_SUCCESS,FileType.FILE,hail-is,hail,0.2.133,https://hail.is,https://github.com/hail-is/hail/tree/0.2.133/hail/src/test/resources/backward_compatability/1.6.0/matrix_table/6.hmt/rows/_SUCCESS,"[{'name': 'Mediator', 'match_type': 'partial', 'implemented_parts': ['Centralizes communication', 'Mediator role'], 'confidence': 0.7, 'evidence': ['Colleagues communicate through Mediator', 'Mediator centralizes communication']}, {'name': 'Memento', 'match_type': 'partial', 'implemented_parts': ['State capture', 'Memento pattern'], 'confidence': 0.8, 'evidence': ['Originator creates Memento', 'Caretaker stores and restores Memento']}, {'name': 'Visitor', 'match_type': 'partial', 'implemented_parts': ['Dynamic dispatch', 'Visitor pattern'], 'confidence': 0.7, 'evidence': ['Visitor adds operations', 'Element accepts Visitors']}]",This file defines a matrix table data structure and provides backward compatibility utilities.,"{'constants': ['Defines constants for data types'], 'types': ['Custom types for matrix table'], 'classes': ['MatrixTable class represents the data structure'], 'functions': ['Backward compatibility functions for older versions']}"
hail/src/test/resources/backward_compatability/1.6.0/matrix_table/6.hmt/rows,FileType.DIR,hail-is,hail,0.2.133,https://hail.is,https://github.com/hail-is/hail/tree/0.2.133/hail/src/test/resources/backward_compatability/1.6.0/matrix_table/6.hmt/rows,"[{'name': 'Memento', 'match_type': 'partial', 'implemented_parts': ['Originator', 'Memento'], 'confidence': 0.7, 'evidence': ['create_memento method', 'get_memento method']}, {'name': 'Visitor', 'match_type': 'partial', 'implemented_parts': ['Visitor', 'Element'], 'confidence': 0.8, 'evidence': ['visit method', 'accept method']}, {'name': 'Mediator', 'match_type': 'partial', 'implemented_parts': ['Centralizes communication', 'Mediator role'], 'confidence': 0.7, 'evidence': ['Colleagues communicate through Mediator', 'Mediator centralizes communication']}, {'name': 'Memento', 'match_type': 'partial', 'implemented_parts': ['State capture', 'Memento pattern'], 'confidence': 0.8, 'evidence': ['Originator creates Memento', 'Caretaker stores and restores Memento']}, {'name': 'Visitor', 'match_type': 'partial', 'implemented_parts': ['Dynamic dispatch', 'Visitor pattern'], 'confidence': 0.7, 'evidence': ['Visitor adds operations', 'Element accepts Visitors']}]",This file provides backward compatibility with older versions of Hail.,"{'constants': [], 'types': [], 'classes': ['Table or MatrixTable'], 'functions': []}"
hail/src/test/resources/backward_compatability/1.6.0/matrix_table/6.hmt/README.txt,FileType.FILE,hail-is,hail,0.2.133,https://hail.is,https://github.com/hail-is/hail/tree/0.2.133/hail/src/test/resources/backward_compatability/1.6.0/matrix_table/6.hmt/README.txt,[],This file provides metadata about a Hail Table or MatrixTable.,"{'constants': [], 'types': [], 'classes': [], 'functions': []}"
hail/src/test/resources/backward_compatability/1.6.0/matrix_table/6.hmt/_SUCCESS,FileType.FILE,hail-is,hail,0.2.133,https://hail.is,https://github.com/hail-is/hail/tree/0.2.133/hail/src/test/resources/backward_compatability/1.6.0/matrix_table/6.hmt/_SUCCESS,"[{'name': 'Mediator', 'match_type': 'full', 'implemented_parts': ['Centralizes communication', 'Colleagues communicate through Mediator'], 'confidence': 1.0, 'evidence': ['Mediator centralizes communication between Colleagues', 'Colleagues communicate through the Mediator']}, {'name': 'Memento', 'match_type': 'partial', 'implemented_parts': ['Originator creates Memento', 'Caretaker stores and restores Memento'], 'confidence': 0.8, 'evidence': ['Originator creates Memento to capture state', 'Caretaker stores and restores Memento']}, {'name': 'Visitor', 'match_type': 'partial', 'implemented_parts': ['Adds operations to Element', 'Element accepts Visitors'], 'confidence': 0.7, 'evidence': ['Visitor adds operations to Element without modifying it', 'Element accepts Visitors']}]",This file defines a system for handling backward compatibility issues in the hail project.,"{'constants': ['Defines compatibility-related constants'], 'types': ['Custom types for compatibility handling'], 'classes': ['Mediator centralizes communication', 'Memento captures state', 'Visitor adds operations'], 'functions': ['Mediate between Incompatible elements', 'Capture state', 'Add operations dynamically']}"
hail/src/test/resources/backward_compatability/1.6.0/matrix_table/6.hmt,FileType.DIR,hail-is,hail,0.2.133,https://hail.is,https://github.com/hail-is/hail/tree/0.2.133/hail/src/test/resources/backward_compatability/1.6.0/matrix_table/6.hmt,"[{'name': 'Mediator', 'match_type': 'full', 'implemented_parts': ['Centralizes communication', 'Colleagues communicate through Mediator'], 'confidence': 1.0, 'evidence': ['Mediator centralizes communication between Colleagues', 'Colleagues communicate through the Mediator']}, {'name': 'Memento', 'match_type': 'partial', 'implemented_parts': ['Originator creates Memento', 'Caretaker stores and restores Memento'], 'confidence': 0.8, 'evidence': ['Originator creates Memento to capture state', 'Caretaker stores and restores Memento']}, {'name': 'Visitor', 'match_type': 'partial', 'implemented_parts': ['Adds operations to Element', 'Element accepts Visitors'], 'confidence': 0.7, 'evidence': ['Visitor adds operations to Element without modifying it', 'Element accepts Visitors']}]",This file defines a system for handling backward compatibility issues in the hail project.,"{'constants': ['Defines compatibility-related constants'], 'types': ['Custom types for compatibility handling'], 'classes': ['Mediator centralizes communication', 'Memento captures state', 'Visitor adds operations'], 'functions': ['Mediate between Incompatible elements', 'Capture state', 'Add operations dynamically']}"
hail/src/test/resources/backward_compatability/1.6.0/matrix_table/7.hmt/cols/rows/parts,FileType.DIR,hail-is,hail,0.2.133,https://hail.is,https://github.com/hail-is/hail/tree/0.2.133/hail/src/test/resources/backward_compatability/1.6.0/matrix_table/7.hmt/cols/rows/parts,[],This directory contains resource files for testing compatibility between different versions of the Hail product.,"{'constants': [], 'types': [], 'classes': [], 'functions': []}"
hail/src/test/resources/backward_compatability/1.6.0/matrix_table/7.hmt/cols/rows,FileType.DIR,hail-is,hail,0.2.133,https://hail.is,https://github.com/hail-is/hail/tree/0.2.133/hail/src/test/resources/backward_compatability/1.6.0/matrix_table/7.hmt/cols/rows,[],This directory contains header files for testing compatibility of Hail code with different versions.,"{'constants': [], 'types': [], 'classes': [], 'functions': []}"
hail/src/test/resources/backward_compatability/1.6.0/matrix_table/7.hmt/cols/README.txt,FileType.FILE,hail-is,hail,0.2.133,https://hail.is,https://github.com/hail-is/hail/tree/0.2.133/hail/src/test/resources/backward_compatability/1.6.0/matrix_table/7.hmt/cols/README.txt,"[{'name': 'Memento', 'match_type': 'partial', 'implemented_parts': ['Originator', 'Memento', 'Caretaker'], 'confidence': 0.8, 'evidence': ['Originator saves state to Memento', 'Caretaker stores and restores Memento']}, {'name': 'Visitor', 'match_type': 'partial', 'implemented_parts': ['Visitor adds operations to Element'], 'confidence': 0.7, 'evidence': ['Element accepts Visitors', 'visit method on Visitor']}]",This file defines state management and operations for a Hail table.,"{'constants': [], 'types': ['Table', 'Column'], 'classes': ['Table', 'Column'], 'functions': ['save_state', 'restore_state']}"
hail/src/test/resources/backward_compatability/1.6.0/matrix_table/7.hmt/cols/_SUCCESS,FileType.FILE,hail-is,hail,0.2.133,https://hail.is,https://github.com/hail-is/hail/tree/0.2.133/hail/src/test/resources/backward_compatability/1.6.0/matrix_table/7.hmt/cols/_SUCCESS,"[{'name': 'Mediator', 'match_type': 'partial', 'implemented_parts': ['Centralizes communication', 'Colleagues communicate through Mediator'], 'confidence': 0.85, 'evidence': ['Mediator class', 'communication methods like notify, coordinate']}, {'name': 'Memento', 'match_type': 'partial', 'implemented_parts': ['State capturing', 'Caretaker functionality'], 'confidence': 0.75, 'evidence': ['Memento class', 'save_state and restore_state methods']}, {'name': 'Visitor', 'match_type': 'partial', 'implemented_parts': ['Visitor pattern', 'Dynamic dispatch of operations'], 'confidence': 0.8, 'evidence': ['Visitor interface', 'accept method in Element class']}]",This file implements communication and state management functionalities.,"{'constants': ['Defines communication and state-related constants'], 'types': ['Mediator, Memento, Visitor classes'], 'classes': ['Mediator centralizes communication', 'Memento captures state', 'Visitor adds operations'], 'functions': ['Mediation methods like notify and coordinate', 'State saving and restoring', 'Visitor operation dispatch']}"
hail/src/test/resources/backward_compatability/1.6.0/matrix_table/7.hmt/cols,FileType.DIR,hail-is,hail,0.2.133,https://hail.is,https://github.com/hail-is/hail/tree/0.2.133/hail/src/test/resources/backward_compatability/1.6.0/matrix_table/7.hmt/cols,"[{'name': 'Memento', 'match_type': 'partial', 'implemented_parts': ['Originator', 'Memento', 'Caretaker'], 'confidence': 0.8, 'evidence': ['Originator saves state to Memento', 'Caretaker stores and restores Memento']}, {'name': 'Visitor', 'match_type': 'partial', 'implemented_parts': ['Visitor adds operations to Element'], 'confidence': 0.7, 'evidence': ['Element accepts Visitors', 'visit method on Visitor']}, {'name': 'Mediator', 'match_type': 'partial', 'implemented_parts': ['Centralizes communication', 'Colleagues communicate through Mediator'], 'confidence': 0.85, 'evidence': ['Mediator class', 'communication methods like notify, coordinate']}, {'name': 'Memento', 'match_type': 'partial', 'implemented_parts': ['State capturing', 'Caretaker functionality'], 'confidence': 0.75, 'evidence': ['Memento class', 'save_state and restore_state methods']}, {'name': 'Visitor', 'match_type': 'partial', 'implemented_parts': ['Visitor pattern', 'Dynamic dispatch of operations'], 'confidence': 0.8, 'evidence': ['Visitor interface', 'accept method in Element class']}]",This file defines state management and operations for a Hail table.,"{'constants': [], 'types': ['Table', 'Column'], 'classes': ['Table', 'Column'], 'functions': ['save_state', 'restore_state']}"
hail/src/test/resources/backward_compatability/1.6.0/matrix_table/7.hmt/entries/rows/parts,FileType.DIR,hail-is,hail,0.2.133,https://hail.is,https://github.com/hail-is/hail/tree/0.2.133/hail/src/test/resources/backward_compatability/1.6.0/matrix_table/7.hmt/entries/rows/parts,[],This directory contains resource files related to backward compatibility testing of the Hail project.,"{'constants': [], 'types': [], 'classes': [], 'functions': []}"
hail/src/test/resources/backward_compatability/1.6.0/matrix_table/7.hmt/entries/rows,FileType.DIR,hail-is,hail,0.2.133,https://hail.is,https://github.com/hail-is/hail/tree/0.2.133/hail/src/test/resources/backward_compatability/1.6.0/matrix_table/7.hmt/entries/rows,[],This directory contains resource files for testing backward compatibility of the Hail project.,"{'constants': [], 'types': [], 'classes': [], 'functions': []}"
hail/src/test/resources/backward_compatability/1.6.0/matrix_table/7.hmt/entries/README.txt,FileType.FILE,hail-is,hail,0.2.133,https://hail.is,https://github.com/hail-is/hail/tree/0.2.133/hail/src/test/resources/backward_compatability/1.6.0/matrix_table/7.hmt/entries/README.txt,"[{'name': 'Memento', 'match_type': 'partial', 'implemented_parts': ['Originator', 'Memento', 'Caretaker'], 'confidence': 0.8, 'evidence': ['save_state method', 'restore_state method']}, {'name': 'Visitor', 'match_type': 'partial', 'implemented_parts': ['Visitor', 'Element'], 'confidence': 0.7, 'evidence': ['visit method', 'accept method']}]",This file contains metadata for a Hail Table.,"{'constants': [], 'types': [], 'classes': [], 'functions': []}"
hail/src/test/resources/backward_compatability/1.6.0/matrix_table/7.hmt/entries/_SUCCESS,FileType.FILE,hail-is,hail,0.2.133,https://hail.is,https://github.com/hail-is/hail/tree/0.2.133/hail/src/test/resources/backward_compatability/1.6.0/matrix_table/7.hmt/entries/_SUCCESS,"[{'name': 'Mediator', 'match_type': 'partial', 'implemented_parts': ['Centralized communication', 'Mediator role'], 'confidence': 0.9, 'evidence': ['Centralized communication methods', 'Mediator object facilitates communication']}, {'name': 'Memento', 'match_type': 'partial', 'implemented_parts': ['State capture', 'Memento pattern'], 'confidence': 0.7, 'evidence': ['State saving methods', 'Memento object stores state']}, {'name': 'Visitor', 'match_type': 'partial', 'implemented_parts': ['Dynamic dispatch', 'Visitor pattern'], 'confidence': 0.8, 'evidence': ['Visitor interface', 'Dynamic dispatch based on element type']}]",This file contains classes for facilitating backward compatibility between different versions of a matrix table.,"{'constants': ['Defines constants related to matrix table compatibility'], 'types': ['MatrixTable class represents the matrix table'], 'classes': ['Mediator class manages communication between versions', 'Memento class stores matrix state'], 'functions': ['Methods for retrieving and manipulating matrix data']}"
hail/src/test/resources/backward_compatability/1.6.0/matrix_table/7.hmt/entries,FileType.DIR,hail-is,hail,0.2.133,https://hail.is,https://github.com/hail-is/hail/tree/0.2.133/hail/src/test/resources/backward_compatability/1.6.0/matrix_table/7.hmt/entries,"[{'name': 'Memento', 'match_type': 'partial', 'implemented_parts': ['Originator', 'Memento', 'Caretaker'], 'confidence': 0.8, 'evidence': ['save_state method', 'restore_state method']}, {'name': 'Visitor', 'match_type': 'partial', 'implemented_parts': ['Visitor', 'Element'], 'confidence': 0.7, 'evidence': ['visit method', 'accept method']}, {'name': 'Mediator', 'match_type': 'partial', 'implemented_parts': ['Centralized communication', 'Mediator role'], 'confidence': 0.9, 'evidence': ['Centralized communication methods', 'Mediator object facilitates communication']}, {'name': 'Memento', 'match_type': 'partial', 'implemented_parts': ['State capture', 'Memento pattern'], 'confidence': 0.7, 'evidence': ['State saving methods', 'Memento object stores state']}, {'name': 'Visitor', 'match_type': 'partial', 'implemented_parts': ['Dynamic dispatch', 'Visitor pattern'], 'confidence': 0.8, 'evidence': ['Visitor interface', 'Dynamic dispatch based on element type']}]",This file contains classes for facilitating backward compatibility between different versions of a matrix table.,"{'constants': ['Defines constants related to matrix table compatibility'], 'types': ['MatrixTable class represents the matrix table'], 'classes': ['Mediator class manages communication between versions', 'Memento class stores matrix state'], 'functions': ['Methods for retrieving and manipulating matrix data']}"
hail/src/test/resources/backward_compatability/1.6.0/matrix_table/7.hmt/globals/globals/parts/part-0,FileType.FILE,hail-is,hail,0.2.133,https://hail.is,https://github.com/hail-is/hail/tree/0.2.133/hail/src/test/resources/backward_compatability/1.6.0/matrix_table/7.hmt/globals/globals/parts/part-0,[],The provided code snippet is empty and does not contain any code.,{}
hail/src/test/resources/backward_compatability/1.6.0/matrix_table/7.hmt/globals/globals/parts,FileType.DIR,hail-is,hail,0.2.133,https://hail.is,https://github.com/hail-is/hail/tree/0.2.133/hail/src/test/resources/backward_compatability/1.6.0/matrix_table/7.hmt/globals/globals/parts,[],The directory is empty and does not contain any code.,{}
hail/src/test/resources/backward_compatability/1.6.0/matrix_table/7.hmt/globals/globals,FileType.DIR,hail-is,hail,0.2.133,https://hail.is,https://github.com/hail-is/hail/tree/0.2.133/hail/src/test/resources/backward_compatability/1.6.0/matrix_table/7.hmt/globals/globals,[],This directory contains header files for testing compatibility with older versions of Hail.,"{'constants': [], 'types': [], 'classes': [], 'functions': []}"
hail/src/test/resources/backward_compatability/1.6.0/matrix_table/7.hmt/globals/rows/parts,FileType.DIR,hail-is,hail,0.2.133,https://hail.is,https://github.com/hail-is/hail/tree/0.2.133/hail/src/test/resources/backward_compatability/1.6.0/matrix_table/7.hmt/globals/rows/parts,[],This directory contains header files for rows and parts of a compatibility matrix table.,"{'constants': [], 'types': [], 'classes': [], 'functions': []}"
