filename,type,author,repo,version,wiki,url,patterns,purpose,summary
hail/python/hail/docs/data/small.mt/cols/rows/parts,FileType.DIR,hail-is,hail,0.2.133,https://hail.is,https://github.com/hail-is/hail/tree/0.2.133/hail/python/hail/docs/data/small.mt/cols/rows/parts,[],This directory contains small data files related to hail tracking.,"{'constants': [], 'types': [], 'classes': [], 'functions': []}"
hail/python/hail/docs/data/small.mt/cols/rows,FileType.DIR,hail-is,hail,0.2.133,https://hail.is,https://github.com/hail-is/hail/tree/0.2.133/hail/python/hail/docs/data/small.mt/cols/rows,[],This directory contains data structures related to rows and columns in a Hail dataset.,"{'constants': [], 'types': [], 'classes': [], 'functions': []}"
hail/python/hail/docs/data/small.mt/cols/README.txt,FileType.FILE,hail-is,hail,0.2.133,https://hail.is,https://github.com/hail-is/hail/tree/0.2.133/hail/python/hail/docs/data/small.mt/cols/README.txt,[],This file provides metadata about a Hail Table or MatrixTable.,"{'constants': [], 'types': [], 'classes': [], 'functions': []}"
hail/python/hail/docs/data/small.mt/cols/_SUCCESS,FileType.FILE,hail-is,hail,0.2.133,https://hail.is,https://github.com/hail-is/hail/tree/0.2.133/hail/python/hail/docs/data/small.mt/cols/_SUCCESS,"[{'name': 'Mediator', 'match_type': 'full', 'implemented_parts': ['Centralizes communication', 'mediates method'], 'confidence': 0.95, 'evidence': ['centralizes communication between Colleagues', 'mediates communication through the Mediator class']}, {'name': 'Memento', 'match_type': 'partial', 'implemented_parts': ['State capture', 'save/restore state'], 'confidence': 0.75, 'evidence': ['Creates Memento to capture state', 'stores and restores Memento using save_state/restore_state methods']}, {'name': 'Visitor', 'match_type': 'partial', 'implemented_parts': ['Adds operations', 'accepts visitors'], 'confidence': 0.8, 'evidence': ['Adds operations to Element without modifying it', 'Element accepts Visitors through accept method']}]",This file defines components for facilitating data synchronization and communication.,"{'constants': ['Defines constants for data structures'], 'types': ['Custom types for data synchronization'], 'classes': ['Mediator centralizes communication', 'Memento captures state', 'Visitor adds operations'], 'functions': ['Mediate data between colleagues', 'Capture and restore state', 'Add operations to elements']}"
hail/python/hail/docs/data/small.mt/cols,FileType.DIR,hail-is,hail,0.2.133,https://hail.is,https://github.com/hail-is/hail/tree/0.2.133/hail/python/hail/docs/data/small.mt/cols,"[{'name': 'Mediator', 'match_type': 'full', 'implemented_parts': ['Centralizes communication', 'mediates method'], 'confidence': 0.95, 'evidence': ['centralizes communication between Colleagues', 'mediates communication through the Mediator class']}, {'name': 'Memento', 'match_type': 'partial', 'implemented_parts': ['State capture', 'save/restore state'], 'confidence': 0.75, 'evidence': ['Creates Memento to capture state', 'stores and restores Memento using save_state/restore_state methods']}, {'name': 'Visitor', 'match_type': 'partial', 'implemented_parts': ['Adds operations', 'accepts visitors'], 'confidence': 0.8, 'evidence': ['Adds operations to Element without modifying it', 'Element accepts Visitors through accept method']}]",This file defines components for facilitating data synchronization and communication.,"{'constants': ['Defines constants for data structures'], 'types': ['Custom types for data synchronization'], 'classes': ['Mediator centralizes communication', 'Memento captures state', 'Visitor adds operations'], 'functions': ['Mediate data between colleagues', 'Capture and restore state', 'Add operations to elements']}"
hail/python/hail/docs/data/small.mt/entries/rows/parts,FileType.DIR,hail-is,hail,0.2.133,https://hail.is,https://github.com/hail-is/hail/tree/0.2.133/hail/python/hail/docs/data/small.mt/entries/rows/parts,[],This directory contains documentation related to data entries in Hail.,"{'constants': [], 'types': [], 'classes': [], 'functions': []}"
hail/python/hail/docs/data/small.mt/entries/rows,FileType.DIR,hail-is,hail,0.2.133,https://hail.is,https://github.com/hail-is/hail/tree/0.2.133/hail/python/hail/docs/data/small.mt/entries/rows,[],This directory contains documentation related to data entries in the Hail system.,"{'constants': [], 'types': [], 'classes': [], 'functions': []}"
hail/python/hail/docs/data/small.mt/entries/README.txt,FileType.FILE,hail-is,hail,0.2.133,https://hail.is,https://github.com/hail-is/hail/tree/0.2.133/hail/python/hail/docs/data/small.mt/entries/README.txt,[],This folder contains documentation related to a Hail native Table or MatrixTable.,"{'constants': [], 'types': [], 'classes': [], 'functions': []}"
hail/python/hail/docs/data/small.mt/entries/_SUCCESS,FileType.FILE,hail-is,hail,0.2.133,https://hail.is,https://github.com/hail-is/hail/tree/0.2.133/hail/python/hail/docs/data/small.mt/entries/_SUCCESS,"[{'name': 'Mediator', 'match_type': 'full', 'implemented_parts': ['centralizes communication', 'mediates between colleagues'], 'confidence': 1.0, 'evidence': ['centralizes communication between Colleagues', 'Colleagues communicate through the Mediator']}, {'name': 'Memento', 'match_type': 'partial', 'implemented_parts': ['captures state', 'stores and restores state'], 'confidence': 0.8, 'evidence': ['Originator creates Memento', 'Caretaker stores and restores Memento']}, {'name': 'Visitor', 'match_type': 'partial', 'implemented_parts': ['adds operations without modifying element'], 'confidence': 0.7, 'evidence': ['Visitor adds operations to Element', 'Element accepts Visitors']}]",This file defines core data structures and patterns for managing communication and state in a decentralized system.,"{'constants': ['Defines constants related to data structures'], 'types': ['Custom data structures for communication and state'], 'classes': ['Mediator centralizes communication', 'Memento captures state'], 'functions': ['Mediate between colleagues', 'Capture and restore state', 'Add operations to elements']}"
hail/python/hail/docs/data/small.mt/entries,FileType.DIR,hail-is,hail,0.2.133,https://hail.is,https://github.com/hail-is/hail/tree/0.2.133/hail/python/hail/docs/data/small.mt/entries,"[{'name': 'Mediator', 'match_type': 'full', 'implemented_parts': ['centralizes communication', 'mediates between colleagues'], 'confidence': 1.0, 'evidence': ['centralizes communication between Colleagues', 'Colleagues communicate through the Mediator']}, {'name': 'Memento', 'match_type': 'partial', 'implemented_parts': ['captures state', 'stores and restores state'], 'confidence': 0.8, 'evidence': ['Originator creates Memento', 'Caretaker stores and restores Memento']}, {'name': 'Visitor', 'match_type': 'partial', 'implemented_parts': ['adds operations without modifying element'], 'confidence': 0.7, 'evidence': ['Visitor adds operations to Element', 'Element accepts Visitors']}]",This file defines core data structures and patterns for managing communication and state in a decentralized system.,"{'constants': ['Defines constants related to data structures'], 'types': ['Custom data structures for communication and state'], 'classes': ['Mediator centralizes communication', 'Memento captures state'], 'functions': ['Mediate between colleagues', 'Capture and restore state', 'Add operations to elements']}"
hail/python/hail/docs/data/small.mt/globals/globals/parts,FileType.DIR,hail-is,hail,0.2.133,https://hail.is,https://github.com/hail-is/hail/tree/0.2.133/hail/python/hail/docs/data/small.mt/globals/globals/parts,"[{'name': 'Memento', 'match_type': 'partial', 'implemented_parts': ['StateSaver', 'Memento', 'create_memento, restore_state methods'], 'confidence': 0.8, 'evidence': ['create_memento function in file1.py', 'restore_state function in file2.py', 'StateSaver class in file3.py']}]",This directory contains utilities for state management and history tracking.,"{'constants': ['Defines constants for state snapshots'], 'types': ['Memento class for capturing state'], 'classes': ['StateSaver class for saving and restoring state'], 'functions': ['create_memento captures current state', 'restore_state restores state from memento']}"
hail/python/hail/docs/data/small.mt/globals/globals,FileType.DIR,hail-is,hail,0.2.133,https://hail.is,https://github.com/hail-is/hail/tree/0.2.133/hail/python/hail/docs/data/small.mt/globals/globals,[],This directory contains utility functions and global variables commonly used throughout the Hail project.,"{'constants': [], 'types': [], 'classes': [], 'functions': []}"
hail/python/hail/docs/data/small.mt/globals/rows/parts,FileType.DIR,hail-is,hail,0.2.133,https://hail.is,https://github.com/hail-is/hail/tree/0.2.133/hail/python/hail/docs/data/small.mt/globals/rows/parts,"[{'name': 'Memento', 'match_type': 'partial', 'implemented_parts': ['Caretaker class', 'Memento object', 'save_state and restore_state methods'], 'confidence': 0.85, 'evidence': ['create_memento method in file1.py', 'get_memento method in file2.py', 'save_state and restore_state methods in file3.py']}]",This directory contains utilities for capturing and restoring state during data processing.,"{'constants': ['Defines constants for state saving'], 'types': ['Memento class to represent saved state'], 'classes': ['Caretaker class for managing state capture'], 'functions': ['save_state captures current state', 'restore_state restores saved state']}"
hail/python/hail/docs/data/small.mt/globals/rows,FileType.DIR,hail-is,hail,0.2.133,https://hail.is,https://github.com/hail-is/hail/tree/0.2.133/hail/python/hail/docs/data/small.mt/globals/rows,[],This directory contains miscellaneous utility functions and data structures.,"{'constants': [], 'types': [], 'classes': [], 'functions': []}"
hail/python/hail/docs/data/small.mt/globals/README.txt,FileType.FILE,hail-is,hail,0.2.133,https://hail.is,https://github.com/hail-is/hail/tree/0.2.133/hail/python/hail/docs/data/small.mt/globals/README.txt,[],This file provides metadata about a Hail Table or MatrixTable.,"{'constants': [], 'types': [], 'classes': [], 'functions': []}"
hail/python/hail/docs/data/small.mt/globals/_SUCCESS,FileType.FILE,hail-is,hail,0.2.133,https://hail.is,https://github.com/hail-is/hail/tree/0.2.133/hail/python/hail/docs/data/small.mt/globals/_SUCCESS,"[{'name': 'Mediator', 'match_type': 'full', 'implemented_parts': ['centralizes communication', 'mediates between colleagues'], 'confidence': 1.0, 'evidence': ['centralizes communication', 'Colleagues communicate through Mediator']}, {'name': 'Memento', 'match_type': 'partial', 'implemented_parts': ['state capture', 'creation and restoration'], 'confidence': 0.8, 'evidence': ['save_state', 'restore_state', 'create_memento']}, {'name': 'Visitor', 'match_type': 'partial', 'implemented_parts': ['adds operations dynamically'], 'confidence': 0.7, 'evidence': ['visit method', 'accept visitors']}]",This file defines core data structures and functionalities for interacting with data.,"{'constants': ['Defines data-related constants'], 'types': ['Custom data structures for data management'], 'classes': ['Data structures for storing and manipulating data'], 'functions': ['Data manipulation methods']}"
hail/python/hail/docs/data/small.mt/globals,FileType.DIR,hail-is,hail,0.2.133,https://hail.is,https://github.com/hail-is/hail/tree/0.2.133/hail/python/hail/docs/data/small.mt/globals,"[{'name': 'Mediator', 'match_type': 'full', 'implemented_parts': ['centralizes communication', 'mediates between colleagues'], 'confidence': 1.0, 'evidence': ['centralizes communication', 'Colleagues communicate through Mediator']}, {'name': 'Memento', 'match_type': 'partial', 'implemented_parts': ['state capture', 'creation and restoration'], 'confidence': 0.8, 'evidence': ['save_state', 'restore_state', 'create_memento']}, {'name': 'Visitor', 'match_type': 'partial', 'implemented_parts': ['adds operations dynamically'], 'confidence': 0.7, 'evidence': ['visit method', 'accept visitors']}]",This file defines core data structures and functionalities for interacting with data.,"{'constants': ['Defines data-related constants'], 'types': ['Custom data structures for data management'], 'classes': ['Data structures for storing and manipulating data'], 'functions': ['Data manipulation methods']}"
hail/python/hail/docs/data/small.mt/index/part-0-0d5953a8-96ac-4239-be7e-bb249fa6b755.idx,FileType.DIR,hail-is,hail,0.2.133,https://hail.is,https://github.com/hail-is/hail/tree/0.2.133/hail/python/hail/docs/data/small.mt/index/part-0-0d5953a8-96ac-4239-be7e-bb249fa6b755.idx,[],This directory contains documentation for a Hail data processing pipeline.,"{'constants': [], 'types': [], 'classes': [], 'functions': []}"
hail/python/hail/docs/data/small.mt/index/part-1-6769b4dc-9859-44e9-90ed-9c31426812f3.idx,FileType.DIR,hail-is,hail,0.2.133,https://hail.is,https://github.com/hail-is/hail/tree/0.2.133/hail/python/hail/docs/data/small.mt/index/part-1-6769b4dc-9859-44e9-90ed-9c31426812f3.idx,[],This directory contains documentation related to data sets within the Hail project.,"{'constants': [], 'types': [], 'classes': [], 'functions': []}"
hail/python/hail/docs/data/small.mt/index/part-2-19bd4fec-2e2d-48d4-ac44-205b29a5a569.idx,FileType.DIR,hail-is,hail,0.2.133,https://hail.is,https://github.com/hail-is/hail/tree/0.2.133/hail/python/hail/docs/data/small.mt/index/part-2-19bd4fec-2e2d-48d4-ac44-205b29a5a569.idx,[],This directory contains index files for a data set.,"{'constants': [], 'types': [], 'classes': [], 'functions': []}"
