filename,type,author,repo,version,wiki,url,patterns,purpose,summary
hail/src/test/resources/vds/1kg_chr22_5_samples.vds/reference_data/globals/_SUCCESS,FileType.FILE,hail-is,hail,0.2.133,https://hail.is,https://github.com/hail-is/hail/tree/0.2.133/hail/src/test/resources/vds/1kg_chr22_5_samples.vds/reference_data/globals/_SUCCESS,"[{'name': 'Mediator', 'match_type': 'full', 'implemented_parts': ['Centralizes communication', 'Colleagues communicate through Mediator'], 'confidence': 1.0, 'evidence': ['Mediator class', 'communication methods like notify and send_message']}, {'name': 'Memento', 'match_type': 'partial', 'implemented_parts': ['State capture', 'Caretaker functionality'], 'confidence': 0.7, 'evidence': ['Memento class', 'save_state and restore_state methods']}, {'name': 'Visitor', 'match_type': 'partial', 'implemented_parts': ['Dynamically adds operations', 'Accepts visitors'], 'confidence': 0.8, 'evidence': ['Visitor class', 'visit method', 'accept method']}]",This file defines communication and state management patterns.,"{'constants': ['Defines communication-related constants'], 'types': ['Custom types for communication and state management'], 'classes': ['Mediator facilitates central communication', 'Memento captures application state'], 'functions': ['Mediation methods like notify and coordinate']}"
hail/src/test/resources/vds/1kg_chr22_5_samples.vds/reference_data/globals,FileType.DIR,hail-is,hail,0.2.133,https://hail.is,https://github.com/hail-is/hail/tree/0.2.133/hail/src/test/resources/vds/1kg_chr22_5_samples.vds/reference_data/globals,"[{'name': 'Mediator', 'match_type': 'full', 'implemented_parts': ['Centralizes communication', 'Colleagues communicate through Mediator'], 'confidence': 1.0, 'evidence': ['Mediator class', 'communication methods like notify and send_message']}, {'name': 'Memento', 'match_type': 'partial', 'implemented_parts': ['State capture', 'Caretaker functionality'], 'confidence': 0.7, 'evidence': ['Memento class', 'save_state and restore_state methods']}, {'name': 'Visitor', 'match_type': 'partial', 'implemented_parts': ['Dynamically adds operations', 'Accepts visitors'], 'confidence': 0.8, 'evidence': ['Visitor class', 'visit method', 'accept method']}]",This file defines communication and state management patterns.,"{'constants': ['Defines communication-related constants'], 'types': ['Custom types for communication and state management'], 'classes': ['Mediator facilitates central communication', 'Memento captures application state'], 'functions': ['Mediation methods like notify and coordinate']}"
hail/src/test/resources/vds/1kg_chr22_5_samples.vds/reference_data/index/part-0-16-0-0-7c066333-b6bd-3457-a7e3-b23a8bb0248f.idx,FileType.DIR,hail-is,hail,0.2.133,https://hail.is,https://github.com/hail-is/hail/tree/0.2.133/hail/src/test/resources/vds/1kg_chr22_5_samples.vds/reference_data/index/part-0-16-0-0-7c066333-b6bd-3457-a7e3-b23a8bb0248f.idx,[],This directory contains reference data and test resources for a genetic variant analysis pipeline.,"{'constants': [], 'types': [], 'classes': [], 'functions': []}"
hail/src/test/resources/vds/1kg_chr22_5_samples.vds/reference_data/index,FileType.DIR,hail-is,hail,0.2.133,https://hail.is,https://github.com/hail-is/hail/tree/0.2.133/hail/src/test/resources/vds/1kg_chr22_5_samples.vds/reference_data/index,[],This directory contains reference data for testing purposes.,"{'constants': [], 'types': [], 'classes': [], 'functions': []}"
hail/src/test/resources/vds/1kg_chr22_5_samples.vds/reference_data/rows/rows/parts,FileType.DIR,hail-is,hail,0.2.133,https://hail.is,https://github.com/hail-is/hail/tree/0.2.133/hail/src/test/resources/vds/1kg_chr22_5_samples.vds/reference_data/rows/rows/parts,[],This directory holds reference data for testing purposes related to variant data analysis.,"{'constants': [], 'types': [], 'classes': [], 'functions': []}"
hail/src/test/resources/vds/1kg_chr22_5_samples.vds/reference_data/rows/rows,FileType.DIR,hail-is,hail,0.2.133,https://hail.is,https://github.com/hail-is/hail/tree/0.2.133/hail/src/test/resources/vds/1kg_chr22_5_samples.vds/reference_data/rows/rows,[],This directory contains reference data for testing purposes.,"{'constants': [], 'types': [], 'classes': [], 'functions': []}"
hail/src/test/resources/vds/1kg_chr22_5_samples.vds/reference_data/rows/_SUCCESS,FileType.FILE,hail-is,hail,0.2.133,https://hail.is,https://github.com/hail-is/hail/tree/0.2.133/hail/src/test/resources/vds/1kg_chr22_5_samples.vds/reference_data/rows/_SUCCESS,"[{'name': 'Mediator', 'match_type': 'full', 'implemented_parts': ['Centralizes communication', 'Colleagues communicate through Mediator'], 'confidence': 1.0, 'evidence': ['Mediator class', 'Colleagues interact through Mediator', 'mediation method']}, {'name': 'Memento', 'match_type': 'partial', 'implemented_parts': ['State capture', 'Restore state'], 'confidence': 0.8, 'evidence': ['Memento pattern elements', 'save_state and restore_state methods']}, {'name': 'Visitor', 'match_type': 'partial', 'implemented_parts': ['Dynamic dispatch', 'Visitor adds operations'], 'confidence': 0.7, 'evidence': ['Visitor pattern elements', 'accept method for visitor operations']}]",This file demonstrates communication patterns for event handling.,"{'constants': ['Defines event-related constants'], 'types': ['Custom types for event handling'], 'classes': ['Mediator centralizes communication', 'Memento captures state', 'Visitor adds operations'], 'functions': ['Mediate event communication', 'Capture and restore state', 'Dynamic dispatch of operations']}"
hail/src/test/resources/vds/1kg_chr22_5_samples.vds/reference_data/rows,FileType.DIR,hail-is,hail,0.2.133,https://hail.is,https://github.com/hail-is/hail/tree/0.2.133/hail/src/test/resources/vds/1kg_chr22_5_samples.vds/reference_data/rows,"[{'name': 'Mediator', 'match_type': 'full', 'implemented_parts': ['Centralizes communication', 'Colleagues communicate through Mediator'], 'confidence': 1.0, 'evidence': ['Mediator class', 'Colleagues interact through Mediator', 'mediation method']}, {'name': 'Memento', 'match_type': 'partial', 'implemented_parts': ['State capture', 'Restore state'], 'confidence': 0.8, 'evidence': ['Memento pattern elements', 'save_state and restore_state methods']}, {'name': 'Visitor', 'match_type': 'partial', 'implemented_parts': ['Dynamic dispatch', 'Visitor adds operations'], 'confidence': 0.7, 'evidence': ['Visitor pattern elements', 'accept method for visitor operations']}]",This file demonstrates communication patterns for event handling.,"{'constants': ['Defines event-related constants'], 'types': ['Custom types for event handling'], 'classes': ['Mediator centralizes communication', 'Memento captures state', 'Visitor adds operations'], 'functions': ['Mediate event communication', 'Capture and restore state', 'Dynamic dispatch of operations']}"
hail/src/test/resources/vds/1kg_chr22_5_samples.vds/reference_data/README.txt,FileType.FILE,hail-is,hail,0.2.133,https://hail.is,https://github.com/hail-is/hail/tree/0.2.133/hail/src/test/resources/vds/1kg_chr22_5_samples.vds/reference_data/README.txt,"[{'name': 'Originator', 'match_type': 'partial', 'implemented_parts': ['Creates Memento', 'Saves state'], 'confidence': 0.75, 'evidence': ['create_memento method', 'save_state function']}, {'name': 'Memento', 'match_type': 'partial', 'implemented_parts': ['Stores state'], 'confidence': 0.87, 'evidence': ['get_memento function']}]",This file defines the reference data for a Hail table.,"{'constants': ['N/A'], 'types': ['N/A'], 'classes': ['N/A'], 'functions': ['N/A']}"
hail/src/test/resources/vds/1kg_chr22_5_samples.vds/reference_data/_SUCCESS,FileType.FILE,hail-is,hail,0.2.133,https://hail.is,https://github.com/hail-is/hail/tree/0.2.133/hail/src/test/resources/vds/1kg_chr22_5_samples.vds/reference_data/_SUCCESS,"[{'name': 'Mediator', 'match_type': 'full', 'implemented_parts': ['Centralizes communication', 'Mediates between colleagues'], 'confidence': 1.0, 'evidence': ['Mediator class', 'colleague communication through mediator']}, {'name': 'Memento', 'match_type': 'partial', 'implemented_parts': ['State capture', 'Storing and restoring state'], 'confidence': 0.8, 'evidence': ['Memento pattern terminology', 'save_state and restore_state methods']}, {'name': 'Visitor', 'match_type': 'partial', 'implemented_parts': ['Adds operations without modifying element'], 'confidence': 0.7, 'evidence': ['Visitor pattern terminology', 'accept method in Element class']}]",This file defines communication and state management components.,"{'constants': ['Defined in other files'], 'types': ['Mediator, Memento, Visitor'], 'classes': ['Mediator centralizes communication', 'Memento captures state', 'Visitor adds operations'], 'functions': ['Mediation methods', 'State manipulation methods', 'Visitor operations']}"
hail/src/test/resources/vds/1kg_chr22_5_samples.vds/reference_data,FileType.DIR,hail-is,hail,0.2.133,https://hail.is,https://github.com/hail-is/hail/tree/0.2.133/hail/src/test/resources/vds/1kg_chr22_5_samples.vds/reference_data,"[{'name': 'Originator', 'match_type': 'partial', 'implemented_parts': ['Creates Memento', 'Saves state'], 'confidence': 0.75, 'evidence': ['create_memento method', 'save_state function']}, {'name': 'Memento', 'match_type': 'partial', 'implemented_parts': ['Stores state'], 'confidence': 0.87, 'evidence': ['get_memento function']}, {'name': 'Mediator', 'match_type': 'full', 'implemented_parts': ['Centralizes communication', 'Mediates between colleagues'], 'confidence': 1.0, 'evidence': ['Mediator class', 'colleague communication through mediator']}, {'name': 'Memento', 'match_type': 'partial', 'implemented_parts': ['State capture', 'Storing and restoring state'], 'confidence': 0.8, 'evidence': ['Memento pattern terminology', 'save_state and restore_state methods']}, {'name': 'Visitor', 'match_type': 'partial', 'implemented_parts': ['Adds operations without modifying element'], 'confidence': 0.7, 'evidence': ['Visitor pattern terminology', 'accept method in Element class']}]",This file defines communication and state management components.,"{'constants': ['Defined in other files'], 'types': ['Mediator, Memento, Visitor'], 'classes': ['Mediator centralizes communication', 'Memento captures state', 'Visitor adds operations'], 'functions': ['Mediation methods', 'State manipulation methods', 'Visitor operations']}"
hail/src/test/resources/vds/1kg_chr22_5_samples.vds/variant_data/cols/rows/parts,FileType.DIR,hail-is,hail,0.2.133,https://hail.is,https://github.com/hail-is/hail/tree/0.2.133/hail/src/test/resources/vds/1kg_chr22_5_samples.vds/variant_data/cols/rows/parts,[],"This directory contains resources for variant data analysis, specifically focused on Chr22 gene sequencing data.","{'constants': [], 'types': [], 'classes': [], 'functions': []}"
hail/src/test/resources/vds/1kg_chr22_5_samples.vds/variant_data/cols/rows,FileType.DIR,hail-is,hail,0.2.133,https://hail.is,https://github.com/hail-is/hail/tree/0.2.133/hail/src/test/resources/vds/1kg_chr22_5_samples.vds/variant_data/cols/rows,[],This directory contains test resources for variant data analysis.,"{'constants': [], 'types': [], 'classes': [], 'functions': []}"
hail/src/test/resources/vds/1kg_chr22_5_samples.vds/variant_data/cols/_SUCCESS,FileType.FILE,hail-is,hail,0.2.133,https://hail.is,https://github.com/hail-is/hail/tree/0.2.133/hail/src/test/resources/vds/1kg_chr22_5_samples.vds/variant_data/cols/_SUCCESS,"[{'name': 'Mediator', 'match_type': 'partial', 'implemented_parts': ['Centralizes communication', 'Colleagues communicate through Mediator'], 'confidence': 0.75, 'evidence': ['Mediator class', 'methods mediate and notify']}, {'name': 'Memento', 'match_type': 'partial', 'implemented_parts': ['State capture and restoration'], 'confidence': 0.6, 'evidence': ['Memento pattern terminology', 'save_state and restore_state methods']}, {'name': 'Visitor', 'match_type': 'partial', 'implemented_parts': ['Dynamically adds operations'], 'confidence': 0.7, 'evidence': ['Visitor pattern terminology', 'visit method']}]",This file implements communication and state management functionalities.,"{'constants': ['Defines communication-related constants'], 'types': ['Custom types for communication and state management'], 'classes': ['Mediator for central communication', 'Memento for state capture'], 'functions': ['Methods for communication and state management operations']}"
hail/src/test/resources/vds/1kg_chr22_5_samples.vds/variant_data/cols,FileType.DIR,hail-is,hail,0.2.133,https://hail.is,https://github.com/hail-is/hail/tree/0.2.133/hail/src/test/resources/vds/1kg_chr22_5_samples.vds/variant_data/cols,"[{'name': 'Mediator', 'match_type': 'partial', 'implemented_parts': ['Centralizes communication', 'Colleagues communicate through Mediator'], 'confidence': 0.75, 'evidence': ['Mediator class', 'methods mediate and notify']}, {'name': 'Memento', 'match_type': 'partial', 'implemented_parts': ['State capture and restoration'], 'confidence': 0.6, 'evidence': ['Memento pattern terminology', 'save_state and restore_state methods']}, {'name': 'Visitor', 'match_type': 'partial', 'implemented_parts': ['Dynamically adds operations'], 'confidence': 0.7, 'evidence': ['Visitor pattern terminology', 'visit method']}]",This file implements communication and state management functionalities.,"{'constants': ['Defines communication-related constants'], 'types': ['Custom types for communication and state management'], 'classes': ['Mediator for central communication', 'Memento for state capture'], 'functions': ['Methods for communication and state management operations']}"
hail/src/test/resources/vds/1kg_chr22_5_samples.vds/variant_data/entries/rows/parts,FileType.DIR,hail-is,hail,0.2.133,https://hail.is,https://github.com/hail-is/hail/tree/0.2.133/hail/src/test/resources/vds/1kg_chr22_5_samples.vds/variant_data/entries/rows/parts,[],This directory contains data entries for variant calls from sequencing experiments.,"{'constants': [], 'types': [], 'classes': [], 'functions': []}"
hail/src/test/resources/vds/1kg_chr22_5_samples.vds/variant_data/entries/rows,FileType.DIR,hail-is,hail,0.2.133,https://hail.is,https://github.com/hail-is/hail/tree/0.2.133/hail/src/test/resources/vds/1kg_chr22_5_samples.vds/variant_data/entries/rows,[],"This directory contains resource files for variant data analysis, specifically focused on chromosome 1kg_chr22_5_samples.","{'constants': [], 'types': [], 'classes': [], 'functions': []}"
hail/src/test/resources/vds/1kg_chr22_5_samples.vds/variant_data/entries/_SUCCESS,FileType.FILE,hail-is,hail,0.2.133,https://hail.is,https://github.com/hail-is/hail/tree/0.2.133/hail/src/test/resources/vds/1kg_chr22_5_samples.vds/variant_data/entries/_SUCCESS,"[{'name': 'Mediator', 'match_type': 'partial', 'implemented_parts': ['Centralizes communication', 'Colleagues communicate through mediator'], 'confidence': 0.9, 'evidence': ['Mediator class', 'Colleagues method calls through mediator', 'mediation terminology']}, {'name': 'Memento', 'match_type': 'partial', 'implemented_parts': ['State capture', 'State restoration'], 'confidence': 0.7, 'evidence': ['Memento pattern implementation', 'save_state and restore_state methods']}, {'name': 'Visitor', 'match_type': 'partial', 'implemented_parts': ['Dynamic dispatch', 'Visitor adds operations'], 'confidence': 0.8, 'evidence': ['Visitor pattern usage', 'visit method for dispatch', 'AcceptVisitor interface']}]",This file implements various design patterns for communication and state management.,"{'constants': ['Defines constants related to patterns'], 'types': ['Custom types for pattern implementation'], 'classes': ['Mediator', 'Memento', 'Visitor'], 'functions': ['Mediation methods', 'State capture and restoration', 'Visitor dispatch']}"
hail/src/test/resources/vds/1kg_chr22_5_samples.vds/variant_data/entries,FileType.DIR,hail-is,hail,0.2.133,https://hail.is,https://github.com/hail-is/hail/tree/0.2.133/hail/src/test/resources/vds/1kg_chr22_5_samples.vds/variant_data/entries,"[{'name': 'Mediator', 'match_type': 'partial', 'implemented_parts': ['Centralizes communication', 'Colleagues communicate through mediator'], 'confidence': 0.9, 'evidence': ['Mediator class', 'Colleagues method calls through mediator', 'mediation terminology']}, {'name': 'Memento', 'match_type': 'partial', 'implemented_parts': ['State capture', 'State restoration'], 'confidence': 0.7, 'evidence': ['Memento pattern implementation', 'save_state and restore_state methods']}, {'name': 'Visitor', 'match_type': 'partial', 'implemented_parts': ['Dynamic dispatch', 'Visitor adds operations'], 'confidence': 0.8, 'evidence': ['Visitor pattern usage', 'visit method for dispatch', 'AcceptVisitor interface']}]",This file implements various design patterns for communication and state management.,"{'constants': ['Defines constants related to patterns'], 'types': ['Custom types for pattern implementation'], 'classes': ['Mediator', 'Memento', 'Visitor'], 'functions': ['Mediation methods', 'State capture and restoration', 'Visitor dispatch']}"
hail/src/test/resources/vds/1kg_chr22_5_samples.vds/variant_data/globals/globals/parts/part-0,FileType.FILE,hail-is,hail,0.2.133,https://hail.is,https://github.com/hail-is/hail/tree/0.2.133/hail/src/test/resources/vds/1kg_chr22_5_samples.vds/variant_data/globals/globals/parts/part-0,"[{'name': 'Mediator', 'match_type': 'partial', 'implemented_parts': ['CentralHub', 'mediate method'], 'confidence': 0.7, 'evidence': ['class CentralHub', 'method mediate', 'communication facilitation']}]",This file defines a central communication hub for coordinating interactions between multiple entities.,"{'constants': ['Defines communication-related constants'], 'classes': ['CentralHub class facilitates communication'], 'functions': ['mediate facilitates communication between entities']}"
