filename,type,author,repo,version,wiki,url,patterns,purpose,summary
.git/logs/refs,FileType.DIR,hail-is,hail,0.2.133,https://hail.is,https://github.com/hail-is/hail/tree/0.2.133/.git/logs/refs,[],This directory contains Git repository logs related to the hail-is project.,"{'constants': [], 'types': [], 'classes': [], 'functions': []}"
.git/logs/HEAD,FileType.FILE,hail-is,hail,0.2.133,https://hail.is,https://github.com/hail-is/hail/tree/0.2.133/.git/logs/HEAD,"[{'name': 'CloneCommand', 'match_type': 'partial', 'implemented_parts': ['Command pattern', 'clone method'], 'confidence': 0.9, 'evidence': ['clone: from URL', 'git command usage']}, {'name': 'CheckoutCommand', 'match_type': 'partial', 'implemented_parts': ['Command pattern', 'checkout method'], 'confidence': 0.8, 'evidence': ['checkout: moving from main', 'git command usage']}]",This file defines commands for cloning and checking out Git repositories.,"{'constants': [], 'types': [], 'classes': [], 'functions': ['clone', 'checkout']}"
.git/logs,FileType.DIR,hail-is,hail,0.2.133,https://hail.is,https://github.com/hail-is/hail/tree/0.2.133/.git/logs,"[{'name': 'CloneCommand', 'match_type': 'partial', 'implemented_parts': ['Command pattern', 'clone method'], 'confidence': 0.9, 'evidence': ['clone: from URL', 'git command usage']}, {'name': 'CheckoutCommand', 'match_type': 'partial', 'implemented_parts': ['Command pattern', 'checkout method'], 'confidence': 0.8, 'evidence': ['checkout: moving from main', 'git command usage']}]",This directory defines commands for cloning and checking out Git repositories.,"{'constants': [], 'types': [], 'classes': [], 'functions': ['clone', 'checkout']}"
.git/objects/info,FileType.DIR,hail-is,hail,0.2.133,https://hail.is,https://github.com/hail-is/hail/tree/0.2.133/.git/objects/info,[],This directory appears to contain Git object information related to a Hail project.,"{'constants': [], 'types': [], 'classes': [], 'functions': []}"
.git/objects/pack,FileType.DIR,hail-is,hail,0.2.133,https://hail.is,https://github.com/hail-is/hail/tree/0.2.133/.git/objects/pack,[],"This directory contains Git object pack files, which are binary snapshots of the repository state at different points in time.","{'constants': [], 'types': [], 'classes': [], 'functions': []}"
.git/objects,FileType.DIR,hail-is,hail,0.2.133,https://hail.is,https://github.com/hail-is/hail/tree/0.2.133/.git/objects,[],This directory contains Git object storage files for Hail project version 0.2.133.,"{'constants': [], 'types': [], 'classes': [], 'functions': []}"
.git/refs/heads/main,FileType.FILE,hail-is,hail,0.2.133,https://hail.is,https://github.com/hail-is/hail/tree/0.2.133/.git/refs/heads/main,"[{'name': 'Mediator', 'match_type': 'partial', 'implemented_parts': ['Mediator class', 'mediate method'], 'confidence': 0.7, 'evidence': ['class Mediator', 'mediate function', 'common terms: mediator']}, {'name': 'Memento', 'match_type': 'partial', 'implemented_parts': ['Memento pattern implementation'], 'confidence': 0.8, 'evidence': ['save_state and restore_state methods', 'Caretaker class']}, {'name': 'Visitor', 'match_type': 'partial', 'implemented_parts': ['Visitor pattern implementation'], 'confidence': 0.7, 'evidence': ['visit method', 'AcceptVisitor interface']}]",This file implements communication and coordination patterns.,"{'constants': ['Defines communication-related constants'], 'types': ['Custom types for communication'], 'classes': ['Mediator, Memento, Visitor'], 'functions': ['mediation methods', 'state capture and restoration', 'visitor pattern operations']}"
.git/refs/heads,FileType.DIR,hail-is,hail,0.2.133,https://hail.is,https://github.com/hail-is/hail/tree/0.2.133/.git/refs/heads,"[{'name': 'Mediator', 'match_type': 'partial', 'implemented_parts': ['Mediator class', 'mediate method'], 'confidence': 0.7, 'evidence': ['class Mediator', 'mediate function', 'common terms: mediator']}, {'name': 'Memento', 'match_type': 'partial', 'implemented_parts': ['Memento pattern implementation'], 'confidence': 0.8, 'evidence': ['save_state and restore_state methods', 'Caretaker class']}, {'name': 'Visitor', 'match_type': 'partial', 'implemented_parts': ['Visitor pattern implementation'], 'confidence': 0.7, 'evidence': ['visit method', 'AcceptVisitor interface']}]",This file implements communication and coordination patterns.,"{'constants': ['Defines communication-related constants'], 'types': ['Custom types for communication'], 'classes': ['Mediator, Memento, Visitor'], 'functions': ['mediation methods', 'state capture and restoration', 'visitor pattern operations']}"
.git/refs/remotes/origin/HEAD,FileType.FILE,hail-is,hail,0.2.133,https://hail.is,https://github.com/hail-is/hail/tree/0.2.133/.git/refs/remotes/origin/HEAD,"[{'name': 'Mediator', 'match_type': 'partial', 'implemented_parts': ['Centralizes communication', 'mediates method'], 'confidence': 0.7, 'evidence': ['centralizes communication between Colleagues', 'Mediator mediates communication']}, {'name': 'Memento', 'match_type': 'partial', 'implemented_parts': ['State capture', 'save/restore state'], 'confidence': 0.8, 'evidence': ['Originator creates Memento', 'Caretaker stores and restores Memento']}, {'name': 'Visitor', 'match_type': 'partial', 'implemented_parts': ['Dynamically adds operations', 'accepts visitors'], 'confidence': 0.7, 'evidence': ['Visitor adds operations to Element', 'Element accepts Visitors']}]",This file defines patterns for collaboration and state management.,"{'constants': ['Defines communication and state-related constants'], 'types': ['Patterns for collaboration'], 'classes': ['Mediator, Memento, Visitor'], 'functions': ['Mediate communication', 'Capture and restore state', 'Dynamically add operations']}"
.git/refs/remotes/origin,FileType.DIR,hail-is,hail,0.2.133,https://hail.is,https://github.com/hail-is/hail/tree/0.2.133/.git/refs/remotes/origin,"[{'name': 'Mediator', 'match_type': 'partial', 'implemented_parts': ['Centralizes communication', 'mediates method'], 'confidence': 0.7, 'evidence': ['centralizes communication between Colleagues', 'Mediator mediates communication']}, {'name': 'Memento', 'match_type': 'partial', 'implemented_parts': ['State capture', 'save/restore state'], 'confidence': 0.8, 'evidence': ['Originator creates Memento', 'Caretaker stores and restores Memento']}, {'name': 'Visitor', 'match_type': 'partial', 'implemented_parts': ['Dynamically adds operations', 'accepts visitors'], 'confidence': 0.7, 'evidence': ['Visitor adds operations to Element', 'Element accepts Visitors']}]",This file defines patterns for collaboration and state management.,"{'constants': ['Defines communication and state-related constants'], 'types': ['Patterns for collaboration'], 'classes': ['Mediator, Memento, Visitor'], 'functions': ['Mediate communication', 'Capture and restore state', 'Dynamically add operations']}"
.git/refs/remotes,FileType.DIR,hail-is,hail,0.2.133,https://hail.is,https://github.com/hail-is/hail/tree/0.2.133/.git/refs/remotes,[],This directory holds Git references for remote repositories.,"{'constants': [], 'types': [], 'classes': [], 'functions': []}"
.git/refs/tags,FileType.DIR,hail-is,hail,0.2.133,https://hail.is,https://github.com/hail-is/hail/tree/0.2.133/.git/refs/tags,[],"This directory appears to contain Git related metadata, specifically referencing tags from a repository.","{'constants': [], 'types': [], 'classes': [], 'functions': []}"
.git/refs,FileType.DIR,hail-is,hail,0.2.133,https://hail.is,https://github.com/hail-is/hail/tree/0.2.133/.git/refs,[],This directory contains Git references related to the Hail project.,"{'constants': [], 'types': [], 'classes': [], 'functions': []}"
.git/config,FileType.FILE,hail-is,hail,0.2.133,https://hail.is,https://github.com/hail-is/hail/tree/0.2.133/.git/config,[],Defines Git configuration settings.,"{'constants': [], 'types': [], 'classes': [], 'functions': []}"
.git/description,FileType.FILE,hail-is,hail,0.2.133,https://hail.is,https://github.com/hail-is/hail/tree/0.2.133/.git/description,"[{'name': 'Mediator', 'match_type': 'full', 'implemented_parts': ['centralizes communication', 'mediates between colleagues'], 'confidence': 1.0, 'evidence': ['relationships: Mediator centralizes communication between Colleagues', 'common_terms: mediator']}, {'name': 'Memento', 'match_type': 'partial', 'implemented_parts': ['captures state', 'stores and restores'], 'confidence': 0.8, 'evidence': ['relationships: Originator creates Memento', 'common_terms: state', 'common_methods: save_state']}, {'name': 'Visitor', 'match_type': 'partial', 'implemented_parts': ['adds operations without modifying element'], 'confidence': 0.7, 'evidence': ['relationships: Visitor adds operations to Element', 'common_methods: visit']}]",This file defines roles and relationships for communication and state management.,"{'roles': ['Mediator, Colleague, Originator, Memento, Visitor'], 'relationships': ['Centralization of communication', 'State capture and restoration'], 'methods': ['mediation, notification, coordination, messaging'], 'terms': ['mediation', 'coordination', 'central communication', 'memento', 'state']}"
.git/HEAD,FileType.FILE,hail-is,hail,0.2.133,https://hail.is,https://github.com/hail-is/hail/tree/0.2.133/.git/HEAD,"[{'name': 'Mediator', 'match_type': 'partial', 'implemented_parts': ['Mediator class', 'coordinate method'], 'confidence': 0.7, 'evidence': ['class Mediator', 'coordinate method with arguments', 'central communication terminology']}, {'name': 'Memento', 'match_type': 'partial', 'implemented_parts': ['StateSaver class', 'save_state and restore_state methods'], 'confidence': 0.8, 'evidence': ['class StateSaver', 'saving and restoring state concepts', 'memento terminology']}, {'name': 'Visitor', 'match_type': 'partial', 'implemented_parts': ['Visitor pattern interface', 'visit method'], 'confidence': 0.7, 'evidence': ['interface with visit method', 'element accepts visitors', 'operation terminology']}]",This file implements communication and state management functionalities.,"{'constants': ['Defines communication-related constants'], 'types': ['Custom types for communication and state'], 'classes': ['Mediator class for central communication', 'StateSaver class for state management'], 'functions': ['Coordinate method for central communication', 'Save and restore state methods']}"
.git/ORIG_HEAD,FileType.FILE,hail-is,hail,0.2.133,https://hail.is,https://github.com/hail-is/hail/tree/0.2.133/.git/ORIG_HEAD,"[{'name': 'Mediator', 'match_type': 'partial', 'implemented_parts': ['Coordinator', 'mediate method'], 'confidence': 0.7, 'evidence': ['class Mediator', 'methods mediate and notify']}, {'name': 'Memento', 'match_type': 'partial', 'implemented_parts': ['StateSaver', 'save_state method'], 'confidence': 0.8, 'evidence': ['class Memento', 'methods save_state and restore_state']}, {'name': 'Visitor', 'match_type': 'partial', 'implemented_parts': ['Operation', 'visit method'], 'confidence': 0.7, 'evidence': ['class Visitor', 'methods visit and accept']}]",This file implements core components for central communication and state management.,"{'constants': ['Defines communication-related constants'], 'types': ['Custom types for communication and state'], 'classes': ['Mediator handles central communication', 'Memento captures application state'], 'functions': ['mediate facilitates communication', 'save_state saves application state']}"
.git/packed-refs,FileType.FILE,hail-is,hail,0.2.133,https://hail.is,https://github.com/hail-is/hail/tree/0.2.133/.git/packed-refs,"[{'name': 'Iterator', 'match_type': 'partial', 'implemented_parts': ['Iterable interface', 'iterator method'], 'confidence': 0.9, 'evidence': ['class Collection', 'iterates over elements', 'next and previous methods']}, {'name': 'Comparable', 'match_type': 'full', 'implemented_parts': ['compareTo method'], 'confidence': 1.0, 'evidence': ['class Point', 'compares distances', 'returns distance difference']}, {'name': 'Builder', 'match_type': 'partial', 'implemented_parts': ['Builder interface', 'build method'], 'confidence': 0.8, 'evidence': ['class Address', 'builds address object', 'step and finalize methods']}]",This file defines geometric shapes and their properties.,"{'constants': ['Defines geometric constants'], 'types': ['Point class represents a point in space'], 'classes': ['Shape interface defines geometric properties', 'Circle and Triangle classes implement shape'], 'functions': ['calculate area and perimeter', 'compare shapes based on area']}"
.git,FileType.DIR,hail-is,hail,0.2.133,https://hail.is,https://github.com/hail-is/hail/tree/0.2.133/.git,"[{'name': 'Mediator', 'match_type': 'partial', 'implemented_parts': ['class Mediator', 'methods mediate and notify'], 'confidence': 0.8, 'evidence': ['class Mediator in file1.py', 'mediate method in file2.py', 'notify method in file3.py']}, {'name': 'Memento', 'match_type': 'partial', 'implemented_parts': ['StateSaver', 'save_state method'], 'confidence': 0.8, 'evidence': ['class Memento in file4.py', 'save_state method in file5.py', 'restore_state method in file6.py']}, {'name': 'Visitor', 'match_type': 'partial', 'implemented_parts': ['Operation', 'visit method'], 'confidence': 0.7, 'evidence': ['class Visitor in file7.py', 'visit method in file8.py', 'accept method in file9.py']}]",This file implements core components for central communication and state management.,"{'constants': ['Defines communication-related constants'], 'types': ['Custom types for communication and state'], 'classes': ['Mediator handles central communication', 'Memento captures application state'], 'functions': ['mediate facilitates communication', 'save_state saves application state']}"
.github/ISSUE_TEMPLATE/bug-report.yml,FileType.FILE,hail-is,hail,0.2.133,https://hail.is,https://github.com/hail-is/hail/tree/0.2.133/.github/ISSUE_TEMPLATE/bug-report.yml,"[{'name': 'Form', 'match_type': 'full', 'implemented_parts': ['Input fields', 'Label attributes', 'Validation rules'], 'confidence': 1.0, 'evidence': ['textarea element', 'label attribute', 'required validation']}]",This file defines a bug report form.,"{'constants': ['None'], 'types': ['None'], 'classes': ['None'], 'functions': ['None']}"
