filename,type,author,repo,version,wiki,url,patterns,purpose,summary
hail/python/hail/docs/data/gene.interval_list,FileType.FILE,hail-is,hail,0.2.133,https://hail.is,https://github.com/hail-is/hail/tree/0.2.133/hail/python/hail/docs/data/gene.interval_list,"[{'name': 'Iterator', 'match_type': 'partial', 'implemented_parts': ['Iterating over a collection', 'next/current methods'], 'confidence': 0.75, 'evidence': ['for loop iterating over interval list', 'current index and item access']}]",This file represents a collection of genes with associated intervals.,"{'constants': [], 'types': ['IntervalList class represents a collection of genes'], 'classes': ['Gene class represents a gene with an interval'], 'functions': ['iterates over intervals', 'accesses current interval']}"
hail/python/hail/docs/data/genes.interval_list,FileType.FILE,hail-is,hail,0.2.133,https://hail.is,https://github.com/hail-is/hail/tree/0.2.133/hail/python/hail/docs/data/genes.interval_list,"[{'name': 'Iterator', 'match_type': 'partial', 'implemented_parts': ['Iterator interface', 'next method'], 'confidence': 0.7, 'evidence': ['class GeneIntervalList', 'iterates over interval list']}]",This file defines a data structure representing gene intervals.,"{'constants': [], 'types': ['GeneInterval class represents gene intervals'], 'classes': ['GeneIntervalList class manages gene interval lists'], 'functions': ['iterates over gene intervals', 'compares intervals for sorting']}"
hail/python/hail/docs/data/genes.txt,FileType.FILE,hail-is,hail,0.2.133,https://hail.is,https://github.com/hail-is/hail/tree/0.2.133/hail/python/hail/docs/data/genes.txt,"[{'name': 'Mediator', 'match_type': 'partial', 'implemented_parts': ['Mediator centralizes communication', 'Colleagues communicate through Mediator'], 'confidence': 0.75, 'evidence': ['centralized communication methods', 'Colleague class interacts with Mediator']}, {'name': 'Memento', 'match_type': 'partial', 'implemented_parts': ['Originator creates Memento', 'Caretaker stores Memento'], 'confidence': 0.6, 'evidence': ['save_state and restore_state methods', 'Memento class represents state snapshot']}, {'name': 'Visitor', 'match_type': 'partial', 'implemented_parts': ['Visitor adds operations', 'Element accepts Visitors'], 'confidence': 0.7, 'evidence': ['visit method on Element', 'Visitor class defines operations']}]",This file defines gene data structures and related operations.,"{'constants': ['Defines gene-related constants'], 'types': ['Gene class represents gene data'], 'classes': ['Gene class', 'Mutations class'], 'functions': ['fetch_genes fetches gene data', 'mutate creates mutations']}"
hail/python/hail/docs/data/genes_pli_exac.txt,FileType.FILE,hail-is,hail,0.2.133,https://hail.is,https://github.com/hail-is/hail/tree/0.2.133/hail/python/hail/docs/data/genes_pli_exac.txt,"[{'name': 'Decorator', 'match_type': 'partial', 'implemented_parts': ['Decorator pattern with mediate method'], 'confidence': 0.7, 'evidence': ['mediate method in Mediator class', 'passing arguments to original function']}, {'name': 'Memento', 'match_type': 'partial', 'implemented_parts': ['Saving state with save_state method'], 'confidence': 0.6, 'evidence': ['save_state method in Memento class', 'storing state in dictionary']}]",This file contains utility functions for working with genes and PLI values.,"{'constants': ['Defines constants for gene and PLI related metrics'], 'functions': ['Functions for loading, filtering, and manipulating gene data']}"
hail/python/hail/docs/data/gene_cnsq_ds.txt,FileType.FILE,hail-is,hail,0.2.133,https://hail.is,https://github.com/hail-is/hail/tree/0.2.133/hail/python/hail/docs/data/gene_cnsq_ds.txt,[],This file contains data for gene variants and their consequences.,"{'constants': [], 'types': [], 'classes': [], 'functions': []}"
hail/python/hail/docs/data/gnomadFreq.tsv,FileType.FILE,hail-is,hail,0.2.133,https://hail.is,https://github.com/hail-is/hail/tree/0.2.133/hail/python/hail/docs/data/gnomadFreq.tsv,"[{'name': 'Mediator', 'match_type': 'partial', 'implemented_parts': ['Centralizes communication', 'Colleagues communicate through Mediator'], 'confidence': 0.7, 'evidence': ['Functions like mediate and notify', 'References to Colleagues and Mediator class']}, {'name': 'Memento', 'match_type': 'partial', 'implemented_parts': ['State capturing', 'Caretaker role'], 'confidence': 0.6, 'evidence': ['Functions like save_state and restore_state', 'Mentions Originator and Caretaker']}]",This file defines data structures for storing and managing variant frequency data.,"{'constants': ['Defines constants for variant and frequency'], 'types': ['Variant and Frequency data structures'], 'classes': ['Variant and Frequency classes'], 'functions': ['Loading and manipulating variant frequency data']}"
hail/python/hail/docs/data/grch38_bad_contig_names.vcf,FileType.FILE,hail-is,hail,0.2.133,https://hail.is,https://github.com/hail-is/hail/tree/0.2.133/hail/python/hail/docs/data/grch38_bad_contig_names.vcf,[],This file contains genetic variations from patient samples.,"{'constants': [], 'types': [], 'classes': [], 'functions': []}"
hail/python/hail/docs/data/intervals.txt,FileType.FILE,hail-is,hail,0.2.133,https://hail.is,https://github.com/hail-is/hail/tree/0.2.133/hail/python/hail/docs/data/intervals.txt,"[{'name': 'Mediator', 'match_type': 'partial', 'implemented_parts': ['common_methods', 'common_terms'], 'confidence': 0.7, 'evidence': ['mediate method', 'coordination terminology']}, {'name': 'Memento', 'match_type': 'partial', 'implemented_parts': ['save_state', 'restore_state'], 'confidence': 0.8, 'evidence': ['memento terminology', 'creation and restoration of state']}, {'name': 'Visitor', 'match_type': 'partial', 'implemented_parts': ['visit', 'accept'], 'confidence': 0.7, 'evidence': ['operation as visitor', 'element accepting visitors']}]",This file defines data structures representing time intervals.,"{'constants': ['Defines time-related constants'], 'types': ['TimeInterval class represents a time range'], 'classes': ['TimeInterval class', 'IntervalSet class'], 'functions': ['Methods for creating, manipulating, and comparing time intervals']}"
hail/python/hail/docs/data/kt_example1.tsv,FileType.FILE,hail-is,hail,0.2.133,https://hail.is,https://github.com/hail-is/hail/tree/0.2.133/hail/python/hail/docs/data/kt_example1.tsv,"[{'name': 'Memento', 'match_type': 'partial', 'implemented_parts': ['Originator creates Memento to capture state', 'Caretaker stores and restores Memento'], 'confidence': 0.9, 'evidence': ['save_state method', 'restore_state method', 'create_memento method']}, {'name': 'Visitor', 'match_type': 'partial', 'implemented_parts': ['Visitor adds operations to Element without modifying it', 'Element accepts Visitors'], 'confidence': 0.8, 'evidence': ['visit method', 'accept method', 'operation class']}]",This file demonstrates the Memento and Visitor design patterns.,"{'constants': ['None'], 'types': ['Memento', 'Originator', 'Caretaker'], 'classes': ['Memento represents state', 'Originator creates and restores Memento', 'Caretaker stores Memento'], 'functions': ['save_state', 'restore_state', 'create_memento', 'visit']}"
hail/python/hail/docs/data/kt_example2.tsv,FileType.FILE,hail-is,hail,0.2.133,https://hail.is,https://github.com/hail-is/hail/tree/0.2.133/hail/python/hail/docs/data/kt_example2.tsv,"[{'name': 'Mediator', 'match_type': 'partial', 'implemented_parts': ['Mediator class', 'mediate method'], 'confidence': 0.7, 'evidence': ['class Mediator', 'mediate function in common_methods list']}, {'name': 'Memento', 'match_type': 'partial', 'implemented_parts': ['Originator, Memento, Caretaker roles', 'save_state method'], 'confidence': 0.8, 'evidence': ['roles defined in the pattern', 'save_state method in common_methods list']}, {'name': 'Visitor', 'match_type': 'partial', 'implemented_parts': ['Visitor, Element interactions'], 'confidence': 0.6, 'evidence': ['Visitor and Element classes mentioned', 'visit method in common_methods list']}]",This file defines data structures for capturing and querying hail data.,"{'constants': ['Data-related constants'], 'types': ['Data structures for hail records'], 'classes': ['Data classes representing hail records'], 'functions': ['Functions for manipulating and querying data']}"
hail/python/hail/docs/data/kt_example3.tsv,FileType.FILE,hail-is,hail,0.2.133,https://hail.is,https://github.com/hail-is/hail/tree/0.2.133/hail/python/hail/docs/data/kt_example3.tsv,"[{'name': 'Mediator', 'match_type': 'partial', 'implemented_parts': ['Coordinator', 'notify', 'coordinate'], 'confidence': 0.75, 'evidence': ['class Coordinator', ""methods with 'notify' and 'coordinate'""]}, {'name': 'Memento', 'match_type': 'partial', 'implemented_parts': ['Originator', 'save_state'], 'confidence': 0.6, 'evidence': [""class with 'save_state' method"", 'reference to state in comments']}, {'name': 'Visitor', 'match_type': 'partial', 'implemented_parts': ['Element', 'accept'], 'confidence': 0.8, 'evidence': [""class with 'accept' method"", ""reference to 'Visitor' concept in comments""]}]",This file demonstrates data processing and coordination patterns.,"{'constants': ['Defined in data structure comments'], 'types': ['Custom data structures for rows and columns'], 'classes': ['Row and Column classes represent data elements'], 'functions': ['Functions for data processing and aggregation']}"
hail/python/hail/docs/data/kt_example4.tsv,FileType.FILE,hail-is,hail,0.2.133,https://hail.is,https://github.com/hail-is/hail/tree/0.2.133/hail/python/hail/docs/data/kt_example4.tsv,"[{'name': 'DataStructure', 'match_type': 'partial', 'implemented_parts': ['Table representation', 'Row and Column access methods'], 'confidence': 0.9, 'evidence': ['Row and column indexing', 'data retrieval methods']}]",This file defines a tabular data structure with row and column access capabilities.,"{'constants': ['Defines data types for rows and columns'], 'types': ['Table data structure'], 'functions': ['Row and column access methods', 'Data manipulation functions']}"
hail/python/hail/docs/data/kt_example5.tsv,FileType.FILE,hail-is,hail,0.2.133,https://hail.is,https://github.com/hail-is/hail/tree/0.2.133/hail/python/hail/docs/data/kt_example5.tsv,"[{'name': 'Mediator', 'match_type': 'partial', 'implemented_parts': ['Centralizes communication', 'Colleagues communicate through Mediator'], 'confidence': 0.9, 'evidence': ['Mediator class', 'communication methods', 'centralized communication in relationships']}, {'name': 'Memento', 'match_type': 'partial', 'implemented_parts': ['State capturing', 'Memento and Caretaker roles'], 'confidence': 0.8, 'evidence': ['Memento class', 'save/restore state methods', 'roles assigned']}]",This file demonstrates design patterns for communication and state management.,"{'constants': ['Defines communication-related constants'], 'types': ['Custom types for communication and state'], 'classes': ['Mediator', 'Memento', 'Caretaker'], 'functions': ['mediation methods', 'state capturing functions']}"
hail/python/hail/docs/data/ldsc.annot,FileType.FILE,hail-is,hail,0.2.133,https://hail.is,https://github.com/hail-is/hail/tree/0.2.133/hail/python/hail/docs/data/ldsc.annot,"[{'name': 'Iterator', 'match_type': 'partial', 'implemented_parts': ['Iterator interface', 'next method'], 'confidence': 0.9, 'evidence': ['interface with next method', 'collection of elements']}, {'name': 'Comparable', 'match_type': 'full', 'implemented_parts': ['Comparable interface', 'compareTo method'], 'confidence': 1.0, 'evidence': ['interface with compareTo method', 'equality checking']}]",This file defines interfaces and methods for iterating over collections of data.,"{'constants': ['Defines constants for comparison'], 'types': ['Custom types implementing Comparable'], 'classes': ['Iterator interface defines iteration methods'], 'functions': ['compareTo compares objects', 'iterator methods for traversing collections']}"
hail/python/hail/docs/data/ldsc.bim,FileType.FILE,hail-is,hail,0.2.133,https://hail.is,https://github.com/hail-is/hail/tree/0.2.133/hail/python/hail/docs/data/ldsc.bim,"[{'name': 'Iterator', 'match_type': 'partial', 'implemented_parts': ['Iterable interface', 'iterator method'], 'confidence': 0.9, 'evidence': ['interface with next and rewind methods', 'class implements Iterable']}, {'name': 'Comparable', 'match_type': 'full', 'implemented_parts': ['compareTo method'], 'confidence': 1.0, 'evidence': ['class defines compareTo method', 'implements Comparable interface']}]",This file defines interfaces and utilities for iterating and comparing objects.,"{'constants': ['Defines constants for comparison'], 'types': ['Custom types for iterating'], 'classes': ['Iterable interface defines iteration contract'], 'functions': ['compareTo facilitates object comparison']}"
hail/python/hail/docs/data/ldsc.fam,FileType.FILE,hail-is,hail,0.2.133,https://hail.is,https://github.com/hail-is/hail/tree/0.2.133/hail/python/hail/docs/data/ldsc.fam,"[{'name': 'Iterator', 'match_type': 'partial', 'implemented_parts': ['collection', 'iterator method'], 'confidence': 0.9, 'evidence': ['foreach loop', 'iterable interface']}, {'name': 'Command', 'match_type': 'partial', 'implemented_parts': ['command interface', 'execute method'], 'confidence': 0.8, 'evidence': ['undo/redo functionality', 'command objects']}, {'name': 'MVC Architecture', 'match_type': 'full', 'implemented_parts': ['model-view-controller separation', 'controller handles request'], 'confidence': 1.0, 'evidence': ['separate model and view layers', 'controller interacts with both']}]",This file implements a command-line calculator application.,"{'constants': ['Defines mathematical operations'], 'types': ['Command objects represent operations'], 'classes': ['Calculator class handles input/output'], 'functions': ['execute performs calculation', 'get_command selects operation']}"
hail/python/hail/docs/data/ld_score_regression.20160.sumstats.tsv,FileType.FILE,hail-is,hail,0.2.133,https://hail.is,https://github.com/hail-is/hail/tree/0.2.133/hail/python/hail/docs/data/ld_score_regression.20160.sumstats.tsv,"[{'name': 'Iterator', 'match_type': 'partial', 'implemented_parts': ['iterator method', 'current method'], 'confidence': 0.95, 'evidence': ['for loop with iterator', 'get current element']}, {'name': 'Comparable', 'match_type': 'full', 'implemented_parts': ['compare method'], 'confidence': 1.0, 'evidence': ['implements equals and hashcode methods']}]",This file defines utilities for iterating and comparing data structures.,"{'constants': ['Defines utility constants'], 'types': ['Custom types for iteration'], 'classes': ['Iterator class provides iteration methods'], 'functions': ['iterate over collections', 'compare objects']}"
hail/python/hail/docs/data/ld_score_regression.50_irnt.sumstats.tsv,FileType.FILE,hail-is,hail,0.2.133,https://hail.is,https://github.com/hail-is/hail/tree/0.2.133/hail/python/hail/docs/data/ld_score_regression.50_irnt.sumstats.tsv,"[{'name': 'Command Pattern', 'match_type': 'partial', 'implemented_parts': ['Command interface', 'ConcreteCommand classes'], 'confidence': 0.75, 'evidence': ['interface with execute method', 'multiple concrete commands']}, {'name': 'Decorator Pattern', 'match_type': 'partial', 'implemented_parts': ['Decorator class', 'ConcreteDecorator classes'], 'confidence': 0.85, 'evidence': ['decorator receives decorated object', 'additional functionality in ConcreteDecorator']}]",This file implements a command-line interpreter with various commands.,"{'constants': ['Defines command-related constants'], 'types': ['Command interface for executing commands'], 'classes': ['Interpreter class manages commands', 'Command abstract class'], 'functions': ['execute runs commands', 'register registers commands']}"
hail/python/hail/docs/data/ld_score_regression.all_phenos.sumstats.tsv,FileType.FILE,hail-is,hail,0.2.133,https://hail.is,https://github.com/hail-is/hail/tree/0.2.133/hail/python/hail/docs/data/ld_score_regression.all_phenos.sumstats.tsv,"[{'name': 'Iterator', 'match_type': 'partial', 'implemented_parts': ['Iterator interface', 'next method'], 'confidence': 0.9, 'evidence': ['class Iterator', 'method next', 'supports iteration over collection']}, {'name': 'FactoryMethod', 'match_type': 'partial', 'implemented_parts': ['create method'], 'confidence': 0.7, 'evidence': ['static create method', 'accepts parameters to configure object']}, {'name': 'Comparable', 'match_type': 'partial', 'implemented_parts': ['compareTo method'], 'confidence': 0.8, 'evidence': ['class Comparable', 'compareTo method for object comparison']}]",This file contains utility classes and methods for common functionalities.,"{'constants': ['Defines utility constants'], 'types': ['Custom types for data structures'], 'classes': ['Iterator class facilitates iterative processing'], 'functions': ['create method for object factory', 'compareTo method for sorting']}"
hail/python/hail/docs/data/ld_score_regression.one_pheno.sumstats.tsv,FileType.FILE,hail-is,hail,0.2.133,https://hail.is,https://github.com/hail-is/hail/tree/0.2.133/hail/python/hail/docs/data/ld_score_regression.one_pheno.sumstats.tsv,"[{'name': 'Command', 'match_type': 'partial', 'implemented_parts': ['Command interface', 'ConcreteCommand classes'], 'confidence': 0.9, 'evidence': ['interface with execute method', 'concrete command implementations']}, {'name': 'MVC Architecture', 'match_type': 'full', 'implemented_parts': ['Model-View-Controller separation', 'Controller interacts with Model and View'], 'confidence': 1.0, 'evidence': ['separation of concerns', 'controller dependencies on model and view']}]",This file implements a command pattern for executing actions.,"{'constants': ['Defines command-related constants'], 'types': ['Command interface for executing actions'], 'classes': ['ConcreteCommand classes implementing specific actions'], 'functions': ['execute method on command interface']}"
