filename,type,author,repo,version,wiki,url,patterns,purpose,summary
.github/ISSUE_TEMPLATE/change-request.yml,FileType.FILE,hail-is,hail,0.2.133,https://hail.is,https://github.com/hail-is/hail/tree/0.2.133/.github/ISSUE_TEMPLATE/change-request.yml,"[{'name': 'Form Validation', 'match_type': 'partial', 'implemented_parts': ['Input fields', 'Validation rules', 'Error handling'], 'confidence': 0.9, 'evidence': ['type: textarea', 'validations: required', 'attributes: label']}]",This file defines a configuration change issue template.,"{'constants': [], 'types': [], 'classes': [], 'functions': []}"
.github/ISSUE_TEMPLATE/config.yml,FileType.FILE,hail-is,hail,0.2.133,https://hail.is,https://github.com/hail-is/hail/tree/0.2.133/.github/ISSUE_TEMPLATE/config.yml,"[{'name': 'Mediator', 'match_type': 'partial', 'implemented_parts': ['Central communication', 'Mediator object'], 'confidence': 0.7, 'evidence': ['Central communication methods', 'Mediates interactions between components']}, {'name': 'Memento', 'match_type': 'partial', 'implemented_parts': ['Originator, Memento, Caretaker roles'], 'confidence': 0.8, 'evidence': ['State capture and restoration methods', 'Memento object']}, {'name': 'Visitor', 'match_type': 'partial', 'implemented_parts': ['Visitor pattern', 'Accept method'], 'confidence': 0.7, 'evidence': ['Visitor class', 'Accepts operations as parameters']}]",This file configures the issue tracking system.,"{'constants': ['Defines issue-related configurations'], 'functions': ['Loads configuration data']}"
.github/ISSUE_TEMPLATE,FileType.DIR,hail-is,hail,0.2.133,https://hail.is,https://github.com/hail-is/hail/tree/0.2.133/.github/ISSUE_TEMPLATE,"[{'name': 'Form', 'match_type': 'full', 'implemented_parts': ['Input fields', 'Label attributes', 'Validation rules'], 'confidence': 1.0, 'evidence': ['textarea element', 'label attribute', 'required validation']}, {'name': 'Form Validation', 'match_type': 'partial', 'implemented_parts': ['Input fields', 'Validation rules', 'Error handling'], 'confidence': 0.9, 'evidence': ['type: textarea', 'validations: required', 'attributes: label']}, {'name': 'Mediator', 'match_type': 'partial', 'implemented_parts': ['Central communication', 'Mediator object'], 'confidence': 0.7, 'evidence': ['Central communication methods', 'Mediates interactions between components']}, {'name': 'Memento', 'match_type': 'partial', 'implemented_parts': ['Originator, Memento, Caretaker roles'], 'confidence': 0.8, 'evidence': ['State capture and restoration methods', 'Memento object']}, {'name': 'Visitor', 'match_type': 'partial', 'implemented_parts': ['Visitor pattern', 'Accept method'], 'confidence': 0.7, 'evidence': ['Visitor class', 'Accepts operations as parameters']}]",This file defines a bug report form.,"{'constants': ['None'], 'types': ['None'], 'classes': ['None'], 'functions': ['None']}"
.github/pull_request_template.md,FileType.FILE,hail-is,hail,0.2.133,https://hail.is,https://github.com/hail-is/hail/tree/0.2.133/.github/pull_request_template.md,"[{'name': 'Issue Tracking', 'match_type': 'partial', 'implemented_parts': ['Issue assignment', 'Impact assessment', 'Security review'], 'confidence': 0.75, 'evidence': ['issue #<issue_number> reference', 'security impact categorization', 'mitigation suggestions']}]",This file describes a security-related change to the Hail codebase.,"{'constants': ['N/A'], 'types': ['N/A'], 'classes': ['N/A'], 'functions': ['N/A']}"
.github,FileType.DIR,hail-is,hail,0.2.133,https://hail.is,https://github.com/hail-is/hail/tree/0.2.133/.github,"[{'name': 'Issue Tracking', 'match_type': 'partial', 'implemented_parts': ['Issue assignment', 'Impact assessment', 'Security review'], 'confidence': 0.75, 'evidence': ['issue #<issue_number> reference', 'security impact categorization', 'mitigation suggestions']}]",This directory contains code related to security issue tracking and management.,"{'constants': [], 'types': [], 'classes': [], 'functions': []}"
admin-pod/.gitignore,FileType.FILE,hail-is,hail,0.2.133,https://hail.is,https://github.com/hail-is/hail/tree/0.2.133/admin-pod/.gitignore,[],This file is likely used for storing configuration or metadata related to an administrative pod.,"{'constants': [], 'types': [], 'classes': [], 'functions': []}"
admin-pod/admin-pod.yaml,FileType.FILE,hail-is,hail,0.2.133,https://hail.is,https://github.com/hail-is/hail/tree/0.2.133/admin-pod/admin-pod.yaml,"[{'name': 'Preemptible Deployment', 'match_type': 'full', 'implemented_parts': ['nodeSelector', 'tolerations', 'preemptible label'], 'confidence': 1.0, 'evidence': ['nodeSelector with preemptible value', 'tolerations for preemptible and scalesetpriority', 'label key preemptible explicitly set']}]",This deployment configures a preemptible Kubernetes cluster for running the admin pod.,"{'constants': [], 'types': [], 'classes': [], 'functions': []}"
admin-pod/Dockerfile,FileType.FILE,hail-is,hail,0.2.133,https://hail.is,https://github.com/hail-is/hail/tree/0.2.133/admin-pod/Dockerfile,"[{'name': 'Visitor Pattern', 'match_type': 'partial', 'implemented_parts': ['Visitor', 'Element', 'AcceptVisitor'], 'confidence': 0.9, 'evidence': ['visit method', 'AcceptVisitor interface', 'Visitor class implementation']}]","This file demonstrates the Visitor pattern, which allows visitors to perform actions on elements without modifying them.","{'constants': [], 'types': ['Visitor', 'Element'], 'classes': ['Operation (visitor)', 'Element'], 'functions': ['visit method']}"
admin-pod/Makefile,FileType.FILE,hail-is,hail,0.2.133,https://hail.is,https://github.com/hail-is/hail/tree/0.2.133/admin-pod/Makefile,"[{'name': 'Makefile', 'match_type': 'partial', 'implemented_parts': ['Target definition', 'Dependency management'], 'confidence': 0.9, 'evidence': ['include statement', 'target dependencies']}]",This Makefile defines build and deployment tasks for an application.,"{'constants': [], 'types': [], 'classes': [], 'functions': ['include loads configuration', 'target defines tasks']}"
admin-pod,FileType.DIR,hail-is,hail,0.2.133,https://hail.is,https://github.com/hail-is/hail/tree/0.2.133/admin-pod,"[{'name': 'Preemptible Deployment', 'match_type': 'full', 'implemented_parts': ['nodeSelector', 'tolerations', 'preemptible label'], 'confidence': 1.0, 'evidence': ['nodeSelector with preemptible value', 'tolerations for preemptible and scalesetpriority', 'label key preemptible explicitly set']}, {'name': 'Visitor Pattern', 'match_type': 'partial', 'implemented_parts': ['Visitor', 'Element', 'AcceptVisitor'], 'confidence': 0.9, 'evidence': ['visit method', 'AcceptVisitor interface', 'Visitor class implementation']}, {'name': 'Makefile', 'match_type': 'partial', 'implemented_parts': ['Target definition', 'Dependency management'], 'confidence': 0.9, 'evidence': ['include statement', 'target dependencies']}]",This deployment configures a preemptible Kubernetes cluster for running the admin pod.,"{'constants': [], 'types': [], 'classes': [], 'functions': []}"
auth/auth/driver/driver.py,FileType.FILE,hail-is,hail,0.2.133,https://hail.is,https://github.com/hail-is/hail/tree/0.2.133/auth/auth/driver/driver.py,"[{'name': 'Database Connection Handling', 'match_type': 'partial', 'implemented_parts': ['Database connection initialization', 'Asynchronous database connection management', 'Database connection pool creation'], 'confidence': 0.9, 'evidence': ['Database class initialization with connection details', 'async_init method for asynchronous connection', 'create method for connection pool']}, {'name': 'Event Handling and Looping', 'match_type': 'full', 'implemented_parts': ['Event loop creation', 'Event handler registration', 'Background loop execution'], 'confidence': 1.0, 'evidence': ['EventHandler class for event handling', 'users_changed_handler function for processing user updates', 'start method to initiate background loop']}]",This code manages database connections and handles user data updates in a background loop.,"{'constants': ['Defines database connection parameters'], 'types': ['Custom types for event handling'], 'classes': ['Database class for connection management', 'EventHandler for event processing'], 'functions': ['async_init for database connection', 'users_changed_handler for event processing']}"
auth/auth/driver/__init__.py,FileType.FILE,hail-is,hail,0.2.133,https://hail.is,https://github.com/hail-is/hail/tree/0.2.133/auth/auth/driver/__init__.py,"[{'name': 'Mediator', 'match_type': 'full', 'implemented_parts': ['Centralizes communication', 'Mediator role'], 'confidence': 1.0, 'evidence': ['centralizes communication between colleagues', 'roles include Mediator']}, {'name': 'Memento', 'match_type': 'partial', 'implemented_parts': ['State capture', 'Caretaker role'], 'confidence': 0.8, 'evidence': ['creates Memento to capture state', 'Caretaker stores and restores state']}, {'name': 'Visitor', 'match_type': 'partial', 'implemented_parts': ['Dynamic dispatch', 'Visitor pattern'], 'confidence': 0.7, 'evidence': ['adds operations without modifying Element', 'accept method for dispatch']}]",This file defines core components for facilitating communication and collaboration.,"{'constants': ['Defines communication-related constants'], 'types': ['Classes for communication participants'], 'classes': ['Mediator centralizes communication', 'Memento captures state', 'Visitor adds operations'], 'functions': ['Methods for communication and state management']}"
auth/auth/driver/__main__.py,FileType.FILE,hail-is,hail,0.2.133,https://hail.is,https://github.com/hail-is/hail/tree/0.2.133/auth/auth/driver/__main__.py,"[{'name': 'Memento', 'match_type': 'partial', 'implemented_parts': ['Originator', 'Memento', 'Caretaker'], 'confidence': 0.8, 'evidence': ['create_memento', 'save_state', 'restore_state']}, {'name': 'Visitor', 'match_type': 'partial', 'implemented_parts': ['Visitor', 'Element'], 'confidence': 0.7, 'evidence': ['visit method', 'accept method']}]",This file initializes the application and runs the main event loop.,"{'constants': [], 'types': ['asyncio library for asynchronous I/O'], 'classes': ['None'], 'functions': ['configure_logging', 'async_main']}"
auth/auth/driver,FileType.DIR,hail-is,hail,0.2.133,https://hail.is,https://github.com/hail-is/hail/tree/0.2.133/auth/auth/driver,"[{'name': 'Mediator', 'match_type': 'full', 'implemented_parts': ['Centralizes communication', 'Mediator role'], 'confidence': 1.0, 'evidence': ['centralizes communication between colleagues', 'roles include Mediator']}, {'name': 'Memento', 'match_type': 'partial', 'implemented_parts': ['State capture', 'Caretaker role'], 'confidence': 0.8, 'evidence': ['creates Memento to capture state', 'Caretaker stores and restores state']}, {'name': 'Visitor', 'match_type': 'partial', 'implemented_parts': ['Dynamic dispatch', 'Visitor pattern'], 'confidence': 0.7, 'evidence': ['adds operations without modifying Element', 'accept method for dispatch']}]",This file defines core components for facilitating communication and collaboration.,"{'constants': ['Defines communication-related constants'], 'types': ['Classes for communication participants'], 'classes': ['Mediator centralizes communication', 'Memento captures state', 'Visitor adds operations'], 'functions': ['Methods for communication and state management']}"
auth/auth/templates/account-creating.html,FileType.FILE,hail-is,hail,0.2.133,https://hail.is,https://github.com/hail-is/hail/tree/0.2.133/auth/auth/templates/account-creating.html,"[{'name': 'Observer', 'match_type': 'partial', 'implemented_parts': ['Element', 'Visitor', 'accept method'], 'confidence': 0.8, 'evidence': ['function accept(visitor)']}]",This file uses the Visitor pattern to add operations to elements without modifying them.,"{'classes': ['Element', 'Visitor'], 'functions': ['visit method']}"
auth/auth/templates/account-error.html,FileType.FILE,hail-is,hail,0.2.133,https://hail.is,https://github.com/hail-is/hail/tree/0.2.133/auth/auth/templates/account-error.html,"[{'name': 'Template Inheritance', 'match_type': 'full', 'implemented_parts': ['Extends base template', 'Overrides title block'], 'confidence': 1.0, 'evidence': ['{% extends ""layout.html"" %}', '{% block title %}Account Error{% endblock %}']}, {'name': 'Content Block', 'match_type': 'full', 'implemented_parts': ['Defines content block'], 'confidence': 1.0, 'evidence': ['{% block content %} ... {% endblock %}']}]",This file inherits a base layout template and defines specific content for an account error page.,"{'constants': ['None'], 'types': ['None'], 'classes': ['None'], 'functions': ['None']}"
auth/auth/templates/copy-paste-token.html,FileType.FILE,hail-is,hail,0.2.133,https://hail.is,https://github.com/hail-is/hail/tree/0.2.133/auth/auth/templates/copy-paste-token.html,[],This file displays a copy paste token for authentication purposes.,"{'constants': [], 'types': [], 'classes': [], 'functions': []}"
auth/auth/templates/index.html,FileType.FILE,hail-is,hail,0.2.133,https://hail.is,https://github.com/hail-is/hail/tree/0.2.133/auth/auth/templates/index.html,[],This file defines the index page template.,"{'constants': [], 'types': [], 'classes': [], 'functions': []}"
auth/auth/templates/roles.html,FileType.FILE,hail-is,hail,0.2.133,https://hail.is,https://github.com/hail-is/hail/tree/0.2.133/auth/auth/templates/roles.html,"[{'name': 'Form Submission', 'match_type': 'partial', 'implemented_parts': ['CSRF token handling', 'Submit button processing', 'Form data submission'], 'confidence': 0.9, 'evidence': [""input[type=hidden] with name '_csrf'"", 'submit_button function call', 'form action attribute']}, {'name': 'Table Data Listing', 'match_type': 'partial', 'implemented_parts': [""Iterating over 'roles' list"", 'Displaying ID and name for each role'], 'confidence': 0.8, 'evidence': [""for loop iterating over 'roles'"", 'table rows with ID and name columns']}]",This file defines a page for creating and listing roles.,"{'constants': [], 'types': [], 'classes': [], 'functions': ['submit_button function']}"
auth/auth/templates/user.html,FileType.FILE,hail-is,hail,0.2.133,https://hail.is,https://github.com/hail-is/hail/tree/0.2.133/auth/auth/templates/user.html,[],This file displays a user's profile page.,"{'constants': ['CSRF token'], 'types': ['String'], 'classes': [], 'functions': ['submit_button']}"
