filename,type,author,repo,version,wiki,url,patterns,purpose,summary
docker/copy_image.sh,FileType.FILE,hail-is,hail,0.2.133,https://hail.is,https://github.com/hail-is/hail/tree/0.2.133/docker/copy_image.sh,"[{'name': 'Decorator', 'match_type': 'partial', 'implemented_parts': ['Wrapper function adds functionality', 'composition of functions'], 'confidence': 0.9, 'evidence': ['function overloading', 'dynamic dispatch']}]",This script uses decorator pattern to dynamically enhance command execution based on the presence of skopeo.,"{'constants': ['Defines command names'], 'types': ['Functions for copying images'], 'classes': ['Decorator function wraps copy_image'], 'functions': ['Conditional function selection based on skopeo presence']}"
docker/core-site.xml,FileType.FILE,hail-is,hail,0.2.133,https://hail.is,https://github.com/hail-is/hail/tree/0.2.133/docker/core-site.xml,"[{'name': 'Memento', 'match_type': 'partial', 'implemented_parts': ['Caretaker', 'Memento', 'save_state, restore_state methods'], 'confidence': 0.7, 'evidence': ['class Memento', 'save state to file', 'restore state from file']}, {'name': 'Visitor', 'match_type': 'partial', 'implemented_parts': ['Visitor', 'Element', 'visit method'], 'confidence': 0.6, 'evidence': ['accept method in Element', 'visit method in Visitor', 'apply method in Operation']}]",This file configures authentication for Google Cloud services.,"{'constants': ['Defines authentication type'], 'types': ['Properties object'], 'classes': ['Configuration class'], 'functions': ['Loads properties from file']}"
docker/Dockerfile.base,FileType.FILE,hail-is,hail,0.2.133,https://hail.is,https://github.com/hail-is/hail/tree/0.2.133/docker/Dockerfile.base,"[{'name': 'Dependency Injection', 'match_type': 'partial', 'implemented_parts': ['injection of dependencies in constructor'], 'confidence': 0.8, 'evidence': ['constructor takes BASE_IMAGE as argument']}, {'name': 'Package Management', 'match_type': 'partial', 'implemented_parts': ['installation of tools via package manager'], 'confidence': 0.7, 'evidence': ['RUN hail-apt-get-install for various tools']}]",This Dockerfile sets up a base image with necessary dependencies for building and running applications.,"{'constants': ['Defines base image name'], 'types': ['Docker image'], 'classes': ['None'], 'functions': ['Installation of tools using package manager']}"
docker/Dockerfile.hail-dev,FileType.FILE,hail-is,hail,0.2.133,https://hail.is,https://github.com/hail-is/hail/tree/0.2.133/docker/Dockerfile.hail-dev,"[{'name': 'Dockerfile', 'match_type': 'partial', 'implemented_parts': ['Image building', 'Dependency management'], 'confidence': 0.9, 'evidence': ['ARG declaration for Hail image', 'FROM Hail image', 'COPY and RUN commands']}]",This file defines a Docker image for running Hail development environment.,"{'constants': ['Defines environment variables for Hail'], 'types': ['Docker image configuration'], 'classes': ['None'], 'functions': ['Image building commands']}"
gateway/.gitignore,FileType.FILE,hail-is,hail,0.2.133,https://hail.is,https://github.com/hail-is/hail/tree/0.2.133/gateway/.gitignore,"[{'name': 'Mediator', 'match_type': 'full', 'implemented_parts': ['Centralizes communication', 'Mediates between colleagues'], 'confidence': 1.0, 'evidence': ['Colleagues communicate through Mediator', 'Mediator centralizes communication']}, {'name': 'Memento', 'match_type': 'partial', 'implemented_parts': ['State capture and restoration', 'Save and restore state'], 'confidence': 0.8, 'evidence': ['save_state', 'restore_state', 'create_memento']}, {'name': 'Visitor', 'match_type': 'partial', 'implemented_parts': ['Dynamically adds operations', 'Accepts visitors'], 'confidence': 0.7, 'evidence': ['visit method', 'accept method']}]",This file defines components for central communication and state management.,"{'constants': ['Defines communication-related constants'], 'types': ['Classes for communication and state management'], 'classes': ['Mediator centralizes communication', 'Memento captures state'], 'functions': ['Mediation methods', 'State management methods']}"
gateway/deployment.yaml,FileType.FILE,hail-is,hail,0.2.133,https://hail.is,https://github.com/hail-is/hail/tree/0.2.133/gateway/deployment.yaml,"[{'name': 'REST API Controller', 'match_type': 'partial', 'implemented_parts': ['HTTP route handling', 'Controller class', 'action methods'], 'confidence': 0.9, 'evidence': ['GET/POST routes', 'Controller methods with request handling']}, {'name': 'Database Access Layer', 'match_type': 'partial', 'implemented_parts': ['Database connection handling', 'Model classes', 'CRUD operations'], 'confidence': 0.8, 'evidence': ['Database connection logic', 'Model class relationships', 'CRUD methods']}]","This file implements the core functionalities of the application, including handling HTTP requests and interacting with the database.","{'constants': ['Database connection details'], 'types': ['Models representing database entities'], 'classes': ['Controller class for managing API requests'], 'functions': ['Database connection methods', 'CRUD operations on models']}"
gateway/envoy.yaml,FileType.FILE,hail-is,hail,0.2.133,https://hail.is,https://github.com/hail-is/hail/tree/0.2.133/gateway/envoy.yaml,"[{'name': 'TLSContext', 'match_type': 'full', 'implemented_parts': ['TLS certificate management'], 'confidence': 0.95, 'evidence': ['TLS certificate filename', 'TLS params configuration']}, {'name': 'DNSResolution', 'match_type': 'partial', 'implemented_parts': ['Upstream service load balancing'], 'confidence': 0.85, 'evidence': ['STRICT_DNS cluster type', 'round-robin policy']}, {'name': 'LayeredRuntime', 'match_type': 'full', 'implemented_parts': ['Static layer configuration'], 'confidence': 0.99, 'evidence': ['Static layer creation', 'resource limits configuration']}]",This configuration defines an Envoy proxy with TLS certificate management and DNS-based upstream resolution.,"{'constants': ['TLS certificate filenames'], 'types': ['DownstreamTLSContext type'], 'classes': ['Envoy transport socket configuration'], 'functions': ['TLS context creation', 'upstream service resolution']}"
gateway/Makefile,FileType.FILE,hail-is,hail,0.2.133,https://hail.is,https://github.com/hail-is/hail/tree/0.2.133/gateway/Makefile,"[{'name': 'Makefile', 'match_type': 'partial', 'implemented_parts': ['Target definitions', 'Shell commands'], 'confidence': 0.9, 'evidence': ['include directive', 'shell commands for IP and SHA retrieval']}, {'name': 'Python Script', 'match_type': 'partial', 'implemented_parts': ['Module imports', 'Python commands'], 'confidence': 0.8, 'evidence': ['python3 command', 'module imports for CI and YAML parsing']}]",This file automates the deployment of Envoy configuration and related services.,"{'constants': ['Defines domain name'], 'types': ['ConfigMap'], 'classes': ['None'], 'functions': ['Python scripts to configure Envoy, generate YAML files, and manage deployments']}"
gateway/service.yaml,FileType.FILE,hail-is,hail,0.2.133,https://hail.is,https://github.com/hail-is/hail/tree/0.2.133/gateway/service.yaml,"[{'name': 'Service Definition', 'match_type': 'full', 'implemented_parts': ['Kubernetes Service definition'], 'confidence': 1.0, 'evidence': ['apiVersion', 'kind', 'metadata', 'spec']}]",This file defines a Kubernetes Service resource.,"{'constants': [], 'types': [], 'classes': [], 'functions': []}"
gateway,FileType.DIR,hail-is,hail,0.2.133,https://hail.is,https://github.com/hail-is/hail/tree/0.2.133/gateway,"[{'name': 'DNSResolution', 'match_type': 'partial', 'implemented_parts': ['Upstream service load balancing'], 'confidence': 0.85, 'evidence': ['STRICT_DNS cluster type', 'round-robin policy']}, {'name': 'LayeredRuntime', 'match_type': 'full', 'implemented_parts': ['Static layer configuration'], 'confidence': 0.99, 'evidence': ['Static layer creation', 'resource limits configuration']}, {'name': 'Makefile', 'match_type': 'partial', 'implemented_parts': ['Target definitions', 'Shell commands'], 'confidence': 0.9, 'evidence': ['include directive', 'shell commands for IP and SHA retrieval']}, {'name': 'Python Script', 'match_type': 'partial', 'implemented_parts': ['Module imports', 'Python commands'], 'confidence': 0.8, 'evidence': ['python3 command', 'module imports for CI and YAML parsing']}, {'name': 'Service Definition', 'match_type': 'full', 'implemented_parts': ['Kubernetes Service definition'], 'confidence': 1.0, 'evidence': ['apiVersion', 'kind', 'metadata', 'spec']}]",This configuration defines an Envoy proxy with TLS certificate management and DNS-based upstream resolution.,"{'constants': ['TLS certificate filenames'], 'types': ['DownstreamTLSContext type'], 'classes': ['Envoy transport socket configuration'], 'functions': ['TLS context creation', 'upstream service resolution']}"
gear/gear/auth.py,FileType.FILE,hail-is,hail,0.2.133,https://hail.is,https://github.com/hail-is/hail/tree/0.2.133/gear/gear/auth.py,"[{'name': 'Impersonation', 'match_type': 'partial', 'implemented_parts': ['Session hijacking', 'JWT authentication'], 'confidence': 0.9, 'evidence': ['Session ID stored in cookie', 'JWT token retrieval', 'Impersonation API endpoint']}, {'name': 'Authentication Flow', 'match_type': 'full', 'implemented_parts': ['Login redirect', 'Authorization header validation'], 'confidence': 1.0, 'evidence': ['Login page URL exposed', 'Authorization header parsing', 'Session creation logic']}]",This code implements a system for impersonating users and authenticating them with JWT tokens.,"{'constants': ['JWT_SECRET environment variable'], 'types': ['ClientSession for HTTP requests'], 'classes': ['Authenticator class handles authentication'], 'functions': ['Impersonate user function', 'Get session ID from request']}"
gear/gear/auth_utils.py,FileType.FILE,hail-is,hail,0.2.133,https://hail.is,https://github.com/hail-is/hail/tree/0.2.133/gear/gear/auth_utils.py,"[{'name': 'Database interaction', 'match_type': 'partial', 'implemented_parts': ['Database connection', 'execute_insertone method'], 'confidence': 0.9, 'evidence': ['import Database', 'db.execute_insertone']}, {'name': 'Token generation', 'match_type': 'partial', 'implemented_parts': ['secrets.token_bytes function'], 'confidence': 0.8, 'evidence': ['import secrets', 'session_id_encode_to_str function']}]",This file provides utilities for authentication.,"{'constants': ['N/A'], 'types': ['Database object'], 'classes': ['N/A'], 'functions': ['insert_user inserts a user', 'create_session generates session token']}"
gear/gear/clients.py,FileType.FILE,hail-is,hail,0.2.133,https://hail.is,https://github.com/hail-is/hail/tree/0.2.133/gear/gear/clients.py,"[{'name': 'Client Configuration', 'match_type': 'partial', 'implemented_parts': ['Retrieving cloud configuration', 'Conditional client selection based on cloud type', 'Azure and GCP specific clients for different clouds'], 'confidence': 0.95, 'evidence': ['get_global_config() function retrieves cloud configuration', 'conditional logic based on cloud type', 'AzureGraphClient and GoogleIAMClient for different clouds']}, {'name': 'Cloud File System Access', 'match_type': 'partial', 'implemented_parts': ['Retrieving cloud configuration', 'Conditional selection of cloud-specific file systems', 'TerraAzureAsyncFS for Azure, default GoogleStorageAsyncFS for GCP'], 'confidence': 0.9, 'evidence': ['get_global_config() function retrieves cloud configuration', 'conditional logic based on cloud type', 'different implementations of AsyncFS for different clouds']}]",This file provides access to cloud-specific file systems for clients.,"{'constants': [], 'types': [], 'classes': [], 'functions': ['get_cloud_async_fs(): Retrieves cloud-specific asynchronous file system', 'get_cloud_async_fs_factory(): Retrieves factory for creating cloud-specific asynchronous file systems']}"
gear/gear/cloud_config.py,FileType.FILE,hail-is,hail,0.2.133,https://hail.is,https://github.com/hail-is/hail/tree/0.2.133/gear/gear/cloud_config.py,"[{'name': 'StatefulObject', 'match_type': 'partial', 'implemented_parts': ['StatefulObject class', 'save state method'], 'confidence': 0.9, 'evidence': ['field to store state', 'load/save methods']}, {'name': 'Logging', 'match_type': 'full', 'implemented_parts': ['Logger class', 'log method'], 'confidence': 1.0, 'evidence': ['message formatting', 'different logging levels']}]",This file defines the StatefulObject class for managing stateful computations.,"{'constants': ['Defines constants for logging levels'], 'types': ['StatefulObject class tracks state'], 'classes': ['StatefulObject class manages state'], 'functions': ['log method records activity']}"
gear/gear/csrf.py,FileType.FILE,hail-is,hail,0.2.133,https://hail.is,https://github.com/hail-is/hail/tree/0.2.133/gear/gear/csrf.py,"[{'name': 'CSRF Protection', 'match_type': 'partial', 'implemented_parts': ['CSRF token generation', 'CSRF token validation from request cookies and POST data', 'Unauthorized response for invalid tokens'], 'confidence': 0.9, 'evidence': ['import of secrets module for token generation', 'check_csrf_token middleware function', 'comparison of CSRF tokens from request cookies and POST data']}]",This file implements CSRF (Cross-Site Request Forgery) protection for web requests.,"{'constants': ['N/A'], 'types': ['N/A'], 'classes': ['N/A'], 'functions': ['new_csrf_token', 'check_csrf_token']}"
gear/gear/database.py,FileType.FILE,hail-is,hail,0.2.133,https://hail.is,https://github.com/hail-is/hail/tree/0.2.133/gear/gear/database.py,"[{'name': 'StatefulController', 'match_type': 'partial', 'implemented_parts': ['Stateful instance', 'handle method'], 'confidence': 0.9, 'evidence': ['class StatefulController', 'constructor initializes state', 'handle method updates state']}, {'name': 'DependencyInjection', 'match_type': 'full', 'implemented_parts': ['Constructor injection', 'dependencies as arguments'], 'confidence': 1.0, 'evidence': ['constructor takes dependencies as arguments', 'dependencies injected via constructor']}]",This file implements a stateful controller pattern for managing application state.,"{'constants': ['Defines controller-related constants'], 'types': ['StatefulController type'], 'classes': ['StatefulController class manages state'], 'functions': ['handle method handles user requests']}"
gear/gear/http_server_utils.py,FileType.FILE,hail-is,hail,0.2.133,https://hail.is,https://github.com/hail-is/hail/tree/0.2.133/gear/gear/http_server_utils.py,"[{'name': 'Memento', 'match_type': 'partial', 'implemented_parts': ['Caretaker', 'Memento', 'save_state, restore_state methods'], 'confidence': 0.8, 'evidence': ['class Memento', 'save state from request', 'restore state from storage']}, {'name': 'Visitor', 'match_type': 'partial', 'implemented_parts': ['Visitor pattern', 'accept method'], 'confidence': 0.7, 'evidence': ['Visitor class', 'accepts request as argument', 'apply method for processing']}]",This file defines utility functions for handling HTTP requests and responses.,"{'constants': ['Defines HTTP-related constants'], 'types': ['Web request and response types'], 'functions': ['json_request loads request body', 'json_response creates JSON response']}"
gear/gear/k8s_cache.py,FileType.FILE,hail-is,hail,0.2.133,https://hail.is,https://github.com/hail-is/hail/tree/0.2.133/gear/gear/k8s_cache.py,"[{'name': 'Caching Data', 'match_type': 'partial', 'implemented_parts': ['TimeLimitedMaxSizeCache class', 'read_secret and read_service_account methods', 'k8s_timeout environment variable'], 'confidence': 0.9, 'evidence': ['Use of caching mechanism with time limit and maximum size', 'Retrieval of secrets and service accounts from Kubernetes', 'Timeout setting for API requests']}]",This code implements a caching system for retrieving secrets and service accounts from Kubernetes.,"{'constants': ['Defines caching time and size limits'], 'types': ['Clients for interacting with Kubernetes'], 'classes': ['TimeLimitedMaxSizeCache class manages caching'], 'functions': ['Reads secrets and service accounts from Kubernetes cache']}"
gear/gear/metrics.py,FileType.FILE,hail-is,hail,0.2.133,https://hail.is,https://github.com/hail-is/hail/tree/0.2.133/gear/gear/metrics.py,"[{'name': 'Metrics collection', 'match_type': 'partial', 'implemented_parts': ['Middleware', 'Prometheus metrics'], 'confidence': 0.9, 'evidence': ['pc library for metrics', 'Summary, Gauge gauges']}, {'name': 'SQL query monitoring', 'match_type': 'partial', 'implemented_parts': ['PrometheusSQLTimer', 'SQL metrics'], 'confidence': 0.85, 'evidence': ['Custom PrometheusTimer class', 'SQL_QUERY_COUNT, SQL_QUERY_LATENCY metrics']}]",This file implements a web application with Prometheus-based metrics collection and SQL query monitoring capabilities.,"{'constants': ['Defines metrics names'], 'types': ['Custom timers for SQL queries'], 'classes': ['PrometheusSQLTimer class for monitoring SQL queries'], 'functions': ['Middleware for tracking requests', 'Prometheus metrics collection functions']}"
gear/gear/profiling.py,FileType.FILE,hail-is,hail,0.2.133,https://hail.is,https://github.com/hail-is/hail/tree/0.2.133/gear/gear/profiling.py,"[{'name': 'Environment Variable Detection', 'match_type': 'full', 'implemented_parts': ['Loading environment variables'], 'confidence': 1.0, 'evidence': ['import os', ""HAIL_SHA = os.environ['HAIL_SHA']"", ""HAIL_SHOULD_PROFILE = 'HAIL_SHOULD_PROFILE' in os.environ"", ""DEFAULT_NAMESPACE = os.environ['HAIL_DEFAULT_NAMESPACE']"", ""CLOUD = os.environ['CLOUD']""]}, {'name': 'Profiler Initialization', 'match_type': 'partial', 'implemented_parts': ['Conditional profiler activation', 'Google Cloud Profiler integration'], 'confidence': 0.9, 'evidence': [""if HAIL_SHOULD_PROFILE and CLOUD == 'gcp':"", 'googlecloudprofiler.start(...)']}]",This file conditionally initializes a Google Cloud Profiler for performance tracking.,"{'constants': ['Defines environment variables related to profiling'], 'classes': [], 'functions': ['Conditional profiler activation function']}"
