filename,type,author,repo,version,wiki,url,patterns,purpose,summary
batch/batch/front_end/__main__.py,FileType.FILE,hail-is,hail,0.2.133,https://hail.is,https://github.com/hail-is/hail/tree/0.2.133/batch/batch/front_end/__main__.py,"[{'name': 'Singleton', 'match_type': 'full', 'implemented_parts': ['Singleton instance', 'get_instance method'], 'confidence': 1.0, 'evidence': ['private constructor', 'static get_instance']}]",Configure logging for the application.,"{'constants': [], 'types': [], 'classes': [], 'functions': ['configure_logging', 'import logging module']}"
batch/batch/front_end,FileType.DIR,hail-is,hail,0.2.133,https://hail.is,https://github.com/hail-is/hail/tree/0.2.133/batch/batch/front_end,"[{'name': 'Mediator', 'match_type': 'partial', 'implemented_parts': ['Centralizes communication', 'Mediator role'], 'confidence': 0.7, 'evidence': ['centralizes communication between colleagues', 'Mediator class']}, {'name': 'Memento', 'match_type': 'partial', 'implemented_parts': ['State capture', 'Caretaker role'], 'confidence': 0.8, 'evidence': ['creates Memento to capture state', 'Caretaker stores and restores']}, {'name': 'Visitor', 'match_type': 'partial', 'implemented_parts': ['Dynamic dispatch', 'Visitor pattern'], 'confidence': 0.9, 'evidence': ['adds operations without modifying Element', 'Visitor pattern usage']}]",This file implements core components for facilitating communication and state management in a collaborative environment.,"{'constants': ['Defines communication-related constants'], 'types': ['Custom types for communication and state management'], 'classes': ['Mediator centralizes communication', 'Memento captures state', 'Visitor adds operations'], 'functions': ['mediation methods', 'state capture and restoration', 'dynamic dispatch of operations']}"
batch/batch/worker/disk.py,FileType.FILE,hail-is,hail,0.2.133,https://hail.is,https://github.com/hail-is/hail/tree/0.2.133/batch/batch/worker/disk.py,"[{'name': 'Context Manager', 'match_type': 'full', 'implemented_parts': ['__aenter__/__aexit__ methods'], 'confidence': 1.0, 'evidence': ['async context management using __aenter__ and __aexit__']}]",This file defines a CloudDisk class that provides asynchronous access to a cloud-based disk storage.,"{'constants': ['Defines disk-related constants'], 'types': ['CloudDisk class for disk access'], 'classes': ['CloudDisk class manages disk operations'], 'functions': ['create and delete methods for disk manipulation']}"
batch/batch/worker/jvm_entryway_protocol.py,FileType.FILE,hail-is,hail,0.2.133,https://hail.is,https://github.com/hail-is/hail/tree/0.2.133/batch/batch/worker/jvm_entryway_protocol.py,"[{'name': 'Iterator', 'match_type': 'partial', 'implemented_parts': ['Iterable interface', 'iterator method'], 'confidence': 0.9, 'evidence': ['implements Iterable', 'has next method']}, {'name': 'Comparable', 'match_type': 'full', 'implemented_parts': ['compareTo method'], 'confidence': 1.0, 'evidence': ['defines compareTo method', 'supports sorting']}]",This file defines utilities for iterating over collections and comparing values.,"{'constants': ['Defines constants for comparison'], 'types': ['Custom types implementing Comparable'], 'classes': ['Iterable interface', 'Comparable class'], 'functions': ['compareTo for object comparisons']}"
batch/batch/worker/worker.py,FileType.FILE,hail-is,hail,0.2.133,https://hail.is,https://github.com/hail-is/hail/tree/0.2.133/batch/batch/worker/worker.py,"[{'name': 'Iterator', 'match_type': 'partial', 'implemented_parts': ['iterating over a collection', 'next function', 'stop condition'], 'confidence': 0.95, 'evidence': ['for loop over list', 'generator function', 'check if next element exists']}, {'name': 'Command Design Pattern', 'match_type': 'full', 'implemented_parts': ['Command interface', 'Concrete command implementations', 'execute method'], 'confidence': 1.0, 'evidence': ['interface with execute method', 'concrete command classes', 'dependency injection of command object']}]",This file implements an iterative command handler.,"{'constants': ['Defines constants for command types'], 'types': ['Command interface for executing commands'], 'classes': ['Concrete command classes implement specific actions'], 'functions': ['execute command method']}"
batch/batch/worker/worker_api.py,FileType.FILE,hail-is,hail,0.2.133,https://hail.is,https://github.com/hail-is/hail/tree/0.2.133/batch/batch/worker/worker_api.py,"[{'name': 'Abstract Class', 'match_type': 'full', 'implemented_parts': ['Abstract method definitions', 'Concrete implementations prohibited'], 'confidence': 0.99, 'evidence': ['@abc.abstractmethod decorator', 'Concrete methods raise NotImplementedError']}, {'name': 'Container Registry Authentication', 'match_type': 'partial', 'implemented_parts': ['worker_container_registry_credentials', 'user_container_registry_credentials'], 'confidence': 0.85, 'evidence': ['Credentials retrieval methods for worker and user registries']}, {'name': 'Metadata Server Application', 'match_type': 'partial', 'implemented_parts': ['create_metadata_server_app'], 'confidence': 0.75, 'evidence': ['Function to create a web application for metadata management']}, {'name': 'Cloud Files Mounting', 'match_type': 'partial', 'implemented_parts': ['_mount_cloudfuse', 'mount_cloudfuse'], 'confidence': 0.8, 'evidence': ['Functions for mounting Cloud Files using CloudFuse']}, {'name': 'Instance Configuration', 'match_type': 'partial', 'implemented_parts': ['instance_config_from_config_dict'], 'confidence': 0.9, 'evidence': ['Function to create InstanceConfig object from configuration dictionary']}]",This abstract class defines an interface for interacting with cloud storage.,"{'constants': ['Defines configuration constants'], 'types': ['Cloud-related data types'], 'classes': ['AbstractCloudDisk'], 'functions': ['create_disk', 'worker_container_registry_credentials', 'user_container_registry_credentials', 'create_metadata_server_app', 'instance_config_from_config_dict', '_mount_cloudfuse', 'mount_cloudfuse', 'unmount_cloudfuse', 'close']}"
batch/batch/worker/__init__.py,FileType.FILE,hail-is,hail,0.2.133,https://hail.is,https://github.com/hail-is/hail/tree/0.2.133/batch/batch/worker/__init__.py,"[{'name': 'Mediator', 'match_type': 'full', 'implemented_parts': ['Centralizes communication', 'Mediator role, Colleague role'], 'confidence': 1.0, 'evidence': ['centralizes communication between Colleagues', 'Colleagues communicate through the Mediator']}, {'name': 'Memento', 'match_type': 'partial', 'implemented_parts': ['Originator creates Memento', 'Caretaker stores and restores'], 'confidence': 0.8, 'evidence': ['save_state method', 'restore_state method', 'Originator creates Memento']}, {'name': 'Visitor', 'match_type': 'partial', 'implemented_parts': ['Adds operations', 'Element accepts Visitors'], 'confidence': 0.7, 'evidence': ['visit method', 'accept method']}]",This file defines core components for facilitating communication and state management.,"{'constants': ['Defines communication-related constants'], 'types': ['Custom types for communication and state management'], 'classes': ['Mediator centralizes communication', 'Memento captures state'], 'functions': ['Mediate between Colleagues', 'Save and restore state', 'Visit elements']}"
batch/batch/worker,FileType.DIR,hail-is,hail,0.2.133,https://hail.is,https://github.com/hail-is/hail/tree/0.2.133/batch/batch/worker,"[{'name': 'Mediator', 'match_type': 'full', 'implemented_parts': ['Centralizes communication', 'Mediator role, Colleague role'], 'confidence': 1.0, 'evidence': ['centralizes communication between Colleagues', 'Colleagues communicate through the Mediator']}, {'name': 'Memento', 'match_type': 'partial', 'implemented_parts': ['Originator creates Memento', 'Caretaker stores and restores'], 'confidence': 0.8, 'evidence': ['save_state method', 'restore_state method', 'Originator creates Memento']}, {'name': 'Visitor', 'match_type': 'partial', 'implemented_parts': ['Adds operations', 'Element accepts Visitors'], 'confidence': 0.7, 'evidence': ['visit method', 'accept method']}]",This file defines core components for facilitating communication and state management.,"{'constants': ['Defines communication-related constants'], 'types': ['Custom types for communication and state management'], 'classes': ['Mediator centralizes communication', 'Memento captures state'], 'functions': ['Mediate between Colleagues', 'Save and restore state', 'Visit elements']}"
batch/batch/batch.py,FileType.FILE,hail-is,hail,0.2.133,https://hail.is,https://github.com/hail-is/hail/tree/0.2.133/batch/batch/batch.py,"[{'name': 'Iterator pattern', 'match_type': 'partial', 'implemented_parts': ['Iterator class', 'has_next method', 'next method'], 'confidence': 0.9, 'evidence': ['class iterates over collection', 'generic type parameter for collection', 'implements sequential access']}, {'name': 'Decorator pattern', 'match_type': 'partial', 'implemented_parts': ['Decorator class', 'wraps target object', 'extends functionality'], 'confidence': 0.8, 'evidence': ['class adds additional behavior', 'takes target object as argument', 'overrides methods with enhanced functionality']}]",This file implements an iterator pattern for efficiently iterating over collections and a decorator pattern for extending functionality.,"{'constants': ['Defines collection-related constants'], 'types': ['Custom iterator type'], 'classes': ['Iterator class for collection iteration'], 'functions': ['Decorates target objects with additional methods']}"
batch/batch/batch_configuration.py,FileType.FILE,hail-is,hail,0.2.133,https://hail.is,https://github.com/hail-is/hail/tree/0.2.133/batch/batch/batch_configuration.py,"[{'name': 'Environment Variable Retrieval', 'match_type': 'partial', 'implemented_parts': ['Retrieving values from environment variables'], 'confidence': 0.9, 'evidence': ['os.environ.get() function call for multiple environment variables']}, {'name': 'Constant Definition', 'match_type': 'partial', 'implemented_parts': ['Defining constants from environment variables'], 'confidence': 0.8, 'evidence': ['Initialization of constants from os.environ']}]",This file configures batch processing parameters and retrieves environment variables.,"{'constants': ['HAIL_DEFAULT_NAMESPACE, HAIL_SCOPE, CLOUD'], 'types': ['float (timeout), int (refresh interval)', 'string (namespace, scope)'], 'functions': ['Retrieving values from environment variables']}"
batch/batch/batch_format_version.py,FileType.FILE,hail-is,hail,0.2.133,https://hail.is,https://github.com/hail-is/hail/tree/0.2.133/batch/batch/batch_format_version.py,"[{'name': 'Iterator pattern', 'match_type': 'partial', 'implemented_parts': ['iterator method', 'next method'], 'confidence': 0.9, 'evidence': ['for loop with iterator', 'current item access using next']}, {'name': 'Decorator pattern', 'match_type': 'full', 'implemented_parts': ['decorator function', 'decorated function'], 'confidence': 1.0, 'evidence': ['wrapping function with decorator', 'additional functionality added']}]",This file implements utility functions to handle collections of data and enhance functionality.,"{'constants': ['Defines constants for iteration'], 'types': ['Custom iterator type'], 'classes': ['Iterator class provides loop functionality'], 'functions': ['iterates over collections', 'applies decorator to functions']}"
batch/batch/exceptions.py,FileType.FILE,hail-is,hail,0.2.133,https://hail.is,https://github.com/hail-is/hail/tree/0.2.133/batch/batch/exceptions.py,"[{'name': 'Iterator', 'match_type': 'partial', 'implemented_parts': ['Iteration method', 'iterator class'], 'confidence': 0.9, 'evidence': ['for loop', 'iteratable interface']}, {'name': 'Comparable', 'match_type': 'full', 'implemented_parts': ['compare method'], 'confidence': 1.0, 'evidence': ['interface with compare method', 'equality check in code']}]",This file defines utilities for iterating over collections of data and comparing values.,"{'constants': ['Defines constants related to iteration'], 'types': ['Custom types for iterables'], 'classes': ['Iterator class for efficient iteration'], 'functions': ['compare method for comparing objects']}"
batch/batch/file_store.py,FileType.FILE,hail-is,hail,0.2.133,https://hail.is,https://github.com/hail-is/hail/tree/0.2.133/batch/batch/file_store.py,"[{'name': 'Dependency Injection', 'match_type': 'partial', 'implemented_parts': ['Constructor injection', 'Field injection'], 'confidence': 0.95, 'evidence': ['constructor takes dependencies as arguments', 'fields annotated with @Inject']}, {'name': 'Model-View-Controller (MVC)', 'match_type': 'full', 'implemented_parts': ['Model layer', 'View layer', 'Controller layer'], 'confidence': 1.0, 'evidence': ['separate folders for models, views, and controllers', 'Controller interacts with model and view']}]",This file implements the core architecture of the application using the MVC pattern.,"{'constants': ['Defines application-related constants'], 'types': ['Models represent data entities', 'Views handle user interaction', 'Controllers handle business logic'], 'classes': ['AbstractModel, BaseView, BaseController'], 'functions': ['Controller methods interact with models and views']}"
batch/batch/globals.py,FileType.FILE,hail-is,hail,0.2.133,https://hail.is,https://github.com/hail-is/hail/tree/0.2.133/batch/batch/globals.py,"[{'name': 'State Machine', 'match_type': 'partial', 'implemented_parts': ['States', 'Transitions between states', 'Initial state', 'Final state'], 'confidence': 0.9, 'evidence': ['Defined states: Pending, Ready, Creating, etc.', 'Transitions defined between states', 'Initial state is Pending', 'Final state is Success']}, {'name': 'Task Management', 'match_type': 'partial', 'implemented_parts': ['Tasks list', 'Assigning tasks to states', 'Tracking completion status'], 'confidence': 0.8, 'evidence': ['Defined tasks: input, main, output', 'Tasks assigned to different states', 'Completion status tracked for each task']}]",This file defines the state machine and task management system for the Hail platform.,"{'constants': ['Defines state machine and task related constants'], 'types': ['Custom types for state and task representation'], 'classes': ['State machine class manages the state transitions', 'Task class represents a unit of work'], 'functions': ['Transition between states based on task completion', 'Track completion status of tasks', 'Manage different states and tasks']}"
batch/batch/instance_config.py,FileType.FILE,hail-is,hail,0.2.133,https://hail.is,https://github.com/hail-is/hail/tree/0.2.133/batch/batch/instance_config.py,"[{'name': 'Cost Estimation', 'match_type': 'partial', 'implemented_parts': ['Cost calculation functions', 'Resource quantification'], 'confidence': 0.9, 'evidence': ['cost_per_hour function', 'quantified_resources function', 'Resource rates dictionary utilization']}, {'name': 'Price Calculation', 'match_type': 'full', 'implemented_parts': ['Price per hour function', 'Entire instance price per hour function'], 'confidence': 1.0, 'evidence': ['Price_per_hour function parameters', 'Entire_instance_price_per_hour function call', 'Resource rates dictionary input']}]",This file calculates the cost of renting and operating an instance.,"{'constants': ['Defines resource cost constants'], 'types': ['Dictionaries for resource rates'], 'classes': ['InstanceConfig class handles cost calculations'], 'functions': ['Cost estimation functions', 'Price calculation functions']}"
batch/batch/inst_coll_config.py,FileType.FILE,hail-is,hail,0.2.133,https://hail.is,https://github.com/hail-is/hail/tree/0.2.133/batch/batch/inst_coll_config.py,"[{'name': 'Resource Conversion', 'match_type': 'partial', 'implemented_parts': ['pool.convert_requests_to_resources function', 'core/memory/storage conversion logic'], 'confidence': 0.9, 'evidence': ['Function takes cores/memory/storage as input', 'Calculates actual resource requirements based on configuration']}, {'name': 'Job Selection', 'match_type': 'partial', 'implemented_parts': ['select_job_private function', 'conversion of machine type to resources'], 'confidence': 0.8, 'evidence': ['Function selects optimal job based on given parameters', 'Considers worker type, machine type, and storage requirements']}, {'name': 'Instance Collection', 'match_type': 'partial', 'implemented_parts': ['select_inst_coll function', 'logic for selecting pool/job based on criteria'], 'confidence': 0.7, 'evidence': ['Function collects instances based on user request', 'Prioritizes preemptible options and cheapest prices']}]",This code manages resource allocation for a cloud platform.,"{'constants': ['Defines cloud-related constants'], 'types': ['Custom types for resources'], 'classes': ['Pool class manages cloud instances'], 'functions': ['Convert request specifications to resource requirements', 'Select optimal job based on user requirements', 'Collect instances based on user criteria']}"
batch/batch/publicly_available_images.py,FileType.FILE,hail-is,hail,0.2.133,https://hail.is,https://github.com/hail-is/hail/tree/0.2.133/batch/batch/publicly_available_images.py,"[{'name': 'Decorator', 'match_type': 'partial', 'implemented_parts': ['Function wrapping', 'decorator syntax'], 'confidence': 0.8, 'evidence': ['def publicly_available_images wraps HAIL_GENETICS_IMAGES list']}]",This file defines a function to retrieve publicly available images from a Docker repository.,"{'constants': ['Docker prefix'], 'functions': ['publicly_available_images function']}"
batch/batch/resources.py,FileType.FILE,hail-is,hail,0.2.133,https://hail.is,https://github.com/hail-is/hail/tree/0.2.133/batch/batch/resources.py,"[{'name': 'StatefulObserver', 'match_type': 'partial', 'implemented_parts': ['StatefulSubject', 'StatefulObserver', 'update method', 'context field'], 'confidence': 0.9, 'evidence': ['context field in Observer', 'update method takes context as argument', 'StatefulSubject stores state']}, {'name': 'IteratorPattern', 'match_type': 'full', 'implemented_parts': ['Iterator interface', 'Concrete iterator class', 'hasNext method', 'next method'], 'confidence': 1.0, 'evidence': ['Iterator interface defines abstract methods', 'Concrete iterator class implements methods', 'hasNext and next methods iterate over collection']}]",This file demonstrates state management using observer pattern and iterator pattern.,"{'constants': ['Defines constants for iteration'], 'types': ['Custom types for observer and iterator'], 'classes': ['StatefulSubject manages state', 'ConcreteIterator implements iteration', 'Observer interacts with state'], 'functions': ['update broadcasts state changes', 'hasNext and next iterate over elements', 'notify observers when state changes']}"
batch/batch/resource_usage.py,FileType.FILE,hail-is,hail,0.2.133,https://hail.is,https://github.com/hail-is/hail/tree/0.2.133/batch/batch/resource_usage.py,"[{'name': 'Data Access Layer', 'match_type': 'partial', 'implemented_parts': ['Database connection', 'CRUD operations'], 'confidence': 0.9, 'evidence': ['SQL statements', 'data access layer methods']}, {'name': 'Caching', 'match_type': 'partial', 'implemented_parts': ['Cache implementation', 'cache retrieval'], 'confidence': 0.8, 'evidence': ['hash table data structure', 'cache expiration logic']}]",This file provides access to and manipulation of data from a persistent storage.,"{'constants': ['Defines database connection parameters'], 'types': ['Data models representing records'], 'classes': ['DataAccess class handles database operations'], 'functions': ['fetch retrieves data', 'create inserts data', 'update modifies data', 'delete deletes data']}"
batch/batch/semaphore.py,FileType.FILE,hail-is,hail,0.2.133,https://hail.is,https://github.com/hail-is/hail/tree/0.2.133/batch/batch/semaphore.py,"[{'name': 'Context Manager', 'match_type': 'partial', 'implemented_parts': ['__aenter__ method', '__aexit__ method', 'NullWeightedSemaphore instance'], 'confidence': 0.9, 'evidence': ['async context management', 'NullWeightedSemaphore class', '__call__ method with weight argument']}, {'name': 'Weighted Semaphore', 'match_type': 'full', 'implemented_parts': ['Value tracking', 'Queue for awaiting requests'], 'confidence': 1.0, 'evidence': ['FIFOWeightedSemaphore class', 'acquire method checks value and queue', 'release method increments value and notifies waiters']}]",This file implements a weighted semaphore for asynchronous event handling.,"{'constants': ['Defines constants for event processing'], 'types': ['Custom types for semaphore management'], 'classes': ['ANullContextManager', 'NullWeightedSemaphore', 'FIFOWeightedSemaphoreContextManager', 'FIFOWeightedSemaphore'], 'functions': ['Weighted semaphore functions for acquire and release']}"
