filename,type,author,repo,version,wiki,url,patterns,purpose,summary
hail/src/main/scala/is/hail/io/reference/LiftOver.scala,FileType.FILE,hail-is,hail,0.2.133,https://hail.is,https://github.com/hail-is/hail/tree/0.2.133/hail/src/main/scala/is/hail/io/reference/LiftOver.scala,"[{'name': 'LiftOver', 'match_type': 'partial', 'implemented_parts': ['liftOver method', 'interval class', 'contig map'], 'confidence': 0.9, 'evidence': ['lifting genomic intervals', 'handling different contigs', 'checking interval positions']}, {'name': 'QueryLocus', 'match_type': 'partial', 'implemented_parts': ['queryLocus method', 'liftOver result'], 'confidence': 0.8, 'evidence': ['locating genomic positions', 'handling interval overlaps', 'returning result of liftOver operation']}, {'name': 'ChainFileCheck', 'match_type': 'full', 'implemented_parts': ['checkChainFile method', 'contig map'], 'confidence': 1.0, 'evidence': ['validating chain file integrity', 'checking contig presence']}]",This file provides utilities for lifting genomic intervals between different reference genomes.,"{'constants': ['Defines constants related to liftOver process'], 'types': ['Types for genomic intervals and contigs'], 'classes': ['LiftOver class performs interval lifting'], 'functions': ['liftOver method for lifting intervals', 'queryLocus method for querying loci']}"
hail/src/main/scala/is/hail/io/reference,FileType.DIR,hail-is,hail,0.2.133,https://hail.is,https://github.com/hail-is/hail/tree/0.2.133/hail/src/main/scala/is/hail/io/reference,"[{'name': 'Comparable', 'match_type': 'full', 'implemented_parts': ['compareTo method'], 'confidence': 1.0, 'evidence': ['method signature with two Comparable objects as arguments', 'return value based on comparison of fields', 'presence of equals and hashcode methods']}, {'name': 'LiftOver', 'match_type': 'partial', 'implemented_parts': ['liftOver method', 'interval class', 'contig map'], 'confidence': 0.9, 'evidence': ['lifting genomic intervals', 'handling different contigs', 'checking interval positions']}, {'name': 'QueryLocus', 'match_type': 'partial', 'implemented_parts': ['queryLocus method', 'liftOver result'], 'confidence': 0.8, 'evidence': ['locating genomic positions', 'handling interval overlaps', 'returning result of liftOver operation']}, {'name': 'ChainFileCheck', 'match_type': 'full', 'implemented_parts': ['checkChainFile method', 'contig map'], 'confidence': 1.0, 'evidence': ['validating chain file integrity', 'checking contig presence']}]",This file defines utilities for iterating over collections of data and comparing objects.,"{'constants': ['Defines constant for empty collection'], 'types': ['Generic type for iterators'], 'classes': ['Comparable interface defines comparison contract'], 'functions': ['Iterators provide methods for traversing collections', 'compareTo method facilitates object comparisons']}"
hail/src/main/scala/is/hail/io/tabix/TabixReader.scala,FileType.FILE,hail-is,hail,0.2.133,https://hail.is,https://github.com/hail-is/hail/tree/0.2.133/hail/src/main/scala/is/hail/io/tabix/TabixReader.scala,"[{'name': 'Iterator pattern', 'match_type': 'partial', 'implemented_parts': ['AbstractIterator', 'Iterator methods'], 'confidence': 0.95, 'evidence': ['class TabixLineIterator', 'virtualSeek method', 'next method iterates over lines']}, {'name': 'Decorator pattern', 'match_type': 'partial', 'implemented_parts': ['LineReaderDecorator', 'BGzipLineReader'], 'confidence': 0.85, 'evidence': ['class TabixLineIterator wraps LineReader', 'decorator pattern allows customization of reader behavior']}]",This file implements efficient line reading functionality for tabix files.,"{'constants': ['Defines tabix-related constants'], 'types': ['Custom types for tabix file handling'], 'classes': ['LineReader class reads tabix files', 'Decorator class enhances LineReader'], 'functions': ['read next line efficiently', 'seek to specific line']}"
hail/src/main/scala/is/hail/io/tabix,FileType.DIR,hail-is,hail,0.2.133,https://hail.is,https://github.com/hail-is/hail/tree/0.2.133/hail/src/main/scala/is/hail/io/tabix,"[{'name': 'Iterator pattern', 'match_type': 'partial', 'implemented_parts': ['AbstractIterator', 'Iterator methods'], 'confidence': 0.95, 'evidence': ['class TabixLineIterator', 'virtualSeek method', 'next method iterates over lines']}, {'name': 'Decorator pattern', 'match_type': 'partial', 'implemented_parts': ['LineReaderDecorator', 'BGzipLineReader'], 'confidence': 0.85, 'evidence': ['class TabixLineIterator wraps LineReader', 'decorator pattern allows customization of reader behavior']}]",This file implements efficient line reading functionality for tabix files.,"{'constants': ['Defines tabix-related constants'], 'types': ['Custom types for tabix file handling'], 'classes': ['LineReader class reads tabix files', 'Decorator class enhances LineReader'], 'functions': ['read next line efficiently', 'seek to specific line']}"
hail/src/main/scala/is/hail/io/vcf/ExportVCF.scala,FileType.FILE,hail-is,hail,0.2.133,https://hail.is,https://github.com/hail-is/hail/tree/0.2.133/hail/src/main/scala/is/hail/io/vcf/ExportVCF.scala,"[{'name': 'Field Lookup', 'match_type': 'partial', 'implemented_parts': ['Field index retrieval', 'Type comparison'], 'confidence': 0.9, 'evidence': ['rowType.fieldIdx.get(fieldName)', 'expectedTypeOpt.forall(t == _)', 'rowType.types(idx)']}, {'name': 'Tabix Index Creation', 'match_type': 'full', 'implemented_parts': ['Tabix index building', 'Feature extraction'], 'confidence': 1.0, 'evidence': ['new TabixIndexCreator(TabixFormat.VCF)', 'lines.readLine()', 'tabix.addFeature']}]",This code includes field lookup functionality and tabix index creation for VCF files.,"{'constants': ['None'], 'types': ['TStruct, String, Option[Type]'], 'classes': ['SimpleFeature'], 'functions': ['lookupVAField', 'apply']}"
hail/src/main/scala/is/hail/io/vcf/LoadVCF.scala,FileType.FILE,hail-is,hail,0.2.133,https://hail.is,https://github.com/hail-is/hail/tree/0.2.133/hail/src/main/scala/is/hail/io/vcf/LoadVCF.scala,"[{'name': 'GenomeBrowserInteraction', 'match_type': 'partial', 'implemented_parts': ['Region selection', 'Haplotype state management', 'Filtering and replacement of text', 'Sample header processing', 'Reference genome handling'], 'confidence': 0.95, 'evidence': ['class HailStateManager', 'class Region', 'class PStruct', 'TextInputFilterAndReplace', 'Set[String]', 'ReferenceGenome']}, {'name': 'ConcurrencyControl', 'match_type': 'full', 'implemented_parts': ['Element region tracking', 'Memory management'], 'confidence': 1.0, 'evidence': ['Settable[Region] elementRegion', 'requiresMemoryManagementPerElement', 'LproduceElement label']}]",This file interacts with a genome browser to analyze haplotypes from sequence data.,"{'constants': ['Defines constants for element tracking'], 'types': ['Custom types for haplotype analysis'], 'classes': ['HailStateManager for haplotype management'], 'functions': ['Element processing pipeline']}"
hail/src/main/scala/is/hail/io/vcf/TabixReadVCFIterator.scala,FileType.FILE,hail-is,hail,0.2.133,https://hail.is,https://github.com/hail-is/hail/tree/0.2.133/hail/src/main/scala/is/hail/io/vcf/TabixReadVCFIterator.scala,"[{'name': 'Iterator pattern', 'match_type': 'partial', 'implemented_parts': ['Iterator interface', 'hasNext method', 'next method'], 'confidence': 0.9, 'evidence': ['interface definition with hasNext() and next() methods', 'class implements Iterator interface', 'iterating over a collection of elements']}, {'name': 'Decorator pattern', 'match_type': 'partial', 'implemented_parts': ['Transformer class', 'filterAndReplace method', 'linesIter variable'], 'confidence': 0.8, 'evidence': ['transformer class with filterAndReplace method', 'linesIter initialized with a Transformer object', 'lines are transformed before parsing']}]",This code implements a line parser for reading entries from a VCF file.,"{'constants': ['Defines constants related to VCF file format'], 'types': ['Custom types for various data structures'], 'classes': ['RegionValueBuilder constructs region-value pairs'], 'functions': ['parseLine method reads and parses VCF lines']}"
hail/src/main/scala/is/hail/io/vcf,FileType.DIR,hail-is,hail,0.2.133,https://hail.is,https://github.com/hail-is/hail/tree/0.2.133/hail/src/main/scala/is/hail/io/vcf,"[{'name': 'Iterator pattern', 'match_type': 'partial', 'implemented_parts': ['Iterator interface', 'hasNext method', 'next method'], 'confidence': 0.9, 'evidence': ['interface definition with hasNext() and next() methods', 'class implements Iterator interface', 'iterating over a collection of elements']}, {'name': 'Decorator pattern', 'match_type': 'partial', 'implemented_parts': ['Transformer class', 'filterAndReplace method', 'linesIter variable'], 'confidence': 0.8, 'evidence': ['transformer class with filterAndReplace method', 'linesIter initialized with a Transformer object', 'lines are transformed before parsing']}]",This code implements a line parser for reading entries from a VCF file.,"{'constants': ['Defines constants related to VCF file format'], 'types': ['Custom types for various data structures'], 'classes': ['RegionValueBuilder constructs region-value pairs'], 'functions': ['parseLine method reads and parses VCF lines']}"
hail/src/main/scala/is/hail/io/AbstractBinaryReader.scala,FileType.FILE,hail-is,hail,0.2.133,https://hail.is,https://github.com/hail-is/hail/tree/0.2.133/hail/src/main/scala/is/hail/io/AbstractBinaryReader.scala,"[{'name': 'Iterator', 'match_type': 'partial', 'implemented_parts': ['Iterator interface', 'hasNext method', 'next method'], 'confidence': 0.9, 'evidence': ['interface with iterable methods', 'class implementing iterator']}, {'name': 'Comparable', 'match_type': 'full', 'implemented_parts': ['compareTo method'], 'confidence': 1.0, 'evidence': ['class implements Comparable', 'compareTo logic']}]",This file defines interfaces and implementations for iterating over collections of data and comparing objects.,"{'constants': ['Defines constants for comparison'], 'types': ['Custom types for iterating'], 'classes': ['AbstractIterator class provides generic iteration'], 'functions': ['compare values based on compareTo method']}"
hail/src/main/scala/is/hail/io/BufferSpecs.scala,FileType.FILE,hail-is,hail,0.2.133,https://hail.is,https://github.com/hail-is/hail/tree/0.2.133/hail/src/main/scala/is/hail/io/BufferSpecs.scala,"[{'name': 'Iterator pattern', 'match_type': 'partial', 'implemented_parts': ['Iterator interface', 'hasNext method', 'next method'], 'confidence': 0.95, 'evidence': ['interface with iterable methods', 'recursive implementation']}, {'name': 'Decorator pattern', 'match_type': 'full', 'implemented_parts': ['Decorator class', 'decorator methods'], 'confidence': 1.0, 'evidence': ['wraps original object', 'additional functionality']}, {'name': 'Command pattern', 'match_type': 'partial', 'implemented_parts': ['Command interface', 'execute method'], 'confidence': 0.85, 'evidence': ['abstract command class', 'concrete command implementations']}]",This file implements reusable and extensible command handling functionalities.,"{'constants': ['Defines command-related constants'], 'types': ['Command interface', 'Concrete command types'], 'classes': ['Command class represents a command', 'Receiver class handles commands'], 'functions': ['execute command', 'register command', 'dispatch command']}"
hail/src/main/scala/is/hail/io/ByteArrayReader.scala,FileType.FILE,hail-is,hail,0.2.133,https://hail.is,https://github.com/hail-is/hail/tree/0.2.133/hail/src/main/scala/is/hail/io/ByteArrayReader.scala,"[{'name': 'Iterator', 'match_type': 'partial', 'implemented_parts': ['element', 'hasNext', 'next'], 'confidence': 0.9, 'evidence': ['arr.length', 'position', 'arr(position)']}, {'name': 'StatefulIterator', 'match_type': 'partial', 'implemented_parts': ['position', 'read', 'seek'], 'confidence': 0.8, 'evidence': ['final var position', 'read() method', 'seek(pos) method']}]",This file defines a class for reading bytes from an array in a sequential order.,"{'constants': ['None'], 'types': ['Array[Byte]'], 'classes': ['ByteArrayReader'], 'functions': ['read', 'readArray', 'seek', 'skipBytes', 'hasNext']}"
hail/src/main/scala/is/hail/io/CodecSpec.scala,FileType.FILE,hail-is,hail,0.2.133,https://hail.is,https://github.com/hail-is/hail/tree/0.2.133/hail/src/main/scala/is/hail/io/CodecSpec.scala,"[{'name': 'Data Structure Factory', 'match_type': 'partial', 'implemented_parts': ['create_* methods', 'generic type parameter', 'constructor with optional parameters'], 'confidence': 0.9, 'evidence': ['interface DataStructureFactory', 'method signatures with <T>', 'default values for optional parameters']}, {'name': 'Iterator Pattern', 'match_type': 'full', 'implemented_parts': ['hasNext', 'next', 'iterator class'], 'confidence': 1.0, 'evidence': ['class implementing Iterable', 'hasNext() and next() methods', 'custom iterator class with specific methods']}]",This file defines a factory for creating various data structures.,"{'constants': ['Defines constants related to data structures'], 'types': ['Generic type parameter for data structures'], 'classes': ['DataStructureFactory class'], 'functions': ['create* methods for different data structures']}"
hail/src/main/scala/is/hail/io/Decoder.scala,FileType.FILE,hail-is,hail,0.2.133,https://hail.is,https://github.com/hail-is/hail/tree/0.2.133/hail/src/main/scala/is/hail/io/Decoder.scala,"[{'name': 'Decoder', 'match_type': 'partial', 'implemented_parts': ['Reads data from input buffer', 'Provides access to region values', 'Closeable interface'], 'confidence': 0.95, 'evidence': ['readByte method', 'readRegionValue method', 'close method']}, {'name': 'CompiledDecoder', 'match_type': 'partial', 'implemented_parts': ['Extends Decoder', 'Uses compiled function for region value reading'], 'confidence': 0.9, 'evidence': ['constructor takes compiled function as argument', 'readRegionValue method delegates to compiled function']}, {'name': 'ByteArrayDecoder', 'match_type': 'partial', 'implemented_parts': ['Reads data from ByteArrayInputStream', 'Provides access to region values from bytes'], 'confidence': 0.85, 'evidence': ['regionValueFromBytes method', 'set method', 'readValue method']}]",This file defines classes for decoding data structures.,"{'constants': ['None'], 'types': ['PType, DecoderAsmFunction'], 'classes': ['Decoder: Base class for data decoders', 'CompiledDecoder: Specialized decoder using compiled function', 'ByteArrayDecoder: Decoder for reading data from byte array'], 'functions': ['readByte, readRegionValue, seek methods']}"
hail/src/main/scala/is/hail/io/DoubleInputBuffer.scala,FileType.FILE,hail-is,hail,0.2.133,https://hail.is,https://github.com/hail-is/hail/tree/0.2.133/hail/src/main/scala/is/hail/io/DoubleInputBuffer.scala,"[{'name': 'Iterator', 'match_type': 'partial', 'implemented_parts': ['Iterator interface', 'hasNext method', 'next method'], 'confidence': 0.9, 'evidence': ['implements Iterable interface', 'defines current element']}, {'name': 'Comparable', 'match_type': 'full', 'implemented_parts': ['compareTo method'], 'confidence': 1.0, 'evidence': ['defines comparison logic', 'returns 0 for equality']}]",This file defines classes that handle iteration and sorting of data.,"{'constants': ['Defines constants for comparison'], 'types': ['Custom types implementing Comparable'], 'classes': ['Iterator class manages iteration', 'Comparable interface defines sorting'], 'functions': ['compare values', 'iterate over collections']}"
hail/src/main/scala/is/hail/io/ElasticsearchConnector.scala,FileType.FILE,hail-is,hail,0.2.133,https://hail.is,https://github.com/hail-is/hail/tree/0.2.133/hail/src/main/scala/is/hail/io/ElasticsearchConnector.scala,"[{'name': 'Singleton', 'match_type': 'full', 'implemented_parts': ['Singleton instance', 'get_instance method'], 'confidence': 1.0, 'evidence': ['private constructor', 'static get_instance']}, {'name': 'Exportable', 'match_type': 'partial', 'implemented_parts': ['export method'], 'confidence': 0.9, 'evidence': ['spark DataFrame as input', 'elasticsearch connection parameters']}]",This file provides an Elasticsearch connector for exporting data.,"{'constants': ['Defines Elasticsearch connection parameters'], 'types': ['Spark DataFrame'], 'classes': ['ElasticsearchConnector class for exporting data'], 'functions': ['export method for DataFrame to Elasticsearch']}"
hail/src/main/scala/is/hail/io/Encoder.scala,FileType.FILE,hail-is,hail,0.2.133,https://hail.is,https://github.com/hail-is/hail/tree/0.2.133/hail/src/main/scala/is/hail/io/Encoder.scala,"[{'name': 'StatefulObserver', 'match_type': 'partial', 'implemented_parts': ['StatefulObserver class', 'update method', 'store state field'], 'confidence': 0.9, 'evidence': ['StatefulObserver extends Observer', 'update method receives state', 'store state field holds internal state']}, {'name': 'DecoratorPattern', 'match_type': 'full', 'implemented_parts': ['Decorator class', 'decorator method', 'decorated method call'], 'confidence': 1.0, 'evidence': ['Decorator class wraps another object', 'decorator method modifies behavior', ""decorated method call uses original object's methods""]}]",This file implements a stateful observer pattern and a decorator pattern.,"{'constants': ['Defines observer-related constants'], 'types': ['Custom types for observer pattern'], 'classes': ['StatefulObserver class manages stateful listeners', 'Decorator class wraps another object with additional functionality'], 'functions': ['update broadcasts state changes', 'decorator method enhances functionality', ""decorated methods access original object's methods""]}"
hail/src/main/scala/is/hail/io/FileWriteMetadata.scala,FileType.FILE,hail-is,hail,0.2.133,https://hail.is,https://github.com/hail-is/hail/tree/0.2.133/hail/src/main/scala/is/hail/io/FileWriteMetadata.scala,"[{'name': 'Data Access Object', 'match_type': 'partial', 'implemented_parts': ['CRUD operations'], 'confidence': 0.75, 'evidence': ['save_state', 'restore_state']}]",This file defines a data access object for writing metadata to a file.,"{'constants': [], 'types': ['FileWriteMetadata class'], 'classes': ['FileWriteMetadata class'], 'functions': ['render method for metadata string']}"
hail/src/main/scala/is/hail/io/HadoopFSDataBinaryReader.scala,FileType.FILE,hail-is,hail,0.2.133,https://hail.is,https://github.com/hail-is/hail/tree/0.2.133/hail/src/main/scala/is/hail/io/HadoopFSDataBinaryReader.scala,"[{'name': 'Visitor', 'match_type': 'partial', 'implemented_parts': ['Element accepts Visitors'], 'confidence': 0.8, 'evidence': ['visit method', 'accepts method']}]",This file defines a data reader for interacting with HadoopFS data.,"{'constants': [], 'types': ['SeekableDataInputStream'], 'classes': ['HadoopFSDataBinaryReader'], 'functions': ['read', 'readArray', 'close', 'seek', 'skipBytes', 'getPosition']}"
hail/src/main/scala/is/hail/io/IndexBTree.scala,FileType.FILE,hail-is,hail,0.2.133,https://hail.is,https://github.com/hail-is/hail/tree/0.2.133/hail/src/main/scala/is/hail/io/IndexBTree.scala,"[{'name': 'Iterator', 'match_type': 'partial', 'implemented_parts': ['next method', 'current method'], 'confidence': 0.9, 'evidence': ['class with next method', 'field representing current item']}, {'name': 'Comparable', 'match_type': 'full', 'implemented_parts': ['compareTo method'], 'confidence': 1.0, 'evidence': ['interface with compareTo method']}]",This file implements an iterator pattern for iterating over a collection of elements.,"{'constants': ['Defines iterator-related constants'], 'types': ['Custom iterator type'], 'classes': ['Iterator class provides iteration methods'], 'functions': ['iterate over elements', 'compare elements']}"
hail/src/main/scala/is/hail/io/IndexedBinaryBlockReader.scala,FileType.FILE,hail-is,hail,0.2.133,https://hail.is,https://github.com/hail-is/hail/tree/0.2.133/hail/src/main/scala/is/hail/io/IndexedBinaryBlockReader.scala,"[{'name': 'Observer', 'match_type': 'partial', 'implemented_parts': ['Subject', 'Observer', 'notify method'], 'confidence': 0.8, 'evidence': ['class Subject', 'notify observers', 'on_change handler']}, {'name': 'Singleton', 'match_type': 'full', 'implemented_parts': ['Singleton instance', 'get_instance method'], 'confidence': 1.0, 'evidence': ['private constructor', 'static get_instance']}]",This file implements a notification system for managing event listeners.,"{'constants': ['Defines event-related constants'], 'types': ['Custom types for event handling'], 'classes': ['Subject class manages observers', 'Observer class represents listeners'], 'functions': ['notify updates observers', 'attach adds listeners']}"
