filename,type,author,repo,version,wiki,url,patterns,purpose,summary
hail/src/test/resources/backward_compatability/1.6.0/matrix_table/6.hmt/cols/rows,FileType.DIR,hail-is,hail,0.2.133,https://hail.is,https://github.com/hail-is/hail/tree/0.2.133/hail/src/test/resources/backward_compatability/1.6.0/matrix_table/6.hmt/cols/rows,[],This directory includes resource files related to backward compatibility testing of Hail.,"{'constants': [], 'types': [], 'classes': [], 'functions': []}"
hail/src/test/resources/backward_compatability/1.6.0/matrix_table/6.hmt/cols/README.txt,FileType.FILE,hail-is,hail,0.2.133,https://hail.is,https://github.com/hail-is/hail/tree/0.2.133/hail/src/test/resources/backward_compatability/1.6.0/matrix_table/6.hmt/cols/README.txt,"[{'name': 'Memento', 'match_type': 'partial', 'implemented_parts': ['Originator', 'Memento', 'Caretaker'], 'confidence': 0.7, 'evidence': ['create_memento', 'save_state', 'restore_state']}, {'name': 'Visitor', 'match_type': 'partial', 'implemented_parts': ['Visitor', 'Element'], 'confidence': 0.8, 'evidence': ['visit method', 'accept method']}]",This file describes the README file of a Hail table.,"{'constants': [], 'types': [], 'classes': [], 'functions': []}"
hail/src/test/resources/backward_compatability/1.6.0/matrix_table/6.hmt/cols/_SUCCESS,FileType.FILE,hail-is,hail,0.2.133,https://hail.is,https://github.com/hail-is/hail/tree/0.2.133/hail/src/test/resources/backward_compatability/1.6.0/matrix_table/6.hmt/cols/_SUCCESS,"[{'name': 'Mediator', 'match_type': 'full', 'implemented_parts': ['Centralizes communication', 'Colleagues communicate through Mediator'], 'confidence': 1.0, 'evidence': ['Mediator class', 'Colleagues method calls mediator']}, {'name': 'Memento', 'match_type': 'partial', 'implemented_parts': ['State capture', 'Memento storage'], 'confidence': 0.8, 'evidence': ['Memento pattern terminology', 'save_state method']}, {'name': 'Visitor', 'match_type': 'partial', 'implemented_parts': ['Dynamically adds operations', 'Element accepts Visitors'], 'confidence': 0.7, 'evidence': ['Visitor pattern terminology', 'visit method on Element']}]",This file implements communication and state management functionalities.,"{'constants': ['Defines communication-related constants'], 'types': ['Custom types for communication and state'], 'classes': ['Mediator centralizes communication', 'Memento captures state'], 'functions': ['Coordinate actions', 'Send messages', 'Save and restore state']}"
hail/src/test/resources/backward_compatability/1.6.0/matrix_table/6.hmt/entries/rows/parts,FileType.DIR,hail-is,hail,0.2.133,https://hail.is,https://github.com/hail-is/hail/tree/0.2.133/hail/src/test/resources/backward_compatability/1.6.0/matrix_table/6.hmt/entries/rows/parts,[],This directory contains resource files for testing backward compatibility of Hail features.,"{'constants': [], 'types': [], 'classes': [], 'functions': []}"
hail/src/test/resources/backward_compatability/1.6.0/matrix_table/6.hmt/entries/rows,FileType.DIR,hail-is,hail,0.2.133,https://hail.is,https://github.com/hail-is/hail/tree/0.2.133/hail/src/test/resources/backward_compatability/1.6.0/matrix_table/6.hmt/entries/rows,[],This directory contains test resources related to backward compatibility testing for the Hail project.,"{'constants': [], 'types': [], 'classes': [], 'functions': []}"
hail/src/test/resources/backward_compatability/1.6.0/matrix_table/6.hmt/entries/README.txt,FileType.FILE,hail-is,hail,0.2.133,https://hail.is,https://github.com/hail-is/hail/tree/0.2.133/hail/src/test/resources/backward_compatability/1.6.0/matrix_table/6.hmt/entries/README.txt,"[{'name': 'Memento', 'match_type': 'partial', 'implemented_parts': ['Originator', 'Memento', 'Caretaker'], 'confidence': 0.8, 'evidence': ['create_memento method', 'save_state method', 'restore_state method']}, {'name': 'Visitor', 'match_type': 'partial', 'implemented_parts': ['Visitor', 'Element'], 'confidence': 0.7, 'evidence': ['visit method', 'accept method']}]",This file describes a Hail table or matrix table.,"{'constants': [], 'types': [], 'classes': [], 'functions': []}"
hail/src/test/resources/backward_compatability/1.6.0/matrix_table/6.hmt/entries/_SUCCESS,FileType.FILE,hail-is,hail,0.2.133,https://hail.is,https://github.com/hail-is/hail/tree/0.2.133/hail/src/test/resources/backward_compatability/1.6.0/matrix_table/6.hmt/entries/_SUCCESS,"[{'name': 'Mediator', 'match_type': 'partial', 'implemented_parts': ['Centralized communication', 'Mediator role'], 'confidence': 0.8, 'evidence': ['Central communication facilitated by Mediator', 'Colleagues communicate through Mediator']}, {'name': 'Memento', 'match_type': 'partial', 'implemented_parts': ['State capture', 'Memento pattern'], 'confidence': 0.7, 'evidence': ['Originator creates Memento', 'Caretaker stores and restores state']}, {'name': 'Visitor', 'match_type': 'partial', 'implemented_parts': ['Visitor pattern', 'Dynamic dispatch'], 'confidence': 0.8, 'evidence': ['Visitor adds operations', 'Element accepts Visitors']}]",This file defines a matrix table that tracks compatibility between different versions of Hail.,"{'constants': ['Defines table headers and cell values'], 'types': ['Custom type for matrix cell'], 'classes': ['MatrixTable class represents the table'], 'functions': ['get_compatibility method retrieves compatibility data']}"
hail/src/test/resources/backward_compatability/1.6.0/matrix_table/6.hmt/entries,FileType.DIR,hail-is,hail,0.2.133,https://hail.is,https://github.com/hail-is/hail/tree/0.2.133/hail/src/test/resources/backward_compatability/1.6.0/matrix_table/6.hmt/entries,"[{'name': 'Memento', 'match_type': 'partial', 'implemented_parts': ['Originator', 'Memento', 'Caretaker'], 'confidence': 0.8, 'evidence': ['create_memento method', 'save_state method', 'restore_state method']}, {'name': 'Visitor', 'match_type': 'partial', 'implemented_parts': ['Visitor', 'Element'], 'confidence': 0.7, 'evidence': ['visit method', 'accept method']}, {'name': 'Mediator', 'match_type': 'partial', 'implemented_parts': ['Centralized communication', 'Mediator role'], 'confidence': 0.8, 'evidence': ['Central communication facilitated by Mediator', 'Colleagues communicate through Mediator']}, {'name': 'Memento', 'match_type': 'partial', 'implemented_parts': ['State capture', 'Memento pattern'], 'confidence': 0.7, 'evidence': ['Originator creates Memento', 'Caretaker stores and restores state']}, {'name': 'Visitor', 'match_type': 'partial', 'implemented_parts': ['Visitor pattern', 'Dynamic dispatch'], 'confidence': 0.8, 'evidence': ['Visitor adds operations', 'Element accepts Visitors']}]",This file defines a matrix table that tracks compatibility between different versions of Hail.,"{'constants': ['Defines table headers and cell values'], 'types': ['Custom type for matrix cell'], 'classes': ['MatrixTable class represents the table'], 'functions': ['get_compatibility method retrieves compatibility data']}"
hail/src/test/resources/backward_compatability/1.6.0/matrix_table/6.hmt/globals/globals/parts/part-0,FileType.FILE,hail-is,hail,0.2.133,https://hail.is,https://github.com/hail-is/hail/tree/0.2.133/hail/src/test/resources/backward_compatability/1.6.0/matrix_table/6.hmt/globals/globals/parts/part-0,"[{'name': 'Mediator', 'match_type': 'partial', 'implemented_parts': ['Mediator role', 'notify method'], 'confidence': 0.8, 'evidence': ['Mediator class', 'communication through notify method']}]",The file defines a mediator pattern for centralizing communication between components.,"{'classes': ['Mediator class facilitates communication'], 'methods': ['notify method sends messages between components']}"
hail/src/test/resources/backward_compatability/1.6.0/matrix_table/6.hmt/globals/globals/parts,FileType.DIR,hail-is,hail,0.2.133,https://hail.is,https://github.com/hail-is/hail/tree/0.2.133/hail/src/test/resources/backward_compatability/1.6.0/matrix_table/6.hmt/globals/globals/parts,"[{'name': 'Mediator', 'match_type': 'partial', 'implemented_parts': ['Mediator role', 'notify method'], 'confidence': 0.8, 'evidence': ['Mediator class', 'communication through notify method']}]",The directory defines a mediator pattern for centralizing communication between components.,"{'classes': ['Mediator class facilitates communication'], 'methods': ['notify method sends messages between components']}"
hail/src/test/resources/backward_compatability/1.6.0/matrix_table/6.hmt/globals/globals,FileType.DIR,hail-is,hail,0.2.133,https://hail.is,https://github.com/hail-is/hail/tree/0.2.133/hail/src/test/resources/backward_compatability/1.6.0/matrix_table/6.hmt/globals/globals,[],This directory contains header files related to backward compatibility testing of a hail-is project.,"{'constants': [], 'types': [], 'classes': [], 'functions': []}"
hail/src/test/resources/backward_compatability/1.6.0/matrix_table/6.hmt/globals/rows/parts,FileType.DIR,hail-is,hail,0.2.133,https://hail.is,https://github.com/hail-is/hail/tree/0.2.133/hail/src/test/resources/backward_compatability/1.6.0/matrix_table/6.hmt/globals/rows/parts,[],This directory contains header files for various data structures used in the Hail project.,"{'constants': [], 'types': [], 'classes': [], 'functions': []}"
hail/src/test/resources/backward_compatability/1.6.0/matrix_table/6.hmt/globals/rows,FileType.DIR,hail-is,hail,0.2.133,https://hail.is,https://github.com/hail-is/hail/tree/0.2.133/hail/src/test/resources/backward_compatability/1.6.0/matrix_table/6.hmt/globals/rows,[],This directory contains header files defining data structures and helper functions for matrix table manipulation.,"{'constants': [], 'types': [], 'classes': [], 'functions': []}"
hail/src/test/resources/backward_compatability/1.6.0/matrix_table/6.hmt/globals/README.txt,FileType.FILE,hail-is,hail,0.2.133,https://hail.is,https://github.com/hail-is/hail/tree/0.2.133/hail/src/test/resources/backward_compatability/1.6.0/matrix_table/6.hmt/globals/README.txt,"[{'name': 'Memento', 'match_type': 'partial', 'implemented_parts': ['Originator', 'Memento', 'Caretaker'], 'confidence': 0.7, 'evidence': ['create_memento method', 'save_state and restore_state methods', 'Originator relationship with Memento']}, {'name': 'Visitor', 'match_type': 'partial', 'implemented_parts': ['Visitor', 'Element'], 'confidence': 0.6, 'evidence': ['visit method', 'accept method', 'Element relationship with Visitor']}]",This file provides backward compatibility for an older Hail Table.,"{'constants': ['Version information'], 'classes': ['Native Table or MatrixTable'], 'functions': []}"
hail/src/test/resources/backward_compatability/1.6.0/matrix_table/6.hmt/globals/_SUCCESS,FileType.FILE,hail-is,hail,0.2.133,https://hail.is,https://github.com/hail-is/hail/tree/0.2.133/hail/src/test/resources/backward_compatability/1.6.0/matrix_table/6.hmt/globals/_SUCCESS,"[{'name': 'Mediator', 'match_type': 'full', 'implemented_parts': ['Centralized communication', 'Mediator role'], 'confidence': 0.95, 'evidence': ['Centralized communication through Mediator', 'Methods like mediate, notify']}, {'name': 'Memento', 'match_type': 'partial', 'implemented_parts': ['State capture', 'Memento pattern elements'], 'confidence': 0.75, 'evidence': ['State saving with create_memento and restore_state methods']}, {'name': 'Visitor', 'match_type': 'partial', 'implemented_parts': ['Dynamic visitor pattern', 'Visitor-Element interaction'], 'confidence': 0.85, 'evidence': ['Visitor class with visit method', 'Element class with accept method']}]",This file defines communication and state management patterns.,"{'constants': ['Defines various communication-related constants'], 'types': ['Custom types for communication patterns'], 'classes': ['Mediator facilitates central communication', 'Memento captures state'], 'functions': ['Mediator methods for communication', 'State management methods for Memento']}"
hail/src/test/resources/backward_compatability/1.6.0/matrix_table/6.hmt/index/part-0-f66dad92-59e7-42d8-bc24-d2ed5f3ac724.idx,FileType.DIR,hail-is,hail,0.2.133,https://hail.is,https://github.com/hail-is/hail/tree/0.2.133/hail/src/test/resources/backward_compatability/1.6.0/matrix_table/6.hmt/index/part-0-f66dad92-59e7-42d8-bc24-d2ed5f3ac724.idx,[],This directory contains a matrix table index file generated by the Hail compatibility tool.,"{'constants': [], 'types': [], 'classes': [], 'functions': []}"
hail/src/test/resources/backward_compatability/1.6.0/matrix_table/6.hmt/index/part-1-e5426b09-ba2d-43ec-855e-cf6b2d9d56fc.idx,FileType.DIR,hail-is,hail,0.2.133,https://hail.is,https://github.com/hail-is/hail/tree/0.2.133/hail/src/test/resources/backward_compatability/1.6.0/matrix_table/6.hmt/index/part-1-e5426b09-ba2d-43ec-855e-cf6b2d9d56fc.idx,[],This directory contains a matrix table index file with associated metadata.,"{'constants': [], 'types': [], 'classes': [], 'functions': []}"
hail/src/test/resources/backward_compatability/1.6.0/matrix_table/6.hmt/index,FileType.DIR,hail-is,hail,0.2.133,https://hail.is,https://github.com/hail-is/hail/tree/0.2.133/hail/src/test/resources/backward_compatability/1.6.0/matrix_table/6.hmt/index,[],This directory contains test resources for backward compatibility testing.,"{'constants': [], 'types': [], 'classes': [], 'functions': []}"
hail/src/test/resources/backward_compatability/1.6.0/matrix_table/6.hmt/rows/rows/parts,FileType.DIR,hail-is,hail,0.2.133,https://hail.is,https://github.com/hail-is/hail/tree/0.2.133/hail/src/test/resources/backward_compatability/1.6.0/matrix_table/6.hmt/rows/rows/parts,[],This directory contains resource files for testing compatibility with older versions of the Hail product.,"{'constants': [], 'types': [], 'classes': [], 'functions': []}"
hail/src/test/resources/backward_compatability/1.6.0/matrix_table/6.hmt/rows/rows,FileType.DIR,hail-is,hail,0.2.133,https://hail.is,https://github.com/hail-is/hail/tree/0.2.133/hail/src/test/resources/backward_compatability/1.6.0/matrix_table/6.hmt/rows/rows,[],This directory contains header files for unit tests related to the 'backward compatibility' feature.,"{'constants': [], 'types': [], 'classes': [], 'functions': []}"
