filename,type,author,repo,version,wiki,url,patterns,purpose,summary
ci/ci/constants.py,FileType.FILE,hail-is,hail,0.2.133,https://hail.is,https://github.com/hail-is/hail/tree/0.2.133/ci/ci/constants.py,"[{'name': 'Singleton', 'match_type': 'full', 'implemented_parts': ['Singleton instance', 'get_instance method'], 'confidence': 1.0, 'evidence': ['private constructor', 'static get_instance']}, {'name': 'Data Class', 'match_type': 'partial', 'implemented_parts': ['User class with attributes'], 'confidence': 0.75, 'evidence': ['Class has attributes like username and teams', 'Methods for accessing/modifying these attributes']}]",This file defines data structures and related methods.,"{'constants': ['Defined at the top of the file'], 'types': ['Custom type for User'], 'classes': ['User class with attributes'], 'functions': ['Constructor for User class']}"
ci/ci/environment.py,FileType.FILE,hail-is,hail,0.2.133,https://hail.is,https://github.com/hail-is/hail/tree/0.2.133/ci/ci/environment.py,"[{'name': 'Global Configuration Retrieval', 'match_type': 'partial', 'implemented_parts': ['Importing configuration functions', 'Retrieving global config'], 'confidence': 0.9, 'evidence': ['import statements for get_gcp_config, get_azure_config, get_global_config', 'global_config = get_global_config()']}, {'name': 'Environment Variable Retrieval', 'match_type': 'partial', 'implemented_parts': ['Retrieving environment variables', 'Accessing CI_UTILS_IMAGE'], 'confidence': 0.8, 'evidence': [""os.environ['HAIL_CI_UTILS_IMAGE']"", 'similar retrieval for other environment variables']}]",This file loads environment-specific configurations and retrieves relevant values from the global configuration.,"{'constants': ['Defines environment-related constants'], 'types': ['Data structures for configurations'], 'classes': ['None'], 'functions': ['Functions for loading and retrieving configurations']}"
ci/ci/envoy.py,FileType.FILE,hail-is,hail,0.2.133,https://hail.is,https://github.com/hail-is/hail/tree/0.2.133/ci/ci/envoy.py,"[{'name': 'CentralizedConfigProvider', 'match_type': 'partial', 'implemented_parts': ['configuration retrieval', 'data caching'], 'confidence': 0.95, 'evidence': ['external config API call', 'cached data access']}, {'name': 'RateLimiter', 'match_type': 'full', 'implemented_parts': ['request throttling', 'rate calculation'], 'confidence': 1.0, 'evidence': ['rate limiting algorithm', 'API endpoint protection']}]",This file manages central configuration and rate limiting for the application.,"{'constants': ['Defines constants for rate limiting'], 'types': ['Custom types for configuration data'], 'classes': ['ConfigProvider class fetches and caches configuration'], 'functions': ['get configuration method', 'calculate rate limiting']}"
ci/ci/github.py,FileType.FILE,hail-is,hail,0.2.133,https://hail.is,https://github.com/hail-is/hail/tree/0.2.133/ci/ci/github.py,"[{'name': 'MVC Architecture', 'match_type': 'partial', 'implemented_parts': ['Controller', 'Model', 'View', 'routes configuration', 'data access layer'], 'confidence': 0.9, 'evidence': ['use of request/response model', 'separation of business logic', 'database access methods']}, {'name': 'Dependency Injection', 'match_type': 'full', 'implemented_parts': ['constructor injection', 'dependency tree'], 'confidence': 1.0, 'evidence': ['injection of dependencies through constructor', 'external dependencies registered in a central location']}]",This project follows a clean and modular design based on the MVC architectural pattern.,"{'constants': ['Defines configuration and application settings'], 'types': ['Models represent data entities', 'Controllers handle user requests'], 'classes': ['View components display information', 'Router manages request routing'], 'functions': ['Data access methods retrieve and manipulate data']}"
ci/ci/globals.py,FileType.FILE,hail-is,hail,0.2.133,https://hail.is,https://github.com/hail-is/hail/tree/0.2.133/ci/ci/globals.py,[],Defines a variable to determine if the current deployment is a test environment.,"{'constants': [], 'types': [], 'classes': [], 'functions': []}"
ci/ci/utils.py,FileType.FILE,hail-is,hail,0.2.133,https://hail.is,https://github.com/hail-is/hail/tree/0.2.133/ci/ci/utils.py,"[{'name': 'StatefulController', 'match_type': 'partial', 'implemented_parts': ['StatefulSet', 'Deployment', 'Liveness and Readiness probes', 'Scaling', 'Rolling updates'], 'confidence': 0.95, 'evidence': ['StatefulSet and Deployment resources', 'Liveness and Readiness probes configured', 'Autoscaling enabled', 'Rollback strategy defined']}, {'name': 'MicroserviceArchitecture', 'match_type': 'full', 'implemented_parts': ['REST API', 'Messaging queue', 'Database'], 'confidence': 1.0, 'evidence': ['HTTP server implementation', 'Message queue for asynchronous communication', 'Database connection established']}]",This file describes the architecture of a scalable and resilient microservice application.,"{'constants': ['Defines configuration values'], 'types': ['Custom types for API requests and responses'], 'classes': ['Controllers handle incoming requests'], 'functions': ['Processes API requests', 'Communicates via message queue', 'Manages data persistence']}"
ci/ci/__init__.py,FileType.FILE,hail-is,hail,0.2.133,https://hail.is,https://github.com/hail-is/hail/tree/0.2.133/ci/ci/__init__.py,"[{'name': 'Mediator', 'match_type': 'full', 'implemented_parts': ['Centralizes communication', 'Mediates between Colleagues'], 'confidence': 0.95, 'evidence': ['Centralizes communication between Colleagues', 'Colleagues communicate through Mediator']}, {'name': 'Memento', 'match_type': 'partial', 'implemented_parts': ['State capture', 'State restoration'], 'confidence': 0.8, 'evidence': ['Creates Memento to capture state', 'Restores state from Memento']}, {'name': 'Visitor', 'match_type': 'partial', 'implemented_parts': ['Adds operations', 'Accepts visitors'], 'confidence': 0.75, 'evidence': ['Elements accept Visitors', 'Visitors add operations']}]",This file implements core components for facilitating collaboration and communication between multiple agents.,"{'constants': ['Defines communication-related constants'], 'types': ['Agents, messages'], 'classes': ['Mediator centralizes communication', 'Memento captures state'], 'functions': ['Mediate communication', 'Capture and restore state', 'Add operations to elements']}"
ci/ci/__main__.py,FileType.FILE,hail-is,hail,0.2.133,https://hail.is,https://github.com/hail-is/hail/tree/0.2.133/ci/ci/__main__.py,"[{'name': 'Singleton', 'match_type': 'full', 'implemented_parts': ['Singleton instance', 'get_instance method'], 'confidence': 1.0, 'evidence': ['private constructor', 'static get_instance']}]",Configure logging before importing any other dependencies.,{'functions': ['configure_logging']}
ci/ci,FileType.DIR,hail-is,hail,0.2.133,https://hail.is,https://github.com/hail-is/hail/tree/0.2.133/ci/ci,"[{'name': 'Mediator', 'match_type': 'full', 'implemented_parts': ['Centralizes communication', 'Mediates between Colleagues'], 'confidence': 0.95, 'evidence': ['Centralizes communication between Colleagues', 'Colleagues communicate via Mediator']}, {'name': 'Memento', 'match_type': 'partial', 'implemented_parts': ['State capture', 'State restoration'], 'confidence': 0.8, 'evidence': ['Creates Memento to capture state', 'Restores state from Memento']}, {'name': 'Visitor', 'match_type': 'partial', 'implemented_parts': ['Adds operations', 'Accepts visitors'], 'confidence': 0.75, 'evidence': ['Elements accept Visitors', 'Visitors add operations']}, {'name': 'Singleton', 'match_type': 'full', 'implemented_parts': ['Singleton instance', 'get_instance method'], 'confidence': 1.0, 'evidence': ['private constructor', 'static get_instance']}]",This file implements core components for facilitating collaboration and communication between multiple agents.,"{'constants': ['Defines communication-related constants'], 'types': ['Agents, messages'], 'classes': ['Mediator centralizes communication', 'Memento captures state'], 'functions': ['Mediate communication', 'Capture and restore state', 'Add operations to elements']}"
ci/sql/active-namespaces.sql,FileType.FILE,hail-is,hail,0.2.133,https://hail.is,https://github.com/hail-is/hail/tree/0.2.133/ci/sql/active-namespaces.sql,"[{'name': 'Data Access Object', 'match_type': 'partial', 'implemented_parts': ['CRUD operations', 'Database connection management', 'Table creation and management'], 'confidence': 0.9, 'evidence': ['CREATE TABLE statements', 'INSERT, SELECT, UPDATE, DELETE statements', 'UTC_TIMESTAMP function call']}]",This file defines the data access layer for managing active namespaces and deployed services.,"{'constants': [], 'types': [], 'classes': [], 'functions': []}"
ci/sql/add-frozen-mode.sql,FileType.FILE,hail-is,hail,0.2.133,https://hail.is,https://github.com/hail-is/hail/tree/0.2.133/ci/sql/add-frozen-mode.sql,[],Creates a table to store a flag indicating whether deployments are frozen.,"{'constants': [], 'types': [], 'classes': [], 'functions': []}"
ci/sql/add-service-rate-limits.sql,FileType.FILE,hail-is,hail,0.2.133,https://hail.is,https://github.com/hail-is/hail/tree/0.2.133/ci/sql/add-service-rate-limits.sql,[],Adds a new column called 'rate_limit_rps' to the 'deployed_services' table.,"{'constants': [], 'types': [], 'classes': [], 'functions': []}"
ci/sql/estimated-current.sql,FileType.FILE,hail-is,hail,0.2.133,https://hail.is,https://github.com/hail-is/hail/tree/0.2.133/ci/sql/estimated-current.sql,[],"This file defines tables for managing blockchain data related to hashing, alerts, and namespaces.","{'constants': [], 'types': [], 'classes': [], 'functions': []}"
ci/sql/fix-default-namespace.py,FileType.FILE,hail-is,hail,0.2.133,https://hail.is,https://github.com/hail-is/hail/tree/0.2.133/ci/sql/fix-default-namespace.py,"[{'name': 'Visitor Pattern', 'match_type': 'partial', 'implemented_parts': ['Element accepts Visitors', 'AcceptVisitor method'], 'confidence': 0.9, 'evidence': ['visit method', 'AcceptVisitor abstract class']}]",This file demonstrates the Visitor Pattern for operating on elements without modifying them.,"{'constants': [], 'types': ['Element', 'Visitor'], 'classes': ['Element', 'Visitor'], 'functions': ['visit method', 'AcceptVisitor abstract class']}"
ci/sql/initial.sql,FileType.FILE,hail-is,hail,0.2.133,https://hail.is,https://github.com/hail-is/hail/tree/0.2.133/ci/sql/initial.sql,[],Creates a table to store authorized SHA-1 values.,"{'constants': [], 'types': [], 'classes': [], 'functions': []}"
ci/sql/invalidated-batches.sql,FileType.FILE,hail-is,hail,0.2.133,https://hail.is,https://github.com/hail-is/hail/tree/0.2.133/ci/sql/invalidated-batches.sql,"[{'name': 'Singleton', 'match_type': 'full', 'implemented_parts': ['Singleton instance', 'get_instance method'], 'confidence': 1.0, 'evidence': ['CREATE TABLE statement with primary key', 'INDEX creation']}]",This file defines a database table for storing invalidated batches.,"{'constants': [], 'types': [], 'classes': [], 'functions': []}"
ci/sql/record-failure-notifications.sql,FileType.FILE,hail-is,hail,0.2.133,https://hail.is,https://github.com/hail-is/hail/tree/0.2.133/ci/sql/record-failure-notifications.sql,"[{'name': 'Singleton', 'match_type': 'full', 'implemented_parts': ['Singleton instance', 'get_instance method'], 'confidence': 1.0, 'evidence': ['CREATE TABLE is a singleton pattern', 'primary key constraint implies single instance']}]",This file defines a table for storing failed SHA values.,"{'constants': ['None'], 'types': ['VARCHAR'], 'classes': ['None'], 'functions': ['CREATE TABLE statement']}"
ci/sql,FileType.DIR,hail-is,hail,0.2.133,https://hail.is,https://github.com/hail-is/hail/tree/0.2.133/ci/sql,"[{'name': 'Visitor Pattern', 'match_type': 'partial', 'implemented_parts': ['Element accepts Visitors', 'AcceptVisitor method'], 'confidence': 0.9, 'evidence': ['visit method', 'AcceptVisitor abstract class']}, {'name': 'Singleton', 'match_type': 'full', 'implemented_parts': ['Singleton instance', 'get_instance method'], 'confidence': 1.0, 'evidence': ['CREATE TABLE statement with primary key', 'INDEX creation']}, {'name': 'Singleton', 'match_type': 'full', 'implemented_parts': ['Singleton instance', 'get_instance method'], 'confidence': 1.0, 'evidence': ['CREATE TABLE is a singleton pattern', 'primary key constraint implies single instance']}]","This file defines tables for managing blockchain data related to hashing, alerts, and namespaces.","{'constants': [], 'types': [], 'classes': [], 'functions': []}"
ci/test/envoy/test_gateway_cds_response.yaml,FileType.FILE,hail-is,hail,0.2.133,https://hail.is,https://github.com/hail-is/hail/tree/0.2.133/ci/test/envoy/test_gateway_cds_response.yaml,"[{'name': 'TLS Configuration', 'match_type': 'partial', 'implemented_parts': ['TLS certificate loading', 'TLS validation context setup', 'Upstream TLS context creation'], 'confidence': 0.98, 'evidence': ['filename attributes for certificate and key files', 'validation_context definition', 'TLSContext type configuration']}, {'name': 'Cluster Configuration', 'match_type': 'partial', 'implemented_parts': ['Cluster definition with name and lb_policy', 'Strict DNS resolution type', 'Load assignment configuration'], 'confidence': 0.95, 'evidence': ['Cluster name and lb_policy attributes', 'STRICT_DNS type declaration', 'Load assignment with cluster name and endpoints']}]",This configuration defines TLS-enabled clusters and endpoints for a service.,"{'constants': [], 'types': [], 'classes': [], 'functions': []}"
ci/test/envoy/test_gateway_rds_response.yaml,FileType.FILE,hail-is,hail,0.2.133,https://hail.is,https://github.com/hail-is/hail/tree/0.2.133/ci/test/envoy/test_gateway_rds_response.yaml,"[{'name': 'ExtAuthzFilter', 'match_type': 'partial', 'implemented_parts': ['ExtAuthzPerRoute configuration', 'LocalRateLimit filter'], 'confidence': 0.95, 'evidence': ['type definition for ExtAuthzPerRoute', 'filter configuration for LocalRateLimit', 'stat prefix and token bucket settings']}, {'name': 'VirtualHost Configuration', 'match_type': 'full', 'implemented_parts': ['Domain configuration for internal.hail.is', 'Route definition for /test/bar path'], 'confidence': 1.0, 'evidence': ['domains section with internal.hail.is', 'routes section with path /test/bar', 'LocalRateLimit filter configuration']}]",This configuration defines routing rules and authentication filters for the internal.hail.is domain.,"{'constants': [], 'types': [], 'classes': [], 'functions': []}"
