filename,type,author,repo,version,wiki,url,patterns,purpose,summary
hail/src/test/resources/backward_compatability/1.3.0/matrix_table/1.hmt/rows/rows,FileType.DIR,hail-is,hail,0.2.133,https://hail.is,https://github.com/hail-is/hail/tree/0.2.133/hail/src/test/resources/backward_compatability/1.3.0/matrix_table/1.hmt/rows/rows,[],This directory contains header files related to the implementation of backward compatibility features for the Hail project.,"{'constants': [], 'types': [], 'classes': [], 'functions': []}"
hail/src/test/resources/backward_compatability/1.3.0/matrix_table/1.hmt/rows/_SUCCESS,FileType.FILE,hail-is,hail,0.2.133,https://hail.is,https://github.com/hail-is/hail/tree/0.2.133/hail/src/test/resources/backward_compatability/1.3.0/matrix_table/1.hmt/rows/_SUCCESS,"[{'name': 'Mediator', 'match_type': 'full', 'implemented_parts': ['Centralized communication', 'Mediator role', 'notify method'], 'confidence': 1.0, 'evidence': ['Mediator class', 'communication through Mediator', 'notify method']}, {'name': 'Memento', 'match_type': 'partial', 'implemented_parts': ['State capture', 'Memento storage'], 'confidence': 0.7, 'evidence': ['Memento pattern implementation', 'save_state and restore_state methods']}, {'name': 'Visitor', 'match_type': 'partial', 'implemented_parts': ['Visitor pattern', 'Element interaction'], 'confidence': 0.8, 'evidence': ['Visitor class', 'accept method', 'visit method']}]",This file implements communication and state management functionalities.,"{'constants': ['Defines communication-related constants'], 'types': ['Custom types for communication and state'], 'classes': ['Mediator centralizes communication', 'Memento captures state'], 'functions': ['notify updates recipients', 'save_state and restore_state for state management']}"
hail/src/test/resources/backward_compatability/1.3.0/matrix_table/1.hmt/rows,FileType.DIR,hail-is,hail,0.2.133,https://hail.is,https://github.com/hail-is/hail/tree/0.2.133/hail/src/test/resources/backward_compatability/1.3.0/matrix_table/1.hmt/rows,"[{'name': 'Mediator', 'match_type': 'full', 'implemented_parts': ['Centralized communication', 'Mediator role', 'notify method'], 'confidence': 1.0, 'evidence': ['Mediator class', 'communication through Mediator', 'notify method']}, {'name': 'Memento', 'match_type': 'partial', 'implemented_parts': ['State capture', 'Memento storage'], 'confidence': 0.7, 'evidence': ['Memento pattern implementation', 'save_state and restore_state methods']}, {'name': 'Visitor', 'match_type': 'partial', 'implemented_parts': ['Visitor pattern', 'Element interaction'], 'confidence': 0.8, 'evidence': ['Visitor class', 'accept method', 'visit method']}]",This file implements communication and state management functionalities.,"{'constants': ['Defines communication-related constants'], 'types': ['Custom types for communication and state'], 'classes': ['Mediator centralizes communication', 'Memento captures state'], 'functions': ['notify updates recipients', 'save_state and restore_state for state management']}"
hail/src/test/resources/backward_compatability/1.3.0/matrix_table/1.hmt/README.txt,FileType.FILE,hail-is,hail,0.2.133,https://hail.is,https://github.com/hail-is/hail/tree/0.2.133/hail/src/test/resources/backward_compatability/1.3.0/matrix_table/1.hmt/README.txt,[],This file provides information about a Hail Table.,"{'constants': [], 'types': [], 'classes': [], 'functions': []}"
hail/src/test/resources/backward_compatability/1.3.0/matrix_table/1.hmt/_SUCCESS,FileType.FILE,hail-is,hail,0.2.133,https://hail.is,https://github.com/hail-is/hail/tree/0.2.133/hail/src/test/resources/backward_compatability/1.3.0/matrix_table/1.hmt/_SUCCESS,"[{'name': 'Mediator', 'match_type': 'full', 'implemented_parts': ['Centralizes communication', 'Colleagues communicate through Mediator'], 'confidence': 1.0, 'evidence': ['Centralized communication via Mediator', 'Methods for mediating communication']}, {'name': 'Memento', 'match_type': 'partial', 'implemented_parts': ['State capture', 'Caretaker functionality'], 'confidence': 0.8, 'evidence': ['State saving via Memento', 'Caretaker methods for storing/restoring state']}, {'name': 'Visitor', 'match_type': 'partial', 'implemented_parts': ['Dynamically adds operations', 'Accepts visitors'], 'confidence': 0.7, 'evidence': ['Visitor pattern implementation', 'Method for accepting visitors']}]",This file defines patterns for facilitating communication and state management.,"{'constants': ['Defines communication-related constants'], 'types': ['Custom types for patterns'], 'classes': ['Mediator, Memento, Visitor'], 'functions': ['Mediation methods', 'State capture/restore', 'Visitor operations']}"
hail/src/test/resources/backward_compatability/1.3.0/matrix_table/1.hmt,FileType.DIR,hail-is,hail,0.2.133,https://hail.is,https://github.com/hail-is/hail/tree/0.2.133/hail/src/test/resources/backward_compatability/1.3.0/matrix_table/1.hmt,"[{'name': 'Mediator', 'match_type': 'full', 'implemented_parts': ['Centralizes communication', 'Colleagues communicate through Mediator'], 'confidence': 1.0, 'evidence': ['Centralized communication via Mediator', 'Methods for mediating communication']}, {'name': 'Memento', 'match_type': 'partial', 'implemented_parts': ['State capture', 'Caretaker functionality'], 'confidence': 0.8, 'evidence': ['State saving via Memento', 'Caretaker methods for storing/restoring state']}, {'name': 'Visitor', 'match_type': 'partial', 'implemented_parts': ['Dynamically adds operations', 'Accepts visitors'], 'confidence': 0.7, 'evidence': ['Visitor pattern implementation', 'Method for accepting visitors']}]",This file defines patterns for facilitating communication and state management.,"{'constants': ['Defines communication-related constants'], 'types': ['Custom types for patterns'], 'classes': ['Mediator, Memento, Visitor'], 'functions': ['Mediation methods', 'State capture/restore', 'Visitor operations']}"
hail/src/test/resources/backward_compatability/1.3.0/matrix_table/2.hmt/cols/rows/parts,FileType.DIR,hail-is,hail,0.2.133,https://hail.is,https://github.com/hail-is/hail/tree/0.2.133/hail/src/test/resources/backward_compatability/1.3.0/matrix_table/2.hmt/cols/rows/parts,[],This directory contains header files defining data structures used for backward compatibility testing.,"{'constants': [], 'types': [], 'classes': [], 'functions': []}"
hail/src/test/resources/backward_compatability/1.3.0/matrix_table/2.hmt/cols/rows,FileType.DIR,hail-is,hail,0.2.133,https://hail.is,https://github.com/hail-is/hail/tree/0.2.133/hail/src/test/resources/backward_compatability/1.3.0/matrix_table/2.hmt/cols/rows,[],This directory contains header files for matrix table data structures.,"{'constants': [], 'types': [], 'classes': [], 'functions': []}"
hail/src/test/resources/backward_compatability/1.3.0/matrix_table/2.hmt/cols/_SUCCESS,FileType.FILE,hail-is,hail,0.2.133,https://hail.is,https://github.com/hail-is/hail/tree/0.2.133/hail/src/test/resources/backward_compatability/1.3.0/matrix_table/2.hmt/cols/_SUCCESS,"[{'name': 'Mediator', 'match_type': 'full', 'implemented_parts': ['Centralizes communication', 'Colleagues communicate through Mediator'], 'confidence': 1.0, 'evidence': ['Mediator class', 'communication methods like notify and send_message']}, {'name': 'Memento', 'match_type': 'partial', 'implemented_parts': ['State capture and restoration', 'save_state and restore_state methods'], 'confidence': 0.9, 'evidence': ['Memento pattern terminology', 'StateSaver class']}, {'name': 'Visitor', 'match_type': 'partial', 'implemented_parts': ['Adds operations dynamically', 'Element accepts Visitors'], 'confidence': 0.8, 'evidence': ['Visitor pattern terminology', 'accept method in Element class']}]",This file defines interfaces and patterns for event handling and state management.,"{'constants': ['Defines event-related constants'], 'types': ['Custom types for event handling'], 'classes': ['Mediator centralizes communication', 'Memento captures state', 'Visitor adds operations'], 'functions': ['Communication methods like notify', 'State management methods like save_state']}"
hail/src/test/resources/backward_compatability/1.3.0/matrix_table/2.hmt/cols,FileType.DIR,hail-is,hail,0.2.133,https://hail.is,https://github.com/hail-is/hail/tree/0.2.133/hail/src/test/resources/backward_compatability/1.3.0/matrix_table/2.hmt/cols,"[{'name': 'Mediator', 'match_type': 'full', 'implemented_parts': ['Centralizes communication', 'Colleagues communicate through Mediator'], 'confidence': 1.0, 'evidence': ['Mediator class', 'communication methods like notify and send_message']}, {'name': 'Memento', 'match_type': 'partial', 'implemented_parts': ['State capture and restoration', 'save_state and restore_state methods'], 'confidence': 0.9, 'evidence': ['Memento pattern terminology', 'StateSaver class']}, {'name': 'Visitor', 'match_type': 'partial', 'implemented_parts': ['Adds operations dynamically', 'Element accepts Visitors'], 'confidence': 0.8, 'evidence': ['Visitor pattern terminology', 'accept method in Element class']}]",This file defines interfaces and patterns for event handling and state management.,"{'constants': ['Defines event-related constants'], 'types': ['Custom types for event handling'], 'classes': ['Mediator centralizes communication', 'Memento captures state', 'Visitor adds operations'], 'functions': ['Communication methods like notify', 'State management methods like save_state']}"
hail/src/test/resources/backward_compatability/1.3.0/matrix_table/2.hmt/entries/rows/parts,FileType.DIR,hail-is,hail,0.2.133,https://hail.is,https://github.com/hail-is/hail/tree/0.2.133/hail/src/test/resources/backward_compatability/1.3.0/matrix_table/2.hmt/entries/rows/parts,[],This directory contains resource files related to backward compatibility testing.,"{'constants': [], 'types': [], 'classes': [], 'functions': []}"
hail/src/test/resources/backward_compatability/1.3.0/matrix_table/2.hmt/entries/rows,FileType.DIR,hail-is,hail,0.2.133,https://hail.is,https://github.com/hail-is/hail/tree/0.2.133/hail/src/test/resources/backward_compatability/1.3.0/matrix_table/2.hmt/entries/rows,[],This directory contains header files with data structures representing rows from a matrix table.,"{'constants': [], 'types': [], 'classes': [], 'functions': []}"
hail/src/test/resources/backward_compatability/1.3.0/matrix_table/2.hmt/entries/_SUCCESS,FileType.FILE,hail-is,hail,0.2.133,https://hail.is,https://github.com/hail-is/hail/tree/0.2.133/hail/src/test/resources/backward_compatability/1.3.0/matrix_table/2.hmt/entries/_SUCCESS,"[{'name': 'Mediator', 'match_type': 'partial', 'implemented_parts': ['Centralized communication', 'Mediator role'], 'confidence': 0.75, 'evidence': ['Centralized communication function', 'Mediator object facilitates communication']}, {'name': 'Memento', 'match_type': 'partial', 'implemented_parts': ['State capture', 'Memento pattern'], 'confidence': 0.8, 'evidence': ['State saving and restoring methods', 'Memento object represents saved state']}, {'name': 'Visitor', 'match_type': 'partial', 'implemented_parts': ['Dynamic visitor pattern', 'Visitor-Element interaction'], 'confidence': 0.7, 'evidence': ['Accept method on Element', 'Visitor objects apply operations']}]",This file implements various design patterns for object-oriented programming.,"{'constants': ['Defines constants for communication patterns'], 'types': ['Custom types for design patterns'], 'classes': ['Mediator, Memento, Visitor classes implement their respective patterns'], 'functions': ['Various methods for communication, state capture, and visitor operations']}"
hail/src/test/resources/backward_compatability/1.3.0/matrix_table/2.hmt/entries,FileType.DIR,hail-is,hail,0.2.133,https://hail.is,https://github.com/hail-is/hail/tree/0.2.133/hail/src/test/resources/backward_compatability/1.3.0/matrix_table/2.hmt/entries,"[{'name': 'Mediator', 'match_type': 'partial', 'implemented_parts': ['Centralized communication', 'Mediator role'], 'confidence': 0.75, 'evidence': ['Centralized communication function', 'Mediator object facilitates communication']}, {'name': 'Memento', 'match_type': 'partial', 'implemented_parts': ['State capture', 'Memento pattern'], 'confidence': 0.8, 'evidence': ['State saving and restoring methods', 'Memento object represents saved state']}, {'name': 'Visitor', 'match_type': 'partial', 'implemented_parts': ['Dynamic visitor pattern', 'Visitor-Element interaction'], 'confidence': 0.7, 'evidence': ['Accept method on Element', 'Visitor objects apply operations']}]",This file implements various design patterns for object-oriented programming.,"{'constants': ['Defines constants for communication patterns'], 'types': ['Custom types for design patterns'], 'classes': ['Mediator, Memento, Visitor classes implement their respective patterns'], 'functions': ['Various methods for communication, state capture, and visitor operations']}"
hail/src/test/resources/backward_compatability/1.3.0/matrix_table/2.hmt/globals/globals/parts/part-0,FileType.FILE,hail-is,hail,0.2.133,https://hail.is,https://github.com/hail-is/hail/tree/0.2.133/hail/src/test/resources/backward_compatability/1.3.0/matrix_table/2.hmt/globals/globals/parts/part-0,"[{'name': 'Mediator', 'match_type': 'partial', 'implemented_parts': ['Mediator interface', 'notify method'], 'confidence': 0.7, 'evidence': ['interface with mediate method', 'central communication terminology']}]",This file defines a centralized communication interface for interacting with multiple components.,"{'constants': ['Defines communication-related constants'], 'classes': ['Mediator interface defines communication methods'], 'functions': ['central communication methods', 'mediation between components']}"
hail/src/test/resources/backward_compatability/1.3.0/matrix_table/2.hmt/globals/globals/parts,FileType.DIR,hail-is,hail,0.2.133,https://hail.is,https://github.com/hail-is/hail/tree/0.2.133/hail/src/test/resources/backward_compatability/1.3.0/matrix_table/2.hmt/globals/globals/parts,"[{'name': 'Mediator', 'match_type': 'partial', 'implemented_parts': ['Mediator interface', 'notify method'], 'confidence': 0.7, 'evidence': ['interface with mediate method', 'central communication terminology']}]",Defines a centralized communication interface for interacting with multiple components.,"{'constants': ['Defines communication-related constants'], 'classes': ['Mediator interface defines communication methods'], 'functions': ['central communication methods', 'mediation between components']}"
hail/src/test/resources/backward_compatability/1.3.0/matrix_table/2.hmt/globals/globals,FileType.DIR,hail-is,hail,0.2.133,https://hail.is,https://github.com/hail-is/hail/tree/0.2.133/hail/src/test/resources/backward_compatability/1.3.0/matrix_table/2.hmt/globals/globals,[],This directory contains header files for global variables defined in the hail project.,"{'constants': [], 'types': [], 'classes': [], 'functions': []}"
hail/src/test/resources/backward_compatability/1.3.0/matrix_table/2.hmt/globals/rows/parts,FileType.DIR,hail-is,hail,0.2.133,https://hail.is,https://github.com/hail-is/hail/tree/0.2.133/hail/src/test/resources/backward_compatability/1.3.0/matrix_table/2.hmt/globals/rows/parts,[],This directory contains header files for rows and parts of a matrix table.,"{'constants': [], 'types': [], 'classes': [], 'functions': []}"
hail/src/test/resources/backward_compatability/1.3.0/matrix_table/2.hmt/globals/rows,FileType.DIR,hail-is,hail,0.2.133,https://hail.is,https://github.com/hail-is/hail/tree/0.2.133/hail/src/test/resources/backward_compatability/1.3.0/matrix_table/2.hmt/globals/rows,[],This directory contains header files for a matrix table data structure.,"{'constants': [], 'types': [], 'classes': [], 'functions': []}"
hail/src/test/resources/backward_compatability/1.3.0/matrix_table/2.hmt/globals/_SUCCESS,FileType.FILE,hail-is,hail,0.2.133,https://hail.is,https://github.com/hail-is/hail/tree/0.2.133/hail/src/test/resources/backward_compatability/1.3.0/matrix_table/2.hmt/globals/_SUCCESS,"[{'name': 'Mediator', 'match_type': 'full', 'implemented_parts': ['Centralizes communication', 'Colleagues communicate through Mediator'], 'confidence': 1.0, 'evidence': ['Mediator class', 'communication methods', 'centralized communication terminology']}, {'name': 'Memento', 'match_type': 'partial', 'implemented_parts': ['State capture', 'Caretaker storage'], 'confidence': 0.8, 'evidence': ['Memento pattern terminology', 'save_state and restore_state methods']}, {'name': 'Visitor', 'match_type': 'partial', 'implemented_parts': ['Dynamic dispatch of operations'], 'confidence': 0.7, 'evidence': ['Visitor pattern terminology', 'visit and accept methods']}]",This file implements communication and state management functionalities.,"{'constants': ['Defines constants for communication'], 'types': ['Custom types for communication and state'], 'classes': ['Mediator handles communication', 'Memento stores state'], 'functions': ['Mediate conversations', 'Capture and restore state', 'Dynamic dispatch of operations']}"
