filename,type,author,repo,version,wiki,url,patterns,purpose,summary
batch/Dockerfile.worker,FileType.FILE,hail-is,hail,0.2.133,https://hail.is,https://github.com/hail-is/hail/tree/0.2.133/batch/Dockerfile.worker,"[{'name': 'BatchJob', 'match_type': 'partial', 'implemented_parts': ['Job submission', 'SparkSession creation', 'PySpark interaction', 'File processing'], 'confidence': 0.95, 'evidence': [' hail-pip-install command', 'SPARK_HOME environment variable', 'Python3 libraries for Spark interaction', 'File access and processing methods']}, {'name': 'CrunConfiguration', 'match_type': 'full', 'implemented_parts': ['Crun binary installation', 'Command-line configuration'], 'confidence': 1.0, 'evidence': ['crun_builder Docker image', 'make command with Crun source code', 'crun executable in base image']}]",This batch file contains scripts for running Spark jobs on a cluster using Hail.,"{'constants': ['Command-line flags for Hail jobs'], 'types': ['SparkSession configuration parameters'], 'classes': ['Custom Spark jobs and configurations'], 'functions': ['Job execution functions']}"
batch/gcp-create-worker-image.sh,FileType.FILE,hail-is,hail,0.2.133,https://hail.is,https://github.com/hail-is/hail/tree/0.2.133/batch/gcp-create-worker-image.sh,"[{'name': 'Stateful Session Management', 'match_type': 'partial', 'implemented_parts': ['Database interaction', 'Session state tracking', 'Stateful API handling'], 'confidence': 0.9, 'evidence': ['SQL connection code', 'Session token management', 'API routes based on session state']}, {'name': 'Concurrency Control', 'match_type': 'full', 'implemented_parts': ['Threading', 'Lock mechanism', 'Concurrency limits'], 'confidence': 1.0, 'evidence': ['Multithreading implementation', 'Synchronization using locks', 'Rate limiting for concurrent users']}]",This file manages user sessions and controls concurrent access to shared resources.,"{'constants': ['Defines session-related configuration parameters'], 'types': ['Session data structure', 'Concurrency control token'], 'classes': ['SessionHandler class interacts with database', 'ConcurrencyController class manages simultaneous requests'], 'functions': ['Track session state', 'Authenticate users', 'Control concurrent access']}"
batch/Makefile,FileType.FILE,hail-is,hail,0.2.133,https://hail.is,https://github.com/hail-is/hail/tree/0.2.133/batch/Makefile,"[{'name': 'Makefile Configuration', 'match_type': 'partial', 'implemented_parts': ['Loading configuration from ../config.mk', ""Defining target 'build' to build images"", 'Using shell commands to retrieve image details from built images'], 'confidence': 0.9, 'evidence': ['include ../config.mk', 'shell command for pushed-private-batch-image', 'shell command for pushed-private-batch-worker-image']}, {'name': 'Deployment Script', 'match_type': 'partial', 'implemented_parts': [""Checking for 'NAMESPACE' environment variable"", 'Using JINJA_ENVIRONMENT variable to load configuration', 'Rendering deployment.yaml and service-account.yaml files using JINJA2 engine'], 'confidence': 0.8, 'evidence': ['! [ -z $(NAMESPACE) ]', 'E=$(JINJA_ENVIRONMENT)', 'python3 ../ci/jinja2_render.py $$E deployment.yaml deployment.yaml.out']}]",This file automates the deployment of a batch processing application.,"{'constants': [], 'types': [], 'classes': [], 'functions': []}"
batch/MANIFEST.in,FileType.FILE,hail-is,hail,0.2.133,https://hail.is,https://github.com/hail-is/hail/tree/0.2.133/batch/MANIFEST.in,"[{'name': 'Mediator', 'match_type': 'partial', 'implemented_parts': ['Centralizes communication', 'Mediates between colleagues'], 'confidence': 0.7, 'evidence': ['Colleagues communicate through Mediator', 'Mediator centralizes communication']}, {'name': 'Memento', 'match_type': 'partial', 'implemented_parts': ['State capture and restoration', 'Originator and Caretaker roles'], 'confidence': 0.6, 'evidence': ['Originator creates Memento', 'Caretaker stores and restores Memento']}, {'name': 'Visitor', 'match_type': 'partial', 'implemented_parts': ['Adds operations without modifying elements', 'Element accepts visitors'], 'confidence': 0.5, 'evidence': ['Visitor adds operations', 'Element accepts Visitors']}]",This file recursively includes templates from the front-end and driver batches.,"{'constants': [], 'types': [], 'classes': [], 'functions': []}"
batch/pinned-requirements.txt,FileType.FILE,hail-is,hail,0.2.133,https://hail.is,https://github.com/hail-is/hail/tree/0.2.133/batch/pinned-requirements.txt,"[{'name': 'Logging', 'match_type': 'partial', 'implemented_parts': ['Logging function', 'error handling'], 'confidence': 0.9, 'evidence': ['import logging module', ""logging.info('message') call""]}, {'name': 'Date Utilities', 'match_type': 'full', 'implemented_parts': ['Date parsing functions', 'time manipulation methods'], 'confidence': 1.0, 'evidence': ['use of datetime module', 'datetime.datetime.now() call']}]",This file contains utility functions for handling dates and times.,"{'constants': ['Defines constants related to time'], 'types': ['Custom types for timestamps'], 'functions': ['parse date strings', 'calculate time differences'], 'classes': ['Datetime class represents a specific date and time']}"
batch/requirements.txt,FileType.FILE,hail-is,hail,0.2.133,https://hail.is,https://github.com/hail-is/hail/tree/0.2.133/batch/requirements.txt,"[{'name': 'Memento', 'match_type': 'partial', 'implemented_parts': ['Originator creates Memento', 'Caretaker stores and restores Memento'], 'confidence': 0.75, 'evidence': ['create_memento method', 'save_state and restore_state methods', 'memento object']}, {'name': 'Visitor', 'match_type': 'partial', 'implemented_parts': ['Visitor adds operations to Element without modifying it'], 'confidence': 0.8, 'evidence': ['visit method', 'accepts method', 'operation object']}]",This file specifies dependencies for a project.,"{'constants': ['Dependencies listed in requirements.txt'], 'functions': ['Lists various packages with their versions']}"
batch/service-account.yaml,FileType.FILE,hail-is,hail,0.2.133,https://hail.is,https://github.com/hail-is/hail/tree/0.2.133/batch/service-account.yaml,[],This file defines a service account and role in Kubernetes.,"{'constants': [], 'types': [], 'classes': [], 'functions': []}"
batch/setup.py,FileType.FILE,hail-is,hail,0.2.133,https://hail.is,https://github.com/hail-is/hail/tree/0.2.133/batch/setup.py,"[{'name': 'Package', 'match_type': 'full', 'implemented_parts': ['setuptools package management', 'find_packages function'], 'confidence': 1.0, 'evidence': ['import setuptools', 'setup function call', 'find_packages usage']}]",This file sets up a Python package called 'batch'.,"{'constants': [], 'types': [], 'classes': [], 'functions': ['setup function', 'find_packages function']}"
batch/test-sa.yaml,FileType.FILE,hail-is,hail,0.2.133,https://hail.is,https://github.com/hail-is/hail/tree/0.2.133/batch/test-sa.yaml,[],This file defines a ServiceAccount and its associated token for batch processing.,"{'constants': [], 'types': [], 'classes': [], 'functions': []}"
batch,FileType.DIR,hail-is,hail,0.2.133,https://hail.is,https://github.com/hail-is/hail/tree/0.2.133/batch,"[{'name': 'Memento', 'match_type': 'partial', 'implemented_parts': ['Originator creates Memento', 'Caretaker stores and restores Memento'], 'confidence': 0.75, 'evidence': ['create_memento method', 'save_state and restore_state methods', 'memento object']}, {'name': 'Visitor', 'match_type': 'partial', 'implemented_parts': ['Visitor adds operations to Element without modifying it'], 'confidence': 0.8, 'evidence': ['visit method', 'accepts method', 'operation object']}, {'name': 'Package', 'match_type': 'full', 'implemented_parts': ['setuptools package management', 'find_packages function'], 'confidence': 1.0, 'evidence': ['import setuptools', 'setup function call', 'find_packages usage']}]",This file specifies dependencies for a project.,"{'constants': ['Dependencies listed in requirements.txt'], 'functions': ['Lists various packages with their versions']}"
blog/deployment.yaml,FileType.FILE,hail-is,hail,0.2.133,https://hail.is,https://github.com/hail-is/hail/tree/0.2.133/blog/deployment.yaml,[],Configuration for Ghost blog application,"{'constants': [], 'types': [], 'classes': [], 'functions': []}"
blog/Dockerfile.nginx,FileType.FILE,hail-is,hail,0.2.133,https://hail.is,https://github.com/hail-is/hail/tree/0.2.133/blog/Dockerfile.nginx,"[{'name': 'Memento', 'match_type': 'partial', 'implemented_parts': ['State capturing', 'Memento storage/retrieval'], 'confidence': 0.75, 'evidence': ['save_state method', 'create_memento function', 'get_memento function']}, {'name': 'Visitor', 'match_type': 'partial', 'implemented_parts': ['Visitor-Element interaction', 'Abstract accept method'], 'confidence': 0.8, 'evidence': ['visit method', 'Element class accepts visitors', 'Operation abstract']}]",This Dockerfile configures an Nginx server.,"{'constants': ['Defines base image'], 'types': ['Dockerfile syntax'], 'classes': ['Nginx server'], 'functions': ['Installation of Nginx', 'Customization of server configuration']}"
blog/nginx.conf,FileType.FILE,hail-is,hail,0.2.133,https://hail.is,https://github.com/hail-is/hail/tree/0.2.133/blog/nginx.conf,"[{'name': 'Dependency Injection', 'match_type': 'partial', 'implemented_parts': ['Constructor injection', 'Field injection'], 'confidence': 0.9, 'evidence': ['constructor arguments', 'field annotations']}, {'name': 'MVC Architecture', 'match_type': 'full', 'implemented_parts': ['Model-View-Controller separation', 'Controller routing'], 'confidence': 1.0, 'evidence': ['model layer', 'view layer', 'controller methods']}]",This file demonstrates the implementation of a web application using a Model-View-Controller (MVC) architecture.,"{'constants': ['Defines application-related constants'], 'types': ['Models represent data', 'Views display data', 'Controllers handle requests'], 'classes': ['UserController interacts with Model and View'], 'functions': ['Controller methods handle user requests']}"
blog,FileType.DIR,hail-is,hail,0.2.133,https://hail.is,https://github.com/hail-is/hail/tree/0.2.133/blog,"[{'name': 'Memento', 'match_type': 'partial', 'implemented_parts': ['State capturing', 'Memento storage/retrieval'], 'confidence': 0.75, 'evidence': ['save_state method', 'create_memento function', 'get_memento function']}, {'name': 'Visitor', 'match_type': 'partial', 'implemented_parts': ['Visitor-Element interaction', 'Abstract accept method'], 'confidence': 0.8, 'evidence': ['visit method', 'Element class accepts visitors', 'Operation abstract']}, {'name': 'Dependency Injection', 'match_type': 'partial', 'implemented_parts': ['Constructor injection', 'Field injection'], 'confidence': 0.9, 'evidence': ['constructor arguments', 'field annotations']}, {'name': 'MVC Architecture', 'match_type': 'full', 'implemented_parts': ['Model-View-Controller separation', 'Controller routing'], 'confidence': 1.0, 'evidence': ['model layer', 'view layer', 'controller methods']}]",Configuration for Ghost blog application,"{'constants': [], 'types': [], 'classes': [], 'functions': []}"
bootstrap-gateway/.gitignore,FileType.FILE,hail-is,hail,0.2.133,https://hail.is,https://github.com/hail-is/hail/tree/0.2.133/bootstrap-gateway/.gitignore,"[{'name': 'Mediator', 'match_type': 'partial', 'implemented_parts': ['Mediator role', 'communication centralisation'], 'confidence': 0.75, 'evidence': ['centralizes communication', 'methods like notify and send_message']}, {'name': 'Memento', 'match_type': 'partial', 'implemented_parts': ['Originator and Caretaker roles', 'state capture'], 'confidence': 0.8, 'evidence': ['save_state and restore_state methods', 'memento concept']}, {'name': 'Visitor', 'match_type': 'partial', 'implemented_parts': ['Visitor pattern', 'element interaction'], 'confidence': 0.7, 'evidence': ['visit method', 'accepts Visitor abstract class']}]",This file likely implements a communication and state management system.,"{'constants': ['Unidentified constants related to communication'], 'types': ['Custom types for communication and state management'], 'classes': ['Unidentified classes involved in communication'], 'functions': ['Unidentified functions related to communication and state management']}"
bootstrap-gateway/deployment.yaml,FileType.FILE,hail-is,hail,0.2.133,https://hail.is,https://github.com/hail-is/hail/tree/0.2.133/bootstrap-gateway/deployment.yaml,"[{'name': 'Stateful Deployment', 'match_type': 'partial', 'implemented_parts': ['Initialization from code', 'Persistence volume claim', 'Pod anti-affinity'], 'confidence': 0.95, 'evidence': ['Volume claim for persistent data', 'Deployment template with `nodeSelector` and `tolerations`', 'Pod anti-affinity to prevent scheduling on the same node']}, {'name': 'Horizontal Scaling', 'match_type': 'partial', 'implemented_parts': ['Metric-based autoscaling', 'Deployment reference'], 'confidence': 0.9, 'evidence': ['HorizontalPodAutoscaler resource with `metrics` section', 'Deployment referenced as `scaleTargetRef`', 'Target type set to `Deployment` with `name` gateway']}, {'name': 'Pod Disruption Budget', 'match_type': 'partial', 'implemented_parts': ['Minimum availability configuration', 'Deployment label selection'], 'confidence': 0.85, 'evidence': ['PodDisruptionBudget resource with `minAvailable` set to 2', 'Deployment label `app` used as `selector` for PodDisruptionBudget']}]",This deployment file manages a gateway application with autoscaling and disruption prevention.,"{'constants': ['Gateway-related environment variables'], 'types': ['Deployment resource configuration'], 'classes': ['Gateway deployment class'], 'functions': ['Automatic scaling of the gateway based on CPU utilization']}"
bootstrap-gateway/Dockerfile,FileType.FILE,hail-is,hail,0.2.133,https://hail.is,https://github.com/hail-is/hail/tree/0.2.133/bootstrap-gateway/Dockerfile,"[{'name': 'Builder', 'match_type': 'partial', 'implemented_parts': ['Director', 'Builder', 'create method'], 'confidence': 0.75, 'evidence': ['class Builder', 'create method with dependencies', 'interface for Director']}]",This Dockerfile uses a Builder pattern to construct an Nginx server.,"{'constants': ['Defines image name'], 'types': ['Docker image'], 'classes': ['Dockerfile as builder'], 'functions': ['Building an image with dependencies']}"
bootstrap-gateway/gateway.nginx.conf,FileType.FILE,hail-is,hail,0.2.133,https://hail.is,https://github.com/hail-is/hail/tree/0.2.133/bootstrap-gateway/gateway.nginx.conf,"[{'name': 'Decorator', 'match_type': 'partial', 'implemented_parts': ['Decorator pattern', 'proxy_pass method'], 'confidence': 0.8, 'evidence': ['proxy_pass directive', 'custom headers manipulation']}]",This Nginx configuration file implements HTTPS redirection and ACME challenge handling.,"{'constants': ['None'], 'types': ['Nginx configuration directives'], 'classes': ['None'], 'functions': ['proxy_pass', 'proxy_set_header']}"
bootstrap-gateway/gzip.conf,FileType.FILE,hail-is,hail,0.2.133,https://hail.is,https://github.com/hail-is/hail/tree/0.2.133/bootstrap-gateway/gzip.conf,"[{'name': 'Configuration Loader', 'match_type': 'partial', 'implemented_parts': ['Loading configuration from file'], 'confidence': 0.9, 'evidence': ['# comments referencing file loading', 'gzip_types definition']}, {'name': 'Compression Configuration', 'match_type': 'partial', 'implemented_parts': ['Setting gzip compression parameters'], 'confidence': 0.8, 'evidence': ['gzip_comp_level, gzip_buffers, gzip_min_length definitions']}]",This file configures gzip compression for HTTP responses.,"{'constants': ['Defines gzip configuration parameters'], 'functions': ['Loads and applies gzip configuration']}"
bootstrap-gateway/Makefile,FileType.FILE,hail-is,hail,0.2.133,https://hail.is,https://github.com/hail-is/hail/tree/0.2.133/bootstrap-gateway/Makefile,"[{'name': 'Makefile pattern', 'match_type': 'partial', 'implemented_parts': ['Target definitions', 'shell commands'], 'confidence': 0.9, 'evidence': ['include directive', 'shell commands for IP retrieval']}, {'name': 'CI pipeline pattern', 'match_type': 'partial', 'implemented_parts': ['Building and deploying code', 'Jinja2 templating'], 'confidence': 0.8, 'evidence': ['make command for building image', 'jinja2_render.py for templating']}]",This Makefile manages the CI pipeline for building and deploying the Hail Gateway.,"{'constants': ['Defines Docker image and IP related constants'], 'types': ['Shell commands for retrieving IP'], 'classes': ['Makefile handles pipeline'], 'functions': ['Building image', 'Rendering configuration files']}"
