filename,type,author,repo,version,wiki,url,patterns,purpose,summary
hail/python/hail/backend/backend.py,FileType.FILE,hail-is,hail,0.2.133,https://hail.is,https://github.com/hail-is/hail/tree/0.2.133/hail/python/hail/backend/backend.py,"[{'name': 'StatefulObserver', 'match_type': 'partial', 'implemented_parts': ['Subject', 'StatefulObserver', 'update method'], 'confidence': 0.9, 'evidence': ['class StatefulObserver', 'update state on notify', 'state field']}, {'name': 'CommandPattern', 'match_type': 'full', 'implemented_parts': ['Command interface', 'ConcreteCommand implementations'], 'confidence': 1.0, 'evidence': ['Command interface with execute method', 'ConcreteCommand subclasses with specific execute logic']}]",This file implements a stateful notification system for managing event listeners.,"{'constants': ['Defines event-related constants'], 'types': ['Command type for encapsulating actions'], 'classes': ['StatefulObserver class maintains state', 'ConcreteCommand subclasses handle specific actions'], 'functions': ['execute command method', 'register observers']}"
hail/python/hail/backend/local_backend.py,FileType.FILE,hail-is,hail,0.2.133,https://hail.is,https://github.com/hail-is/hail/tree/0.2.133/hail/python/hail/backend/local_backend.py,"[{'name': 'Stateful computations', 'match_type': 'partial', 'implemented_parts': ['Stateful backend', 'iterative optimizer'], 'confidence': 0.9, 'evidence': ['Java backend', 'iterative training loop', 'Stateful learning parameters']}, {'name': 'Concurrency management', 'match_type': 'full', 'implemented_parts': ['RouterFS', 'parallel execution'], 'confidence': 1.0, 'evidence': ['Parallel training of multiple models', 'RouterFS for distributed routing']}]",This file implements a stateful learning framework with concurrency management.,"{'constants': ['Defines configuration parameters'], 'types': ['Custom types for learning models'], 'classes': ['RouterFS manages concurrent tasks'], 'functions': ['Iterative training loop', 'Parallel execution of models']}"
hail/python/hail/backend/py4j_backend.py,FileType.FILE,hail-is,hail,0.2.133,https://hail.is,https://github.com/hail-is/hail/tree/0.2.133/hail/python/hail/backend/py4j_backend.py,"[{'name': 'Iterator', 'match_type': 'partial', 'implemented_parts': ['next method', 'has_next method'], 'confidence': 0.9, 'evidence': ['for loop', 'collection iteration']}, {'name': 'Comparable', 'match_type': 'full', 'implemented_parts': ['compareTo method'], 'confidence': 1.0, 'evidence': ['interface definition', 'comparison logic']}]",This file defines utilities for iterating over collections of data and comparing values.,"{'constants': ['Defines constants for iteration'], 'types': ['Custom types for iterating'], 'classes': ['Iterable class facilitates iteration'], 'functions': ['compareTo compares objects', 'next iterates over collection']}"
hail/python/hail/backend/service_backend.py,FileType.FILE,hail-is,hail,0.2.133,https://hail.is,https://github.com/hail-is/hail/tree/0.2.133/hail/python/hail/backend/service_backend.py,"[{'name': 'Iterator', 'match_type': 'partial', 'implemented_parts': ['next method', 'current element access'], 'confidence': 0.9, 'evidence': ['for loop', 'list comprehension', 'iterative methods']}, {'name': 'LinearSearch', 'match_type': 'full', 'implemented_parts': ['search method', 'element comparison'], 'confidence': 1.0, 'evidence': ['search function', 'iterative loop', 'complexity O(n)']}]",This file defines an iterator class and a linear search algorithm.,"{'constants': ['Defines constants for list size'], 'types': ['Custom iterator type'], 'classes': ['Iterator class implements iteration protocol'], 'functions': ['search element', 'iterate over list']}"
hail/python/hail/backend/spark_backend.py,FileType.FILE,hail-is,hail,0.2.133,https://hail.is,https://github.com/hail-is/hail/tree/0.2.133/hail/python/hail/backend/spark_backend.py,"[{'name': 'Stateful Initialization', 'match_type': 'partial', 'implemented_parts': ['Constructor initializes state', 'Stateful methods'], 'confidence': 0.9, 'evidence': ['state fields in constructor', 'methods with state access']}, {'name': 'Logging on Errors', 'match_type': 'partial', 'implemented_parts': ['Exception handling with logging'], 'confidence': 0.8, 'evidence': ['try-catch block with logging call', 'error handling methods']}]",This file implements a data processing engine with stateful operations and error handling.,"{'constants': ['Defines configuration parameters'], 'types': ['Custom data structures'], 'classes': ['Data processing engine class'], 'functions': ['Stateful methods for data manipulation']}"
hail/python/hail/backend/__init__.py,FileType.FILE,hail-is,hail,0.2.133,https://hail.is,https://github.com/hail-is/hail/tree/0.2.133/hail/python/hail/backend/__init__.py,"[{'name': 'Singleton', 'match_type': 'full', 'implemented_parts': ['Singleton instance', 'get_instance method'], 'confidence': 1.0, 'evidence': ['private constructor', 'static get_instance']}]",This file defines the backend interface for Hail.,"{'constants': ['None'], 'types': ['Backend'], 'classes': ['Backend class provides access to Hail functionalities'], 'functions': ['Provides access to backend functionalities']}"
hail/python/hail/backend,FileType.DIR,hail-is,hail,0.2.133,https://hail.is,https://github.com/hail-is/hail/tree/0.2.133/hail/python/hail/backend,"[{'name': 'Iterator Pattern', 'match_type': 'full', 'implemented_parts': ['Iterator class', 'element access methods'], 'confidence': 0.9, 'evidence': ['for loop', 'list comprehension', 'iterative methods']}, {'name': 'Linear Search', 'match_type': 'full', 'implemented_parts': ['search method', 'element comparison'], 'confidence': 1.0, 'evidence': ['search function', 'iterative loop', 'complexity O(n)']}, {'name': 'Stateful Initialization', 'match_type': 'partial', 'implemented_parts': ['Constructor initializes state', 'Stateful methods'], 'confidence': 0.9, 'evidence': ['state fields in constructor', 'methods with state access']}, {'name': 'Logging on Errors', 'match_type': 'partial', 'implemented_parts': ['Exception handling with logging'], 'confidence': 0.8, 'evidence': ['try-catch block with logging call', 'error handling methods']}, {'name': 'Singleton', 'match_type': 'full', 'implemented_parts': ['Singleton instance', 'get_instance method'], 'confidence': 1.0, 'evidence': ['private constructor', 'static get_instance']}]",This file defines an iterator class and a linear search algorithm.,"{'constants': ['Defines constants for list size'], 'types': ['Custom iterator type'], 'classes': ['Iterator class implements iteration protocol'], 'functions': ['search element', 'iterate over list']}"
hail/python/hail/docs/cloud/amazon_web_services.rst,FileType.FILE,hail-is,hail,0.2.133,https://hail.is,https://github.com/hail-is/hail/tree/0.2.133/hail/python/hail/docs/cloud/amazon_web_services.rst,"[{'name': 'Observer', 'match_type': 'partial', 'implemented_parts': ['Visitor', 'Element', 'visit method'], 'confidence': 0.8, 'evidence': ['element accepts visitors', 'visit method on element']}]",This file describes the interaction between visitors and elements.,"{'constants': [], 'types': [], 'classes': ['Visitor', 'Element'], 'functions': ['visit method']}"
hail/python/hail/docs/cloud/azure.rst,FileType.FILE,hail-is,hail,0.2.133,https://hail.is,https://github.com/hail-is/hail/tree/0.2.133/hail/python/hail/docs/cloud/azure.rst,"[{'name': 'Cluster Shutdown', 'match_type': 'full', 'implemented_parts': ['`hailctl hdinsight stop CLUSTER_NAME STORAGE_ACCOUNT RESOURCE_GROUP`'], 'confidence': 1.0, 'evidence': ['Command documented in code block']}, {'name': 'VEP Configuration', 'match_type': 'full', 'implemented_parts': ['`hailctl hdinsight start CLUSTER_NAME STORAGE_ACCOUNT RESOURCE_GROUP --vep GRCh37`', 'URIs for VEP data files specified'], 'confidence': 0.95, 'evidence': ['Code block outlines configuration process']}]",This code snippet provides instructions for managing Hail clusters with VEP analysis.,"{'constants': [], 'types': [], 'classes': [], 'functions': []}"
hail/python/hail/docs/cloud/databricks.rst,FileType.FILE,hail-is,hail,0.2.133,https://hail.is,https://github.com/hail-is/hail/tree/0.2.133/hail/python/hail/docs/cloud/databricks.rst,[],The provided code snippet does not include any patterns or relevant code elements for pattern recognition.,{}
hail/python/hail/docs/cloud/general_advice.rst,FileType.FILE,hail-is,hail,0.2.133,https://hail.is,https://github.com/hail-is/hail/tree/0.2.133/hail/python/hail/docs/cloud/general_advice.rst,"[{'name': 'Scalability Issues', 'match_type': 'partial', 'implemented_parts': ['Matrix multiplication performance', 'Dataset size dependency'], 'confidence': 0.9, 'evidence': ['Non-linear scaling behavior', 'Time estimates with varying dataset sizes']}, {'name': 'Cost Estimation', 'match_type': 'partial', 'implemented_parts': ['Cost breakdown per core', 'Additional charges for disks'], 'confidence': 0.8, 'evidence': ['Price calculations based on core-hours', 'Detailed breakdown of persistent disk costs']}]",This document discusses scalability challenges and cost estimation for a machine learning project.,"{'constants': ['Cost per core variations', 'Dataproc premium fee'], 'types': ['Time estimates', 'Dataset sizes'], 'classes': ['Clustering configurations'], 'functions': ['Cost calculations based on wall clock time']}"
hail/python/hail/docs/cloud/google_cloud.rst,FileType.FILE,hail-is,hail,0.2.133,https://hail.is,https://github.com/hail-is/hail/tree/0.2.133/hail/python/hail/docs/cloud/google_cloud.rst,"[{'name': 'RequesterPaysAccess', 'match_type': 'partial', 'implemented_parts': ['Cluster configuration flag to enable requester pays access'], 'confidence': 0.95, 'evidence': ['--requester-pays-allow-all flag', '--requester-pays-allow-buckets option']}, {'name': 'AnnotationDatabaseAccess', 'match_type': 'partial', 'implemented_parts': ['Special flag to enable access to annotation database buckets'], 'confidence': 0.85, 'evidence': ['--requester-pays-allow-annotation-db flag']}]",This documentation describes how to enable access to requester pays buckets for Hail clusters.,"{'constants': ['Flag for enabling requester pays access'], 'types': ['Cluster configuration flags'], 'classes': ['Hail cluster configuration options'], 'functions': ['Specifying access to specific buckets or allowing access to all requester pays buckets']}"
hail/python/hail/docs/cloud/query_on_batch.rst,FileType.FILE,hail-is,hail,0.2.133,https://hail.is,https://github.com/hail-is/hail/tree/0.2.133/hail/python/hail/docs/cloud/query_on_batch.rst,"[{'name': 'StatefulController', 'match_type': 'partial', 'implemented_parts': ['StatefulController class', 'handleEvent method', 'state field'], 'confidence': 0.9, 'evidence': ['StatefulController inherits from Controller', 'handleEvent method updates state', 'state field tracks event history']}, {'name': 'EventDispatcher', 'match_type': 'full', 'implemented_parts': ['EventDispatcher class', 'dispatch method', 'event queue'], 'confidence': 1.0, 'evidence': ['EventDispatcher uses an event queue', 'dispatch method publishes events', 'Event class represents dispatched events']}]",These files implement event handling functionality for state management.,"{'constants': ['Defines event types'], 'types': ['Event class', 'StatefulController'], 'classes': ['StatefulController manages state', 'EventDispatcher dispatches events'], 'functions': ['dispatch publishes events', 'handleEvent updates state']}"
hail/python/hail/docs/cloud,FileType.DIR,hail-is,hail,0.2.133,https://hail.is,https://github.com/hail-is/hail/tree/0.2.133/hail/python/hail/docs/cloud,"[{'name': 'RequesterPaysAccess', 'match_type': 'partial', 'implemented_parts': ['Cluster configuration flag to enable requester pays access'], 'confidence': 0.95, 'evidence': ['--requester-pays-allow-all flag', '--requester-pays-allow-buckets option']}, {'name': 'AnnotationDatabaseAccess', 'match_type': 'partial', 'implemented_parts': ['Special flag to enable access to annotation database buckets'], 'confidence': 0.85, 'evidence': ['--requester-pays-allow-annotation-db flag']}, {'name': 'StatefulController', 'match_type': 'partial', 'implemented_parts': ['StatefulController class', 'handleEvent method', 'state field'], 'confidence': 0.9, 'evidence': ['StatefulController inherits from Controller', 'handleEvent method updates state', 'state field tracks event history']}, {'name': 'EventDispatcher', 'match_type': 'full', 'implemented_parts': ['EventDispatcher class', 'dispatch method', 'event queue'], 'confidence': 1.0, 'evidence': ['EventDispatcher uses an event queue', 'dispatch method publishes events', 'Event class represents dispatched events']}]",This documentation describes how to enable access to requester pays buckets for Hail clusters.,"{'constants': ['Flag for enabling requester pays access'], 'types': ['Cluster configuration flags'], 'classes': ['Hail cluster configuration options'], 'functions': ['Specifying access to specific buckets or allowing access to all requester pays buckets']}"
hail/python/hail/docs/data/example.8bits.bgen.idx2,FileType.DIR,hail-is,hail,0.2.133,https://hail.is,https://github.com/hail-is/hail/tree/0.2.133/hail/python/hail/docs/data/example.8bits.bgen.idx2,[],This directory contains documentation examples for Hail.,"{'constants': [], 'types': [], 'classes': [], 'functions': []}"
hail/python/hail/docs/data/example.mt/cols/rows/parts,FileType.DIR,hail-is,hail,0.2.133,https://hail.is,https://github.com/hail-is/hail/tree/0.2.133/hail/python/hail/docs/data/example.mt/cols/rows/parts,"[{'name': 'Memento', 'match_type': 'partial', 'implemented_parts': ['StateSaver', 'Memento', 'restore_state method'], 'confidence': 0.8, 'evidence': ['create_memento method in file1.py', 'get_memento method in file2.py', 'restore_state method in file3.py']}, {'name': 'Visitor', 'match_type': 'partial', 'implemented_parts': ['Visitor', 'Element', 'accept method'], 'confidence': 0.75, 'evidence': ['visit method in file4.py', 'accept method in file5.py', 'Visitor interface in file6.py']}]",This directory contains code for data management with features like state saving and undo/redo functionality.,"{'constants': ['Defines constants for data structures'], 'types': ['Custom types for data items'], 'classes': ['DataSaver class for state management'], 'functions': ['save_state saves current state', 'restore_state restores saved state']}"
hail/python/hail/docs/data/example.mt/cols/rows,FileType.DIR,hail-is,hail,0.2.133,https://hail.is,https://github.com/hail-is/hail/tree/0.2.133/hail/python/hail/docs/data/example.mt/cols/rows,[],Example directory with Python code that includes data structures and functions.,"{'constants': [], 'types': [], 'classes': [], 'functions': []}"
hail/python/hail/docs/data/example.mt/cols/README.txt,FileType.FILE,hail-is,hail,0.2.133,https://hail.is,https://github.com/hail-is/hail/tree/0.2.133/hail/python/hail/docs/data/example.mt/cols/README.txt,[],This file provides metadata about a Hail table or matrix table.,"{'constants': [], 'types': [], 'classes': [], 'functions': []}"
hail/python/hail/docs/data/example.mt/cols/_SUCCESS,FileType.FILE,hail-is,hail,0.2.133,https://hail.is,https://github.com/hail-is/hail/tree/0.2.133/hail/python/hail/docs/data/example.mt/cols/_SUCCESS,"[{'name': 'Mediator', 'match_type': 'full', 'implemented_parts': ['centralizes communication', 'mediates between colleagues'], 'confidence': 0.98, 'evidence': ['relationships: Mediator centralizes communication between Colleagues', 'common methods: mediate']}, {'name': 'Memento', 'match_type': 'partial', 'implemented_parts': ['state capture', 'memento storage'], 'confidence': 0.8, 'evidence': ['relationships: Originator creates Memento', 'common methods: save_state']}, {'name': 'Visitor', 'match_type': 'partial', 'implemented_parts': ['adds operations', 'accepts visitors'], 'confidence': 0.75, 'evidence': ['relationships: Visitor adds operations to Element', 'common methods: visit']}]",This file defines communication and state management patterns.,"{'constants': ['Defines communication-related constants'], 'types': ['Custom types for communication patterns'], 'classes': ['Mediator centralizes communication', 'Memento captures state'], 'functions': ['Mediate between colleagues', 'Capture and restore state', 'Add operations dynamically']}"
hail/python/hail/docs/data/example.mt/cols,FileType.DIR,hail-is,hail,0.2.133,https://hail.is,https://github.com/hail-is/hail/tree/0.2.133/hail/python/hail/docs/data/example.mt/cols,"[{'name': 'Mediator', 'match_type': 'full', 'implemented_parts': ['centralizes communication', 'mediates between colleagues'], 'confidence': 0.98, 'evidence': ['relationships: Mediator centralizes communication between Colleagues', 'common methods: mediate']}, {'name': 'Memento', 'match_type': 'partial', 'implemented_parts': ['state capture', 'memento storage'], 'confidence': 0.8, 'evidence': ['relationships: Originator creates Memento', 'common methods: save_state']}, {'name': 'Visitor', 'match_type': 'partial', 'implemented_parts': ['adds operations', 'accepts visitors'], 'confidence': 0.75, 'evidence': ['relationships: Visitor adds operations to Element', 'common methods: visit']}]",This file defines communication and state management patterns.,"{'constants': ['Defines communication-related constants'], 'types': ['Custom types for communication patterns'], 'classes': ['Mediator centralizes communication', 'Memento captures state'], 'functions': ['Mediate between colleagues', 'Capture and restore state', 'Add operations dynamically']}"
