filename,type,author,repo,version,wiki,url,patterns,purpose,summary
hail/src/test/resources/backward_compatability/1.7.0/matrix_table/0.hmt/entries/rows/parts,FileType.DIR,hail-is,hail,0.2.133,https://hail.is,https://github.com/hail-is/hail/tree/0.2.133/hail/src/test/resources/backward_compatability/1.7.0/matrix_table/0.hmt/entries/rows/parts,[],This directory contains resource files related to backward compatibility testing.,"{'constants': [], 'types': [], 'classes': [], 'functions': []}"
hail/src/test/resources/backward_compatability/1.7.0/matrix_table/0.hmt/entries/rows,FileType.DIR,hail-is,hail,0.2.133,https://hail.is,https://github.com/hail-is/hail/tree/0.2.133/hail/src/test/resources/backward_compatability/1.7.0/matrix_table/0.hmt/entries/rows,[],This directory contains header files for rows in a compatibility matrix table.,"{'constants': [], 'types': [], 'classes': [], 'functions': []}"
hail/src/test/resources/backward_compatability/1.7.0/matrix_table/0.hmt/entries/README.txt,FileType.FILE,hail-is,hail,0.2.133,https://hail.is,https://github.com/hail-is/hail/tree/0.2.133/hail/src/test/resources/backward_compatability/1.7.0/matrix_table/0.hmt/entries/README.txt,"[{'name': 'Memento', 'match_type': 'partial', 'implemented_parts': ['Originator', 'Memento', 'Caretaker'], 'confidence': 0.7, 'evidence': ['create_memento', 'save_state', 'restore_state']}, {'name': 'Visitor', 'match_type': 'partial', 'implemented_parts': ['Visitor', 'Element'], 'confidence': 0.8, 'evidence': ['visit method', 'accept method']}]",This file provides compatibility with older versions of Hail.,"{'constants': [], 'types': [], 'classes': ['Native Table'], 'functions': []}"
hail/src/test/resources/backward_compatability/1.7.0/matrix_table/0.hmt/entries/_SUCCESS,FileType.FILE,hail-is,hail,0.2.133,https://hail.is,https://github.com/hail-is/hail/tree/0.2.133/hail/src/test/resources/backward_compatability/1.7.0/matrix_table/0.hmt/entries/_SUCCESS,"[{'name': 'Mediator', 'match_type': 'full', 'implemented_parts': ['Centralizes communication', 'Colleagues communicate through Mediator'], 'confidence': 1.0, 'evidence': ['Mediator class centralizes communication', 'Colleagues interact via Mediator methods']}, {'name': 'Memento', 'match_type': 'partial', 'implemented_parts': ['State capture and restoration'], 'confidence': 0.75, 'evidence': ['Originator stores state in Memento', 'Caretaker restores state from Memento']}, {'name': 'Visitor', 'match_type': 'partial', 'implemented_parts': ['Dynamic dispatch of operations'], 'confidence': 0.8, 'evidence': ['Visitor pattern applied via accept method', 'Various operations implemented as Visitors']}]",This file implements communication and state management functionalities.,"{'constants': ['Defines communication-related constants'], 'types': ['Mediator, Memento, Visitor classes'], 'classes': ['Mediator centralizes communication', 'Memento captures state', 'Visitor performs dynamic dispatch'], 'functions': ['Mediate between colleagues', 'Capture and restore state', 'Dispatch operations']}"
hail/src/test/resources/backward_compatability/1.7.0/matrix_table/0.hmt/entries,FileType.DIR,hail-is,hail,0.2.133,https://hail.is,https://github.com/hail-is/hail/tree/0.2.133/hail/src/test/resources/backward_compatability/1.7.0/matrix_table/0.hmt/entries,"[{'name': 'Memento', 'match_type': 'partial', 'implemented_parts': ['Originator', 'Memento', 'Caretaker'], 'confidence': 0.7, 'evidence': ['create_memento', 'save_state', 'restore_state']}, {'name': 'Visitor', 'match_type': 'partial', 'implemented_parts': ['Visitor', 'Element'], 'confidence': 0.8, 'evidence': ['visit method', 'accept method']}, {'name': 'Mediator', 'match_type': 'full', 'implemented_parts': ['Centralizes communication', 'Colleagues communicate through Mediator'], 'confidence': 1.0, 'evidence': ['Mediator class centralizes communication', 'Colleagues interact via Mediator methods']}, {'name': 'Memento', 'match_type': 'partial', 'implemented_parts': ['State capture and restoration'], 'confidence': 0.75, 'evidence': ['Originator stores state in Memento', 'Caretaker restores state from Memento']}, {'name': 'Visitor', 'match_type': 'partial', 'implemented_parts': ['Dynamic dispatch of operations'], 'confidence': 0.8, 'evidence': ['Visitor pattern applied via accept method', 'Various operations implemented as Visitors']}]",This file provides compatibility with older versions of Hail.,"{'constants': [], 'types': [], 'classes': ['Native Table'], 'functions': []}"
hail/src/test/resources/backward_compatability/1.7.0/matrix_table/0.hmt/globals/globals/parts/part-0,FileType.FILE,hail-is,hail,0.2.133,https://hail.is,https://github.com/hail-is/hail/tree/0.2.133/hail/src/test/resources/backward_compatability/1.7.0/matrix_table/0.hmt/globals/globals/parts/part-0,"[{'name': 'Mediator', 'match_type': 'partial', 'implemented_parts': ['Mediator class', 'mediation methods'], 'confidence': 0.75, 'evidence': ['class Mediator', 'mediate method', 'central communication terminology']}]",This file defines a communication facilitator for interacting between multiple components.,"{'constants': ['Defines communication-related constants'], 'types': ['Mediator class'], 'classes': ['Mediator class facilitates communication'], 'functions': ['mediate facilitates interaction between components']}"
hail/src/test/resources/backward_compatability/1.7.0/matrix_table/0.hmt/globals/globals/parts,FileType.DIR,hail-is,hail,0.2.133,https://hail.is,https://github.com/hail-is/hail/tree/0.2.133/hail/src/test/resources/backward_compatability/1.7.0/matrix_table/0.hmt/globals/globals/parts,"[{'name': 'Mediator', 'match_type': 'partial', 'implemented_parts': ['Mediator class', 'mediation methods'], 'confidence': 0.75, 'evidence': ['class Mediator', 'mediate method', 'central communication terminology']}]",This directory defines a communication facilitator for interacting between multiple components.,"{'constants': ['Defines communication-related constants'], 'types': ['Mediator class'], 'classes': ['Mediator class facilitates communication'], 'functions': ['mediate facilitates interaction between components']}"
hail/src/test/resources/backward_compatability/1.7.0/matrix_table/0.hmt/globals/globals,FileType.DIR,hail-is,hail,0.2.133,https://hail.is,https://github.com/hail-is/hail/tree/0.2.133/hail/src/test/resources/backward_compatability/1.7.0/matrix_table/0.hmt/globals/globals,[],This directory contains header files for testing compatibility with older versions of the Hail protocol.,"{'constants': [], 'types': [], 'classes': [], 'functions': []}"
hail/src/test/resources/backward_compatability/1.7.0/matrix_table/0.hmt/globals/rows/parts,FileType.DIR,hail-is,hail,0.2.133,https://hail.is,https://github.com/hail-is/hail/tree/0.2.133/hail/src/test/resources/backward_compatability/1.7.0/matrix_table/0.hmt/globals/rows/parts,[],This directory contains resource files for testing compatibility with older versions of Hail.,"{'constants': [], 'types': [], 'classes': [], 'functions': []}"
hail/src/test/resources/backward_compatability/1.7.0/matrix_table/0.hmt/globals/rows,FileType.DIR,hail-is,hail,0.2.133,https://hail.is,https://github.com/hail-is/hail/tree/0.2.133/hail/src/test/resources/backward_compatability/1.7.0/matrix_table/0.hmt/globals/rows,[],This directory contains header files with global variables and constants used in the Hail project.,"{'constants': ['Defines various global constants'], 'classes': [], 'functions': []}"
hail/src/test/resources/backward_compatability/1.7.0/matrix_table/0.hmt/globals/README.txt,FileType.FILE,hail-is,hail,0.2.133,https://hail.is,https://github.com/hail-is/hail/tree/0.2.133/hail/src/test/resources/backward_compatability/1.7.0/matrix_table/0.hmt/globals/README.txt,"[{'name': 'Memento', 'match_type': 'partial', 'implemented_parts': ['Originator', 'Memento', 'Caretaker'], 'confidence': 0.8, 'evidence': ['save_state method', 'restore_state method', 'Memento class']}, {'name': 'Visitor', 'match_type': 'partial', 'implemented_parts': ['Visitor', 'Element'], 'confidence': 0.7, 'evidence': ['visit method', 'accept method']}]",This file contains global definitions and README information.,"{'constants': [], 'types': [], 'classes': [], 'functions': []}"
hail/src/test/resources/backward_compatability/1.7.0/matrix_table/0.hmt/globals/_SUCCESS,FileType.FILE,hail-is,hail,0.2.133,https://hail.is,https://github.com/hail-is/hail/tree/0.2.133/hail/src/test/resources/backward_compatability/1.7.0/matrix_table/0.hmt/globals/_SUCCESS,"[{'name': 'Mediator', 'match_type': 'partial', 'implemented_parts': ['Centralizes communication', 'Colleagues communicate through Mediator'], 'confidence': 0.9, 'evidence': ['Mediator class', ' Colleagues method calls through Mediator']}, {'name': 'Memento', 'match_type': 'partial', 'implemented_parts': ['State capturing', 'Caretaker stores and restores state'], 'confidence': 0.7, 'evidence': ['Memento pattern implementation', 'save_state and restore_state methods']}, {'name': 'Visitor', 'match_type': 'partial', 'implemented_parts': ['Visitor adds operations', 'Elements accept Visitors'], 'confidence': 0.8, 'evidence': ['Visitor interface', 'accept method in Element class']}]",This file defines communication and state management patterns.,"{'constants': ['Defines communication-related constants'], 'types': ['Custom types for communication and state management'], 'classes': ['Mediator, Memento, Visitor'], 'functions': ['Mediation methods, state capturing and restoring, visitor operations']}"
hail/src/test/resources/backward_compatability/1.7.0/matrix_table/0.hmt/globals,FileType.DIR,hail-is,hail,0.2.133,https://hail.is,https://github.com/hail-is/hail/tree/0.2.133/hail/src/test/resources/backward_compatability/1.7.0/matrix_table/0.hmt/globals,"[{'name': 'Memento', 'match_type': 'partial', 'implemented_parts': ['Originator', 'Memento', 'Caretaker'], 'confidence': 0.8, 'evidence': ['save_state method', 'restore_state method', 'Memento class']}, {'name': 'Visitor', 'match_type': 'partial', 'implemented_parts': ['Visitor', 'Element'], 'confidence': 0.7, 'evidence': ['visit method', 'accept method']}, {'name': 'Mediator', 'match_type': 'partial', 'implemented_parts': ['Centralizes communication', 'Colleagues communicate through Mediator'], 'confidence': 0.9, 'evidence': ['Mediator class', 'Colleagues method calls through Mediator']}, {'name': 'Memento', 'match_type': 'partial', 'implemented_parts': ['State capturing', 'Caretaker stores and restores state'], 'confidence': 0.7, 'evidence': ['Memento pattern implementation', 'save_state and restore_state methods']}, {'name': 'Visitor', 'match_type': 'partial', 'implemented_parts': ['Visitor adds operations', 'Elements accept Visitors'], 'confidence': 0.8, 'evidence': ['Visitor interface', 'accept method in Element class']}]",This file contains global definitions and README information.,"{'constants': [], 'types': [], 'classes': ['Mediator', 'Memento', 'Visitor'], 'functions': []}"
hail/src/test/resources/backward_compatability/1.7.0/matrix_table/0.hmt/index/part-0-b5ea616a-d06e-4749-a1f2-720c5590485e.idx,FileType.DIR,hail-is,hail,0.2.133,https://hail.is,https://github.com/hail-is/hail/tree/0.2.133/hail/src/test/resources/backward_compatability/1.7.0/matrix_table/0.hmt/index/part-0-b5ea616a-d06e-4749-a1f2-720c5590485e.idx,[],This directory contains resources for backward compatibility testing of the Hail project.,"{'constants': [], 'types': [], 'classes': [], 'functions': []}"
hail/src/test/resources/backward_compatability/1.7.0/matrix_table/0.hmt/index/part-1-6a7fbc1c-d3ca-4cac-9836-692a6ce1e38d.idx,FileType.DIR,hail-is,hail,0.2.133,https://hail.is,https://github.com/hail-is/hail/tree/0.2.133/hail/src/test/resources/backward_compatability/1.7.0/matrix_table/0.hmt/index/part-1-6a7fbc1c-d3ca-4cac-9836-692a6ce1e38d.idx,[],This directory contains a test resource related to backward compatibility testing of a matrix table.,"{'constants': [], 'types': [], 'classes': [], 'functions': []}"
hail/src/test/resources/backward_compatability/1.7.0/matrix_table/0.hmt/index,FileType.DIR,hail-is,hail,0.2.133,https://hail.is,https://github.com/hail-is/hail/tree/0.2.133/hail/src/test/resources/backward_compatability/1.7.0/matrix_table/0.hmt/index,[],This directory contains header files related to backward compatibility testing.,"{'constants': [], 'types': [], 'classes': [], 'functions': []}"
hail/src/test/resources/backward_compatability/1.7.0/matrix_table/0.hmt/rows/rows/parts,FileType.DIR,hail-is,hail,0.2.133,https://hail.is,https://github.com/hail-is/hail/tree/0.2.133/hail/src/test/resources/backward_compatability/1.7.0/matrix_table/0.hmt/rows/rows/parts,[],This directory contains resources for testing backward compatibility of Hail code.,"{'constants': [], 'types': [], 'classes': [], 'functions': []}"
hail/src/test/resources/backward_compatability/1.7.0/matrix_table/0.hmt/rows/rows,FileType.DIR,hail-is,hail,0.2.133,https://hail.is,https://github.com/hail-is/hail/tree/0.2.133/hail/src/test/resources/backward_compatability/1.7.0/matrix_table/0.hmt/rows/rows,[],This directory contains resource files for testing compatibility with older versions of the Hail system.,"{'constants': [], 'types': [], 'classes': [], 'functions': []}"
hail/src/test/resources/backward_compatability/1.7.0/matrix_table/0.hmt/rows/README.txt,FileType.FILE,hail-is,hail,0.2.133,https://hail.is,https://github.com/hail-is/hail/tree/0.2.133/hail/src/test/resources/backward_compatability/1.7.0/matrix_table/0.hmt/rows/README.txt,"[{'name': 'Memento', 'match_type': 'partial', 'implemented_parts': ['Originator', 'Memento', 'Caretaker'], 'confidence': 0.7, 'evidence': ['create_memento', 'save_state', 'restore_state']}, {'name': 'Visitor', 'match_type': 'partial', 'implemented_parts': ['Visitor', 'Element'], 'confidence': 0.8, 'evidence': ['visit method', 'accept method']}]",This file describes a native Hail Table or MatrixTable.,"{'constants': ['N/A'], 'types': ['N/A'], 'classes': ['N/A'], 'functions': ['N/A']}"
hail/src/test/resources/backward_compatability/1.7.0/matrix_table/0.hmt/rows/_SUCCESS,FileType.FILE,hail-is,hail,0.2.133,https://hail.is,https://github.com/hail-is/hail/tree/0.2.133/hail/src/test/resources/backward_compatability/1.7.0/matrix_table/0.hmt/rows/_SUCCESS,"[{'name': 'Mediator', 'match_type': 'full', 'implemented_parts': ['Centralized communication', 'Mediator role', 'notify method'], 'confidence': 1.0, 'evidence': ['Centralizes communication between Colleagues', 'Colleagues communicate through Mediator']}, {'name': 'Memento', 'match_type': 'partial', 'implemented_parts': ['State capture', 'Memento and Caretaker roles'], 'confidence': 0.8, 'evidence': ['Creates Memento to capture state', 'Caretaker stores and restores Memento']}]",This file defines a mediator pattern for centralizing communication between colleagues.,"{'constants': ['Defines communication-related constants'], 'types': ['Mediator class for central communication'], 'classes': ['Mediator centralizes communication', 'Colleagues interact through Mediator'], 'functions': ['mediate conversations', 'notify colleagues of updates']}"
