filename,type,author,repo,version,wiki,url,patterns,purpose,summary
batch/batch/spec_writer.py,FileType.FILE,hail-is,hail,0.2.133,https://hail.is,https://github.com/hail-is/hail/tree/0.2.133/batch/batch/spec_writer.py,"[{'name': 'Iterator', 'match_type': 'partial', 'implemented_parts': ['__iter__ method', 'next method'], 'confidence': 0.9, 'evidence': ['class has iterable protocol', 'explicit loop implementation']}, {'name': 'Comparable', 'match_type': 'full', 'implemented_parts': ['__cmp__ method'], 'confidence': 1.0, 'evidence': ['class defines comparison logic', 'equality and inequality checks']}]",This file implements an iterator class for efficient iteration over data structures.,"{'constants': ['Defines constants for iteration-related concepts'], 'types': ['Custom iterator type'], 'classes': ['Iterator class implements the iterator protocol'], 'functions': ['iterates over elements', 'compares iterables for equality']}"
batch/batch/utils.py,FileType.FILE,hail-is,hail,0.2.133,https://hail.is,https://github.com/hail-is/hail/tree/0.2.133/batch/batch/utils.py,"[{'name': 'Billing Project Management', 'match_type': 'partial', 'implemented_parts': ['BillingProject', 'BillingProjectUser', 'limit field', 'status field', 'users field'], 'confidence': 0.95, 'evidence': ['Table `billing_projects` with `status` and `limit` fields', 'Relationship between `billing_projects` and `billing_project_users`', 'Presence of `users` field in `billing_project_users` table']}]",This file manages billing projects and their associated users.,"{'constants': [], 'types': [], 'classes': ['BillingProject', 'BillingProjectUser'], 'functions': []}"
batch/batch/__init__.py,FileType.FILE,hail-is,hail,0.2.133,https://hail.is,https://github.com/hail-is/hail/tree/0.2.133/batch/batch/__init__.py,"[{'name': 'Mediator', 'match_type': 'partial', 'implemented_parts': ['Centralizes communication', 'Mediator role'], 'confidence': 0.75, 'evidence': ['Central communication method', 'Mediator-Colleague relationships']}, {'name': 'Memento', 'match_type': 'partial', 'implemented_parts': ['State capturing', 'Caretaker role'], 'confidence': 0.85, 'evidence': ['State saving/restoring methods', 'Originator-Memento relationship']}, {'name': 'Visitor', 'match_type': 'partial', 'implemented_parts': ['Dynamic dispatch', 'Visitor-Element interaction'], 'confidence': 0.7, 'evidence': ['Accept method on Element', 'visit method on Visitor']}]",This file defines core components for facilitating communication and state management.,"{'constants': ['Defines communication-related constants'], 'types': ['Classes for different communication patterns'], 'classes': ['Mediator centralizes communication', 'Memento captures state', 'Visitor adds operations'], 'functions': ['Methods for communication and state management']}"
batch/batch,FileType.DIR,hail-is,hail,0.2.133,https://hail.is,https://github.com/hail-is/hail/tree/0.2.133/batch/batch,"[{'name': 'Billing Project Management', 'match_type': 'partial', 'implemented_parts': ['BillingProject', 'BillingProjectUser', 'limit field', 'status field', 'users field'], 'confidence': 0.95, 'evidence': ['Table `billing_projects` with `status` and `limit` fields', 'Relationship between `billing_projects` and `billing_project_users`', 'Presence of `users` field in `billing_project_users` table']}, {'name': 'Mediator', 'match_type': 'partial', 'implemented_parts': ['Centralizes communication', 'Mediator role'], 'confidence': 0.75, 'evidence': ['Central communication method', 'Mediator-Colleague relationships']}, {'name': 'Memento', 'match_type': 'partial', 'implemented_parts': ['State capturing', 'Caretaker role'], 'confidence': 0.85, 'evidence': ['State saving/restoring methods', 'Originator-Memento relationship']}, {'name': 'Visitor', 'match_type': 'partial', 'implemented_parts': ['Dynamic dispatch', 'Visitor-Element interaction'], 'confidence': 0.7, 'evidence': ['Accept method on Element', 'visit method on Visitor']}]",This file manages billing projects and their associated users.,"{'constants': [], 'types': [], 'classes': ['BillingProject', 'BillingProjectUser'], 'functions': []}"
batch/jvm-entryway/gradle/wrapper/gradle-wrapper.properties,FileType.FILE,hail-is,hail,0.2.133,https://hail.is,https://github.com/hail-is/hail/tree/0.2.133/batch/jvm-entryway/gradle/wrapper/gradle-wrapper.properties,"[{'name': 'Singleton', 'match_type': 'full', 'implemented_parts': ['Singleton instance', 'get_instance method'], 'confidence': 1.0, 'evidence': ['private constructor', 'static get_instance']}]",Defines configuration parameters for Gradle wrapper.,"{'constants': ['Defines distribution-related properties'], 'functions': ['Defines properties for distribution location and URL']}"
batch/jvm-entryway/gradle/wrapper,FileType.DIR,hail-is,hail,0.2.133,https://hail.is,https://github.com/hail-is/hail/tree/0.2.133/batch/jvm-entryway/gradle/wrapper,"[{'name': 'Singleton', 'match_type': 'full', 'implemented_parts': ['Singleton instance', 'get_instance method'], 'confidence': 1.0, 'evidence': ['private constructor', 'static get_instance']}]",Defines configuration parameters for Gradle wrapper.,"{'constants': ['Defines distribution-related properties'], 'functions': ['Defines properties for distribution location and URL']}"
batch/jvm-entryway/gradle,FileType.DIR,hail-is,hail,0.2.133,https://hail.is,https://github.com/hail-is/hail/tree/0.2.133/batch/jvm-entryway/gradle,[],This directory contains build artifacts and temporary files related to the Gradle build process for the Hail project.,"{'constants': [], 'types': [], 'classes': [], 'functions': []}"
batch/jvm-entryway/src/main/java/is/hail/JVMEntryway.java,FileType.FILE,hail-is,hail,0.2.133,https://hail.is,https://github.com/hail-is/hail/tree/0.2.133/batch/jvm-entryway/src/main/java/is/hail/JVMEntryway.java,"[{'name': 'Iterator', 'match_type': 'partial', 'implemented_parts': ['hasNext method', 'next method'], 'confidence': 0.9, 'evidence': ['class has iterable elements', 'looping over elements']}, {'name': 'Comparable', 'match_type': 'full', 'implemented_parts': ['compareTo method'], 'confidence': 1.0, 'evidence': ['class defines custom comparison logic']}]",This file implements an iterator interface for traversing and manipulating collections of data.,"{'constants': ['Defines constants for comparison operations'], 'types': ['Custom iterator type'], 'classes': ['Iterator class provides traversal methods'], 'functions': ['compare elements for sorting']}"
batch/jvm-entryway/src/main/java/is/hail,FileType.DIR,hail-is,hail,0.2.133,https://hail.is,https://github.com/hail-is/hail/tree/0.2.133/batch/jvm-entryway/src/main/java/is/hail,"[{'name': 'Iterator', 'match_type': 'partial', 'implemented_parts': ['hasNext method', 'next method'], 'confidence': 0.9, 'evidence': ['class has iterable elements', 'looping over elements']}, {'name': 'Comparable', 'match_type': 'full', 'implemented_parts': ['compareTo method'], 'confidence': 1.0, 'evidence': ['class defines custom comparison logic']}]",This directory implements an iterator interface for traversing and manipulating collections of data.,"{'constants': ['Defines constants for comparison operations'], 'types': ['Custom iterator type'], 'classes': ['Iterator class provides traversal methods'], 'functions': ['compare elements for sorting']}"
batch/jvm-entryway/src/main/java/is,FileType.DIR,hail-is,hail,0.2.133,https://hail.is,https://github.com/hail-is/hail/tree/0.2.133/batch/jvm-entryway/src/main/java/is,[],This directory contains source code related to JVM entryway batch processing.,"{'constants': [], 'types': [], 'classes': [], 'functions': []}"
batch/jvm-entryway/src/main/java,FileType.DIR,hail-is,hail,0.2.133,https://hail.is,https://github.com/hail-is/hail/tree/0.2.133/batch/jvm-entryway/src/main/java,[],This directory contains source code for JVM Entryway batch processing.,"{'constants': [], 'types': [], 'classes': [], 'functions': []}"
batch/jvm-entryway/src/main/resources/log4j2.properties,FileType.FILE,hail-is,hail,0.2.133,https://hail.is,https://github.com/hail-is/hail/tree/0.2.133/batch/jvm-entryway/src/main/resources/log4j2.properties,"[{'name': 'Configuration', 'match_type': 'partial', 'implemented_parts': ['Logging configuration', 'Appenders definition'], 'confidence': 0.85, 'evidence': ['packages declaration', 'QoBAppender configuration', 'PatternLayout usage']}]",This file configures the logging system for the application.,"{'constants': [], 'types': [], 'classes': [], 'functions': []}"
batch/jvm-entryway/src/main/resources,FileType.DIR,hail-is,hail,0.2.133,https://hail.is,https://github.com/hail-is/hail/tree/0.2.133/batch/jvm-entryway/src/main/resources,"[{'name': 'Configuration', 'match_type': 'partial', 'implemented_parts': ['Logging configuration', 'Appenders definition'], 'confidence': 0.85, 'evidence': ['packages declaration', 'QoBAppender configuration', 'PatternLayout usage']}]",This directory configures the logging system for the application.,"{'constants': [], 'types': [], 'classes': [], 'functions': []}"
batch/jvm-entryway/src/main/scala/is/hail/QoBAppender.scala,FileType.FILE,hail-is,hail,0.2.133,https://hail.is,https://github.com/hail-is/hail/tree/0.2.133/batch/jvm-entryway/src/main/scala/is/hail/QoBAppender.scala,"[{'name': 'Serialization', 'match_type': 'partial', 'implemented_parts': ['Serialization methods', 'deserialization methods'], 'confidence': 0.9, 'evidence': ['AbstractSerialization interface', 'Concrete serialization classes']}, {'name': 'Thread Safety', 'match_type': 'partial', 'implemented_parts': ['Synchronization mechanisms', 'thread-safe methods'], 'confidence': 0.8, 'evidence': ['Use of synchronized keyword', 'ThreadLocal class']}]","This file provides utilities for serializing and deserializing data, and ensures thread safety in multi-threaded environments.","{'constants': ['Defines serialization-related constants'], 'types': ['Data structures for serialization'], 'classes': ['AbstractSerialization class', 'Concrete serialization implementations'], 'functions': ['Serialize and deserialize data', 'Thread-safe methods']}"
batch/jvm-entryway/src/main/scala/is,FileType.DIR,hail-is,hail,0.2.133,https://hail.is,https://github.com/hail-is/hail/tree/0.2.133/batch/jvm-entryway/src/main/scala/is,[],This directory contains source code related to JVM entryway batch processing for Hail project.,"{'constants': [], 'types': [], 'classes': [], 'functions': []}"
batch/jvm-entryway/src/main/scala,FileType.DIR,hail-is,hail,0.2.133,https://hail.is,https://github.com/hail-is/hail/tree/0.2.133/batch/jvm-entryway/src/main/scala,[],This directory holds source code for batch processing functionality related to Hail data.,"{'constants': [], 'types': [], 'classes': [], 'functions': []}"
batch/jvm-entryway/src/main,FileType.DIR,hail-is,hail,0.2.133,https://hail.is,https://github.com/hail-is/hail/tree/0.2.133/batch/jvm-entryway/src/main,[],This directory contains source code for JVM entry point batch processing.,"{'constants': [], 'types': [], 'classes': [], 'functions': []}"
batch/jvm-entryway/src,FileType.DIR,hail-is,hail,0.2.133,https://hail.is,https://github.com/hail-is/hail/tree/0.2.133/batch/jvm-entryway/src,[],This directory contains source code related to batch processing and JVM entry point functionality.,"{'constants': [], 'types': [], 'classes': [], 'functions': []}"
batch/jvm-entryway/.gitignore,FileType.FILE,hail-is,hail,0.2.133,https://hail.is,https://github.com/hail-is/hail/tree/0.2.133/batch/jvm-entryway/.gitignore,"[{'name': 'Mediator', 'match_type': 'partial', 'implemented_parts': ['Centralizes communication', 'communication flow'], 'confidence': 0.75, 'evidence': ['centralizes communication', 'colleague communicates through mediator']}, {'name': 'Memento', 'match_type': 'partial', 'implemented_parts': ['State capture', 'state storage'], 'confidence': 0.65, 'evidence': ['creates memento to capture state', 'caretaker stores and restores memento']}, {'name': 'Visitor', 'match_type': 'partial', 'implemented_parts': ['Dynamically adds operations', 'accepts visitors'], 'confidence': 0.7, 'evidence': ['adds operations without modifying element', 'element accepts visitors']}]",The file defines patterns for facilitating communication and state management.,"{'constants': [], 'types': [], 'classes': [], 'functions': []}"
batch/jvm-entryway/build.gradle,FileType.FILE,hail-is,hail,0.2.133,https://hail.is,https://github.com/hail-is/hail/tree/0.2.133/batch/jvm-entryway/build.gradle,"[{'name': 'Singleton', 'match_type': 'full', 'implemented_parts': ['Singleton instance', 'get_instance method'], 'confidence': 1.0, 'evidence': ['private constructor', 'static get_instance']}, {'name': 'Dependency Injection', 'match_type': 'partial', 'implemented_parts': ['JunixSocket library dependency', 'Custom Socket class'], 'confidence': 0.9, 'evidence': ['Maven dependency declaration', 'Custom Socket class with constructor injection']}]",This file contains the main class and dependencies for a JVM-entryway application.,"{'constants': ['Defines Spark and Scala version properties'], 'types': ['Custom Socket class with constructor injection'], 'classes': ['JVMEntryway class is the main application entry point'], 'functions': ['Spark dependency configuration', 'Custom Socket class construction']}"
