filename,type,author,repo,version,wiki,url,patterns,purpose,summary
hail/src/main/scala/is/hail/types/physical/PLocus.scala,FileType.FILE,hail-is,hail,0.2.133,https://hail.is,https://github.com/hail-is/hail/tree/0.2.133/hail/src/main/scala/is/hail/types/physical/PLocus.scala,"[{'name': 'Visitor', 'match_type': 'partial', 'implemented_parts': ['Subject', 'Visitor', 'visit method'], 'confidence': 0.85, 'evidence': ['class PLocus', 'visit method takes TLocus as argument', 'virtualType field']}]",This file defines a physical locus type with methods for interacting with virtual representations.,"{'constants': [], 'types': ['PLocus', 'TLocus'], 'classes': ['PLocus abstract class'], 'functions': ['visit method for interacting with virtual types']}"
hail/src/main/scala/is/hail/types/physical/PNDArray.scala,FileType.FILE,hail-is,hail,0.2.133,https://hail.is,https://github.com/hail-is/hail/tree/0.2.133/hail/src/main/scala/is/hail/types/physical/PNDArray.scala,"[{'name': 'Iterator', 'match_type': 'partial', 'implemented_parts': ['Stateful iterator', 'hasNext method', 'next method'], 'confidence': 0.9, 'evidence': ['mutable state', 'looping construct', 'element access']}, {'name': 'DataStructure', 'match_type': 'full', 'implemented_parts': ['Abstract data structure', 'insert method', 'delete method'], 'confidence': 1.0, 'evidence': ['generic type parameter', 'multiple data access methods']}]",This file implements a data structure with efficient iteration capabilities.,"{'constants': ['Defines data structure-related constants'], 'types': ['Custom data structure type'], 'classes': ['Abstract data structure class'], 'functions': ['insert and delete elements', 'iterating over elements']}"
hail/src/main/scala/is/hail/types/physical/PNumeric.scala,FileType.FILE,hail-is,hail,0.2.133,https://hail.is,https://github.com/hail-is/hail/tree/0.2.133/hail/src/main/scala/is/hail/types/physical/PNumeric.scala,"[{'name': 'Memento', 'match_type': 'partial', 'implemented_parts': ['State saving/restoring', 'Memento object'], 'confidence': 0.7, 'evidence': ['create_memento method', 'get_memento method', 'state representation']}, {'name': 'Visitor', 'match_type': 'partial', 'implemented_parts': ['Visitor pattern', 'Accept method'], 'confidence': 0.8, 'evidence': ['visit method', 'accept method', 'operation interface']}]",This file defines a numerical type with basic arithmetic operations.,"{'constants': ['None'], 'types': ['PNumeric type'], 'classes': ['PNumeric abstract class'], 'functions': ['zero method', 'add method', 'multiply method']}"
hail/src/main/scala/is/hail/types/physical/PPrimitive.scala,FileType.FILE,hail-is,hail,0.2.133,https://hail.is,https://github.com/hail-is/hail/tree/0.2.133/hail/src/main/scala/is/hail/types/physical/PPrimitive.scala,"[{'name': 'StatefulObserver', 'match_type': 'partial', 'implemented_parts': ['Stateful observer pattern', 'store method', 'storeAtAddress method', 'unstagedStoreJavaObject method'], 'confidence': 0.95, 'evidence': ['Stateful class with store method', 'Address allocation and copying in storeAtAddress', 'Unstaged store of Java objects']}, {'name': 'PrimitiveAccess', 'match_type': 'full', 'implemented_parts': ['Direct access to primitive values', 'storePrimitiveAtAddress method'], 'confidence': 1.0, 'evidence': ['Methods for storing various primitive types', 'Direct access to memory through addresses']}]",This file implements a stateful observer pattern for managing event listeners and provides access to primitive values.,"{'constants': [], 'types': ['Custom types for memory management and event handling'], 'classes': ['HailStateManager class manages state'], 'functions': ['store method for persisting state', 'storePrimitiveAtAddress for storing primitive values']}"
hail/src/main/scala/is/hail/types/physical/PSet.scala,FileType.FILE,hail-is,hail,0.2.133,https://hail.is,https://github.com/hail-is/hail/tree/0.2.133/hail/src/main/scala/is/hail/types/physical/PSet.scala,"[{'name': 'Memento', 'match_type': 'partial', 'implemented_parts': ['State saving and restoring', 'Caretaker role'], 'confidence': 0.75, 'evidence': ['save_state and restore_state methods', 'Caretaker class']}, {'name': 'Visitor', 'match_type': 'partial', 'implemented_parts': ['Visitor pattern with accept method'], 'confidence': 0.85, 'evidence': ['visit method', 'Element class with accept method']}]","This file defines a physical set type, which utilizes state management capabilities.","{'constants': [], 'types': ['PSet type'], 'classes': ['PSet class'], 'functions': ['genNonmissingValue method for state restoration']}"
hail/src/main/scala/is/hail/types/physical/PString.scala,FileType.FILE,hail-is,hail,0.2.133,https://hail.is,https://github.com/hail-is/hail/tree/0.2.133/hail/src/main/scala/is/hail/types/physical/PString.scala,"[{'name': 'Visitor Pattern', 'match_type': 'partial', 'implemented_parts': ['AcceptVisitor method', 'visit method'], 'confidence': 0.9, 'evidence': ['visit method receives a Visitor object', 'AcceptVisitor method defined in abstract class']}]",This file defines the PString class which implements the Visitor Pattern.,"{'constants': [], 'types': ['PString', 'PType'], 'classes': ['PString extends PType'], 'functions': ['unsafeOrdering', 'allocateAndStoreString']}"
hail/src/main/scala/is/hail/types/physical/PStruct.scala,FileType.FILE,hail-is,hail,0.2.133,https://hail.is,https://github.com/hail-is/hail/tree/0.2.133/hail/src/main/scala/is/hail/types/physical/PStruct.scala,"[{'name': 'Iterator', 'match_type': 'partial', 'implemented_parts': ['iterator method', 'next element', 'has_next method'], 'confidence': 0.95, 'evidence': ['for loop', 'collection class']}, {'name': 'Comparable', 'match_type': 'partial', 'implemented_parts': ['compareTo method'], 'confidence': 0.8, 'evidence': ['interface with compareTo method', 'equality checks']}, {'name': 'Builder', 'match_type': 'full', 'implemented_parts': ['build method', 'base class with blueprint'], 'confidence': 1.0, 'evidence': ['abstract builder', 'concrete builder with specific methods']}]",This file defines utilities for iterating over data structures and comparing values.,"{'constants': ['Defines constants for iteration'], 'types': ['Generic iterator type'], 'classes': ['Iterator class provides iteration methods'], 'functions': ['compare values for equality', 'build objects from blueprints']}"
hail/src/main/scala/is/hail/types/physical/PSubsetStruct.scala,FileType.FILE,hail-is,hail,0.2.133,https://hail.is,https://github.com/hail-is/hail/tree/0.2.133/hail/src/main/scala/is/hail/types/physical/PSubsetStruct.scala,"[{'name': 'Stateful Observer Pattern', 'match_type': 'partial', 'implemented_parts': ['Observer interface with state', 'Stateful update method', 'Store state in constructor'], 'confidence': 0.9, 'evidence': ['class implements Observer', 'state field in constructor', 'update method takes state as argument']}, {'name': 'Command Design Pattern', 'match_type': 'full', 'implemented_parts': ['Command interface', 'ConcreteCommand classes'], 'confidence': 1.0, 'evidence': ['abstract Command interface', 'concrete Command classes implement execute method', 'Receiver object receives command and executes it']}]",This file implements a stateful observer pattern and command design pattern.,"{'constants': ['Defines constants for command types'], 'types': ['Command interface for executing actions', 'ConcreteCommand classes for specific actions'], 'classes': ['Observer class maintains state', 'CommandSender class dispatches commands'], 'functions': ['execute method in ConcreteCommand', 'dispatch method in CommandSender']}"
hail/src/main/scala/is/hail/types/physical/PTuple.scala,FileType.FILE,hail-is,hail,0.2.133,https://hail.is,https://github.com/hail-is/hail/tree/0.2.133/hail/src/main/scala/is/hail/types/physical/PTuple.scala,"[{'name': 'Visitor', 'match_type': 'partial', 'implemented_parts': ['Visitor', 'Element', 'visit method'], 'confidence': 0.8, 'evidence': ['visit method takes Element as parameter', 'Element class has accept method']}]",This file defines a physical tuple type with associated metadata.,"{'constants': [], 'types': ['PTuple', 'PTupleField'], 'classes': ['PTuple extends PBaseStruct'], 'functions': ['virtualType method creates a virtual representation of the tuple']}"
hail/src/main/scala/is/hail/types/physical/PType.scala,FileType.FILE,hail-is,hail,0.2.133,https://hail.is,https://github.com/hail-is/hail/tree/0.2.133/hail/src/main/scala/is/hail/types/physical/PType.scala,"[{'name': 'Iterator', 'match_type': 'partial', 'implemented_parts': ['iterator object', 'hasNext method', 'next method'], 'confidence': 0.95, 'evidence': ['class with iterator methods', 'iterates over collection', 'uses index variable']}, {'name': 'Comparable', 'match_type': 'partial', 'implemented_parts': ['compareTo method'], 'confidence': 0.85, 'evidence': ['class defines compareTo method', 'compares two values', 'returns 0 if equal']}, {'name': 'Serializable', 'match_type': 'partial', 'implemented_parts': ['readObject and writeObject methods'], 'confidence': 0.9, 'evidence': ['class defines serialization methods', 'reads/writes data from file', 'compatible with external libraries']}]",This file defines data structures and utilities for efficient iteration and serialization.,"{'constants': ['Defines utility constants'], 'types': ['Custom types for iterating and serializing'], 'classes': ['Iterator class provides iteration methods'], 'functions': ['Serializes and deserializes data structures']}"
hail/src/main/scala/is/hail/types/physical/PUnrealizable.scala,FileType.FILE,hail-is,hail,0.2.133,https://hail.is,https://github.com/hail-is/hail/tree/0.2.133/hail/src/main/scala/is/hail/types/physical/PUnrealizable.scala,"[{'name': 'PUnrealizable', 'match_type': 'full', 'implemented_parts': ['Unsupported methods and fields'], 'confidence': 1.0, 'evidence': ['Unsupported operations exception', 'lack of implementation for core methods']}]",This class represents an unrealizable data type.,"{'constants': [], 'types': ['PUnrealizable'], 'classes': [], 'functions': []}"
hail/src/main/scala/is/hail/types/physical/PVoid.scala,FileType.FILE,hail-is,hail,0.2.133,https://hail.is,https://github.com/hail-is/hail/tree/0.2.133/hail/src/main/scala/is/hail/types/physical/PVoid.scala,"[{'name': 'PType', 'match_type': 'full', 'implemented_parts': ['Case object defining PType', 'PUnrealizable trait'], 'confidence': 1.0, 'evidence': ['case object PVoid', 'extends PType', 'implements PUnrealizable']}, {'name': 'SVoid', 'match_type': 'partial', 'implemented_parts': ['Type alias for SType'], 'confidence': 0.9, 'evidence': ['type alias SVoid = ...', 'extends SType']}]",Defines a physical type representing the absence of a value.,"{'constants': [], 'types': ['SVoid - alias for SType'], 'classes': ['PVoid - case object representing PType'], 'functions': []}"
hail/src/main/scala/is/hail/types/physical/StoredSTypePType.scala,FileType.FILE,hail-is,hail,0.2.133,https://hail.is,https://github.com/hail-is/hail/tree/0.2.133/hail/src/main/scala/is/hail/types/physical/StoredSTypePType.scala,"[{'name': 'StoredStypePType', 'match_type': 'partial', 'implemented_parts': ['castRename method', 'containsPointers', 'setRequired method'], 'confidence': 0.9, 'evidence': ['StoredSTypePType class definition', 'use of castRename method for type conversion', 'checks for pointers in the type definition']}]",This file represents a stored data type that supports renaming and pointer handling.,"{'constants': [], 'types': ['StoredSTypePType class for storing renamed types'], 'classes': ['StoredSTypePType class'], 'functions': []}"
hail/src/main/scala/is/hail/types/physical,FileType.DIR,hail-is,hail,0.2.133,https://hail.is,https://github.com/hail-is/hail/tree/0.2.133/hail/src/main/scala/is/hail/types/physical,"[{'name': 'Iterator', 'match_type': 'full', 'implemented_parts': ['Provides iteration methods', 'Serializes and deserializes data structures'], 'confidence': 1.0, 'evidence': ['Serializes and deserializes data structures function', 'Iterator class definition']}, {'name': 'PUnrealizable', 'match_type': 'full', 'implemented_parts': ['Unsupported methods and fields'], 'confidence': 1.0, 'evidence': ['Unsupported operations exception', 'Lack of implementation for core methods']}, {'name': 'PType', 'match_type': 'full', 'implemented_parts': ['Case object defining PType', 'PUnrealizable trait'], 'confidence': 1.0, 'evidence': ['Case object PVoid', 'Extends PType', 'Implements PUnrealizable']}, {'name': 'SVoid', 'match_type': 'partial', 'implemented_parts': ['Type alias for SType'], 'confidence': 0.9, 'evidence': ['Type alias SVoid = ...', 'Extends SType']}, {'name': 'StoredStypePType', 'match_type': 'partial', 'implemented_parts': ['castRename method', 'Contains pointers', 'SetRequired method'], 'confidence': 0.9, 'evidence': ['StoredSTypePType class definition', 'Use of castRename method for type conversion', 'Checks for pointers in the type definition']}]",This directory contains classes and types related to data storage and manipulation.,"{'constants': [], 'types': ['SVoid - alias for SType', 'StoredSTypePType - class for storing renamed types'], 'classes': ['StoredSTypePType'], 'functions': []}"
hail/src/main/scala/is/hail/types/virtual/BlockMatrixType.scala,FileType.FILE,hail-is,hail,0.2.133,https://hail.is,https://github.com/hail-is/hail/tree/0.2.133/hail/src/main/scala/is/hail/types/virtual/BlockMatrixType.scala,"[{'name': 'BlockMatrix', 'match_type': 'partial', 'implemented_parts': ['Distributed block storage', 'Parallel matrix multiplication'], 'confidence': 0.95, 'evidence': ['parallel decomposition', 'block dependencies', 'distributed data structures']}]",This file defines a distributed block matrix data structure for parallel numerical computations.,"{'constants': ['Defines constants for block size and sparsity'], 'types': ['BlockMatrix type represents the block matrix'], 'classes': ['BlockMatrix class manages the block data structure'], 'functions': ['Block multiplication', 'Dependency extraction']}"
hail/src/main/scala/is/hail/types/virtual/Field.scala,FileType.FILE,hail-is,hail,0.2.133,https://hail.is,https://github.com/hail-is/hail/tree/0.2.133/hail/src/main/scala/is/hail/types/virtual/Field.scala,"[{'name': 'Visitor', 'match_type': 'partial', 'implemented_parts': ['AcceptVisitor interface, visit method'], 'confidence': 0.85, 'evidence': ['visit method receives Visitor as argument', 'Element accepts Visitors through AcceptVisitor interface']}]",This file defines the Field data structure for storing field metadata.,"{'constants': [], 'types': ['Field represents a database field'], 'classes': ['Field class', 'Type class'], 'functions': ['unify compares fields', 'pretty formats Field data']}"
hail/src/main/scala/is/hail/types/virtual/MatrixType.scala,FileType.FILE,hail-is,hail,0.2.133,https://hail.is,https://github.com/hail-is/hail/tree/0.2.133/hail/src/main/scala/is/hail/types/virtual/MatrixType.scala,"[{'name': 'Matrix Data Structure', 'match_type': 'partial', 'implemented_parts': ['Row and column binding', 'Entry storage and retrieval', 'Row and column key management'], 'confidence': 0.95, 'evidence': ['Env data structure for environment variables', 'IndexedSeq for collections of key-value pairs', 'Row and column name references', 'Entry value storage and retrieval methods']}, {'name': 'Genome-Wide Association Studies', 'match_type': 'partial', 'implemented_parts': ['Row key variant analysis', 'Column key string representation', 'Reference genome name retrieval'], 'confidence': 0.85, 'evidence': ['Locus and allele types in row key', 'String representation for column key', 'Reference genome annotation', 'Global type representation']}]",This code implements a data structure for storing and manipulating genetic data from genome-wide association studies.,"{'constants': ['Defines constants related to the data structure'], 'types': ['Custom types for row, column, and entry values'], 'classes': ['Env data structure for environment variables'], 'functions': ['Row and column binding methods', 'Entry storage and retrieval methods', 'Row key variant analysis functions', 'Column key string representation functions']}"
hail/src/main/scala/is/hail/types/virtual/TableType.scala,FileType.FILE,hail-is,hail,0.2.133,https://hail.is,https://github.com/hail-is/hail/tree/0.2.133/hail/src/main/scala/is/hail/types/virtual/TableType.scala,"[{'name': 'Iterator', 'match_type': 'partial', 'implemented_parts': ['hasNext method', 'next method'], 'confidence': 0.9, 'evidence': ['class Iterator', 'looping constructs']}, {'name': 'Comparable', 'match_type': 'full', 'implemented_parts': ['compareTo method'], 'confidence': 1.0, 'evidence': ['interface Comparable']}]",This file defines an iterator interface for iterating over collections of data.,"{'constants': ['Defines comparison-related constants'], 'types': ['Custom iterator type'], 'classes': ['Iterator interface'], 'functions': ['compare elements', 'looping methods']}"
hail/src/main/scala/is/hail/types/virtual/TArray.scala,FileType.FILE,hail-is,hail,0.2.133,https://hail.is,https://github.com/hail-is/hail/tree/0.2.133/hail/src/main/scala/is/hail/types/virtual/TArray.scala,"[{'name': 'Iterator', 'match_type': 'partial', 'implemented_parts': ['next method', 'current element access'], 'confidence': 0.9, 'evidence': ['class Iterator', 'iterates over collection', 'accessing current element']}, {'name': 'Comparable', 'match_type': 'partial', 'implemented_parts': ['compare to method'], 'confidence': 0.8, 'evidence': ['class Comparable', 'comparison operators', 'implementing equals method']}, {'name': 'List', 'match_type': 'full', 'implemented_parts': ['append method', 'list elements access'], 'confidence': 1.0, 'evidence': ['class List', 'mutable collection', 'element manipulation methods']}]",This file defines an iterative data structure for efficiently handling sequences of elements.,"{'constants': ['Defines list-related constants'], 'types': ['Custom list type'], 'classes': ['List class implements list functionalities'], 'functions': ['adding elements', 'iterating over elements']}"
hail/src/main/scala/is/hail/types/virtual/TBaseStruct.scala,FileType.FILE,hail-is,hail,0.2.133,https://hail.is,https://github.com/hail-is/hail/tree/0.2.133/hail/src/main/scala/is/hail/types/virtual/TBaseStruct.scala,"[{'name': 'Iterator', 'match_type': 'partial', 'implemented_parts': ['Iterable implementation', 'iterator method', 'hasNext and next methods'], 'confidence': 0.9, 'evidence': ['Iterable interface', 'iterator class', 'hasNext and next methods defined']}, {'name': 'Comparable', 'match_type': 'partial', 'implemented_parts': ['compareTo method', 'equals and hashcode methods'], 'confidence': 0.8, 'evidence': ['Comparable interface', 'compareTo method definition', 'equals and hashcode methods defined']}]",This file defines utility classes for iterating over collections and comparing values.,"{'constants': ['Defines constants for comparison'], 'types': ['Custom types for iterating and comparing'], 'classes': ['Iterable class for iterating', 'Comparable interface for comparing'], 'functions': ['compareTo method for comparing', 'iterator method for iterating']}"
