filename,type,author,repo,version,wiki,url,patterns,purpose,summary
hail/python/test/hail/expr/test_math.py,FileType.FILE,hail-is,hail,0.2.133,https://hail.is,https://github.com/hail-is/hail/tree/0.2.133/hail/python/test/hail/expr/test_math.py,"[{'name': 'Visitor pattern', 'match_type': 'partial', 'implemented_parts': ['Visitor adds operations to Element without modifying it', 'Element accepts Visitors'], 'confidence': 0.9, 'evidence': ['visit method on Element', 'accept method on Element', 'Operation class for manipulating Element']}]",This file tests mathematical functions implemented in the Hail library.,"{'constants': ['None'], 'types': ['Decimal'], 'classes': ['None'], 'functions': ['logit', 'expit']}"
hail/python/test/hail/expr/test_ndarrays.py,FileType.FILE,hail-is,hail,0.2.133,https://hail.is,https://github.com/hail-is/hail/tree/0.2.133/hail/python/test/hail/expr/test_ndarrays.py,"[{'name': 'Linear Algebra Operations', 'match_type': 'partial', 'implemented_parts': ['Matrix multiplication', 'Solving linear systems', 'Eigenvalue decomposition', 'Solving triangular systems'], 'confidence': 0.95, 'evidence': ['annotation of matrix x', 'solving equations with ht.g', 'svd and inv functions', 'h and i functions for matrix manipulation']}, {'name': 'Log Broadcasting', 'match_type': 'partial', 'implemented_parts': ['Broadcasting logarithmic function'], 'confidence': 0.85, 'evidence': ['log function applied to array']}, {'name': 'Memory Allocation Optimization', 'match_type': 'partial', 'implemented_parts': ['Handling large arrays efficiently'], 'confidence': 0.75, 'evidence': ['range_matrix_table function', 'aggregate_cols function', 'array_equal function with large dataset']}]",This file contains helper functions for performing linear algebra operations and managing large datasets efficiently.,"{'constants': [], 'types': [], 'classes': [], 'functions': ['log function for broadcasting', 'matrix multiplication and solving functions', 'eigenvalue and triangular system solvers', 'functions for memory allocation optimization']}"
hail/python/test/hail/expr/test_show.py,FileType.FILE,hail-is,hail,0.2.133,https://hail.is,https://github.com/hail-is/hail/tree/0.2.133/hail/python/test/hail/expr/test_show.py,"[{'name': 'Balding Nichols Model', 'match_type': 'full', 'implemented_parts': ['Population genetic model', 'balding-nichols method'], 'confidence': 1.0, 'evidence': ['Hardy-Weinberg equilibrium equations', 'allele frequency update rule']}, {'name': 'Sample Index Tracking', 'match_type': 'partial', 'implemented_parts': ['Sample indices as genetic data', 'sample_idx method'], 'confidence': 0.9, 'evidence': ['Initialization of sample indices', 'Updates based on simulations']}, {'name': 'Genetic Variation Analysis', 'match_type': 'partial', 'implemented_parts': ['Number of alternative alleles', 'GT allele counting'], 'confidence': 0.8, 'evidence': ['Methods for allele counting', 'Calculation of genetic diversity measures']}, {'name': 'Population Size Estimation', 'match_type': 'partial', 'implemented_parts': ['Number of alleles and genotypes', 'sample size estimation'], 'confidence': 0.7, 'evidence': ['Model-based estimation of population size', 'Comparison with observed data']}]",This file implements a Balding-Nichols model for simulating genetic diversity in populations.,"{'constants': ['Population parameters and genetic diversity measures'], 'types': ['Random number generators', 'Genetic data structures'], 'classes': ['BaldingNicholsModel class for model simulation'], 'functions': ['Sample simulations', 'Genetic diversity analysis']}"
hail/python/test/hail/expr/test_types.py,FileType.FILE,hail-is,hail,0.2.133,https://hail.is,https://github.com/hail-is/hail/tree/0.2.133/hail/python/test/hail/expr/test_types.py,"[{'name': 'Set Construction', 'match_type': 'partial', 'implemented_parts': ['Empty set initialization', 'Adding elements using various methods'], 'confidence': 0.9, 'evidence': ['start_set() function call', 'tset() function usage', 'tarray() function for element addition']}, {'name': 'Type Inference', 'match_type': 'full', 'implemented_parts': ['Automatic type deduction for various data structures', 'Custom type definition using tstruct() function'], 'confidence': 1.0, 'evidence': ['tinterval() type inference', 'tdict() function with type argument', 'tunion() function with type union']}]",This code snippet showcases advanced type manipulation techniques in Hail.,"{'constants': [], 'types': ['Custom types using tstruct()', 'Intervals and dictionaries', 'Set data structure with type inference'], 'classes': [], 'functions': []}"
hail/python/test/hail/expr/__init__.py,FileType.FILE,hail-is,hail,0.2.133,https://hail.is,https://github.com/hail-is/hail/tree/0.2.133/hail/python/test/hail/expr/__init__.py,"[{'name': 'Mediator', 'match_type': 'full', 'implemented_parts': ['Mediator roles', 'communication centralisation'], 'confidence': 0.95, 'evidence': ['Centralizes communication', 'Roles include Mediator and Colleague']}, {'name': 'Memento', 'match_type': 'partial', 'implemented_parts': ['Originator, Memento, Caretaker roles'], 'confidence': 0.8, 'evidence': ['Creating Memento to capture state', 'Storing and restoring state']}, {'name': 'Visitor', 'match_type': 'partial', 'implemented_parts': ['Visitor pattern', 'Dynamic dispatch of operations'], 'confidence': 0.75, 'evidence': ['Adds operations without modifying Element', 'Accepts different Visitors']}]",This file implements core components of a messaging system.,"{'constants': ['Defines message-related constants'], 'types': ['Message classes', 'Communicator interfaces'], 'classes': ['Mediator centralizes communication', 'Memento captures state', 'Visitor adds operations'], 'functions': ['Sending and receiving messages', 'Mediating communication', 'Storing and retrieving state']}"
hail/python/test/hail/expr,FileType.DIR,hail-is,hail,0.2.133,https://hail.is,https://github.com/hail-is/hail/tree/0.2.133/hail/python/test/hail/expr,"[{'name': 'Mediator', 'match_type': 'full', 'implemented_parts': ['Mediator roles', 'communication centralisation'], 'confidence': 0.95, 'evidence': ['Centralizes communication', 'Roles include Mediator and Colleague']}, {'name': 'Memento', 'match_type': 'partial', 'implemented_parts': ['Originator, Memento, Caretaker roles'], 'confidence': 0.8, 'evidence': ['Creating Memento to capture state', 'Storing and restoring state']}, {'name': 'Visitor', 'match_type': 'partial', 'implemented_parts': ['Visitor pattern', 'Dynamic dispatch of operations'], 'confidence': 0.75, 'evidence': ['Adds operations without modifying Element', 'Accepts different Visitors']}]",This code snippet showcases advanced type manipulation techniques in Hail.,"{'constants': ['Defines message-related constants'], 'types': ['Custom types using tstruct()', 'Intervals and dictionaries'], 'classes': ['Mediator centralizes communication', 'Memento captures state', 'Visitor adds operations'], 'functions': ['Sending and receiving messages', 'Mediating communication', 'Storing and retrieving state']}"
hail/python/test/hail/extract_intervals/conftest.py,FileType.FILE,hail-is,hail,0.2.133,https://hail.is,https://github.com/hail-is/hail/tree/0.2.133/hail/python/test/hail/extract_intervals/conftest.py,"[{'name': 'Test Fixture', 'match_type': 'full', 'implemented_parts': ['pytest fixture', 'mt and ht fixtures'], 'confidence': 1.0, 'evidence': ['@pytest.fixture decorator', 'hl.read_matrix_table function']}]",This file defines unit tests for functions in the hail library.,"{'constants': [], 'types': [], 'classes': [], 'functions': ['pytest fixtures for accessing hail data']}"
hail/python/test/hail/extract_intervals/test_full_key.py,FileType.FILE,hail-is,hail,0.2.133,https://hail.is,https://github.com/hail-is/hail/tree/0.2.133/hail/python/test/hail/extract_intervals/test_full_key.py,"[{'name': 'Sample Collection', 'match_type': 'full', 'implemented_parts': ['filter method', 'collect method'], 'confidence': 1.0, 'evidence': ['key-based filtering', 'collection into an array']}, {'name': 'Expectation Comparison', 'match_type': 'partial', 'implemented_parts': ['array comparison', 'assertion'], 'confidence': 0.9, 'evidence': ['element-wise comparison', 'asserting equality']}]",This code snippet demonstrates filtering and collecting values from a dataset.,"{'constants': ['No constants defined'], 'types': ['Dataset type'], 'classes': ['None'], 'functions': ['Sample collection methods']}"
hail/python/test/hail/extract_intervals/test_key_prefix.py,FileType.FILE,hail-is,hail,0.2.133,https://hail.is,https://github.com/hail-is/hail/tree/0.2.133/hail/python/test/hail/extract_intervals/test_key_prefix.py,"[{'name': 'Filtering by Bounds', 'match_type': 'partial', 'implemented_parts': ['filter method', 'locus comparison', 'count function'], 'confidence': 0.9, 'evidence': ['filter rows based on locus', 'count rows after filtering', 'n_partitions function for counting partitions']}, {'name': 'Extended Filtering with Bindings', 'match_type': 'partial', 'implemented_parts': ['filter method', 'locus comparison', 'is_defined function'], 'confidence': 0.85, 'evidence': ['filter rows based on locus and defined values', 'is_defined function to check value existence', 'count function to count rows after filtering']}, {'name': 'GRCh38 Reference Genome Support', 'match_type': 'full', 'implemented_parts': ['reference_genome argument'], 'confidence': 1.0, 'evidence': ['balding_nichols_model function with GRCh38 reference']}]",This file provides methods for filtering and querying genomic data.,"{'constants': ['GRCh38 reference genome'], 'types': ['Genomic data structures'], 'classes': ['HT object for storing genomic data'], 'functions': ['Filtering methods for querying data']}"
hail/python/test/hail/extract_intervals/test_locus_position.py,FileType.FILE,hail-is,hail,0.2.133,https://hail.is,https://github.com/hail-is/hail/tree/0.2.133/hail/python/test/hail/extract_intervals/test_locus_position.py,"[{'name': 'Structure', 'match_type': 'full', 'implemented_parts': ['locus', 'alleles', 'rsid', 'qual', 'filters', 'info'], 'confidence': 1.0, 'evidence': ['presence of locus, alleles, rsid, qual, filters, and info fields', 'data types and relationships consistent with variant annotation schema']}, {'name': 'Filtering', 'match_type': 'partial', 'implemented_parts': ['filter function based on locus.position', 'n_partitions and count methods for result'], 'confidence': 0.9, 'evidence': ['code uses filter function with positional comparison', 'count method returns number of filtered rows']}]",This code snippet represents a collection of variants annotated with structural information and filtering criteria.,"{'constants': ['No relevant constants identified'], 'types': ['Variant representation with locus, alleles, rsid, quality, filters'], 'classes': ['Absent'], 'functions': ['Filtering variants based on position']}"
hail/python/test/hail/extract_intervals/__init__.py,FileType.FILE,hail-is,hail,0.2.133,https://hail.is,https://github.com/hail-is/hail/tree/0.2.133/hail/python/test/hail/extract_intervals/__init__.py,"[{'name': 'Mediator', 'match_type': 'partial', 'implemented_parts': ['Centralizes communication', 'Mediator role'], 'confidence': 0.7, 'evidence': ['Centralizes communication methods', 'Mediator relationship']}, {'name': 'Memento', 'match_type': 'partial', 'implemented_parts': ['State capture', 'Memento pattern'], 'confidence': 0.8, 'evidence': ['Save and restore state methods', 'Memento relationship']}, {'name': 'Visitor', 'match_type': 'partial', 'implemented_parts': ['Dynamically adds operations', 'Visitor pattern'], 'confidence': 0.7, 'evidence': ['Accept method for visitors', 'Visit method for applying operations']}]",This file defines core components for facilitating communication and collaboration.,"{'constants': ['Defines communication-related constants'], 'types': ['Message types for communication'], 'classes': ['Mediator facilitates communication', 'Memento stores state', 'Visitor applies operations'], 'functions': ['Mediate messages', 'Capture state', 'Visit elements to apply operations']}"
hail/python/test/hail/extract_intervals,FileType.DIR,hail-is,hail,0.2.133,https://hail.is,https://github.com/hail-is/hail/tree/0.2.133/hail/python/test/hail/extract_intervals,"[{'name': 'Mediator', 'match_type': 'partial', 'implemented_parts': ['Centralizes communication', 'Mediator role'], 'confidence': 0.7, 'evidence': ['Centralizes communication methods', 'Mediator relationship']}, {'name': 'Memento', 'match_type': 'partial', 'implemented_parts': ['State capture', 'Memento pattern'], 'confidence': 0.8, 'evidence': ['Save and restore state methods', 'Memento relationship']}, {'name': 'Visitor', 'match_type': 'partial', 'implemented_parts': ['Dynamically adds operations', 'Visitor pattern'], 'confidence': 0.7, 'evidence': ['Accept method for visitors', 'Visit method for applying operations']}]",This file defines core components for facilitating communication and collaboration.,"{'constants': ['Defines communication-related constants'], 'types': ['Message types for communication'], 'classes': ['Mediator facilitates communication', 'Memento stores state', 'Visitor applies operations'], 'functions': ['Mediate messages', 'Capture state', 'Visit elements to apply operations']}"
hail/python/test/hail/fs/test_worker_driver_fs.py,FileType.FILE,hail-is,hail,0.2.133,https://hail.is,https://github.com/hail-is/hail/tree/0.2.133/hail/python/test/hail/fs/test_worker_driver_fs.py,"[{'name': 'Requester Pays Configuration', 'match_type': 'partial', 'implemented_parts': ['Bucket access configuration', 'User project not provided'], 'confidence': 0.95, 'evidence': ['Exception message indicates bucket is requester pays', 'User project not explicitly specified in code']}, {'name': 'Public Blob Access', 'match_type': 'partial', 'implemented_parts': ['URL resolution for public blob', 'Blob content retrieval'], 'confidence': 0.98, 'evidence': ['URL points to Azure open data storage', 'Blob content is successfully read']}, {'name': 'SAS Token Authentication', 'match_type': 'partial', 'implemented_parts': ['Token generation', 'Access to private data'], 'confidence': 0.97, 'evidence': ['Azure subscription ID and resource group are retrieved from environment variables', 'SAS token is generated and used for access']}]",The code snippet demonstrates access to both private and public data using different authentication methods.,"{'constants': ['Bucket names and authentication credentials'], 'types': ['URL representations', 'Access tokens'], 'classes': ['Azure storage related libraries'], 'functions': ['Importing data from various sources', 'Authenticating with Azure storage']}"
hail/python/test/hail/fs/__init__.py,FileType.FILE,hail-is,hail,0.2.133,https://hail.is,https://github.com/hail-is/hail/tree/0.2.133/hail/python/test/hail/fs/__init__.py,"[{'name': 'Mediator', 'match_type': 'full', 'implemented_parts': ['Mediator role', 'communication centralisation', 'notify method'], 'confidence': 1.0, 'evidence': ['Mediator class', 'centralizes communication', 'notifications through notify method']}, {'name': 'Memento', 'match_type': 'partial', 'implemented_parts': ['Originator', 'Memento creation', 'restore state'], 'confidence': 0.8, 'evidence': ['Memento pattern elements', 'save_state and restore_state methods']}, {'name': 'Visitor', 'match_type': 'partial', 'implemented_parts': ['Visitor pattern structure', 'accept method'], 'confidence': 0.7, 'evidence': ['Visitor class', 'accepts operations through accept method']}]",This file defines communication and state management components for a hail system.,"{'constants': ['Defines communication-related constants'], 'types': ['Custom types for communication and state management'], 'classes': ['Mediator facilitates central communication', 'Memento captures current state'], 'functions': ['Various methods for communication and state management']}"
hail/python/test/hail/fs,FileType.DIR,hail-is,hail,0.2.133,https://hail.is,https://github.com/hail-is/hail/tree/0.2.133/hail/python/test/hail/fs,"[{'name': 'Mediator', 'match_type': 'full', 'implemented_parts': ['Mediator role', 'communication centralisation', 'notify method'], 'confidence': 1.0, 'evidence': ['Mediator class', 'centralizes communication', 'notifications through notify method']}, {'name': 'Memento', 'match_type': 'partial', 'implemented_parts': ['Originator', 'Memento creation', 'restore state'], 'confidence': 0.8, 'evidence': ['Memento pattern elements', 'save_state and restore_state methods']}, {'name': 'Visitor', 'match_type': 'partial', 'implemented_parts': ['Visitor pattern structure', 'accept method'], 'confidence': 0.7, 'evidence': ['Visitor class', 'accepts operations through accept method']}]",This file defines communication and state management components for a hail system.,"{'constants': ['Defines communication-related constants'], 'types': ['Custom types for communication and state management'], 'classes': ['Mediator facilitates central communication', 'Memento captures current state'], 'functions': ['Various methods for communication and state management']}"
hail/python/test/hail/genetics/test_call.py,FileType.FILE,hail-is,hail,0.2.133,https://hail.is,https://github.com/hail-is/hail/tree/0.2.133/hail/python/test/hail/genetics/test_call.py,"[{'name': 'Haploid Allele Representation', 'match_type': 'partial', 'implemented_parts': ['One-hot encoding of alleles', 'Ploidy determination'], 'confidence': 0.9, 'evidence': ['start_haploid method', 'one_hot_alleles function', 'ploidy attribute']}, {'name': 'Zero Allele Representation', 'match_type': 'full', 'implemented_parts': ['Empty allele list', 'Ploidy of 0'], 'confidence': 1.0, 'evidence': ['zeroploid call object', 'alleles attribute']}]",This code defines Call objects representing genotype calls and haplotype information.,"{'constants': ['None'], 'types': ['Call object'], 'classes': ['Call class'], 'functions': ['Representing genotype calls and haplotypes']}"
hail/python/test/hail/genetics/test_locus.py,FileType.FILE,hail-is,hail,0.2.133,https://hail.is,https://github.com/hail-is/hail/tree/0.2.133/hail/python/test/hail/genetics/test_locus.py,"[{'name': 'Memento', 'match_type': 'partial', 'implemented_parts': ['State saving/restoring', 'Memento object'], 'confidence': 0.7, 'evidence': ['save_state method', 'restore_state method', 'memento class']}, {'name': 'Visitor', 'match_type': 'partial', 'implemented_parts': ['Accepting visitors', 'Operation concept'], 'confidence': 0.8, 'evidence': ['accept method', 'visit method', 'operation class']}]",This file demonstrates the use of state management patterns for genetic data.,"{'constants': ['Defined constants for genetic data'], 'types': ['Locus type for representing genetic variants'], 'classes': ['Locus class for managing genetic information'], 'functions': ['Parsing and comparing loci']}"
hail/python/test/hail/genetics/test_pedigree.py,FileType.FILE,hail-is,hail,0.2.133,https://hail.is,https://github.com/hail-is/hail/tree/0.2.133/hail/python/test/hail/genetics/test_pedigree.py,"[{'name': 'Trio', 'match_type': 'partial', 'implemented_parts': ['Family relationships', 'Individual roles', 'Gender information'], 'confidence': 0.95, 'evidence': ['Pat, mat, and child relationships', 'Gender distinction', 'Specific roles for each member']}, {'name': 'Pedigree', 'match_type': 'full', 'implemented_parts': ['Pedigree structure', 'Individual representation', 'Relationships extraction'], 'confidence': 1.0, 'evidence': ['Parsing FAM files', 'Representing individuals with attributes', 'Identifying family relationships']}]",This code deals with family structures by defining individuals and their relationships.,"{'constants': ['Defines constants for family roles'], 'types': ['Trio data structure represents family units'], 'classes': ['Pedigree class manages and manipulates pedigree data'], 'functions': ['Extracting complete trios from pedigree', 'Reading and writing FAM files']}"
hail/python/test/hail/genetics/test_reference_genome.py,FileType.FILE,hail-is,hail,0.2.133,https://hail.is,https://github.com/hail-is/hail/tree/0.2.133/hail/python/test/hail/genetics/test_reference_genome.py,"[{'name': 'Custom Reference Load', 'match_type': 'partial', 'implemented_parts': ['read_matrix_table method', 'resource function'], 'confidence': 0.9, 'evidence': ['exception handling with FatalError', 'custom resource loading']}, {'name': 'Reference Genome Management', 'match_type': 'full', 'implemented_parts': ['ReferenceGenome class', 'locus_from_global_position method'], 'confidence': 1.0, 'evidence': ['custom reference genome definition', 'position conversion from global to locus']}]",This file provides functionalities for managing custom reference genomes and interacting with them.,"{'constants': ['Defines custom reference genome resource'], 'types': ['Custom reference genome class'], 'classes': ['ReferenceGenome class manages reference genomes'], 'functions': ['load_matrix_table reads matrix table from resource', 'locus_from_global_position converts global positions to locus']}"
hail/python/test/hail/genetics/__init__.py,FileType.FILE,hail-is,hail,0.2.133,https://hail.is,https://github.com/hail-is/hail/tree/0.2.133/hail/python/test/hail/genetics/__init__.py,"[{'name': 'Mediator', 'match_type': 'full', 'implemented_parts': ['Centralizes communication', 'Mediator role', 'notify method'], 'confidence': 1.0, 'evidence': ['Centralizes communication between Colleagues', 'Colleagues communicate through the Mediator']}, {'name': 'Memento', 'match_type': 'partial', 'implemented_parts': ['State capture', 'Memento pattern elements'], 'confidence': 0.7, 'evidence': ['Originator creates Memento', 'Caretaker stores and restores Memento']}, {'name': 'Visitor', 'match_type': 'partial', 'implemented_parts': ['Adds operations', 'Visitor pattern elements'], 'confidence': 0.8, 'evidence': ['Visitor adds operations to Element', 'Element accepts Visitors']}]",This file defines helper components for facilitating communication and state management in a collaborative environment.,"{'constants': ['Defines communication-related constants'], 'types': ['Custom types for communication and state management'], 'classes': ['Mediator centralizes communication', 'Memento captures state', 'Visitor adds operations'], 'functions': ['Mediate between colleagues', 'Capture and restore state', 'Add operations dynamically']}"
