filename,type,author,repo,version,wiki,url,patterns,purpose,summary
hail/src/main/scala/is/hail/utils/Logging.scala,FileType.FILE,hail-is,hail,0.2.133,https://hail.is,https://github.com/hail-is/hail/tree/0.2.133/hail/src/main/scala/is/hail/utils/Logging.scala,"[{'name': 'Iterator pattern', 'match_type': 'partial', 'implemented_parts': ['hasNext method', 'next method'], 'confidence': 0.9, 'evidence': ['for loop with conditional break', 'custom iterator class']}, {'name': 'Decorator pattern', 'match_type': 'full', 'implemented_parts': ['Decorator class', 'decorator methods'], 'confidence': 1.0, 'evidence': ['wraps another object with additional functionality', 'virtual method calls']}]",This file implements utility functions for iterating over collections of data.,"{'constants': ['Defines constants for iteration'], 'types': ['Custom iterator types'], 'classes': ['Iterator class provides iteration methods'], 'functions': ['map iterates over elements', 'filter selects elements']}"
hail/src/main/scala/is/hail/utils/MemoryBufferWrapper.scala,FileType.FILE,hail-is,hail,0.2.133,https://hail.is,https://github.com/hail-is/hail/tree/0.2.133/hail/src/main/scala/is/hail/utils/MemoryBufferWrapper.scala,"[{'name': 'Decorator', 'match_type': 'partial', 'implemented_parts': ['Wrapper class', 'forwarding methods'], 'confidence': 0.9, 'evidence': ['new MemoryBufferWrapper class', 'forwarding methods for buffer access']}, {'name': 'Facade', 'match_type': 'partial', 'implemented_parts': ['Simplified interface', 'abstraction of underlying operations'], 'confidence': 0.8, 'evidence': ['MemoryWriterWrapper provides simplified API', 'wraps MemoryBuffer functionalities']}]",This file implements wrappers around memory buffers for simplified access and additional functionalities.,"{'constants': ['Defines memory-related constants'], 'types': ['MemoryBuffer and related wrappers'], 'classes': ['MemoryBufferWrapper and MemoryWriterWrapper'], 'functions': ['Simplified methods for buffer manipulation']}"
hail/src/main/scala/is/hail/utils/MissingArrayBuilder.scala,FileType.FILE,hail-is,hail,0.2.133,https://hail.is,https://github.com/hail-is/hail/tree/0.2.133/hail/src/main/scala/is/hail/utils/MissingArrayBuilder.scala,"[{'name': 'Iterator', 'match_type': 'partial', 'implemented_parts': ['Iterator interface', 'next method'], 'confidence': 0.9, 'evidence': ['interface with next method', 'implementations like ArrayList']}, {'name': 'Comparable', 'match_type': 'partial', 'implemented_parts': ['compareTo method'], 'confidence': 0.7, 'evidence': ['class with compareTo method', 'sorting algorithms']}]",This file defines utilities for iterating over collections of data and comparing values.,"{'constants': ['Defines constants for iteration'], 'types': ['Custom types for iterators'], 'classes': ['Iterator interface defines contract', 'Concrete iterators for lists'], 'functions': ['compare values for sorting']}"
hail/src/main/scala/is/hail/utils/MultiArray2.scala,FileType.FILE,hail-is,hail,0.2.133,https://hail.is,https://github.com/hail-is/hail/tree/0.2.133/hail/src/main/scala/is/hail/utils/MultiArray2.scala,"[{'name': 'Iterator', 'match_type': 'full', 'implemented_parts': ['Iterable interface', 'iterator method'], 'confidence': 1.0, 'evidence': ['implements Iterable interface', 'defines iterator method']}, {'name': 'MultiArray2', 'match_type': 'full', 'implemented_parts': ['Array storage', 'index-based access', 'update methods'], 'confidence': 0.95, 'evidence': ['stores values in an array', 'allows indexing by row/column', 'defines update methods for elements']}]",This file defines a multi-dimensional array data structure and associated operations.,"{'constants': [], 'types': ['MultiArray2 type for representing the data structure'], 'classes': [], 'functions': ['various methods for accessing, updating, and iterating over elements']}"
hail/src/main/scala/is/hail/utils/Muple.scala,FileType.FILE,hail-is,hail,0.2.133,https://hail.is,https://github.com/hail-is/hail/tree/0.2.133/hail/src/main/scala/is/hail/utils/Muple.scala,"[{'name': 'Builder', 'match_type': 'partial', 'implemented_parts': ['Builder creates product in stages'], 'confidence': 0.7, 'evidence': ['set method to update product state']}]",This file defines a mutable data structure called Muple.,"{'constants': [], 'types': ['Muple class represents a mutable pair'], 'classes': ['Muple class'], 'functions': ['set method to update Muple contents']}"
hail/src/main/scala/is/hail/utils/NumericImplicits.scala,FileType.FILE,hail-is,hail,0.2.133,https://hail.is,https://github.com/hail-is/hail/tree/0.2.133/hail/src/main/scala/is/hail/utils/NumericImplicits.scala,"[{'name': 'Iterator', 'match_type': 'partial', 'implemented_parts': ['iterator method', 'hasNext method'], 'confidence': 0.9, 'evidence': ['class with iterable elements', 'looping over elements']}, {'name': 'Comparable', 'match_type': 'partial', 'implemented_parts': ['compareTo method'], 'confidence': 0.8, 'evidence': ['class with comparison logic', 'equality checking']}]",This file defines utilities for iterating over collections of data and comparing values.,"{'constants': ['Defines utility constants'], 'types': ['Custom iterators'], 'classes': ['Iterator class provides iterative methods'], 'functions': ['iterate over elements', 'compare values']}"
hail/src/main/scala/is/hail/utils/NumericPair.scala,FileType.FILE,hail-is,hail,0.2.133,https://hail.is,https://github.com/hail-is/hail/tree/0.2.133/hail/src/main/scala/is/hail/utils/NumericPair.scala,"[{'name': 'Pair Implementation', 'match_type': 'partial', 'implemented_parts': ['NumericPair trait', 'implicit object definitions'], 'confidence': 0.95, 'evidence': ['Generic type parameter T', 'Boxing and unboxing functions']}, {'name': 'Numeric Compatibility', 'match_type': 'full', 'implemented_parts': ['Implicitly extends scala.math.Numeric'], 'confidence': 1.0, 'evidence': ['implicit val numeric: scala.math.Numeric[T]']}]",This file defines a `NumericPair` trait for representing pairs of values along with boxing and unboxing functions.,"{'constants': [], 'types': ['Generic type pair `NumericPair`'], 'classes': ['`NumericPair` trait'], 'functions': ['Boxing and unboxing functions for various numeric types']}"
hail/src/main/scala/is/hail/utils/OrderingView.scala,FileType.FILE,hail-is,hail,0.2.133,https://hail.is,https://github.com/hail-is/hail/tree/0.2.133/hail/src/main/scala/is/hail/utils/OrderingView.scala,"[{'name': 'Memento Pattern', 'match_type': 'partial', 'implemented_parts': ['create_memento', 'get_memento'], 'confidence': 0.8, 'evidence': ['create_memento function', 'get_memento function', ""references to 'memento' terminology""]}, {'name': 'Visitor Pattern', 'match_type': 'partial', 'implemented_parts': ['Visitor adds operations without modifying Element'], 'confidence': 0.7, 'evidence': ['accept method in Element', 'visit method in Visitor', ""references to 'operation' terminology""]}]",This file implements a data structure that can store and retrieve states of a complex object.,"{'constants': ['None'], 'types': ['OrderingView generic type'], 'classes': ['OrderingView class'], 'functions': ['setValue, compare, isEquivalent methods for state management']}"
hail/src/main/scala/is/hail/utils/package.scala,FileType.FILE,hail-is,hail,0.2.133,https://hail.is,https://github.com/hail-is/hail/tree/0.2.133/hail/src/main/scala/is/hail/utils/package.scala,"[{'name': 'Iterator', 'match_type': 'partial', 'implemented_parts': ['hasNext method', 'next method'], 'confidence': 0.9, 'evidence': ['class Iterator', 'loop construct', 'element access']}, {'name': 'Comparable', 'match_type': 'full', 'implemented_parts': ['compareTo method'], 'confidence': 1.0, 'evidence': ['class Comparable', 'sorting algorithms', 'equality check']}]",This file contains utility methods for iterating over collections and comparing values.,"{'constants': ['Defines constants for iteration'], 'types': ['Custom types for iterators'], 'classes': ['Iterator class provides iteration methods'], 'functions': ['compare values for sorting']}"
hail/src/main/scala/is/hail/utils/ParseTrieNode.scala,FileType.FILE,hail-is,hail,0.2.133,https://hail.is,https://github.com/hail-is/hail/tree/0.2.133/hail/src/main/scala/is/hail/utils/ParseTrieNode.scala,"[{'name': 'Hash Table Lookup', 'match_type': 'full', 'implemented_parts': ['Hash function', 'Index calculation', 'Value retrieval'], 'confidence': 1.0, 'evidence': ['Bloom filter implementation', 'Linear probing for collisions']}, {'name': 'Trie Data Structure', 'match_type': 'partial', 'implemented_parts': ['Node representation', 'Search algorithm'], 'confidence': 0.9, 'evidence': ['Node connections form tree structure', 'Efficient search based on character']}]",This file demonstrates efficient data structures for key-value storage.,"{'constants': ['Defines data structures and algorithms'], 'types': ['Custom node type for Trie'], 'classes': ['ParseTrieNode represents a node in the Trie'], 'functions': ['Search function finds values based on characters']}"
hail/src/main/scala/is/hail/utils/PartitionCounts.scala,FileType.FILE,hail-is,hail,0.2.133,https://hail.is,https://github.com/hail-is/hail/tree/0.2.133/hail/src/main/scala/is/hail/utils/PartitionCounts.scala,"[{'name': 'Iterator pattern', 'match_type': 'partial', 'implemented_parts': ['Iterator interface', 'hasNext method', 'next method'], 'confidence': 0.95, 'evidence': ['interface with generic type parameter T', 'hasNext method checks if there are remaining elements', 'next method retrieves and removes the next element']}, {'name': 'Decorator pattern', 'match_type': 'full', 'implemented_parts': ['Decorator class', 'decorator methods', 'wrapped object access'], 'confidence': 1.0, 'evidence': ['Decorator class extends or implements the original object', 'decorator methods intercept and modify object behavior', 'wrapped object is accessible through the decorator']}]",This file implements reusable data access functionality using iterative and decorator patterns.,"{'constants': ['Defines data access-related constants'], 'types': ['Custom types for data models'], 'classes': ['Decorator class provides data access enhancements'], 'functions': ['Data access methods for CRUD operations']}"
hail/src/main/scala/is/hail/utils/Py4jUtils.scala,FileType.FILE,hail-is,hail,0.2.133,https://hail.is,https://github.com/hail-is/hail/tree/0.2.133/hail/src/main/scala/is/hail/utils/Py4jUtils.scala,"[{'name': 'Iterator pattern', 'match_type': 'partial', 'implemented_parts': ['Iterator interface', 'hasNext method', 'next method'], 'confidence': 0.9, 'evidence': ['interface definition with Iterable', 'concrete implementation of Iterator']}, {'name': 'Factory Method pattern', 'match_type': 'full', 'implemented_parts': ['AbstractFactory interface', 'ConcreteFactory implementations'], 'confidence': 1.0, 'evidence': ['abstract factory method', 'concrete factory specific methods']}]",This file utilizes design patterns for efficient iteration and object creation.,"{'constants': ['Defines constants related to the patterns'], 'types': ['Custom types for iterator and factory interfaces'], 'classes': ['AbstractFactory and ConcreteFactory implement the factory method'], 'functions': ['createIterator method for different iterator types']}"
hail/src/main/scala/is/hail/utils/RelativeFuzzyComparable.scala,FileType.FILE,hail-is,hail,0.2.133,https://hail.is,https://github.com/hail-is/hail/tree/0.2.133/hail/src/main/scala/is/hail/utils/RelativeFuzzyComparable.scala,"[{'name': 'Partial Equality', 'match_type': 'partial', 'implemented_parts': ['RelativeEq method', 'tolerance parameter'], 'confidence': 0.9, 'evidence': [""method name 'relativeEq', tolerance argument""]}, {'name': 'Implicitly Defined Comparer', 'match_type': 'full', 'implemented_parts': ['Implicit object definition for RelativeFuzzyComparable'], 'confidence': 1.0, 'evidence': [""implicit object 'rfcDoubles' for Double type""]}, {'name': 'Custom Comparer for Maps', 'match_type': 'partial', 'implemented_parts': ['RelativeEq method for Maps'], 'confidence': 0.8, 'evidence': ['custom equality check for keys and values']}]",This file defines a type-agnostic interface for comparing values with relative tolerance.,"{'constants': ['None'], 'types': ['RelativeFuzzyComparable trait'], 'classes': ['RelativeFuzzyComparable trait'], 'functions': ['relativeEq method for comparing values']}"
hail/src/main/scala/is/hail/utils/RestartableByteArrayInputStream.scala,FileType.FILE,hail-is,hail,0.2.133,https://hail.is,https://github.com/hail-is/hail/tree/0.2.133/hail/src/main/scala/is/hail/utils/RestartableByteArrayInputStream.scala,"[{'name': 'Iterator', 'match_type': 'partial', 'implemented_parts': ['hasNext method', 'next method'], 'confidence': 0.9, 'evidence': ['interface with iterator methods', 'collections framework support']}, {'name': 'Comparable', 'match_type': 'full', 'implemented_parts': ['compareTo method'], 'confidence': 1.0, 'evidence': ['interface definition with compareTo']}]",This file defines classes that facilitate iterating over collections of data and comparing their values.,"{'constants': ['Defines comparison-related constants'], 'types': ['Custom types implementing Comparable'], 'classes': ['Iterator interface provides iteration methods'], 'functions': ['compareTo compares objects for equality']}"
hail/src/main/scala/is/hail/utils/SemanticVersion.scala,FileType.FILE,hail-is,hail,0.2.133,https://hail.is,https://github.com/hail-is/hail/tree/0.2.133/hail/src/main/scala/is/hail/utils/SemanticVersion.scala,"[{'name': 'Data Class', 'match_type': 'full', 'implemented_parts': ['Constructor with parameters', 'data fields', 'equals and hashcode methods'], 'confidence': 1.0, 'evidence': ['Int major', 'Int minor', 'Int patch']}]",This file defines a SemanticVersion class for representing version numbers.,"{'constants': [], 'types': ['SemanticVersion'], 'classes': ['SemanticVersion class'], 'functions': ['Constructor from integer representation', 'supports method to compare versions']}"
hail/src/main/scala/is/hail/utils/SerializableHadoopConfiguration.scala,FileType.FILE,hail-is,hail,0.2.133,https://hail.is,https://github.com/hail-is/hail/tree/0.2.133/hail/src/main/scala/is/hail/utils/SerializableHadoopConfiguration.scala,"[{'name': 'Serialization', 'match_type': 'full', 'implemented_parts': ['Serializable interface', 'writeObject and readObject methods'], 'confidence': 1.0, 'evidence': ['implements Serializable interface', 'defines writeObject and readObject methods']}]",This class provides a way to serialize Hadoop configuration objects for storage and retrieval.,"{'constants': [], 'types': ['Serializable'], 'classes': ['SerializableHadoopConfiguration'], 'functions': ['writeObject and readObject methods for serialization']}"
hail/src/main/scala/is/hail/utils/SpillingCollectIterator.scala,FileType.FILE,hail-is,hail,0.2.133,https://hail.is,https://github.com/hail-is/hail/tree/0.2.133/hail/src/main/scala/is/hail/utils/SpillingCollectIterator.scala,"[{'name': 'Iterator pattern', 'match_type': 'partial', 'implemented_parts': ['AbstractIterator', 'hasNext method', 'next method'], 'confidence': 0.95, 'evidence': ['Generic type parameter T', 'Caching of values in buf array', 'Spilling to temporary file when size limit is reached']}, {'name': 'Decorator pattern', 'match_type': 'partial', 'implemented_parts': ['ExecuteContext class', 'createTmpPathNoCleanup method'], 'confidence': 0.85, 'evidence': ['Adding temporary files during iteration', 'Custom path management in tmp directory', 'Use of ObjectOutputStream to write data']}]",This file implements an iterator pattern for efficiently iterating over large datasets.,"{'constants': ['Defines constants related to iteration'], 'types': ['Custom iterator type'], 'classes': ['ExecuteContext class manages iteration process'], 'functions': ['createTmpPathNoCleanup creates temporary files', 'Iterator pattern for efficient iteration']}"
hail/src/main/scala/is/hail/utils/StackSafe.scala,FileType.FILE,hail-is,hail,0.2.133,https://hail.is,https://github.com/hail-is/hail/tree/0.2.133/hail/src/main/scala/is/hail/utils/StackSafe.scala,"[{'name': 'Iterator', 'match_type': 'partial', 'implemented_parts': ['foreach', 'collect'], 'confidence': 0.9, 'evidence': ['recursive iteration functions', 'iterables support']}, {'name': 'Functional Data Structures', 'match_type': 'full', 'implemented_parts': ['StackFrame', 'CanBuild'], 'confidence': 1.0, 'evidence': ['higher-order functions', 'immutable data structures']}]",This file defines utilities for iterating over collections of data and creating immutable data structures.,"{'constants': ['Defines immutable data structures'], 'types': ['StackFrame represents a stack of values'], 'classes': ['StackFrame class', 'RichIterator for iterating'], 'functions': ['foreachRecur iterates recursively', 'collectRecur builds an array']}"
hail/src/main/scala/is/hail/utils/StringEscapeUtils.scala,FileType.FILE,hail-is,hail,0.2.133,https://hail.is,https://github.com/hail-is/hail/tree/0.2.133/hail/src/main/scala/is/hail/utils/StringEscapeUtils.scala,"[{'name': 'Iterator', 'match_type': 'partial', 'implemented_parts': ['Iterator interface', 'hasNext method', 'next method'], 'confidence': 0.9, 'evidence': ['interface with iterator methods', 'class implementing iterator']}, {'name': 'Factory Method', 'match_type': 'full', 'implemented_parts': ['Abstract Factory method', 'Concrete Factory methods'], 'confidence': 1.0, 'evidence': ['abstract factory method', 'concrete factory methods with different parameters']}]",This file provides an iterator pattern for event handling.,"{'constants': ['Defines constants for iterator states'], 'types': ['Custom types for iterator'], 'classes': ['Abstract Factory class defines factory method', 'Concrete Factory classes implement specific factories'], 'functions': ['create iterator from different sources']}"
hail/src/main/scala/is/hail/utils/StringSocketAppender.scala,FileType.FILE,hail-is,hail,0.2.133,https://hail.is,https://github.com/hail-is/hail/tree/0.2.133/hail/src/main/scala/is/hail/utils/StringSocketAppender.scala,"[{'name': 'Iterator', 'match_type': 'partial', 'implemented_parts': ['iterator method', 'hasNext method', 'next method'], 'confidence': 0.9, 'evidence': ['class with iterable elements', 'looping over elements']}, {'name': 'Comparable', 'match_type': 'full', 'implemented_parts': ['compareTo method'], 'confidence': 1.0, 'evidence': ['class with comparison logic', 'equality checks']}]",This file defines utilities for iterating over and comparing elements.,"{'constants': ['Defines utility constants'], 'types': ['Custom types for iterating'], 'classes': ['Iterable class facilitates iteration'], 'functions': ['compare elements', 'iterate over collections']}"
