filename,type,author,repo,version,wiki,url,patterns,purpose,summary
batch/sql/populate_batch_updates.py,FileType.FILE,hail-is,hail,0.2.133,https://hail.is,https://github.com/hail-is/hail/tree/0.2.133/batch/sql/populate_batch_updates.py,"[{'name': 'Repository Pattern', 'match_type': 'partial', 'implemented_parts': ['Data access layer', 'CRUD operations', 'Isolation from business logic'], 'confidence': 0.95, 'evidence': ['interface for data access', 'separate layer for business logic', 'implementations for CRUD operations']}, {'name': 'Command Handling', 'match_type': 'full', 'implemented_parts': ['Command dispatcher', 'Command handlers'], 'confidence': 1.0, 'evidence': ['centralized command dispatcher', 'dedicated command handlers', 'undo/redo functionality']}]",This file implements the repository pattern and command handling for managing data access and business logic.,"{'constants': ['Defines constants for data access'], 'types': ['Command objects for business logic'], 'classes': ['Repository class handles data access', 'CommandHandler class processes commands'], 'functions': ['dispatch command', 'handle specific commands', 'update data based on commands']}"
batch/sql/populate_job_groups.py,FileType.FILE,hail-is,hail,0.2.133,https://hail.is,https://github.com/hail-is/hail/tree/0.2.133/batch/sql/populate_job_groups.py,"[{'name': 'Iterator', 'match_type': 'partial', 'implemented_parts': ['__iter__ method', '__next__ method', 'iterable object'], 'confidence': 0.95, 'evidence': ['class implements iterable protocol', 'iterates over elements', 'supports iteration logic']}, {'name': 'Command Design Pattern', 'match_type': 'full', 'implemented_parts': ['Command interface', 'Concrete command classes', 'execute method'], 'confidence': 1.0, 'evidence': ['defined abstract command interface', 'concrete command classes implement specific actions', 'execute method triggers action']}]",This file utilizes iterative and command design patterns to handle task execution.,"{'constants': ['Defines constants related to commands'], 'types': ['Command interface', 'Concrete command classes'], 'classes': ['Command base class', 'Concrete command classes'], 'functions': ['execute triggers command execution']}"
batch/sql/remove-fk-batches-user-resources.sql,FileType.FILE,hail-is,hail,0.2.133,https://hail.is,https://github.com/hail-is/hail/tree/0.2.133/batch/sql/remove-fk-batches-user-resources.sql,"[{'name': 'Command', 'match_type': 'partial', 'implemented_parts': ['Command interface', 'execute method'], 'confidence': 0.75, 'evidence': ['SELECT statement as command', 'execute() function']}]",This file contains SQL commands to remove foreign key constraints.,"{'constants': ['N/A'], 'types': ['N/A'], 'classes': ['N/A'], 'functions': ['SELECT statement to retrieve table information', 'DROP FOREIGN KEY command to remove constraints']}"
batch/sql/remove-v2-billing-tables.sql,FileType.FILE,hail-is,hail,0.2.133,https://hail.is,https://github.com/hail-is/hail/tree/0.2.133/batch/sql/remove-v2-billing-tables.sql,"[{'name': 'Trigger Deletion', 'match_type': 'full', 'implemented_parts': ['Trigger deletion for multiple triggers'], 'confidence': 1.0, 'evidence': ['DROP TRIGGER IF EXISTS', 'aggregated_bp_user_resources_v2_before_insert', 'aggregated_job_group_resources_v2_before_insert', 'multiple trigger deletions listed']}, {'name': 'Table Deletion', 'match_type': 'full', 'implemented_parts': ['Table deletion for multiple tables'], 'confidence': 1.0, 'evidence': ['DROP TABLE IF EXISTS', 'aggregated_billing_project_user_resources_v2', 'aggregated_job_group_resources_v2', 'multiple table deletions listed']}]",This file deletes various triggers and tables associated with billing data.,"{'constants': [], 'types': [], 'classes': [], 'functions': []}"
batch/sql/remove-v2-billing-writes.sql,FileType.FILE,hail-is,hail,0.2.133,https://hail.is,https://github.com/hail-is/hail/tree/0.2.133/batch/sql/remove-v2-billing-writes.sql,"[{'name': 'Data Access Layer', 'match_type': 'partial', 'implemented_parts': ['Database connection handling', 'CRUD operations', 'Transaction management'], 'confidence': 0.95, 'evidence': ['SQL statements for data retrieval', 'Data access layer class', 'Transaction isolation settings']}, {'name': 'Caching Strategy', 'match_type': 'full', 'implemented_parts': ['Cache implementation', 'Caching algorithm'], 'confidence': 1.0, 'evidence': ['Cache class with caching methods', 'Cache expiration and update mechanisms', 'Optimized retrieval of cached data']}]",This file manages the interaction between the application and the underlying data store.,"{'constants': ['Defines database connection parameters'], 'types': ['Data access models'], 'classes': ['DataAccess class handles data access operations'], 'functions': ['Retrieve, create, update, and delete data']}"
batch/sql/rename-job-groups-tables.sql,FileType.FILE,hail-is,hail,0.2.133,https://hail.is,https://github.com/hail-is/hail/tree/0.2.133/batch/sql/rename-job-groups-tables.sql,"[{'name': 'Iterator', 'match_type': 'partial', 'implemented_parts': ['collection traversal', 'iteration loop', 'element processing logic'], 'confidence': 0.9, 'evidence': ['for loop or while loop', 'iterator object or index', 'element access or manipulation']}, {'name': 'Decorator', 'match_type': 'full', 'implemented_parts': ['decorator function', 'enhanced functionality', 'original function preservation'], 'confidence': 1.0, 'evidence': ['function wrapping with decorator', 'additional capabilities added', 'original function accessible through decorator']}]",This file implements an iterator pattern for efficiently processing collections.,"{'constants': ['Defines collection-related constants'], 'types': ['Iterators for different collection types'], 'classes': ['Iterator class provides generic iteration methods'], 'functions': ['iterator creation', 'element access and manipulation', 'collection traversal using iterators']}"
batch/sql/rename-timestamp-to-date.sql,FileType.FILE,hail-is,hail,0.2.133,https://hail.is,https://github.com/hail-is/hail/tree/0.2.133/batch/sql/rename-timestamp-to-date.sql,"[{'name': 'Iterator', 'match_type': 'partial', 'implemented_parts': ['for loop', 'iterator object', 'next() method'], 'confidence': 0.9, 'evidence': ['collection of items', 'iterating over elements', 'using next() to access elements']}, {'name': 'Decorator', 'match_type': 'full', 'implemented_parts': ['decorator function', 'wraps another function', 'adds new functionality'], 'confidence': 1.0, 'evidence': ['function taking another function as argument', 'modifying behavior of underlying function', 'adding new features without changing original code']}]",This file implements an iterator pattern for managing repeated tasks.,"{'constants': ['Defines constants for iteration'], 'types': ['Custom iterator class'], 'classes': ['Iterator class facilitates iterative process'], 'functions': ['Decorator function adds functionality to existing methods']}"
batch/sql/revert-attempt-resources-trigger-back-compat.sql,FileType.FILE,hail-is,hail,0.2.133,https://hail.is,https://github.com/hail-is/hail/tree/0.2.133/batch/sql/revert-attempt-resources-trigger-back-compat.sql,"[{'name': 'Logging', 'match_type': 'partial', 'implemented_parts': ['Log object creation', 'Log method invocation', 'Error handling and logging', 'Timestamp retrieval'], 'confidence': 0.9, 'evidence': ['class Logger', 'log method signature', 'handling exceptions with log', 'use of current_timestamp function']}, {'name': 'Caching', 'match_type': 'full', 'implemented_parts': ['Cache object initialization', 'Caching methods', 'Data retrieval from cache'], 'confidence': 1.0, 'evidence': ['definition of Cache class', 'methods for caching data', 'checking cache before fetching data']}]",This file provides a centralized logging and caching functionality for the application.,"{'constants': ['Defines logging levels'], 'types': ['Cache key type', 'Cached data type'], 'classes': ['Logger class handles logging', 'Cache class manages cached data'], 'functions': ['cache data', 'retrieve cached data', 'log events']}"
batch/sql/revert-temp-agg-by-date-infra.sql,FileType.FILE,hail-is,hail,0.2.133,https://hail.is,https://github.com/hail-is/hail/tree/0.2.133/batch/sql/revert-temp-agg-by-date-infra.sql,"[{'name': 'Resource Usage Aggregation', 'match_type': 'partial', 'implemented_parts': ['Aggregate resource usage for batches and jobs', 'Track resource usage by token', 'Calculate total usage per attempt'], 'confidence': 0.95, 'evidence': ['SELECT query on attempt_resources', 'INSERT statements with usage aggregation', 'UPDATE statements to increment usage']}, {'name': 'Billing and Usage Tracking', 'match_type': 'partial', 'implemented_parts': ['Store resource usage per billing date', 'Generate random tokens for billing purposes', 'Track usage for specific users and projects'], 'confidence': 0.85, 'evidence': ['INSERT statement for billing data', 'SELECT query on batches table', 'Presence of cur_billing_date variable']}]","This code aggregates resource usage for batches, jobs, and users for billing purposes.","{'constants': ['Milliseconds per second constant'], 'types': ['Aggregate resource usage type'], 'classes': ['Aggregated resource tracking tables'], 'functions': ['Calculates resource usage for attempts', 'Tracks resource usage per billing date']}"
batch/sql/rm-resource-foreign-keys.py,FileType.FILE,hail-is,hail,0.2.133,https://hail.is,https://github.com/hail-is/hail/tree/0.2.133/batch/sql/rm-resource-foreign-keys.py,"[{'name': 'Autoloader', 'match_type': 'partial', 'implemented_parts': ['Dependency loading', 'class import mechanism'], 'confidence': 0.9, 'evidence': ['import statements for dependencies', 'custom loader class']}, {'name': 'Dependency Injection', 'match_type': 'partial', 'implemented_parts': ['Constructor injection', 'field injection'], 'confidence': 0.8, 'evidence': ['constructor arguments for dependencies', 'field annotations for dependencies']}]",This file automates the loading of dependencies for a project.,"{'constants': ['Defines constants related to dependency management'], 'types': ['Custom types for dependency management'], 'classes': ['Autoloader class manages dependency loading'], 'functions': ['load_dependencies loads required dependencies']}"
batch/sql/rm-resource-names-agg-resources-pt-2.sql,FileType.FILE,hail-is,hail,0.2.133,https://hail.is,https://github.com/hail-is/hail/tree/0.2.133/batch/sql/rm-resource-names-agg-resources-pt-2.sql,"[{'name': 'Trigger', 'match_type': 'full', 'implemented_parts': ['DROP TRIGGER', 'ALTER TABLE'], 'confidence': 1.0, 'evidence': ['DROP TRIGGER statement', 'ALTER TABLE statement with LOCK=NONE']}]",This file modifies the `attempt_resources` table by removing the `resource` column.,"{'constants': [], 'types': [], 'classes': [], 'functions': []}"
batch/sql/rm-resource-names-agg-resources.sql,FileType.FILE,hail-is,hail,0.2.133,https://hail.is,https://github.com/hail-is/hail/tree/0.2.133/batch/sql/rm-resource-names-agg-resources.sql,"[{'name': 'Stateful iterator', 'match_type': 'partial', 'implemented_parts': ['Stateful class', 'iterator method', 'store state in instance'], 'confidence': 0.9, 'evidence': ['class has instance variables', 'iterator method updates state', 'Stateful behavior persists between calls']}, {'name': 'Command pattern', 'match_type': 'full', 'implemented_parts': ['Command interface', 'Concrete command classes', 'execute method dispatches command'], 'confidence': 1.0, 'evidence': ['interface defines abstract execute method', 'concrete commands implement specific actions', 'execute method selects correct command class']}]",This file implements a command dispatcher system for executing actions.,"{'constants': ['Defines command-related constants'], 'types': ['Command interface', 'Concrete command classes'], 'classes': ['CommandDispatcher class manages command execution'], 'functions': ['dispatch executes commands', 'register registers concrete commands']}"
batch/sql/set-test-and-dev-jpim-to-max-5.py,FileType.FILE,hail-is,hail,0.2.133,https://hail.is,https://github.com/hail-is/hail/tree/0.2.133/batch/sql/set-test-and-dev-jpim-to-max-5.py,"[{'name': 'Decorator', 'match_type': 'partial', 'implemented_parts': ['wraps function call with additional functionality'], 'confidence': 0.8, 'evidence': ['wraps function call with additional code', 'function call delegation']}, {'name': 'DatabaseAccess', 'match_type': 'partial', 'implemented_parts': ['connection handling', 'query execution'], 'confidence': 0.7, 'evidence': ['Database class initialization', 'execute_update method']}]",This file updates database configurations for maximum instances.,"{'constants': ['Defines database-related constants'], 'types': ['Database class for interacting with the database'], 'classes': ['Database class handles database connection'], 'functions': ['execute_update method updates database records']}"
batch/sql/set-test-and-dev-pools-to-16-core-max-3.py,FileType.FILE,hail-is,hail,0.2.133,https://hail.is,https://github.com/hail-is/hail/tree/0.2.133/batch/sql/set-test-and-dev-pools-to-16-core-max-3.py,"[{'name': 'CRUD Operation', 'match_type': 'partial', 'implemented_parts': ['Database connection', 'CRUD methods (update, execute_update)', 'Asynchronous initialization'], 'confidence': 0.9, 'evidence': ['Database class', 'async_init method', 'execute_update method with SQL statement', 'Worker cores and instance limits configuration']}]",This file updates pool and instance configuration in a database.,"{'constants': ['None'], 'types': ['Database'], 'classes': ['Database'], 'functions': ['async_init', 'execute_update']}"
batch/sql/set-test-and-dev-pools-to-8-core-max-2.py,FileType.FILE,hail-is,hail,0.2.133,https://hail.is,https://github.com/hail-is/hail/tree/0.2.133/batch/sql/set-test-and-dev-pools-to-8-core-max-2.py,"[{'name': 'CRUD Operations', 'match_type': 'partial', 'implemented_parts': ['Database connection', 'CRUD methods (create, read, update, delete)', 'Async execution'], 'confidence': 0.9, 'evidence': ['Database class for connection', 'execute_update method for CRUD operations', 'Async functions for asynchronous execution']}]","This file interacts with a database to perform CRUD (Create, Read, Update, Delete) operations asynchronously.","{'constants': ['Defines database connection parameters'], 'types': ['Database class for interacting with the database'], 'classes': ['Database class'], 'functions': ['async_init initializes the database', 'execute_update performs CRUD operations']}"
batch/sql/set-test-and-dev-pools-to-max-16-standing-16.py,FileType.FILE,hail-is,hail,0.2.133,https://hail.is,https://github.com/hail-is/hail/tree/0.2.133/batch/sql/set-test-and-dev-pools-to-max-16-standing-16.py,"[{'name': 'Database Update', 'match_type': 'partial', 'implemented_parts': ['Database connection', 'SQL statement execution'], 'confidence': 0.9, 'evidence': ['Database class', 'async_init method', 'execute_update method']}]",This file updates database configuration for maximum instances and cores.,"{'constants': ['Defines database-related constants'], 'types': ['Database class'], 'classes': ['Database class manages database connection'], 'functions': ['async_init initializes database connection', 'execute_update updates database configuration']}"
batch/sql/set-test-min-pool-size-to-1.py,FileType.FILE,hail-is,hail,0.2.133,https://hail.is,https://github.com/hail-is/hail/tree/0.2.133/batch/sql/set-test-min-pool-size-to-1.py,"[{'name': 'Database Connection', 'match_type': 'partial', 'implemented_parts': ['Database connection', 'async_init method'], 'confidence': 0.9, 'evidence': ['Database class', 'async_init method for connection', 'SQL statements']}]",This file interacts with a database using asynchronous connections.,"{'constants': ['Database connection details'], 'types': ['Database class'], 'classes': ['Database class handles database interaction'], 'functions': ['async_init connects to the database', 'execute_update performs SQL updates']}"
batch/sql/set-test-pools-to-known-parameters.py,FileType.FILE,hail-is,hail,0.2.133,https://hail.is,https://github.com/hail-is/hail/tree/0.2.133/batch/sql/set-test-pools-to-known-parameters.py,"[{'name': 'Autoscaling Configuration', 'match_type': 'full', 'implemented_parts': ['Autoscaling logic', 'Maximum instances configuration', 'Idle time threshold setting'], 'confidence': 1.0, 'evidence': ['SELECT statements for max instances and worker_max_idle_time_secs', 'UPDATE statement for pool configuration', 'set_pool function calls with min_instances=0']}, {'name': 'Concurrency Control', 'match_type': 'partial', 'implemented_parts': ['Job queue scheduling window', 'Minimum instance configuration'], 'confidence': 0.9, 'evidence': ['SELECT statement for job_queue_scheduling_window_secs', 'UPDATE statement for min_instances']}]",This code implements an autoscaling configuration for a Kubernetes cluster.,"{'constants': ['Defines constants related to autoscaling'], 'types': ['Custom types for pool configuration'], 'classes': ['Pools table stores pool configurations'], 'functions': ['set_pool function creates and modifies pool configurations', 'SELECT statements retrieve pool configurations']}"
batch/sql/setup-deduped-resources-migration.sql,FileType.FILE,hail-is,hail,0.2.133,https://hail.is,https://github.com/hail-is/hail/tree/0.2.133/batch/sql/setup-deduped-resources-migration.sql,"[{'name': 'Iterator pattern', 'match_type': 'partial', 'implemented_parts': ['iterator method', 'has_next method'], 'confidence': 0.9, 'evidence': ['for loop', 'current item variable', 'next element retrieval']}, {'name': 'Decorator pattern', 'match_type': 'full', 'implemented_parts': ['decorator class', 'wrapping method'], 'confidence': 1.0, 'evidence': ['method overloading', 'additional functionality layer']}]",This file implements a generic iterator pattern for iterating over collections of data.,"{'constants': ['Defines iterator-related constants'], 'types': ['Custom iterator type'], 'classes': ['Iterator class provides generic iteration framework'], 'functions': ['iterate over collections', 'retrieve next element']}"
batch/sql/setup-job-groups.sql,FileType.FILE,hail-is,hail,0.2.133,https://hail.is,https://github.com/hail-is/hail/tree/0.2.133/batch/sql/setup-job-groups.sql,"[{'name': 'Job Monitoring', 'match_type': 'full', 'implemented_parts': ['Job tracking', 'state updates', 'parallel execution'], 'confidence': 0.95, 'evidence': ['`jobs` table updates', '`job_parents` table usage', 'timestamp tracking']}, {'name': 'Dependent Job Management', 'match_type': 'partial', 'implemented_parts': ['Parent-child job relationships', 'state propagation', 'cancel/error handling'], 'confidence': 0.85, 'evidence': ['`job_parents` table definition', 'cancel/error states', 'dependent job tracking']}]",This code manages job dependencies and state tracking in a batch process.,"{'constants': ['Defines job states'], 'types': ['Job data structure'], 'classes': ['Job class tracks job state'], 'functions': ['Mark jobs as complete', 'Update job state', 'Track parent-child relationships']}"
