filename,type,author,repo,version,wiki,url,patterns,purpose,summary
hail/src/main/scala/is/hail/utils/richUtils/RichOption.scala,FileType.FILE,hail-is,hail,0.2.133,https://hail.is,https://github.com/hail-is/hail/tree/0.2.133/hail/src/main/scala/is/hail/utils/richUtils/RichOption.scala,"[{'name': 'Visitor', 'match_type': 'partial', 'implemented_parts': ['Visitor pattern', 'accept method'], 'confidence': 0.8, 'evidence': ['visit method', 'accepts parameter of type Visitor']}]",This class enhances the functionality of Option type by adding useful methods.,"{'constants': [], 'types': ['RichOption'], 'classes': ['RichOption'], 'functions': ['contains checks option value', 'liftedZip combines options']}"
hail/src/main/scala/is/hail/utils/richUtils/RichOrderedArray.scala,FileType.FILE,hail-is,hail,0.2.133,https://hail.is,https://github.com/hail-is/hail/tree/0.2.133/hail/src/main/scala/is/hail/utils/richUtils/RichOrderedArray.scala,"[{'name': 'Memento', 'match_type': 'partial', 'implemented_parts': ['Originator', 'Memento', 'Caretaker'], 'confidence': 0.75, 'evidence': ['create_memento', 'save_state', 'restore_state']}, {'name': 'Visitor', 'match_type': 'partial', 'implemented_parts': ['Visitor', 'Element'], 'confidence': 0.8, 'evidence': ['visit method', 'accept method']}]",This file defines extensions for Scala arrays with utility methods for state tracking and sorting.,"{'constants': [], 'types': ['RichOrderedArray'], 'classes': ['RichOrderedArray'], 'functions': ['isIncreasing', 'isSorted']}"
hail/src/main/scala/is/hail/utils/richUtils/RichOrderedSeq.scala,FileType.FILE,hail-is,hail,0.2.133,https://hail.is,https://github.com/hail-is/hail/tree/0.2.133/hail/src/main/scala/is/hail/utils/richUtils/RichOrderedSeq.scala,"[{'name': 'Memento', 'match_type': 'partial', 'implemented_parts': ['Originator', 'Memento', 'Caretaker'], 'confidence': 0.7, 'evidence': ['save_state method', 'restore_state method', 'create_memento method']}, {'name': 'Visitor', 'match_type': 'partial', 'implemented_parts': ['Visitor', 'Element'], 'confidence': 0.8, 'evidence': ['visit method', 'accept method', 'apply method']}]",This file defines extensions for ordered sequences with utility methods for verifying sorting properties.,"{'constants': [], 'types': ['RichOrderedSeq'], 'classes': ['RichOrderedSeq'], 'functions': ['isIncreasing', 'isSorted']}"
hail/src/main/scala/is/hail/utils/richUtils/RichPairRDD.scala,FileType.FILE,hail-is,hail,0.2.133,https://hail.is,https://github.com/hail-is/hail/tree/0.2.133/hail/src/main/scala/is/hail/utils/richUtils/RichPairRDD.scala,"[{'name': 'Decorator', 'match_type': 'partial', 'implemented_parts': ['Decorator pattern', 'extension method'], 'confidence': 0.9, 'evidence': ['class RichPairRDD', 'mapValuesWithKey method']}]",This file defines an extension for Spark RDDs with additional functionalities.,"{'constants': [], 'types': ['RDD', 'RichPairRDD'], 'classes': ['RichPairRDD'], 'functions': ['mapValuesWithKey extension method']}"
hail/src/main/scala/is/hail/utils/richUtils/RichPartialKleisliOptionFunction.scala,FileType.FILE,hail-is,hail,0.2.133,https://hail.is,https://github.com/hail-is/hail/tree/0.2.133/hail/src/main/scala/is/hail/utils/richUtils/RichPartialKleisliOptionFunction.scala,"[{'name': 'Partial Function Composition', 'match_type': 'partial', 'implemented_parts': ['Partial function composition using lift and flatten methods'], 'confidence': 0.9, 'evidence': ['pf.lift(a).flatten']}]",This class enhances partial functions by providing a way to lift them to handle non-Option values and flatten the results.,"{'constants': [], 'types': ['PartialFunction', 'Option'], 'classes': ['RichPartialKleisliOptionFunction'], 'functions': ['lift', 'flatten']}"
hail/src/main/scala/is/hail/utils/richUtils/RichRDD.scala,FileType.FILE,hail-is,hail,0.2.133,https://hail.is,https://github.com/hail-is/hail/tree/0.2.133/hail/src/main/scala/is/hail/utils/richUtils/RichRDD.scala,"[{'name': 'Iterator pattern', 'match_type': 'partial', 'implemented_parts': ['FastSeq', 'NarrowDependency'], 'confidence': 0.95, 'evidence': ['iterative computation', 'parallel partition management']}, {'name': 'Superset partitioning', 'match_type': 'full', 'implemented_parts': ['SupersetRDDPartition'], 'confidence': 1.0, 'evidence': ['hierarchical partitioning', 'parent-child relationship']}]",This code implements a distributed iterative algorithm for processing data in parallel.,"{'constants': ['Defines constants related to parallelism'], 'types': ['RDD data structure'], 'classes': ['RDD class represents parallel dataset'], 'functions': ['compute iterates over partitions']}"
hail/src/main/scala/is/hail/utils/richUtils/RichRegex.scala,FileType.FILE,hail-is,hail,0.2.133,https://hail.is,https://github.com/hail-is/hail/tree/0.2.133/hail/src/main/scala/is/hail/utils/richUtils/RichRegex.scala,"[{'name': 'Decorator', 'match_type': 'partial', 'implemented_parts': ['Element', 'Decorator'], 'confidence': 0.9, 'evidence': ['wraps element with additional functionality', 'intercepting methods']}]",Provides utility functions for enhancing regular expressions.,"{'constants': ['None'], 'types': ['RichRegex class'], 'classes': ['RichRegex class extends Regex'], 'functions': ['matches method for pattern matching']}"
hail/src/main/scala/is/hail/utils/richUtils/RichRow.scala,FileType.FILE,hail-is,hail,0.2.133,https://hail.is,https://github.com/hail-is/hail/tree/0.2.133/hail/src/main/scala/is/hail/utils/richUtils/RichRow.scala,"[{'name': 'Builder', 'match_type': 'partial', 'implemented_parts': ['Builder interface', 'build method', 'Client class with build() method call'], 'confidence': 0.9, 'evidence': ['interface defines abstract build method', 'Client class explicitly implements build method', 'method takes various parameters representing building blocks']}, {'name': 'Iterator', 'match_type': 'partial', 'implemented_parts': ['Abstract Iterator class', 'hasNext method', 'next method'], 'confidence': 0.8, 'evidence': ['class defines iterative behavior', 'hasNext checks if there are remaining elements', 'next retrieves and removes the next element']}]",This file provides utilities for manipulating rows in a Spark DataFrame.,"{'constants': [], 'types': ['Row class representing a DataFrame row'], 'classes': ['RichRow class extends Row with additional methods'], 'functions': ['update modifies existing row values', 'select extracts specific row fields', 'deleteField removes a specific row field', 'append adds a new value to the end of the row', 'insertBefore inserts a new value at a specific position', 'truncate reduces the size of the row']}"
hail/src/main/scala/is/hail/utils/richUtils/RichSparkContext.scala,FileType.FILE,hail-is,hail,0.2.133,https://hail.is,https://github.com/hail-is/hail/tree/0.2.133/hail/src/main/scala/is/hail/utils/richUtils/RichSparkContext.scala,"[{'name': 'Context Aware RDD', 'match_type': 'partial', 'implemented_parts': ['Context class', 'RDD with context', 'mapPartitionsWithIndex'], 'confidence': 0.9, 'evidence': ['Context class stores line and file information', 'mapPartitionsWithIndex uses context to enrich RDD data']}]",Provides context-aware RDD functionality for text files.,"{'constants': ['None'], 'types': ['RDD with context'], 'classes': ['RichSparkContext'], 'functions': ['textFilesLines', 'textFileLines']}"
hail/src/main/scala/is/hail/utils/richUtils/RichString.scala,FileType.FILE,hail-is,hail,0.2.133,https://hail.is,https://github.com/hail-is/hail/tree/0.2.133/hail/src/main/scala/is/hail/utils/richUtils/RichString.scala,"[{'name': 'Rich Utility', 'match_type': 'partial', 'implemented_parts': ['Class extension', 'utility methods'], 'confidence': 0.9, 'evidence': ['RichString class', 'truncatable and equalsCaseInsensitive methods']}]",This file extends the String class with utility methods for text manipulation.,"{'constants': [], 'types': ['RichString class'], 'classes': ['RichString class'], 'functions': ['truncatable and equalsCaseInsensitive methods']}"
hail/src/main/scala/is/hail/utils/richUtils/RichStringBuilder.scala,FileType.FILE,hail-is,hail,0.2.133,https://hail.is,https://github.com/hail-is/hail/tree/0.2.133/hail/src/main/scala/is/hail/utils/richUtils/RichStringBuilder.scala,"[{'name': 'Visitor Pattern', 'match_type': 'partial', 'implemented_parts': ['Visitor', 'Element', 'visit method'], 'confidence': 0.8, 'evidence': ['class RichStringBuilder', 'a match on different types', 'visit method with specific handling for different types']}]",This file implements a RichStringBuilder class that provides enhanced functionality for manipulating mutable strings.,"{'constants': [], 'types': ['RichStringBuilder extends mutable.StringBuilder'], 'classes': ['RichStringBuilder class'], 'functions': ['tsvAppend method for adding values to the string builder']}"
hail/src/main/scala/is/hail/utils/richUtils,FileType.DIR,hail-is,hail,0.2.133,https://hail.is,https://github.com/hail-is/hail/tree/0.2.133/hail/src/main/scala/is/hail/utils/richUtils,"[{'name': 'Context Aware RDD', 'match_type': 'partial', 'implemented_parts': ['Context class', 'RDD with context', 'mapPartitionsWithIndex'], 'confidence': 0.9, 'evidence': ['Context class stores line and file information', 'mapPartitionsWithIndex uses context to enrich RDD data']}, {'name': 'Rich Utility', 'match_type': 'partial', 'implemented_parts': ['Class extension', 'utility methods'], 'confidence': 0.9, 'evidence': ['RichString class', 'truncatable and equalsCaseInsensitive methods']}, {'name': 'Visitor Pattern', 'match_type': 'partial', 'implemented_parts': ['Visitor', 'Element', 'visit method'], 'confidence': 0.8, 'evidence': ['class RichStringBuilder', 'a match on different types', 'visit method with specific handling for different types']}]",Provides context-aware RDD functionality for text files.,"{'constants': ['None'], 'types': ['RDD with context'], 'classes': ['RichSparkContext'], 'functions': ['textFilesLines', 'textFileLines']}"
hail/src/main/scala/is/hail/utils/AbsoluteFuzzyComparable.scala,FileType.FILE,hail-is,hail,0.2.133,https://hail.is,https://github.com/hail-is/hail/tree/0.2.133/hail/src/main/scala/is/hail/utils/AbsoluteFuzzyComparable.scala,"[{'name': 'Trait with Equality Method', 'match_type': 'partial', 'implemented_parts': ['Trait with `absoluteEq` method'], 'confidence': 0.9, 'evidence': ['`absoluteEq` method signature with tolerance and two arguments']}, {'name': 'Companion Object with Generic Method', 'match_type': 'partial', 'implemented_parts': ['Companion object with `absoluteEq` method'], 'confidence': 0.8, 'evidence': ['Generic `absoluteEq` method with type parameter `T`']}, {'name': 'Implicitly Defining Equality for Doubles', 'match_type': 'partial', 'implemented_parts': ['Implicit object `afcDoubles` extends `AbsoluteFuzzyComparable`'], 'confidence': 0.95, 'evidence': ['`absoluteEq` method defined in `afcDoubles` with `Double` as argument type']}, {'name': 'Extending Equality for Maps', 'match_type': 'partial', 'implemented_parts': ['Implicit method `afcMaps` defines `AbsoluteFuzzyComparable` for `Map`'], 'confidence': 0.85, 'evidence': ['`absoluteEq` method for `Map` checks key set equality and value equality']}]",This file defines the `AbsoluteFuzzyComparable` trait for comparing values with fuzzy equality.,"{'constants': [], 'types': ['`AbsoluteFuzzyComparable` trait'], 'classes': ['`AbsoluteFuzzyComparable` trait'], 'functions': ['`absoluteEq` method for comparing values with tolerance']}"
hail/src/main/scala/is/hail/utils/ArrayOfByteArrayOutputStream.scala,FileType.FILE,hail-is,hail,0.2.133,https://hail.is,https://github.com/hail-is/hail/tree/0.2.133/hail/src/main/scala/is/hail/utils/ArrayOfByteArrayOutputStream.scala,"[{'name': 'Stateful Observer Pattern', 'match_type': 'partial', 'implemented_parts': ['Stateful subject', 'Observer updates state on notify', 'Stateful state management'], 'confidence': 0.9, 'evidence': ['currentArray field stores state', 'write method updates state', 'ensureNextByte method tracks state changes']}, {'name': 'Bounded Capacity Pattern', 'match_type': 'partial', 'implemented_parts': ['Limited buffer size', 'Overflow handling with resizing', 'Individual array capacity management'], 'confidence': 0.8, 'evidence': ['MAX_ARRAY_SIZE constant defines limit', 'ensureNextByte method expands buffer when needed', 'Individual ByteArrayOutputStream instances for each buffer element']}]",This file implements a collection of mutable byte arrays with efficient resizing capabilities.,"{'constants': ['Defines a constant for maximum array size'], 'types': ['Custom type representing a collection of mutable byte arrays'], 'classes': ['ArrayOfByteArrayOutputStream class implements the collection'], 'functions': ['write method adds data to the collection', 'ensureNextByte method expands capacity when needed', 'toByteArrays method retrieves the underlying data as an array of byte arrays']}"
hail/src/main/scala/is/hail/utils/ArrayStack.scala,FileType.FILE,hail-is,hail,0.2.133,https://hail.is,https://github.com/hail-is/hail/tree/0.2.133/hail/src/main/scala/is/hail/utils/ArrayStack.scala,"[{'name': 'Stack', 'match_type': 'full', 'implemented_parts': ['push method', 'pop method', 'top method'], 'confidence': 1.0, 'evidence': ['data stored in array', 'size indicator', 'element manipulation methods']}, {'name': 'ArrayUpdate', 'match_type': 'partial', 'implemented_parts': ['update method', 'apply method'], 'confidence': 0.9, 'evidence': ['array element update', 'index-based access', 'custom apply function']}]",This file defines a stack data structure with efficient insertion and removal of elements.,"{'constants': ['None'], 'types': ['Custom stack type'], 'classes': ['Stack class implements the stack data structure'], 'functions': ['Push element onto the stack', 'Pop element from the stack', 'Access the top element']}"
hail/src/main/scala/is/hail/utils/BinaryHeap.scala,FileType.FILE,hail-is,hail,0.2.133,https://hail.is,https://github.com/hail-is/hail/tree/0.2.133/hail/src/main/scala/is/hail/utils/BinaryHeap.scala,"[{'name': 'Iterator', 'match_type': 'partial', 'implemented_parts': ['Iterator interface', 'hasNext method', 'next method'], 'confidence': 0.9, 'evidence': ['class implements Iterator', 'iterator methods']}, {'name': 'Comparable', 'match_type': 'partial', 'implemented_parts': ['compareTo method'], 'confidence': 0.7, 'evidence': ['class defines compareTo method', 'comparison logic']}, {'name': 'Builder Pattern', 'match_type': 'full', 'implemented_parts': ['Builder interface', 'Builder method'], 'confidence': 1.0, 'evidence': ['abstract Builder class', 'concrete Builder methods']}]",This file introduces mechanisms for iterating over collections and comparing elements.,"{'constants': ['Defines collection-related constants'], 'types': ['Custom types for iterating and comparing'], 'classes': ['Iterator interface defines contract', 'Concrete iterators implement specific algorithms'], 'functions': ['compare elements', 'iterate over collections']}"
hail/src/main/scala/is/hail/utils/Bitstring.scala,FileType.FILE,hail-is,hail,0.2.133,https://hail.is,https://github.com/hail-is/hail/tree/0.2.133/hail/src/main/scala/is/hail/utils/Bitstring.scala,"[{'name': 'Iterator', 'match_type': 'partial', 'implemented_parts': ['next method', 'current method'], 'confidence': 0.7, 'evidence': ['implements Iterable interface', 'has state field']}, {'name': 'Command', 'match_type': 'full', 'implemented_parts': ['execute method'], 'confidence': 0.9, 'evidence': ['abstract class with execute method', 'concrete command classes']}]",This file defines an iterator pattern for iterating over lists and a command pattern for encapsulating actions.,"{'constants': ['Defines constants for iterator states'], 'types': ['Custom iterator and command types'], 'classes': ['Iterator class for iterating over lists', 'Command class for encapsulating actions'], 'functions': ['execute iterates over commands', 'next advances iterator']}"
hail/src/main/scala/is/hail/utils/BitVector.scala,FileType.FILE,hail-is,hail,0.2.133,https://hail.is,https://github.com/hail-is/hail/tree/0.2.133/hail/src/main/scala/is/hail/utils/BitVector.scala,"[{'name': 'ArrayAccess', 'match_type': 'partial', 'implemented_parts': ['index-based access', 'array mutation'], 'confidence': 0.9, 'evidence': ['`a[i]` syntax', '`a(i) = ...` assignments']}, {'name': 'BitVector', 'match_type': 'full', 'implemented_parts': ['custom bit vector implementation', 'size calculation', 'element access'], 'confidence': 1.0, 'evidence': ['`length` field', '`a` array', 'element access method']}]",This file defines a custom BitVector class for efficient bit-level storage and retrieval.,"{'constants': ['None'], 'types': ['BitVector class'], 'classes': ['BitVector class'], 'functions': ['Constructor with `length` argument', 'Element access and modification methods']}"
hail/src/main/scala/is/hail/utils/BoxedArrayBuilder.scala,FileType.FILE,hail-is,hail,0.2.133,https://hail.is,https://github.com/hail-is/hail/tree/0.2.133/hail/src/main/scala/is/hail/utils/BoxedArrayBuilder.scala,"[{'name': 'Iterator', 'match_type': 'partial', 'implemented_parts': ['hasNext method', 'next method'], 'confidence': 0.9, 'evidence': ['class with iterable elements', 'looping over elements']}, {'name': 'Command Design Pattern', 'match_type': 'partial', 'implemented_parts': ['execute method', 'undo/redo functionality'], 'confidence': 0.8, 'evidence': ['abstract command class', 'concrete command implementations']}]",This file implements a collection of commands for performing actions.,"{'constants': ['Defines command-related constants'], 'types': ['Command interface', 'Concrete command implementations'], 'classes': ['Command class manages commands', 'Invoker class orchestrates execution'], 'functions': ['execute performs action', 'undo/redo redoes/undoes action']}"
hail/src/main/scala/is/hail/utils/BufferedAggregatorIterator.scala,FileType.FILE,hail-is,hail,0.2.133,https://hail.is,https://github.com/hail-is/hail/tree/0.2.133/hail/src/main/scala/is/hail/utils/BufferedAggregatorIterator.scala,"[{'name': 'Iterator Aggregation', 'match_type': 'partial', 'implemented_parts': ['BufferedAggregatorIterator', 'makeComb function', 'makeKey function', 'sequence function', 'serializeAndCleanup function', 'bufferSize'], 'confidence': 0.9, 'evidence': ['Iterates over an underlying iterator', 'Maintains a buffer of aggregated values', 'Serializes aggregated values when buffer is full']}]",This class efficiently aggregates values from an iterator using buffering.,"{'constants': ['Defines load factor for buffer sizing'], 'types': ['Custom iterator for buffered aggregation'], 'classes': ['BufferedAggregatorIterator class'], 'functions': ['Calculates buffer size', 'Aggregates values while buffering']}"
