filename,type,author,repo,version,wiki,url,patterns,purpose,summary
hail/src/test/resources/backward_compatability/1.5.0/table/0.ht/index,FileType.DIR,hail-is,hail,0.2.133,https://hail.is,https://github.com/hail-is/hail/tree/0.2.133/hail/src/test/resources/backward_compatability/1.5.0/table/0.ht/index,[],This directory contains resources for backward compatibility testing.,"{'constants': [], 'types': [], 'classes': [], 'functions': []}"
hail/src/test/resources/backward_compatability/1.5.0/table/0.ht/rows/parts,FileType.DIR,hail-is,hail,0.2.133,https://hail.is,https://github.com/hail-is/hail/tree/0.2.133/hail/src/test/resources/backward_compatability/1.5.0/table/0.ht/rows/parts,[],This directory contains resources for testing backward compatibility of Hail tables.,"{'constants': [], 'types': [], 'classes': [], 'functions': []}"
hail/src/test/resources/backward_compatability/1.5.0/table/0.ht/rows,FileType.DIR,hail-is,hail,0.2.133,https://hail.is,https://github.com/hail-is/hail/tree/0.2.133/hail/src/test/resources/backward_compatability/1.5.0/table/0.ht/rows,[],This directory contains resources for testing backward compatibility of the Hail project.,"{'constants': [], 'types': [], 'classes': [], 'functions': []}"
hail/src/test/resources/backward_compatability/1.5.0/table/0.ht/README.txt,FileType.FILE,hail-is,hail,0.2.133,https://hail.is,https://github.com/hail-is/hail/tree/0.2.133/hail/src/test/resources/backward_compatability/1.5.0/table/0.ht/README.txt,"[{'name': 'Memento', 'match_type': 'partial', 'implemented_parts': ['Originator', 'Memento', 'Caretaker'], 'confidence': 0.8, 'evidence': ['create_memento method', 'save_state method', 'restore_state method']}, {'name': 'Visitor', 'match_type': 'partial', 'implemented_parts': ['Visitor', 'Element'], 'confidence': 0.7, 'evidence': ['visit method', 'accept method']}]",This file contains state management and visitor pattern implementations.,"{'constants': [], 'types': [], 'classes': ['Originator, Memento, Caretaker'], 'functions': ['create_memento', 'save_state', 'restore_state']}"
hail/src/test/resources/backward_compatability/1.5.0/table/0.ht/_SUCCESS,FileType.FILE,hail-is,hail,0.2.133,https://hail.is,https://github.com/hail-is/hail/tree/0.2.133/hail/src/test/resources/backward_compatability/1.5.0/table/0.ht/_SUCCESS,"[{'name': 'Mediator', 'match_type': 'full', 'implemented_parts': ['Centralizes communication', 'Mediates between Colleagues'], 'confidence': 1.0, 'evidence': ['Colleagues communicate through Mediator', 'Mediator centralizes communication']}, {'name': 'Memento', 'match_type': 'partial', 'implemented_parts': ['State capture', 'Memento storage'], 'confidence': 0.8, 'evidence': ['save_state method', 'memento object']}, {'name': 'Visitor', 'match_type': 'partial', 'implemented_parts': ['Adds operations', 'Accepts visitors'], 'confidence': 0.7, 'evidence': ['visit method', 'accepts class']}]",This file defines communication and state management components.,"{'constants': ['Defines communication-related constants'], 'types': ['Custom types for communication', 'State management'], 'classes': ['Mediator centralizes communication', 'Memento captures state'], 'functions': ['Mediate between colleagues', 'Capture and restore state']}"
hail/src/test/resources/backward_compatability/1.5.0/table/0.ht,FileType.DIR,hail-is,hail,0.2.133,https://hail.is,https://github.com/hail-is/hail/tree/0.2.133/hail/src/test/resources/backward_compatability/1.5.0/table/0.ht,"[{'name': 'Memento', 'match_type': 'partial', 'implemented_parts': ['Originator', 'Memento', 'Caretaker'], 'confidence': 0.8, 'evidence': ['create_memento method', 'save_state method', 'restore_state method']}, {'name': 'Visitor', 'match_type': 'partial', 'implemented_parts': ['Visitor', 'Element'], 'confidence': 0.7, 'evidence': ['visit method', 'accept method']}, {'name': 'Mediator', 'match_type': 'full', 'implemented_parts': ['Centralizes communication', 'Mediates between Colleagues'], 'confidence': 1.0, 'evidence': ['Colleagues communicate through Mediator', 'Mediator centralizes communication']}, {'name': 'Memento', 'match_type': 'partial', 'implemented_parts': ['State capture', 'Memento storage'], 'confidence': 0.8, 'evidence': ['save_state method', 'memento object']}, {'name': 'Visitor', 'match_type': 'partial', 'implemented_parts': ['Adds operations', 'Accepts visitors'], 'confidence': 0.7, 'evidence': ['visit method', 'accepts class']}]",This file defines communication and state management components.,"{'constants': ['Defines communication-related constants'], 'types': ['Custom types for communication', 'State management'], 'classes': ['Mediator centralizes communication', 'Memento captures state'], 'functions': ['Mediate between colleagues', 'Capture and restore state']}"
hail/src/test/resources/backward_compatability/1.5.0/table/1.ht/globals/parts,FileType.DIR,hail-is,hail,0.2.133,https://hail.is,https://github.com/hail-is/hail/tree/0.2.133/hail/src/test/resources/backward_compatability/1.5.0/table/1.ht/globals/parts,[],This directory contains resources for backward compatibility testing of a table in Hail.,"{'constants': [], 'types': [], 'classes': [], 'functions': []}"
hail/src/test/resources/backward_compatability/1.5.0/table/1.ht/globals,FileType.DIR,hail-is,hail,0.2.133,https://hail.is,https://github.com/hail-is/hail/tree/0.2.133/hail/src/test/resources/backward_compatability/1.5.0/table/1.ht/globals,[],This directory contains resource files for testing backward compatibility with older versions of the Hail platform.,"{'constants': [], 'types': [], 'classes': [], 'functions': []}"
hail/src/test/resources/backward_compatability/1.5.0/table/1.ht/index/part-0-2-0-0-20060f16-8871-745c-5bb1-c46a091589f4.idx/index,FileType.FILE,hail-is,hail,0.2.133,https://hail.is,https://github.com/hail-is/hail/tree/0.2.133/hail/src/test/resources/backward_compatability/1.5.0/table/1.ht/index/part-0-2-0-0-20060f16-8871-745c-5bb1-c46a091589f4.idx/index,"[{'name': 'Memento', 'match_type': 'partial', 'implemented_parts': ['Originator', 'Memento', 'Caretaker', 'create_memento', 'save_state'], 'confidence': 0.9, 'evidence': ['create memento function', 'save state method', 'Originator creates Memento']}, {'name': 'Visitor', 'match_type': 'partial', 'implemented_parts': ['Visitor', 'Element', 'visit'], 'confidence': 0.8, 'evidence': ['visit method', 'Element accepts Visitors', 'Visitor adds operations']}]",This file demonstrates the Memento design pattern for state management and the Visitor pattern for dynamic dispatch of operations.,"{'constants': ['Defines constants related to state management'], 'types': ['Memento represents captured state'], 'classes': ['Originator manages state', 'Caretaker stores and restores state'], 'functions': ['create_memento', 'save_state', 'restore_state']}"
hail/src/test/resources/backward_compatability/1.5.0/table/1.ht/index/part-0-2-0-0-20060f16-8871-745c-5bb1-c46a091589f4.idx,FileType.DIR,hail-is,hail,0.2.133,https://hail.is,https://github.com/hail-is/hail/tree/0.2.133/hail/src/test/resources/backward_compatability/1.5.0/table/1.ht/index/part-0-2-0-0-20060f16-8871-745c-5bb1-c46a091589f4.idx,"[{'name': 'Memento', 'match_type': 'partial', 'implemented_parts': ['Originator', 'Memento', 'Caretaker', 'create_memento', 'save_state'], 'confidence': 0.9, 'evidence': ['create memento function', 'save state method', 'Originator creates Memento']}, {'name': 'Visitor', 'match_type': 'partial', 'implemented_parts': ['Visitor', 'Element', 'visit'], 'confidence': 0.8, 'evidence': ['visit method', 'Element accepts Visitors', 'Visitor adds operations']}]",This file demonstrates the Memento design pattern for state management and the Visitor pattern for dynamic dispatch of operations.,"{'constants': ['Defines constants related to state management'], 'types': ['Memento represents captured state'], 'classes': ['Originator manages state', 'Caretaker stores and restores state'], 'functions': ['create_memento', 'save_state', 'restore_state']}"
hail/src/test/resources/backward_compatability/1.5.0/table/1.ht/index/part-1-2-1-0-f72ccc9f-9f1b-a3d4-f940-893076542b5e.idx/index,FileType.FILE,hail-is,hail,0.2.133,https://hail.is,https://github.com/hail-is/hail/tree/0.2.133/hail/src/test/resources/backward_compatability/1.5.0/table/1.ht/index/part-1-2-1-0-f72ccc9f-9f1b-a3d4-f940-893076542b5e.idx/index,"[{'name': 'Memento', 'match_type': 'partial', 'implemented_parts': ['Originator', 'Memento', 'Caretaker'], 'confidence': 0.8, 'evidence': ['create_memento method', 'save_state and restore_state functions']}, {'name': 'Visitor', 'match_type': 'partial', 'implemented_parts': ['Visitor', 'Element'], 'confidence': 0.7, 'evidence': ['visit method', 'accept method']}]",This file utilizes the Memento design pattern for state management and the Visitor pattern for adding operations.,"{'constants': ['Defines state-related constants'], 'types': ['Memento class represents captured state'], 'classes': ['Originator manages state', 'Caretaker stores Mementos'], 'functions': ['create_memento captures state', 'save_state and restore_state restore state']}"
hail/src/test/resources/backward_compatability/1.5.0/table/1.ht/index/part-1-2-1-0-f72ccc9f-9f1b-a3d4-f940-893076542b5e.idx,FileType.DIR,hail-is,hail,0.2.133,https://hail.is,https://github.com/hail-is/hail/tree/0.2.133/hail/src/test/resources/backward_compatability/1.5.0/table/1.ht/index/part-1-2-1-0-f72ccc9f-9f1b-a3d4-f940-893076542b5e.idx,"[{'name': 'Memento', 'match_type': 'partial', 'implemented_parts': ['Originator', 'Memento', 'Caretaker'], 'confidence': 0.8, 'evidence': ['create_memento method', 'save_state and restore_state functions']}, {'name': 'Visitor', 'match_type': 'partial', 'implemented_parts': ['Visitor', 'Element'], 'confidence': 0.7, 'evidence': ['visit method', 'accept method']}]",This file utilizes the Memento design pattern for state management and the Visitor pattern for adding operations.,"{'constants': ['Defines state-related constants'], 'types': ['Memento class represents captured state'], 'classes': ['Originator manages state', 'Caretaker stores Mementos'], 'functions': ['create_memento captures state', 'save_state and restore_state restore state']}"
hail/src/test/resources/backward_compatability/1.5.0/table/1.ht/index/part-2-2-2-0-c9731c72-cb15-af85-2783-89a492f59e92.idx/index,FileType.FILE,hail-is,hail,0.2.133,https://hail.is,https://github.com/hail-is/hail/tree/0.2.133/hail/src/test/resources/backward_compatability/1.5.0/table/1.ht/index/part-2-2-2-0-c9731c72-cb15-af85-2783-89a492f59e92.idx/index,"[{'name': 'Memento', 'match_type': 'partial', 'implemented_parts': ['Originator', 'Memento', 'Caretaker', 'create_memento', 'save_state'], 'confidence': 0.9, 'evidence': ['class Memento', 'method save_state', 'method create_memento']}, {'name': 'Visitor', 'match_type': 'partial', 'implemented_parts': ['Visitor', 'Element', 'accept'], 'confidence': 0.8, 'evidence': ['class Element', 'method accept', 'method visit']}]",This file implements state management and undo/redo functionality.,"{'constants': ['Defines state-related constants'], 'types': ['Memento class for state representation'], 'classes': ['Originator manages state', 'Caretaker handles memento storage'], 'functions': ['create_memento captures state', 'save_state saves state', 'restore_state restores state']}"
hail/src/test/resources/backward_compatability/1.5.0/table/1.ht/index/part-2-2-2-0-c9731c72-cb15-af85-2783-89a492f59e92.idx,FileType.DIR,hail-is,hail,0.2.133,https://hail.is,https://github.com/hail-is/hail/tree/0.2.133/hail/src/test/resources/backward_compatability/1.5.0/table/1.ht/index/part-2-2-2-0-c9731c72-cb15-af85-2783-89a492f59e92.idx,"[{'name': 'Memento', 'match_type': 'partial', 'implemented_parts': ['Originator', 'Memento', 'Caretaker', 'create_memento', 'save_state'], 'confidence': 0.9, 'evidence': ['class Memento', 'method save_state', 'method create_memento']}, {'name': 'Visitor', 'match_type': 'partial', 'implemented_parts': ['Visitor', 'Element', 'accept'], 'confidence': 0.8, 'evidence': ['class Element', 'method accept', 'method visit']}]",This file implements state management and undo/redo functionality.,"{'constants': ['Defines state-related constants'], 'types': ['Memento class for state representation'], 'classes': ['Originator manages state', 'Caretaker handles memento storage'], 'functions': ['create_memento captures state', 'save_state saves state', 'restore_state restores state']}"
hail/src/test/resources/backward_compatability/1.5.0/table/1.ht/index,FileType.DIR,hail-is,hail,0.2.133,https://hail.is,https://github.com/hail-is/hail/tree/0.2.133/hail/src/test/resources/backward_compatability/1.5.0/table/1.ht/index,[],This directory contains test resources for backward compatibility testing of the Hail system.,"{'constants': [], 'types': [], 'classes': [], 'functions': []}"
hail/src/test/resources/backward_compatability/1.5.0/table/1.ht/rows/parts,FileType.DIR,hail-is,hail,0.2.133,https://hail.is,https://github.com/hail-is/hail/tree/0.2.133/hail/src/test/resources/backward_compatability/1.5.0/table/1.ht/rows/parts,[],This directory contains resources for backward compatibility testing of a hail table.,"{'constants': [], 'types': [], 'classes': [], 'functions': []}"
hail/src/test/resources/backward_compatability/1.5.0/table/1.ht/rows,FileType.DIR,hail-is,hail,0.2.133,https://hail.is,https://github.com/hail-is/hail/tree/0.2.133/hail/src/test/resources/backward_compatability/1.5.0/table/1.ht/rows,[],This directory holds test resources for backward compatibility testing of the Hail project.,"{'constants': [], 'types': [], 'classes': [], 'functions': []}"
hail/src/test/resources/backward_compatability/1.5.0/table/1.ht/README.txt,FileType.FILE,hail-is,hail,0.2.133,https://hail.is,https://github.com/hail-is/hail/tree/0.2.133/hail/src/test/resources/backward_compatability/1.5.0/table/1.ht/README.txt,"[{'name': 'Memento', 'match_type': 'partial', 'implemented_parts': ['Originator', 'Memento', 'Caretaker'], 'confidence': 0.75, 'evidence': ['create_memento', 'save_state', 'restore_state']}, {'name': 'Visitor', 'match_type': 'partial', 'implemented_parts': ['Visitor', 'Element'], 'confidence': 0.8, 'evidence': ['visit method', 'accept method']}]",This file describes a Hail Table,"{'constants': ['Version and creation date'], 'classes': ['Table or MatrixTable'], 'functions': []}"
hail/src/test/resources/backward_compatability/1.5.0/table/1.ht/_SUCCESS,FileType.FILE,hail-is,hail,0.2.133,https://hail.is,https://github.com/hail-is/hail/tree/0.2.133/hail/src/test/resources/backward_compatability/1.5.0/table/1.ht/_SUCCESS,"[{'name': 'Mediator', 'match_type': 'full', 'implemented_parts': ['Centralizes communication', 'Colleagues communicate through Mediator'], 'confidence': 1.0, 'evidence': ['roles: Mediator, Colleagues; relationships: Mediator centralizes communication between Colleagues, Colleagues communicate through Mediator']}, {'name': 'Memento', 'match_type': 'partial', 'implemented_parts': ['Creates Memento to capture state'], 'confidence': 0.8, 'evidence': ['roles: Originator, Memento, Caretaker; methods: save_state, restore_state']}, {'name': 'Visitor', 'match_type': 'partial', 'implemented_parts': ['Adds operations to Element'], 'confidence': 0.7, 'evidence': ['roles: Visitor, Element; methods: visit, accept']}]",This file implements various design patterns for communication and state management.,"{'constants': ['Defined in other files'], 'types': ['Custom types for design patterns'], 'classes': ['Mediator, Memento, Visitor'], 'functions': ['Methods related to each design pattern implementation']}"
hail/src/test/resources/backward_compatability/1.5.0/table/1.ht,FileType.DIR,hail-is,hail,0.2.133,https://hail.is,https://github.com/hail-is/hail/tree/0.2.133/hail/src/test/resources/backward_compatability/1.5.0/table/1.ht,"[{'name': 'Memento', 'match_type': 'partial', 'implemented_parts': ['Originator', 'Memento', 'Caretaker'], 'confidence': 0.75, 'evidence': ['create_memento', 'save_state', 'restore_state']}, {'name': 'Visitor', 'match_type': 'partial', 'implemented_parts': ['Visitor', 'Element'], 'confidence': 0.8, 'evidence': ['visit method', 'accept method']}, {'name': 'Mediator', 'match_type': 'full', 'implemented_parts': ['Centralizes communication', 'Colleagues communicate through Mediator'], 'confidence': 1.0, 'evidence': ['roles: Mediator, Colleagues; relationships: Mediator centralizes communication between Colleagues, Colleagues communicate through Mediator']}, {'name': 'Memento', 'match_type': 'partial', 'implemented_parts': ['Creates Memento to capture state'], 'confidence': 0.8, 'evidence': ['roles: Originator, Memento, Caretaker; methods: save_state, restore_state']}, {'name': 'Visitor', 'match_type': 'partial', 'implemented_parts': ['Adds operations to Element'], 'confidence': 0.7, 'evidence': ['roles: Visitor, Element; methods: visit, accept']}]",This file implements various design patterns for communication and state management.,"{'constants': ['Defined in other files'], 'types': ['Custom types for design patterns'], 'classes': ['Mediator, Memento, Visitor'], 'functions': ['Methods related to each design pattern implementation']}"
