filename,type,author,repo,version,wiki,url,patterns,purpose,summary
dev-docs/services/kubernetes-operations.md,FileType.FILE,hail-is,hail,0.2.133,https://hail.is,https://github.com/hail-is/hail/tree/0.2.133/dev-docs/services/kubernetes-operations.md,"[{'name': 'Centralized Logging', 'match_type': 'partial', 'implemented_parts': ['Log aggregation module', 'Structured logging format'], 'confidence': 0.9, 'evidence': ['common logging interface', 'structured data fields']}, {'name': 'Metrics Collection', 'match_type': 'full', 'implemented_parts': ['Metrics collection library', 'Real-time reporting'], 'confidence': 1.0, 'evidence': ['periodic metrics collection', 'dashboard integration']}]",This file enhances system monitoring by centralizing logging and collecting application metrics.,"{'constants': ['Defines logging configurations'], 'types': ['Custom metrics types'], 'classes': ['Logger class handles logging', 'MetricsCollector class aggregates data'], 'functions': ['collect_metrics', 'log_event']}"
dev-docs/services/letsencrypt.md,FileType.FILE,hail-is,hail,0.2.133,https://hail.is,https://github.com/hail-is/hail/tree/0.2.133/dev-docs/services/letsencrypt.md,"[{'name': 'Certificate Refresh', 'match_type': 'partial', 'implemented_parts': ['Automatic certificate refresh', '`make -C letsencrypt run` command', 'Deployment restart handler'], 'confidence': 0.9, 'evidence': ['cron job schedule', 'Makefile configuration', 'deployment manifest restart strategy']}, {'name': 'Certificate Revocation', 'match_type': 'partial', 'implemented_parts': ['Command-line certificate revocation', '`make -C letsencrypt revoke` command', 'Serial number extraction from CRT.sh'], 'confidence': 0.8, 'evidence': ['curl command fetches certificate data', 'pup and jq utilities extract serial numbers', 'Custom revocation script with confirmation prompt']}]",This file automates Let's Encrypt certificate management for the gateway pod.,"{'constants': ['URL for CRT.sh certificate search'], 'types': ['Secret for storing certificates'], 'classes': ['N/A'], 'functions': ['Automated certificate refresh and revocation commands']}"
dev-docs/services/services-development-faq.md,FileType.FILE,hail-is,hail,0.2.133,https://hail.is,https://github.com/hail-is/hail/tree/0.2.133/dev-docs/services/services-development-faq.md,"[{'name': 'StatefulPersistence', 'match_type': 'partial', 'implemented_parts': ['Database connection handling', 'StatefulSet deployment'], 'confidence': 0.9, 'evidence': ['MySQL connection configuration', 'StatefulSet definition']}, {'name': 'DataIntegrity', 'match_type': 'full', 'implemented_parts': ['Transaction management', 'Rollback mechanism'], 'confidence': 1.0, 'evidence': ['Transaction API usage', 'Error handling and rollback']}]",This code ensures data integrity through stateful deployment and transaction management.,"{'constants': ['Defines database connection parameters'], 'types': ['Custom types for transactions'], 'classes': ['DatabaseManager class handles stateful connections'], 'functions': ['Begin transaction', 'Commit transaction', 'Rollback transaction']}"
dev-docs/services/tls-cookbook.md,FileType.FILE,hail-is,hail,0.2.133,https://hail.is,https://github.com/hail-is/hail/tree/0.2.133/dev-docs/services/tls-cookbook.md,"[{'name': 'ServiceDiscovery', 'match_type': 'partial', 'implemented_parts': ['Client registration', 'service lookup', 'registration API'], 'confidence': 0.9, 'evidence': ['Service interface', 'registration handler', 'DNS resolution']}, {'name': 'ConfigurationManagement', 'match_type': 'full', 'implemented_parts': ['Secret storage', 'configuration loading', 'API access'], 'confidence': 1.0, 'evidence': ['SecretManager interface', 'config.yaml file', 'REST API endpoints']}]",This file facilitates service discovery and configuration management in the Hail ecosystem.,"{'constants': ['Defines configuration and service-related constants'], 'types': ['Data types for service and configuration data'], 'classes': ['SecretManager handles secret storage', 'Service interface facilitates registration'], 'functions': ['get_service retrieves service information', 'load_configuration loads application settings']}"
dev-docs/services/tls.md,FileType.FILE,hail-is,hail,0.2.133,https://hail.is,https://github.com/hail-is/hail/tree/0.2.133/dev-docs/services/tls.md,[],"The provided text discusses TLS, mTLS, and TCP probes in the context of Kubernetes.","{'TLS': 'Transport Layer Security protocol for secure communication', 'mTLS': 'Mutual TLS requiring clients to send trusted certificates', 'TCP probes': 'Best option for liveness and readiness checks'}"
dev-docs/services,FileType.DIR,hail-is,hail,0.2.133,https://hail.is,https://github.com/hail-is/hail/tree/0.2.133/dev-docs/services,"[{'name': 'DatabaseConnectionHandling', 'match_type': 'full', 'implemented_parts': ['Database connection configuration', 'StatefulSet deployment'], 'confidence': 0.9, 'evidence': ['MySQL connection configuration', 'StatefulSet definition']}, {'name': 'DataIntegrity', 'match_type': 'full', 'implemented_parts': ['Transaction management', 'Rollback mechanism'], 'confidence': 1.0, 'evidence': ['Transaction API usage', 'Error handling and rollback']}, {'name': 'ServiceDiscovery', 'match_type': 'partial', 'implemented_parts': ['Client registration', 'service lookup', 'registration API'], 'confidence': 0.9, 'evidence': ['Service interface', 'registration handler', 'DNS resolution']}, {'name': 'ConfigurationManagement', 'match_type': 'full', 'implemented_parts': ['Secret storage', 'configuration loading', 'API access'], 'confidence': 1.0, 'evidence': ['SecretManager interface', 'config.yaml file', 'REST API endpoints']}]","This code ensures data integrity through stateful deployment and transaction management, and facilitates service discovery and configuration management in the Hail ecosystem.","{'constants': ['Defines database connection parameters'], 'types': ['Custom types for transactions'], 'classes': ['DatabaseManager class handles stateful connections'], 'functions': ['Begin transaction', 'Commit transaction', 'Rollback transaction']}"
dev-docs/algolia.md,FileType.FILE,hail-is,hail,0.2.133,https://hail.is,https://github.com/hail-is/hail/tree/0.2.133/dev-docs/algolia.md,"[{'name': 'Page Hierarchy', 'match_type': 'full', 'implemented_parts': ['h1', 'h2', 'h3', 'h4', 'dl.method > dt > .descname', 'dl.function > dt > .descname', 'section > section > section > dl:not(.class)'], 'confidence': 1.0, 'evidence': []}]",Creates hierarchical records from website pages based on HTML tags.,"{'constants': [], 'types': [], 'classes': [], 'functions': []}"
dev-docs/development-process.md,FileType.FILE,hail-is,hail,0.2.133,https://hail.is,https://github.com/hail-is/hail/tree/0.2.133/dev-docs/development-process.md,"[{'name': 'Database Migrations', 'match_type': 'partial', 'implemented_parts': ['Offline migrations', 'service shutdowns'], 'confidence': 0.9, 'evidence': ['CI runs offline migrations to avoid service downtime', 'service shutdown list in migrations']}, {'name': 'Release Process', 'match_type': 'partial', 'implemented_parts': ['Version updates', 'documentation updates'], 'confidence': 0.8, 'evidence': ['Python version change triggers release', 'documentation change logs']}]",This document outlines the database migration and release processes for the Hail platform.,"{'constants': ['Defines configurations related to migrations'], 'types': ['Versions of libraries and tools'], 'classes': ['Processes for managing database changes'], 'functions': ['Automated deployment of changes']}"
dev-docs/google-cloud-cookbook.md,FileType.FILE,hail-is,hail,0.2.133,https://hail.is,https://github.com/hail-is/hail/tree/0.2.133/dev-docs/google-cloud-cookbook.md,"[{'name': 'Iterative Deletion', 'match_type': 'partial', 'implemented_parts': ['for loop iterates over batches of disks', 'gcloud command lists detached disks', 'awk extracts zone information from list output', 'parallel deletion of disks within zones'], 'confidence': 0.9, 'evidence': ['for loop syntax', 'gcloud command usage for listing disks', 'awk command for extracting specific field values', 'parallel execution using `% &` operator']}]",This script efficiently deletes large numbers of detached disks in batches due to API quota limitations.,"{'constants': [], 'types': [], 'classes': [], 'functions': []}"
dev-docs/gvs.md,FileType.FILE,hail-is,hail,0.2.133,https://hail.is,https://github.com/hail-is/hail/tree/0.2.133/dev-docs/gvs.md,"[{'name': 'DataImport', 'match_type': 'partial', 'implemented_parts': ['AvroReader', 'PointToWideRepresentation', 'SampleGroupImport'], 'confidence': 0.9, 'evidence': ['JVM Avro reader usage', 'Point-wise to wide representation conversion', 'Sample group import function']}, {'name': 'VDSCombiner', 'match_type': 'partial', 'implemented_parts': ['Intermediate VDS creation', 'VDS combiner process'], 'confidence': 0.8, 'evidence': ['Multiple intermediate VDS creation', 'VDS combiner function with tens of input files']}]",This file deals with importing variant data from GVS into the Hail Variant Dataset Store (VDS).,"{'constants': ['N/A'], 'types': ['AvroReader', 'VDS'], 'classes': ['N/A'], 'functions': ['Sample group import', 'VDS combiner']}"
dev-docs/hail-for-new-engineers.md,FileType.FILE,hail-is,hail,0.2.133,https://hail.is,https://github.com/hail-is/hail/tree/0.2.133/dev-docs/hail-for-new-engineers.md,[],This document describes the technology stack and architecture used by Hail.,"{'languages': ['C++, Python'], 'frameworks': ['Kubernetes'], 'databases': ['MySQL'], 'concurrency': ['asyncio'], 'networking': ['aiohttp'], 'templating': ['jinja2'], 'containerization': ['Docker']}"
dev-docs/hail-overview.md,FileType.FILE,hail-is,hail,0.2.133,https://hail.is,https://github.com/hail-is/hail/tree/0.2.133/dev-docs/hail-overview.md,[],Microservices architecture documentation for Hail platform.,"{'services': ['auth & auth-driver', 'batch & batch-driver', 'ci', 'gateway', 'internal-gateway', 'website'], 'technologies': ['K8s', 'GCP', 'Algolia', 'MySQL', 'asyncio', 'nginx']}"
dev-docs/hail-production-issues.md,FileType.FILE,hail-is,hail,0.2.133,https://hail.is,https://github.com/hail-is/hail/tree/0.2.133/dev-docs/hail-production-issues.md,"[{'name': 'Bug in Hail PyPI library', 'match_type': 'full', 'implemented_parts': [], 'confidence': 1.0, 'evidence': ['Library prevents use, previous versions work']}, {'name': 'CI job failures', 'match_type': 'partial', 'implemented_parts': ['One in four jobs fail'], 'confidence': 0.8, 'evidence': ['Database or CPU limitations']}]",This file describes known issues with the Hail library and CI pipeline.,"{'constants': [], 'types': [], 'classes': [], 'functions': []}"
dev-docs/pip-dependencies.md,FileType.FILE,hail-is,hail,0.2.133,https://hail.is,https://github.com/hail-is/hail/tree/0.2.133/dev-docs/pip-dependencies.md,"[{'name': 'Dependency Management', 'match_type': 'partial', 'implemented_parts': ['Dependency listing', 'Version constraints', 'Pinned requirements file'], 'confidence': 0.9, 'evidence': ['`requirements.txt` for listing pip dependencies', '`pinned-requirements.txt` for pinned dependencies', 'Command to generate pinned requirements on changes']}]",This file describes the management of dependencies for a Python module.,"{'constants': ['N/A'], 'types': ['N/A'], 'classes': ['N/A'], 'functions': ['N/A']}"
dev-docs,FileType.DIR,hail-is,hail,0.2.133,https://hail.is,https://github.com/hail-is/hail/tree/0.2.133/dev-docs,"[{'name': 'Technology Stack', 'match_type': 'full', 'implemented_parts': ['Kubernetes', 'MySQL', 'asyncio', 'aiohttp', 'jinja2', 'Docker'], 'confidence': 1.0, 'evidence': ['README.md describes tech stack']}, {'name': 'Microservices Architecture', 'match_type': 'full', 'implemented_parts': ['auth & auth-driver', 'batch & batch-driver', 'ci', 'gateway', 'internal-gateway', 'website'], 'confidence': 1.0, 'evidence': ['README.md outlines microservices architecture']}, {'name': 'Known Issues', 'match_type': 'partial', 'implemented_parts': ['Library prevents use, previous versions work', 'CI job failures'], 'confidence': 0.9, 'evidence': ['GitHub issues and documentation references']}, {'name': 'Dependency Management', 'match_type': 'partial', 'implemented_parts': ['Dependency listing', 'Version constraints', 'Pinned requirements file'], 'confidence': 0.9, 'evidence': ['`requirements.txt` and `pinned-requirements.txt` files']}]",This document describes the technology stack and architecture used by Hail.,"{'languages': ['C++, Python'], 'frameworks': ['Kubernetes'], 'databases': ['MySQL'], 'concurrency': ['asyncio'], 'networking': ['aiohttp'], 'templating': ['jinja2'], 'containerization': ['Docker']}"
devbin/dev_proxy.py,FileType.FILE,hail-is,hail,0.2.133,https://hail.is,https://github.com/hail-is/hail/tree/0.2.133/devbin/dev_proxy.py,[],This file handles API requests and serves web pages.,"{'constants': [], 'types': [], 'classes': [], 'functions': []}"
devbin/functions.sh,FileType.FILE,hail-is,hail,0.2.133,https://hail.is,https://github.com/hail-is/hail/tree/0.2.133/devbin/functions.sh,"[{'name': 'StatefulObject', 'match_type': 'partial', 'implemented_parts': ['Initialization with state', 'Stateful methods'], 'confidence': 0.9, 'evidence': ['constructor takes initial state', 'methods update state']}, {'name': 'DependencyInjection', 'match_type': 'full', 'implemented_parts': ['Constructor injection', 'Dependency classes'], 'confidence': 1.0, 'evidence': ['constructor receives dependencies', 'dependencies are injected by constructor']}]",This file defines a stateful object with methods for managing its state.,"{'constants': ['Defines constants for state values'], 'types': ['StatefulObject class represents stateful entity'], 'classes': ['StatefulObject class manages state', 'Dependency classes provide functionality'], 'functions': ['constructor initializes state', 'methods update and retrieve state']}"
devbin/generate_gcp_ar_cleanup_policy.py,FileType.FILE,hail-is,hail,0.2.133,https://hail.is,https://github.com/hail-is/hail/tree/0.2.133/devbin/generate_gcp_ar_cleanup_policy.py,"[{'name': 'Dependency Injection', 'match_type': 'partial', 'implemented_parts': ['constructor receives dependencies', 'dependencies injected at runtime'], 'confidence': 0.95, 'evidence': ['constructor parameters annotated with @Inject', 'dependencies resolved using dependency injection container']}, {'name': 'Model-View-Controller (MVC)', 'match_type': 'full', 'implemented_parts': ['Controller interacts with Model and View', 'Model handles data access', 'View displays data from Model'], 'confidence': 1.0, 'evidence': ['Controller layer separated from Model and View', 'Model contains data access logic', 'View receives data from Controller']}, {'name': 'Event Handling', 'match_type': 'partial', 'implemented_parts': ['Event dispatcher', 'Listener registration'], 'confidence': 0.85, 'evidence': ['Dedicated event dispatcher class', 'Methods annotated with @EventListener', 'Events dispatched and listeners notified']}]",This file adheres to clean architecture principles by separating concerns and promoting modularity.,"{'constants': ['Defines event types'], 'types': ['Event classes', 'Listeners'], 'classes': ['EventDispatcher manages event dispatch', 'Controller interacts with Model and View'], 'functions': ['dispatch event', 'register listener']}"
devbin/hail-build-llvm,FileType.FILE,hail-is,hail,0.2.133,https://hail.is,https://github.com/hail-is/hail/tree/0.2.133/devbin/hail-build-llvm,"[{'name': 'Command Line Parser', 'match_type': 'partial', 'implemented_parts': ['Options handling', 'Help message generation'], 'confidence': 0.9, 'evidence': ['getopt parsing', '_HELP variable']}, {'name': 'CMake Configuration', 'match_type': 'full', 'implemented_parts': ['Building LLVM with specific configurations'], 'confidence': 1.0, 'evidence': ['cmake command with multiple flags', 'LLVM_DIRECTORY and LLVM_BUILD_DIRECTORY variables']}]",This script builds LLVM and MLIR for local Hail development.,"{'constants': ['Defines environment variables for LLVM'], 'types': ['Shell variables for options'], 'classes': ['None'], 'functions': ['Main function runs CMake configuration']}"
devbin/hail-build-native-compiler,FileType.FILE,hail-is,hail,0.2.133,https://hail.is,https://github.com/hail-is/hail/tree/0.2.133/devbin/hail-build-native-compiler,"[{'name': 'Command', 'match_type': 'partial', 'implemented_parts': ['Receiver', 'Command', 'execute method'], 'confidence': 0.9, 'evidence': ['receiver accepts command', 'execute performs action']}, {'name': 'Iterator', 'match_type': 'partial', 'implemented_parts': ['Collection', 'Iterator', 'next method'], 'confidence': 0.8, 'evidence': ['collection iterates over elements', 'next fetches next element']}]",This file builds Hail's native compiler using CMake.,"{'constants': ['Defines build-related constants'], 'types': ['CMake project configuration'], 'classes': ['Custom CMake modules for Hail compiler'], 'functions': ['CMake commands for building the compiler']}"
