filename,type,author,repo,version,wiki,url,patterns,purpose,summary
hail/src/main/scala/is/hail/types/physical/stypes/concrete/SNDArrayPointer.scala,FileType.FILE,hail-is,hail,0.2.133,https://hail.is,https://github.com/hail-is/hail/tree/0.2.133/hail/src/main/scala/is/hail/types/physical/stypes/concrete/SNDArrayPointer.scala,"[{'name': 'Array Pointer Setter', 'match_type': 'partial', 'implemented_parts': ['SettableBuilder', 'SNDArrayPointer', 'settableTuple', 'store'], 'confidence': 0.95, 'evidence': ['newSettable method of SettableBuilder', 'loadCheapSCode method of PType', 'store method of SNDArrayPointerSettable']}, {'name': 'Custom Pointer Arithmetic', 'match_type': 'partial', 'implemented_parts': ['st.pType.elementType', 'ptrs', 'region', 'body'], 'confidence': 0.85, 'evidence': ['pType field of SNDArrayPointer', 'array.st.pType.elementType', 'loadFromNested method of PType']}]",This file defines utilities for manipulating and storing arrays efficiently.,"{'constants': [], 'types': ['Custom types for array handling'], 'classes': [], 'functions': ['Custom methods for array pointer arithmetic']}"
hail/src/main/scala/is/hail/types/physical/stypes/concrete/SNDArraySlice.scala,FileType.FILE,hail-is,hail,0.2.133,https://hail.is,https://github.com/hail-is/hail/tree/0.2.133/hail/src/main/scala/is/hail/types/physical/stypes/concrete/SNDArraySlice.scala,"[{'name': 'Iterator pattern', 'match_type': 'partial', 'implemented_parts': ['Traversable data structure', 'Iterator interface', 'next/current methods'], 'confidence': 0.9, 'evidence': ['for loop iterating over elements', 'custom iterator class', 'current element access']}, {'name': 'Observer pattern', 'match_type': 'partial', 'implemented_parts': ['Subject interface', 'Observer class', 'notify method'], 'confidence': 0.8, 'evidence': ['publish/subscribe events', 'observer registration/unregistration', 'notification mechanism']}, {'name': 'Decorator pattern', 'match_type': 'partial', 'implemented_parts': ['Decorator class', 'wrapping method', 'additional functionality'], 'confidence': 0.7, 'evidence': ['wrapper function around existing object', 'addition of new features', 'dynamic dispatch mechanism']}]",This file implements various data structures and algorithms for efficient processing and manipulation.,"{'constants': ['Defines data-related constants'], 'types': ['Custom data structures', 'Algorithms for various tasks'], 'classes': ['Node class represents a linked list element', 'List class implements a doubly-linked list'], 'functions': ['Various utility functions for data manipulation', 'Algorithmic functions for sorting and searching']}"
hail/src/main/scala/is/hail/types/physical/stypes/concrete/SRNGState.scala,FileType.FILE,hail-is,hail,0.2.133,https://hail.is,https://github.com/hail-is/hail/tree/0.2.133/hail/src/main/scala/is/hail/types/physical/stypes/concrete/SRNGState.scala,"[{'name': 'Initialization with Key', 'match_type': 'partial', 'implemented_parts': ['Key generation', 'Initialization with key'], 'confidence': 0.9, 'evidence': ['ThreefryRandomEngine class', 'key generation method', 'Initialization with key method']}, {'name': 'Block Encryption', 'match_type': 'full', 'implemented_parts': ['Block encryption function'], 'confidence': 1.0, 'evidence': ['Threefry.encrypt method']}, {'name': 'State Management', 'match_type': 'partial', 'implemented_parts': ['State storage and retrieval'], 'confidence': 0.8, 'evidence': ['SRNGStateStaticSizeSettable class', 'store and get methods']}]",This file implements a secure random number generator based on the Threefish stream cipher.,"{'constants': ['Constants related to block size and tweaks'], 'types': ['Custom types for state and engine'], 'classes': ['ThreefryRandomEngine class manages the cipher'], 'functions': ['Initialization methods', 'Encryption and state management functions']}"
hail/src/main/scala/is/hail/types/physical/stypes/concrete/SStackInterval.scala,FileType.FILE,hail-is,hail,0.2.133,https://hail.is,https://github.com/hail-is/hail/tree/0.2.133/hail/src/main/scala/is/hail/types/physical/stypes/concrete/SStackInterval.scala,"[{'name': 'Point-Emit Pattern', 'match_type': 'full', 'implemented_parts': ['Storage type', 'Copied type', 'Contains pointers'], 'confidence': 1.0, 'evidence': ['Custom storage type', 'Copied data type', 'Pointers to underlying data']}, {'name': 'Stack Interval Value', 'match_type': 'partial', 'implemented_parts': ['Value tuple extraction', 'Start and end loading', 'Includes start and end flags'], 'confidence': 0.9, 'evidence': ['Value tuple with start and end values', 'Methods for loading start and end values', 'Flags for including start and end values']}, {'name': 'Stack Interval Settable', 'match_type': 'partial', 'implemented_parts': ['Settable value tuple', 'Storing values'], 'confidence': 0.8, 'evidence': ['Settable value tuple with start and end values', 'Method for storing values']}]",This file defines data structures and functionalities related to stacks and intervals.,"{'constants': [], 'types': ['Custom types for points and intervals'], 'classes': ['Stack interval related types'], 'functions': ['Methods for handling stacks and intervals']}"
hail/src/main/scala/is/hail/types/physical/stypes/concrete/SStackStruct.scala,FileType.FILE,hail-is,hail,0.2.133,https://hail.is,https://github.com/hail-is/hail/tree/0.2.133/hail/src/main/scala/is/hail/types/physical/stypes/concrete/SStackStruct.scala,"[{'name': 'Iterator', 'match_type': 'partial', 'implemented_parts': ['Iterates over a collection', 'next element', 'stop condition'], 'confidence': 0.9, 'evidence': ['for loop', 'iterator class', 'current element access']}, {'name': 'Comparable', 'match_type': 'full', 'implemented_parts': ['Comparison operators', 'equals method'], 'confidence': 1.0, 'evidence': ['== operator', 'hashCode method', 'Comparable interface']}]",This file defines utilities for iterating over collections and comparing values.,"{'constants': ['Defines utility constants'], 'types': ['Custom types for iterating and comparing'], 'classes': ['Iterator class for iterating over collections'], 'functions': ['compare methods for equality checking']}"
hail/src/main/scala/is/hail/types/physical/stypes/concrete/SStringPointer.scala,FileType.FILE,hail-is,hail,0.2.133,https://hail.is,https://github.com/hail-is/hail/tree/0.2.133/hail/src/main/scala/is/hail/types/physical/stypes/concrete/SStringPointer.scala,"[{'name': 'Iterator pattern', 'match_type': 'partial', 'implemented_parts': ['Iterator interface', 'hasNext method', 'next method'], 'confidence': 0.95, 'evidence': ['interface definition with iterable methods', 'concrete iterator class']}, {'name': 'Decorator pattern', 'match_type': 'partial', 'implemented_parts': ['Decorator class', 'decorated method'], 'confidence': 0.85, 'evidence': ['decorator receives decorated object', 'modifies method behavior']}, {'name': 'Factory pattern', 'match_type': 'full', 'implemented_parts': ['Factory method', 'Concrete factory class'], 'confidence': 1.0, 'evidence': ['abstract factory method', 'concrete factory implementation']}]",This file implements various design patterns for object-oriented programming.,"{'constants': ['Defines constants related to design patterns'], 'types': ['Abstract types for design patterns'], 'classes': ['Factory class responsible for object creation'], 'functions': ['Factory method creates concrete objects']}"
hail/src/main/scala/is/hail/types/physical/stypes/concrete/SStructView.scala,FileType.FILE,hail-is,hail,0.2.133,https://hail.is,https://github.com/hail-is/hail/tree/0.2.133/hail/src/main/scala/is/hail/types/physical/stypes/concrete/SStructView.scala,"[{'name': 'Virtual type handling', 'match_type': 'partial', 'implemented_parts': ['virtual type definition', 'field mapping'], 'confidence': 0.9, 'evidence': ['virtual type field', 'newToOldFieldMapping method']}, {'name': 'Struct view manipulation', 'match_type': 'full', 'implemented_parts': ['subset method', 'SStructView class'], 'confidence': 1.0, 'evidence': ['field selection based on names', 'recursive view structure']}]",This file defines a struct view system for working with data structures.,"{'constants': ['Defines constants related to field selection'], 'types': ['Custom types for struct views'], 'classes': ['SStructView class represents a field-selected view'], 'functions': ['subset method for field selection']}"
hail/src/main/scala/is/hail/types/physical/stypes/concrete/SUnreachable.scala,FileType.FILE,hail-is,hail,0.2.133,https://hail.is,https://github.com/hail-is/hail/tree/0.2.133/hail/src/main/scala/is/hail/types/physical/stypes/concrete/SUnreachable.scala,"[{'name': 'Unreachable Container', 'match_type': 'partial', 'implemented_parts': ['SUnreachable class with container elements', 'SUnreachableContainerValue class for element storage'], 'confidence': 0.95, 'evidence': ['Virtual type-based element storage', 'Constant element length', 'Missing element handling via default value']}]",This class represents an unreachable container with virtual type-based elements.,"{'constants': ['Defines constants related to the unreachable container'], 'types': ['Custom type for the unreachable container'], 'classes': ['SUnreachable class and SUnreachableContainerValue class'], 'functions': ['Element storage and retrieval methods']}"
hail/src/main/scala/is/hail/types/physical/stypes/concrete,FileType.DIR,hail-is,hail,0.2.133,https://hail.is,https://github.com/hail-is/hail/tree/0.2.133/hail/src/main/scala/is/hail/types/physical/stypes/concrete,"[{'name': 'Concrete factory class', 'match_type': 'full', 'implemented_parts': ['Factory class with concrete methods'], 'confidence': 1.0, 'evidence': ['abstract factory method', 'concrete factory implementation']}, {'name': 'Virtual type handling', 'match_type': 'partial', 'implemented_parts': ['virtual type definition', 'field mapping'], 'confidence': 0.9, 'evidence': ['virtual type field', 'newToOldFieldMapping method']}, {'name': 'Struct view manipulation', 'match_type': 'full', 'implemented_parts': ['subset method', 'SStructView class'], 'confidence': 1.0, 'evidence': ['field selection based on names', 'recursive view structure']}, {'name': 'Unreachable Container', 'match_type': 'partial', 'implemented_parts': ['SUnreachable class with container elements', 'SUnreachableContainerValue class for element storage'], 'confidence': 0.95, 'evidence': ['Virtual type-based element storage', 'Constant element length', 'Missing element handling via default value']}]",This file implements various design patterns for object-oriented programming.,"{'constants': ['Defines constants related to design patterns'], 'types': ['Abstract types for design patterns'], 'classes': ['Factory class responsible for object creation'], 'functions': ['Factory method creates concrete objects']}"
hail/src/main/scala/is/hail/types/physical/stypes/interfaces/package.scala,FileType.FILE,hail-is,hail,0.2.133,https://hail.is,https://github.com/hail-is/hail/tree/0.2.133/hail/src/main/scala/is/hail/types/physical/stypes/interfaces/package.scala,"[{'name': 'PrimitiveValue Creator', 'match_type': 'full', 'implemented_parts': ['Type-specific value conversion functions'], 'confidence': 1.0, 'evidence': ['def primitive(x: Value[Long]): SInt64Value', 'def primitive(x: Value[Int]): SInt32Value', 'def primitive(x: Value[Double]): SFloat64Value']}, {'name': 'Value Coercion', 'match_type': 'partial', 'implemented_parts': ['Type inference based on input value'], 'confidence': 0.9, 'evidence': ['t match { case TInt32 => primitive(coerce[Int](x)) }', 'case TInt64 => primitive(coerce[Long](x))']}]",This file provides utilities for converting values from various types to their corresponding SValue representations.,"{'constants': [], 'types': ['Custom type for value representation'], 'classes': [], 'functions': ['primitive converts various data types to SValue instances', 'coerce converts values from other types to the target type']}"
hail/src/main/scala/is/hail/types/physical/stypes/interfaces/SBaseStruct.scala,FileType.FILE,hail-is,hail,0.2.133,https://hail.is,https://github.com/hail-is/hail/tree/0.2.133/hail/src/main/scala/is/hail/types/physical/stypes/interfaces/SBaseStruct.scala,"[{'name': 'Iterator Pattern', 'match_type': 'partial', 'implemented_parts': ['Iterator interface', 'create method', 'hasNext method', 'next method'], 'confidence': 0.9, 'evidence': ['Iterator class with abstract methods', 'Concrete iterator implementation', 'Iterating over a collection']}, {'name': 'Decorator Pattern', 'match_type': 'partial', 'implemented_parts': ['Decorator interface', 'Concrete decorator class', 'Decorator method'], 'confidence': 0.8, 'evidence': ['Decorator class with additional functionality', 'Decorator applied to a base class', 'Enhanced functionality through decorator']}, {'name': 'Factory Pattern', 'match_type': 'full', 'implemented_parts': ['Factory interface', 'Concrete factory class'], 'confidence': 1.0, 'evidence': ['Factory class responsible for object creation', 'Multiple concrete factory implementations', 'Dynamic object creation based on criteria']}]",This file implements various design patterns for reusable and maintainable code.,"{'constants': ['Defines constants related to design patterns'], 'types': ['Custom types for design patterns'], 'classes': ['Factory class for creating objects', 'Decorator class for extending functionality', 'Iterator class for iterating over collections'], 'functions': ['Create methods for different patterns', 'Decorator method for additional features', 'Iterator methods for traversing elements']}"
hail/src/main/scala/is/hail/types/physical/stypes/interfaces/SBinary.scala,FileType.FILE,hail-is,hail,0.2.133,https://hail.is,https://github.com/hail-is/hail/tree/0.2.133/hail/src/main/scala/is/hail/types/physical/stypes/interfaces/SBinary.scala,[],This file defines an interface for binary data types.,"{'constants': [], 'types': ['SBinary'], 'classes': ['SBinary trait defines the interface', 'SBinaryValue trait defines specific methods for binary data'], 'functions': []}"
hail/src/main/scala/is/hail/types/physical/stypes/interfaces/SCall.scala,FileType.FILE,hail-is,hail,0.2.133,https://hail.is,https://github.com/hail-is/hail/tree/0.2.133/hail/src/main/scala/is/hail/types/physical/stypes/interfaces/SCall.scala,"[{'name': 'Trait Implementation', 'match_type': 'full', 'implemented_parts': ['Trait definition with abstract method', 'Concrete class implementing the trait'], 'confidence': 1.0, 'evidence': ['`trait SCall extends SType`', '`class SCallValue extends SValue`']}, {'name': 'Value Class Hierarchy', 'match_type': 'partial', 'implemented_parts': ['Abstract class definition with unphase method', 'Concrete class implementing unphase method'], 'confidence': 0.9, 'evidence': ['`trait SCallValue extends SValue`', '`def unphase(cb: EmitCodeBuilder): SCallValue`']}]",This file defines an interface for call data and provides a concrete implementation.,"{'constants': [], 'types': ['SCall type representing call data', 'SCallValue type representing concrete call data'], 'classes': ['SCall trait defines the interface', 'SCallValue class implements the interface'], 'functions': ['unphase method computes unphased call data']}"
hail/src/main/scala/is/hail/types/physical/stypes/interfaces/SContainer.scala,FileType.FILE,hail-is,hail,0.2.133,https://hail.is,https://github.com/hail-is/hail/tree/0.2.133/hail/src/main/scala/is/hail/types/physical/stypes/interfaces/SContainer.scala,"[{'name': 'ArrayHash', 'match_type': 'full', 'implemented_parts': ['hash method'], 'confidence': 1.0, 'evidence': ['element hash calculation', 'local variable for hash result']}, {'name': 'SIndexableArray', 'match_type': 'full', 'implemented_parts': ['sliceArray method'], 'confidence': 0.9, 'evidence': ['element access via index', 'region-based slicing']}, {'name': 'SizeCalculation', 'match_type': 'partial', 'implemented_parts': ['sizeToStoreInBytes method'], 'confidence': 0.8, 'evidence': ['storage type awareness', 'element size calculation']}]",This file defines an indexed array data structure with efficient hashing and slicing capabilities.,"{'constants': ['None'], 'types': ['Custom indexable array type'], 'classes': ['SIndexableArray class'], 'functions': ['Hashing elements', 'Extracting elements from a region']}"
hail/src/main/scala/is/hail/types/physical/stypes/interfaces/SInterval.scala,FileType.FILE,hail-is,hail,0.2.133,https://hail.is,https://github.com/hail-is/hail/tree/0.2.133/hail/src/main/scala/is/hail/types/physical/stypes/interfaces/SInterval.scala,"[{'name': 'Point-in-Time Value', 'match_type': 'partial', 'implemented_parts': ['Interval storage', 'start and end access methods', 'size calculation based on interval'], 'confidence': 0.95, 'evidence': ['RInterval class for point-in-time values', 'start and end fields in SIntervalValue', 'size calculation method based on interval storage type']}, {'name': 'SValue Hierarchy', 'match_type': 'partial', 'implemented_parts': ['Value interface defines common methods', 'SIntervalValue inherits from Value and stores an interval', 'Methods for accessing and manipulating start and end points'], 'confidence': 0.85, 'evidence': ['Value interface with methods like sizeToStoreInBytes', 'SIntervalValue class implementing Value and storing an SInterval', 'Methods for loading and retrieving start and end points']}]",This file defines data structures and utilities for representing and manipulating point-in-time values.,"{'constants': [], 'types': ['Value interface for generic data storage', 'SInterval for point-in-time values'], 'classes': ['SIntervalValue class for storing point-in-time values'], 'functions': []}"
hail/src/main/scala/is/hail/types/physical/stypes/interfaces/SLocus.scala,FileType.FILE,hail-is,hail,0.2.133,https://hail.is,https://github.com/hail-is/hail/tree/0.2.133/hail/src/main/scala/is/hail/types/physical/stypes/interfaces/SLocus.scala,"[{'name': 'Trait Implementation', 'match_type': 'partial', 'implemented_parts': ['Trait definition', 'Methods from supertype'], 'confidence': 0.95, 'evidence': ['extends SType trait', 'defines rg and contigType methods']}, {'name': 'Value Class', 'match_type': 'full', 'implemented_parts': ['Value class definition', ""Methods for accessing traits' fields""], 'confidence': 1.0, 'evidence': ['defines st field of SLocus type', 'provides methods for contig, contigLong, position']}]",This file defines an interface for storing locus information and related data.,"{'constants': [], 'types': ['SLocus and SLocusValue types representing locus data'], 'classes': ['SLocus and SLocusValue traits define the interface'], 'functions': ['Methods for accessing and manipulating locus data']}"
hail/src/main/scala/is/hail/types/physical/stypes/interfaces/SNDArray.scala,FileType.FILE,hail-is,hail,0.2.133,https://hail.is,https://github.com/hail-is/hail/tree/0.2.133/hail/src/main/scala/is/hail/types/physical/stypes/interfaces/SNDArray.scala,"[{'name': 'Iterator', 'match_type': 'partial', 'implemented_parts': ['iterator method', 'next element', 'index tracking'], 'confidence': 0.9, 'evidence': ['for loop', 'collection iteration', 'index counter']}, {'name': 'Comparable', 'match_type': 'partial', 'implemented_parts': ['comparison methods', 'equals and hashcode'], 'confidence': 0.8, 'evidence': ['hash table usage', 'equality checks', 'custom comparison logic']}]",This file defines utility methods for iterating over collections and comparing values.,"{'constants': ['Defines utility constants'], 'types': ['Custom iterators and comparables'], 'classes': ['Reusable utility classes'], 'functions': ['iterate over collections', 'compare values']}"
hail/src/main/scala/is/hail/types/physical/stypes/interfaces/SStream.scala,FileType.FILE,hail-is,hail,0.2.133,https://hail.is,https://github.com/hail-is/hail/tree/0.2.133/hail/src/main/scala/is/hail/types/physical/stypes/interfaces/SStream.scala,"[{'name': 'Stateful Stream Processing', 'match_type': 'partial', 'implemented_parts': ['Stateful iterator', 'store method'], 'confidence': 0.9, 'evidence': ['Stateful SStream iterator', 'store method with SValue']}, {'name': 'Control Flow Management', 'match_type': 'partial', 'implemented_parts': ['Producer dependency', 'getProducer method'], 'confidence': 0.8, 'evidence': ['Producer dependency injected through method', 'getProducer method with method check']}]",This file defines a stateful stream processing system.,"{'constants': ['Defines constants for stream processing'], 'types': ['Custom types for stream processing'], 'classes': ['SStreamConcreteSettable class manages stateful stream'], 'functions': ['store method for persisting state', 'getProducer method for retrieving producer']}"
hail/src/main/scala/is/hail/types/physical/stypes/interfaces/SString.scala,FileType.FILE,hail-is,hail,0.2.133,https://hail.is,https://github.com/hail-is/hail/tree/0.2.133/hail/src/main/scala/is/hail/types/physical/stypes/interfaces/SString.scala,"[{'name': 'Trait definition', 'match_type': 'full', 'implemented_parts': ['Trait declaration with constructor method'], 'confidence': 1.0, 'evidence': ['trait SString extends SType { ... }', 'constructFromString method']}, {'name': 'Value class extension', 'match_type': 'partial', 'implemented_parts': ['Hashing method', 'Value class methods'], 'confidence': 0.9, 'evidence': ['hash method overrides default implementation', 'loadLength, loadString methods']}]",This file defines an interface for string-related data types and provides a concrete value class extension.,"{'constants': [], 'types': ['SString', 'SValue'], 'classes': ['SString', 'SValue'], 'functions': ['constructFromString', 'hash', 'loadLength', 'loadString']}"
hail/src/main/scala/is/hail/types/physical/stypes/interfaces/SVoid.scala,FileType.FILE,hail-is,hail,0.2.133,https://hail.is,https://github.com/hail-is/hail/tree/0.2.133/hail/src/main/scala/is/hail/types/physical/stypes/interfaces/SVoid.scala,"[{'name': 'Unit Type', 'match_type': 'full', 'implemented_parts': ['Empty value representation'], 'confidence': 1.0, 'evidence': ['Case object definition', 'virtualType field']}]",This file defines the `SVoid` type which represents the absence of a value.,"{'constants': [], 'types': ['`SVoid` type for unit value'], 'classes': [], 'functions': []}"
