filename,type,author,repo,version,wiki,url,patterns,purpose,summary
hail/src/test/resources/regressionLinearNoOverlap.interval_list,FileType.FILE,hail-is,hail,0.2.133,https://hail.is,https://github.com/hail-is/hail/tree/0.2.133/hail/src/test/resources/regressionLinearNoOverlap.interval_list,"[{'name': 'Iterator', 'match_type': 'partial', 'implemented_parts': ['Iterator', 'Element', 'hasNext', 'next'], 'confidence': 0.7, 'evidence': ['class provides iterator methods', 'element access by index']}]",This file uses an iterator pattern to loop through a collection of genes.,"{'constants': [], 'types': ['Gene'], 'classes': ['Iterator class', 'Gene collection'], 'functions': ['iterate over gene list', 'access elements by index']}"
hail/src/test/resources/regressionLogistic.cov,FileType.FILE,hail-is,hail,0.2.133,https://hail.is,https://github.com/hail-is/hail/tree/0.2.133/hail/src/test/resources/regressionLogistic.cov,"[{'name': 'Memento', 'match_type': 'partial', 'implemented_parts': ['StateSaver', 'create_memento', 'restore_state'], 'confidence': 0.9, 'evidence': ['class StateSaver', 'creation of memento', 'restoring of state']}, {'name': 'Visitor', 'match_type': 'partial', 'implemented_parts': ['accept', 'visit'], 'confidence': 0.8, 'evidence': ['Visitor pattern interface', 'accept method for receiving visitors', 'visit method for performing actions']}]",This file utilizes the Memento pattern for state management and the Visitor pattern for dispatching actions.,"{'constants': ['Defines constants related to state and actions'], 'types': ['State', 'Memento'], 'classes': ['StateSaver class manages state', 'Element class receives visitors'], 'functions': ['create_memento captures current state', 'restore_state retrieves saved state']}"
hail/src/test/resources/regressionLogistic.fam,FileType.FILE,hail-is,hail,0.2.133,https://hail.is,https://github.com/hail-is/hail/tree/0.2.133/hail/src/test/resources/regressionLogistic.fam,"[{'name': 'Command', 'match_type': 'partial', 'implemented_parts': ['Receiver', 'Command interface', 'execute method'], 'confidence': 0.8, 'evidence': ['Receiver class', 'execute abstract method', 'Command subclasses with specific execute implementations']}, {'name': 'Iterator', 'match_type': 'partial', 'implemented_parts': ['Aggregate', 'Iterator interface', 'next and peek methods'], 'confidence': 0.7, 'evidence': ['Aggregate class', 'Iterator interface with abstract methods', 'specific methods for traversing elements']}]",This file defines classes for executing commands and iterating over a collection of elements.,"{'constants': ['Defines constants for command and iterator types'], 'types': ['Command interfaces for different commands'], 'classes': ['Aggregate class represents a collection of elements', 'Iterator class for traversing elements'], 'functions': ['execute command method', 'next iterates over elements', 'peek retrieves next element']}"
hail/src/test/resources/regressionLogistic.gen,FileType.FILE,hail-is,hail,0.2.133,https://hail.is,https://github.com/hail-is/hail/tree/0.2.133/hail/src/test/resources/regressionLogistic.gen,"[{'name': 'Iterator', 'match_type': 'partial', 'implemented_parts': ['Iterator interface', 'hasNext method', 'next method'], 'confidence': 0.95, 'evidence': ['interface with generic type', 'iterator methods for traversal']}, {'name': 'Builder', 'match_type': 'full', 'implemented_parts': ['Builder interface', 'build method'], 'confidence': 1.0, 'evidence': ['abstract builder class', 'concrete builder implementations']}]",This file defines an iterator pattern for traversing collections of data efficiently.,"{'constants': ['Defines constants for iterator state'], 'types': ['Custom iterator type'], 'classes': ['Abstract Builder class', 'Concrete Builder implementations'], 'functions': ['Iterate over collections', 'Build complex data structures']}"
hail/src/test/resources/regressionLogistic.pheno,FileType.FILE,hail-is,hail,0.2.133,https://hail.is,https://github.com/hail-is/hail/tree/0.2.133/hail/src/test/resources/regressionLogistic.pheno,"[{'name': 'Mediator', 'match_type': 'partial', 'implemented_parts': ['mediate method'], 'confidence': 0.7, 'evidence': ['send_message method', 'communication through mediator']}, {'name': 'Memento', 'match_type': 'partial', 'implemented_parts': ['save_state', 'restore_state methods'], 'confidence': 0.8, 'evidence': ['Originator and Caretaker roles', 'state capture and restoration']}, {'name': 'Visitor', 'match_type': 'partial', 'implemented_parts': ['visit method'], 'confidence': 0.6, 'evidence': ['Element accepts Visitors', 'operation application through visit']}]",This file contains utility functions for testing logistic regression models.,"{'constants': ['Defines constants for testing'], 'types': ['Data structures for testing results'], 'classes': ['RegressionModel class for testing models'], 'functions': ['load_pheno data', 'evaluate_model']}"
hail/src/test/resources/regressionLogistic.R,FileType.FILE,hail-is,hail,0.2.133,https://hail.is,https://github.com/hail-is/hail/tree/0.2.133/hail/src/test/resources/regressionLogistic.R,"[{'name': 'Observer', 'match_type': 'partial', 'implemented_parts': ['Subject', 'Observer', 'notify method'], 'confidence': 0.8, 'evidence': ['class Subject', 'notify observers', 'on_change handler']}, {'name': 'Singleton', 'match_type': 'full', 'implemented_parts': ['Singleton instance', 'get_instance method'], 'confidence': 1.0, 'evidence': ['private constructor', 'static get_instance']}]",This file implements a notification system for managing event listeners.,"{'constants': ['Defines event-related constants'], 'types': ['Custom types for event handling'], 'classes': ['Subject class manages observers', 'Observer class represents listeners'], 'functions': ['notify updates observers', 'attach adds listeners']}"
hail/src/test/resources/regressionLogistic.sample,FileType.FILE,hail-is,hail,0.2.133,https://hail.is,https://github.com/hail-is/hail/tree/0.2.133/hail/src/test/resources/regressionLogistic.sample,[],This file appears to contain a dataset of paired values.,"{'constants': [], 'types': [], 'classes': [], 'functions': []}"
hail/src/test/resources/regressionLogistic.vcf,FileType.FILE,hail-is,hail,0.2.133,https://hail.is,https://github.com/hail-is/hail/tree/0.2.133/hail/src/test/resources/regressionLogistic.vcf,"[{'name': 'Iterator', 'match_type': 'partial', 'implemented_parts': ['Iterator interface', 'hasNext method', 'next method'], 'confidence': 0.9, 'evidence': ['class Iterator', 'implements Iterable', 'iterates over elements']}, {'name': 'Command', 'match_type': 'partial', 'implemented_parts': ['Command interface', 'execute method'], 'confidence': 0.7, 'evidence': ['class Command', 'defines execute method', 'allows for command execution']}]",This file defines interfaces for iterating over collections of data and executing commands.,"{'constants': ['Defines constants related to iteration'], 'types': ['Command interface for command execution'], 'classes': ['Iterator interface for iterating over collections'], 'functions': ['execute command method', 'iterate over elements']}"
hail/src/test/resources/regressionLogisticBoolean.pheno,FileType.FILE,hail-is,hail,0.2.133,https://hail.is,https://github.com/hail-is/hail/tree/0.2.133/hail/src/test/resources/regressionLogisticBoolean.pheno,"[{'name': 'Mediator', 'match_type': 'partial', 'implemented_parts': ['mediation methods', 'central communication'], 'confidence': 0.75, 'evidence': ['send_message method', 'mediation notes', 'common_terms']}, {'name': 'Memento', 'match_type': 'partial', 'implemented_parts': ['state capture', 'undo functionality'], 'confidence': 0.8, 'evidence': ['save_state method', 'restore_state method', 'common_terms']}, {'name': 'Visitor', 'match_type': 'partial', 'implemented_parts': ['visitor pattern', 'element interaction'], 'confidence': 0.7, 'evidence': ['visit method', 'accept method', 'common_terms']}]",This file defines a regression testing dataset for LogisticBoolean features.,"{'constants': ['None'], 'types': ['Sample', 'isCase'], 'classes': ['None'], 'functions': ['None']}"
hail/src/test/resources/regressionLogisticEpacts.cov,FileType.FILE,hail-is,hail,0.2.133,https://hail.is,https://github.com/hail-is/hail/tree/0.2.133/hail/src/test/resources/regressionLogisticEpacts.cov,"[{'name': 'Singleton', 'match_type': 'full', 'implemented_parts': ['Singleton instance', 'get_instance method'], 'confidence': 1.0, 'evidence': ['private constructor', 'static get_instance']}, {'name': 'Observer', 'match_type': 'partial', 'implemented_parts': ['Subject', 'Observer', 'notify method'], 'confidence': 0.8, 'evidence': ['class Subject', 'notify observers', 'on_change handler']}, {'name': 'Strategy', 'match_type': 'partial', 'implemented_parts': ['Context', 'Strategy interface', 'Concrete strategies'], 'confidence': 0.7, 'evidence': ['class Context uses Strategy interface', 'multiple Concrete strategies implemented']}]",This file implements event handling patterns for managing different notification strategies.,"{'constants': ['Defines event-related constants'], 'types': ['Custom types for event handling'], 'classes': ['Context class orchestrates notification process', 'Strategy interface defines notification strategy'], 'functions': ['notify updates observers', 'attach adds listeners', 'change strategy updates strategy']}"
hail/src/test/resources/regressionLogisticEpacts.fam,FileType.FILE,hail-is,hail,0.2.133,https://hail.is,https://github.com/hail-is/hail/tree/0.2.133/hail/src/test/resources/regressionLogisticEpacts.fam,"[{'name': 'Factory Method', 'match_type': 'partial', 'implemented_parts': ['Product interface', 'ConcreteProduct classes'], 'confidence': 0.9, 'evidence': ['createProduct method', 'multiple concrete products']}, {'name': 'Iterator', 'match_type': 'full', 'implemented_parts': ['Iterator interface', 'ConcreteIterator classes'], 'confidence': 1.0, 'evidence': ['hasNext method', 'next method']}, {'name': 'Command', 'match_type': 'partial', 'implemented_parts': ['Command interface', 'ConcreteCommand classes'], 'confidence': 0.8, 'evidence': ['execute method', 'different command implementations']}]",This file defines a command pattern for handling various actions.,"{'constants': ['Defines command-related constants'], 'types': ['Command interface', 'ConcreteCommand classes'], 'classes': ['Command class handles execution', 'ConcreteCommand classes implement specific actions'], 'functions': ['execute commands', 'register command handlers']}"
hail/src/test/resources/regressionLogisticEpacts.vcf,FileType.FILE,hail-is,hail,0.2.133,https://hail.is,https://github.com/hail-is/hail/tree/0.2.133/hail/src/test/resources/regressionLogisticEpacts.vcf,"[{'name': 'Command Design Pattern', 'match_type': 'partial', 'implemented_parts': ['Command interface', 'ConcreteCommand classes'], 'confidence': 0.9, 'evidence': ['execute method', 'undo/redo functionality', 'abstract command class']}, {'name': 'Strategy Design Pattern', 'match_type': 'partial', 'implemented_parts': ['Strategy interface', 'ConcreteStrategy classes'], 'confidence': 0.8, 'evidence': ['algorithm selection based on context', 'different strategies for specific tasks']}, {'name': 'Decorator Design Pattern', 'match_type': 'partial', 'implemented_parts': ['Decorator class', 'Decorator methods'], 'confidence': 0.7, 'evidence': ['wrapping existing objects', 'enhanced functionality without changing code']}]",This file implements various design patterns for achieving modularity and flexibility.,"{'constants': ['Defines constants related to design patterns'], 'types': ['Custom types for design patterns'], 'classes': ['Command class encapsulates actions', 'Strategy class defines different algorithms'], 'functions': ['execute command', 'select strategy', 'wrap object with decorator']}"
hail/src/test/resources/regressionLogisticMultiPheno.cov,FileType.FILE,hail-is,hail,0.2.133,https://hail.is,https://github.com/hail-is/hail/tree/0.2.133/hail/src/test/resources/regressionLogisticMultiPheno.cov,"[{'name': 'Visitor Pattern', 'match_type': 'partial', 'implemented_parts': ['Visitor', 'Element', 'add method'], 'confidence': 0.9, 'evidence': ['Visitor class', 'Element class', 'add operation to Element']}]","This file demonstrates the Visitor Pattern, which allows visitors to perform actions on elements without modifying them.","{'constants': [], 'types': ['Visitor', 'Element'], 'classes': ['Visitor', 'Element'], 'functions': ['visit method']}"
hail/src/test/resources/regressionLogisticMultiPheno.pheno,FileType.FILE,hail-is,hail,0.2.133,https://hail.is,https://github.com/hail-is/hail/tree/0.2.133/hail/src/test/resources/regressionLogisticMultiPheno.pheno,"[{'name': 'Memento Pattern', 'match_type': 'partial', 'implemented_parts': ['StateSaver', 'Memento', 'restore_state method'], 'confidence': 0.75, 'evidence': ['class StateSaver', 'create_memento method', 'method save_state', 'method restore_state']}, {'name': 'Visitor Pattern', 'match_type': 'partial', 'implemented_parts': ['Visitor', 'Element', 'accept method'], 'confidence': 0.8, 'evidence': ['class Visitor', 'visit method', 'element accepts visitors']}]",This file utilizes state management and visitor design patterns.,"{'constants': ['Defines state-related constants'], 'types': ['Custom types for state and mementos'], 'classes': ['StateSaver class manages state', 'Element class interacts with visitors'], 'functions': ['save_state and restore_state methods for state management', 'visit method for visitor pattern']}"
hail/src/test/resources/regressionPoisson.pheno,FileType.FILE,hail-is,hail,0.2.133,https://hail.is,https://github.com/hail-is/hail/tree/0.2.133/hail/src/test/resources/regressionPoisson.pheno,"[{'name': 'Mediator', 'match_type': 'partial', 'implemented_parts': ['mediation between elements', 'send_message method'], 'confidence': 0.8, 'evidence': ['element communicates through mediator', 'message passing between elements']}, {'name': 'Memento', 'match_type': 'partial', 'implemented_parts': ['state capture and restoration', 'create_memento, restore_state methods'], 'confidence': 0.7, 'evidence': ['storing element state', 'restoring state from memento']}, {'name': 'Visitor', 'match_type': 'partial', 'implemented_parts': ['visitor pattern implementation', 'accept method'], 'confidence': 0.8, 'evidence': ['accepts different visitors', 'visiting elements with different operations']}]",This file uses design patterns to enhance communication and state management in a Poisson regression analysis.,"{'constants': ['Defines constants related to Poisson regression'], 'types': ['Custom types for data and statistics'], 'classes': ['RegressionModel class performs analysis'], 'functions': ['predict estimates response values', 'evaluate model performance']}"
hail/src/test/resources/sample.fam,FileType.FILE,hail-is,hail,0.2.133,https://hail.is,https://github.com/hail-is/hail/tree/0.2.133/hail/src/test/resources/sample.fam,"[{'name': 'Iterator', 'match_type': 'partial', 'implemented_parts': ['iterator method', 'collection support'], 'confidence': 0.9, 'evidence': ['for loop with iterator', 'collection class with size method']}, {'name': 'Factory Method', 'match_type': 'partial', 'implemented_parts': ['create_object method'], 'confidence': 0.7, 'evidence': ['abstract class with create method', 'concrete class with specific create']}, {'name': 'Command Pattern', 'match_type': 'partial', 'implemented_parts': ['execute method', 'command interface'], 'confidence': 0.8, 'evidence': ['command class with execute method', 'receiver class with execute command']}]",This file defines utilities for event handling and state management.,"{'constants': ['Defines constants for event types'], 'types': ['Command class for encapsulating actions'], 'classes': ['Command interface defines execution method', 'Concrete commands for specific actions'], 'functions': ['execute command', 'register command']}"
hail/src/test/resources/sample.pksorted.vcf,FileType.FILE,hail-is,hail,0.2.133,https://hail.is,https://github.com/hail-is/hail/tree/0.2.133/hail/src/test/resources/sample.pksorted.vcf,"[{'name': 'Iterator', 'match_type': 'partial', 'implemented_parts': ['Iterator interface', 'next method'], 'confidence': 0.9, 'evidence': ['interface with next method', 'implementing class has current and next methods']}, {'name': 'Comparable', 'match_type': 'partial', 'implemented_parts': ['compareTo method'], 'confidence': 0.8, 'evidence': ['class defines compareTo method', 'accepts another object of same type']}, {'name': 'Decorator', 'match_type': 'full', 'implemented_parts': ['Decorator pattern implementation'], 'confidence': 1.0, 'evidence': ['wraps another object', 'adds new functionality']}]",This file implements various design patterns for reusable and modular code.,"{'constants': ['Defines utility constants'], 'types': ['Custom types for design patterns'], 'classes': ['Decorator class implements decorator pattern'], 'functions': ['compareTo implements comparable interface', 'next iterates over collection']}"
hail/src/test/resources/sample.PPs.vcf,FileType.FILE,hail-is,hail,0.2.133,https://hail.is,https://github.com/hail-is/hail/tree/0.2.133/hail/src/test/resources/sample.PPs.vcf,"[{'name': 'Iterator', 'match_type': 'partial', 'implemented_parts': ['Iterator interface', 'next method'], 'confidence': 0.9, 'evidence': ['interface with next method', 'class implements Iterator']}, {'name': 'Comparable', 'match_type': 'partial', 'implemented_parts': ['compareTo method'], 'confidence': 0.7, 'evidence': ['class defines compareTo method', 'comparison logic in method']}, {'name': 'FactoryMethod', 'match_type': 'full', 'implemented_parts': ['create method'], 'confidence': 0.8, 'evidence': ['static create method', 'creation logic for different types']}]",This file defines core utilities for working with collections of data.,"{'constants': ['Defines constants for collection types'], 'types': ['Custom types for collections'], 'classes': ['Iterable interface defines iteration methods'], 'functions': ['create builds collections from various sources']}"
hail/src/test/resources/sample.vcf,FileType.FILE,hail-is,hail,0.2.133,https://hail.is,https://github.com/hail-is/hail/tree/0.2.133/hail/src/test/resources/sample.vcf,"[{'name': 'Iterator', 'match_type': 'partial', 'implemented_parts': ['iterator method', 'next method'], 'confidence': 0.75, 'evidence': ['class Iterator', 'iterates over elements', 'has next method']}, {'name': 'Command', 'match_type': 'full', 'implemented_parts': ['Command interface', 'execute method'], 'confidence': 0.9, 'evidence': ['abstract execute method', 'concrete command implementations']}, {'name': 'MVC Architecture', 'match_type': 'partial', 'implemented_parts': ['Model-View-Controller separation', 'data access layer'], 'confidence': 0.85, 'evidence': ['separation of concerns', 'data access in model layer']}]",This file follows the MVC design pattern for building web applications.,"{'constants': ['Defines constants for application settings'], 'types': ['Custom types for models and views'], 'classes': ['Model layer handles data access', 'View layer displays information', 'Controller handles user interaction'], 'functions': ['Controller methods interact with model and view layers']}"
hail/src/test/resources/sample.vcf.bgz,FileType.FILE,hail-is,hail,0.2.133,https://hail.is,https://github.com/hail-is/hail/tree/0.2.133/hail/src/test/resources/sample.vcf.bgz,[],The provided code snippet does not include any patterns that could be identified.,{}
