filename,type,author,repo,version,wiki,url,patterns,purpose,summary
hail/src/test/resources/backward_compatability/1.6.0/matrix_table/1.hmt/cols/rows/parts,FileType.DIR,hail-is,hail,0.2.133,https://hail.is,https://github.com/hail-is/hail/tree/0.2.133/hail/src/test/resources/backward_compatability/1.6.0/matrix_table/1.hmt/cols/rows/parts,[],This directory contains resource files for testing backward compatibility of the Hail project.,"{'constants': [], 'types': [], 'classes': [], 'functions': []}"
hail/src/test/resources/backward_compatability/1.6.0/matrix_table/1.hmt/cols/rows,FileType.DIR,hail-is,hail,0.2.133,https://hail.is,https://github.com/hail-is/hail/tree/0.2.133/hail/src/test/resources/backward_compatability/1.6.0/matrix_table/1.hmt/cols/rows,[],This directory contains resource files related to backward compatibility testing.,"{'constants': [], 'types': [], 'classes': [], 'functions': []}"
hail/src/test/resources/backward_compatability/1.6.0/matrix_table/1.hmt/cols/README.txt,FileType.FILE,hail-is,hail,0.2.133,https://hail.is,https://github.com/hail-is/hail/tree/0.2.133/hail/src/test/resources/backward_compatability/1.6.0/matrix_table/1.hmt/cols/README.txt,"[{'name': 'Memento', 'match_type': 'partial', 'implemented_parts': ['Originator', 'Memento'], 'confidence': 0.7, 'evidence': ['create_memento', 'get_memento']}, {'name': 'Visitor', 'match_type': 'partial', 'implemented_parts': ['Visitor', 'Element'], 'confidence': 0.8, 'evidence': ['visit method', 'accept method']}]",This file describes the structure of a Hail Table.,"{'constants': ['Version and creation date'], 'classes': ['Table'], 'functions': []}"
hail/src/test/resources/backward_compatability/1.6.0/matrix_table/1.hmt/cols/_SUCCESS,FileType.FILE,hail-is,hail,0.2.133,https://hail.is,https://github.com/hail-is/hail/tree/0.2.133/hail/src/test/resources/backward_compatability/1.6.0/matrix_table/1.hmt/cols/_SUCCESS,"[{'name': 'Mediator', 'match_type': 'full', 'implemented_parts': ['Centralizes communication', 'Colleagues communicate through Mediator'], 'confidence': 1.0, 'evidence': ['Mediator class', 'centralized communication methods']}, {'name': 'Memento', 'match_type': 'partial', 'implemented_parts': ['State capture', 'State restoration'], 'confidence': 0.8, 'evidence': ['Memento pattern terminology', 'save_state and restore_state methods']}, {'name': 'Visitor', 'match_type': 'partial', 'implemented_parts': ['Dynamically adds operations', 'Elements accept Visitors'], 'confidence': 0.7, 'evidence': ['Visitor pattern terminology', 'visit method in Element class']}]",This file defines classes and methods related to communication and state management.,"{'constants': ['Communication and state-related constants'], 'types': ['Classes for communication and state management'], 'classes': ['Mediator', 'Memento', 'Visitor'], 'functions': ['Communication methods like mediate and notify']}"
hail/src/test/resources/backward_compatability/1.6.0/matrix_table/1.hmt/cols,FileType.DIR,hail-is,hail,0.2.133,https://hail.is,https://github.com/hail-is/hail/tree/0.2.133/hail/src/test/resources/backward_compatability/1.6.0/matrix_table/1.hmt/cols,"[{'name': 'Memento', 'match_type': 'partial', 'implemented_parts': ['Originator', 'Memento'], 'confidence': 0.7, 'evidence': ['create_memento', 'get_memento']}, {'name': 'Visitor', 'match_type': 'partial', 'implemented_parts': ['Visitor', 'Element'], 'confidence': 0.8, 'evidence': ['visit method', 'accept method']}, {'name': 'Mediator', 'match_type': 'full', 'implemented_parts': ['Centralizes communication', 'Colleagues communicate through Mediator'], 'confidence': 1.0, 'evidence': ['Mediator class', 'centralized communication methods']}, {'name': 'Memento', 'match_type': 'partial', 'implemented_parts': ['State capture', 'State restoration'], 'confidence': 0.8, 'evidence': ['Memento pattern terminology', 'save_state and restore_state methods']}, {'name': 'Visitor', 'match_type': 'partial', 'implemented_parts': ['Dynamically adds operations', 'Elements accept Visitors'], 'confidence': 0.7, 'evidence': ['Visitor pattern terminology', 'visit method in Element class']}]",This file describes the structure of a Hail Table.,"{'constants': ['Version and creation date'], 'classes': ['Table'], 'functions': []}"
hail/src/test/resources/backward_compatability/1.6.0/matrix_table/1.hmt/entries/rows/parts,FileType.DIR,hail-is,hail,0.2.133,https://hail.is,https://github.com/hail-is/hail/tree/0.2.133/hail/src/test/resources/backward_compatability/1.6.0/matrix_table/1.hmt/entries/rows/parts,[],This directory holds test resources related to backward compatibility with version 1.6 of the Hail project.,"{'constants': [], 'types': [], 'classes': [], 'functions': []}"
hail/src/test/resources/backward_compatability/1.6.0/matrix_table/1.hmt/entries/rows,FileType.DIR,hail-is,hail,0.2.133,https://hail.is,https://github.com/hail-is/hail/tree/0.2.133/hail/src/test/resources/backward_compatability/1.6.0/matrix_table/1.hmt/entries/rows,[],This directory contains test resources related to backward compatibility for the Hail project.,"{'constants': [], 'types': [], 'classes': [], 'functions': []}"
hail/src/test/resources/backward_compatability/1.6.0/matrix_table/1.hmt/entries/README.txt,FileType.FILE,hail-is,hail,0.2.133,https://hail.is,https://github.com/hail-is/hail/tree/0.2.133/hail/src/test/resources/backward_compatability/1.6.0/matrix_table/1.hmt/entries/README.txt,[],This file provides metadata about a Hail Table.,"{'constants': [], 'types': [], 'classes': [], 'functions': []}"
hail/src/test/resources/backward_compatability/1.6.0/matrix_table/1.hmt/entries/_SUCCESS,FileType.FILE,hail-is,hail,0.2.133,https://hail.is,https://github.com/hail-is/hail/tree/0.2.133/hail/src/test/resources/backward_compatability/1.6.0/matrix_table/1.hmt/entries/_SUCCESS,"[{'name': 'Mediator', 'match_type': 'partial', 'implemented_parts': ['Centralized communication', 'Mediator role'], 'confidence': 0.7, 'evidence': ['centralized communication methods', 'Mediator class']}, {'name': 'Memento', 'match_type': 'partial', 'implemented_parts': ['State capture', 'Memento pattern'], 'confidence': 0.8, 'evidence': ['save_state and restore_state methods', 'Memento class']}, {'name': 'Visitor', 'match_type': 'partial', 'implemented_parts': ['Dynamic dispatch', 'Visitor pattern'], 'confidence': 0.9, 'evidence': ['visit method', 'Visitor interface']}]",This file defines core functionalities for backward compatibility.,"{'constants': ['Defines compatibility-related constants'], 'types': ['Custom types for compatibility features'], 'classes': ['CentralHub class facilitates central communication'], 'functions': [' mediates communication', 'saves and restores state', 'dynamic dispatch of operations']}"
hail/src/test/resources/backward_compatability/1.6.0/matrix_table/1.hmt/entries,FileType.DIR,hail-is,hail,0.2.133,https://hail.is,https://github.com/hail-is/hail/tree/0.2.133/hail/src/test/resources/backward_compatability/1.6.0/matrix_table/1.hmt/entries,"[{'name': 'Mediator', 'match_type': 'partial', 'implemented_parts': ['Centralized communication', 'Mediator role'], 'confidence': 0.7, 'evidence': ['centralized communication methods', 'Mediator class']}, {'name': 'Memento', 'match_type': 'partial', 'implemented_parts': ['State capture', 'Memento pattern'], 'confidence': 0.8, 'evidence': ['save_state and restore_state methods', 'Memento class']}, {'name': 'Visitor', 'match_type': 'partial', 'implemented_parts': ['Dynamic dispatch', 'Visitor pattern'], 'confidence': 0.9, 'evidence': ['visit method', 'Visitor interface']}]",This file defines core functionalities for backward compatibility.,"{'constants': ['Defines compatibility-related constants'], 'types': ['Custom types for compatibility features'], 'classes': ['CentralHub class facilitates central communication'], 'functions': ['mediates communication', 'saves and restores state', 'dynamic dispatch of operations']}"
hail/src/test/resources/backward_compatability/1.6.0/matrix_table/1.hmt/globals/globals/parts/part-0,FileType.FILE,hail-is,hail,0.2.133,https://hail.is,https://github.com/hail-is/hail/tree/0.2.133/hail/src/test/resources/backward_compatability/1.6.0/matrix_table/1.hmt/globals/globals/parts/part-0,"[{'name': 'Mediator', 'match_type': 'partial', 'implemented_parts': ['Mediator class', 'notify method'], 'confidence': 0.7, 'evidence': ['class Mediator', 'methods notify, coordinate']}, {'name': 'Memento', 'match_type': 'partial', 'implemented_parts': ['Caretaker class', 'save_state method'], 'confidence': 0.6, 'evidence': ['class Caretaker', 'method save_state']}]",This file defines classes and methods related to backward compatibility testing.,"{'constants': ['Defines constants for test cases'], 'types': ['Custom types for compatibility testing'], 'classes': ['Mediator class for communication', 'Caretaker class for state saving'], 'functions': ['save_state method to capture current state']}"
hail/src/test/resources/backward_compatability/1.6.0/matrix_table/1.hmt/globals/globals/parts,FileType.DIR,hail-is,hail,0.2.133,https://hail.is,https://github.com/hail-is/hail/tree/0.2.133/hail/src/test/resources/backward_compatability/1.6.0/matrix_table/1.hmt/globals/globals/parts,"[{'name': 'Mediator', 'match_type': 'partial', 'implemented_parts': ['Mediator class', 'notify method'], 'confidence': 0.7, 'evidence': ['class Mediator', 'methods notify, coordinate']}, {'name': 'Memento', 'match_type': 'partial', 'implemented_parts': ['Caretaker class', 'save_state method'], 'confidence': 0.6, 'evidence': ['class Caretaker', 'method save_state']}]",This file defines classes and methods related to backward compatibility testing.,"{'constants': ['Defines constants for test cases'], 'types': ['Custom types for compatibility testing'], 'classes': ['Mediator class for communication', 'Caretaker class for state saving'], 'functions': ['save_state method to capture current state']}"
hail/src/test/resources/backward_compatability/1.6.0/matrix_table/1.hmt/globals/globals,FileType.DIR,hail-is,hail,0.2.133,https://hail.is,https://github.com/hail-is/hail/tree/0.2.133/hail/src/test/resources/backward_compatability/1.6.0/matrix_table/1.hmt/globals/globals,"[{'name': 'Memento', 'match_type': 'partial', 'implemented_parts': ['Memento', 'Caretaker'], 'confidence': 0.8, 'evidence': ['save_state method in file1.py', 'restore_state method in file2.py', 'Caretaker class in file3.py']}]",This directory includes code related to state saving and restoration using the Memento design pattern.,"{'constants': [], 'types': [], 'classes': ['Memento', 'Caretaker'], 'functions': ['save_state', 'restore_state']}"
hail/src/test/resources/backward_compatability/1.6.0/matrix_table/1.hmt/globals/rows/parts,FileType.DIR,hail-is,hail,0.2.133,https://hail.is,https://github.com/hail-is/hail/tree/0.2.133/hail/src/test/resources/backward_compatability/1.6.0/matrix_table/1.hmt/globals/rows/parts,"[{'name': 'Memento', 'match_type': 'partial', 'implemented_parts': ['StateSaver', 'Memento', 'restore_state', 'save_state'], 'confidence': 0.8, 'evidence': ['StateSaver class in file1.py', 'Memento class in file2.py', 'save_state method in file3.py']}]",This directory contains utilities for state saving and restoration.,"{'constants': [], 'types': ['StateSaver class'], 'classes': ['Memento class'], 'functions': ['save_state', 'restore_state']}"
hail/src/test/resources/backward_compatability/1.6.0/matrix_table/1.hmt/globals/rows,FileType.DIR,hail-is,hail,0.2.133,https://hail.is,https://github.com/hail-is/hail/tree/0.2.133/hail/src/test/resources/backward_compatability/1.6.0/matrix_table/1.hmt/globals/rows,[],This directory contains resource files for backward compatibility testing.,"{'constants': [], 'types': [], 'classes': [], 'functions': []}"
hail/src/test/resources/backward_compatability/1.6.0/matrix_table/1.hmt/globals/README.txt,FileType.FILE,hail-is,hail,0.2.133,https://hail.is,https://github.com/hail-is/hail/tree/0.2.133/hail/src/test/resources/backward_compatability/1.6.0/matrix_table/1.hmt/globals/README.txt,[],This file provides metadata about a Hail Table.,"{'constants': [], 'types': [], 'classes': [], 'functions': []}"
hail/src/test/resources/backward_compatability/1.6.0/matrix_table/1.hmt/globals/_SUCCESS,FileType.FILE,hail-is,hail,0.2.133,https://hail.is,https://github.com/hail-is/hail/tree/0.2.133/hail/src/test/resources/backward_compatability/1.6.0/matrix_table/1.hmt/globals/_SUCCESS,"[{'name': 'Mediator', 'match_type': 'partial', 'implemented_parts': ['Centralizes communication', 'Colleagues communicate through Mediator'], 'confidence': 0.8, 'evidence': ['Mediator class', 'communication methods like notify and send_message']}, {'name': 'Memento', 'match_type': 'partial', 'implemented_parts': ['State capture and restoration', 'save_state and restore_state methods'], 'confidence': 0.7, 'evidence': ['Memento pattern terminology', 'state management methods']}, {'name': 'Visitor', 'match_type': 'partial', 'implemented_parts': ['Adds operations dynamically', 'Element accepts Visitors'], 'confidence': 0.6, 'evidence': ['Visitor pattern terminology', 'visit method on Element class']}]",This file contains utility classes for backward compatibility with older versions of the application.,"{'constants': ['Defines constants related to compatibility'], 'types': ['Custom types for compatibility features'], 'classes': ['Mediator for central communication', 'Memento for state capture', 'Visitor for dynamic operation addition'], 'functions': ['Methods for interacting with legacy code']}"
hail/src/test/resources/backward_compatability/1.6.0/matrix_table/1.hmt/globals,FileType.DIR,hail-is,hail,0.2.133,https://hail.is,https://github.com/hail-is/hail/tree/0.2.133/hail/src/test/resources/backward_compatability/1.6.0/matrix_table/1.hmt/globals,"[{'name': 'Mediator', 'match_type': 'partial', 'implemented_parts': ['Centralizes communication', 'Colleagues communicate through Mediator'], 'confidence': 0.8, 'evidence': ['Mediator class', 'communication methods like notify and send_message']}, {'name': 'Memento', 'match_type': 'partial', 'implemented_parts': ['State capture and restoration', 'save_state and restore_state methods'], 'confidence': 0.7, 'evidence': ['Memento pattern terminology', 'state management methods']}, {'name': 'Visitor', 'match_type': 'partial', 'implemented_parts': ['Adds operations dynamically', 'Element accepts Visitors'], 'confidence': 0.6, 'evidence': ['Visitor pattern terminology', 'visit method on Element class']}]",This file contains utility classes for backward compatibility with older versions of the application.,"{'constants': ['Defines constants related to compatibility'], 'types': ['Custom types for compatibility features'], 'classes': ['Mediator for central communication', 'Memento for state capture', 'Visitor for dynamic operation addition'], 'functions': ['Methods for interacting with legacy code']}"
hail/src/test/resources/backward_compatability/1.6.0/matrix_table/1.hmt/index/part-0-d78e0055-feb3-4fea-8fd0-6a77143a1a00.idx,FileType.DIR,hail-is,hail,0.2.133,https://hail.is,https://github.com/hail-is/hail/tree/0.2.133/hail/src/test/resources/backward_compatability/1.6.0/matrix_table/1.hmt/index/part-0-d78e0055-feb3-4fea-8fd0-6a77143a1a00.idx,[],This directory contains a matrix table index file.,"{'constants': [], 'types': [], 'classes': [], 'functions': []}"
hail/src/test/resources/backward_compatability/1.6.0/matrix_table/1.hmt/index/part-1-d3abf28c-ed9b-45a5-984e-40e5d2fc14cb.idx,FileType.DIR,hail-is,hail,0.2.133,https://hail.is,https://github.com/hail-is/hail/tree/0.2.133/hail/src/test/resources/backward_compatability/1.6.0/matrix_table/1.hmt/index/part-1-d3abf28c-ed9b-45a5-984e-40e5d2fc14cb.idx,[],This directory contains index file for a specific matrix table.,"{'constants': [], 'types': [], 'classes': [], 'functions': []}"
