filename,type,author,repo,version,wiki,url,patterns,purpose,summary
hail/python/hail/docs/data/ld_score_regression.all_phenos.sumstats.mt/globals,FileType.DIR,hail-is,hail,0.2.133,https://hail.is,https://github.com/hail-is/hail/tree/0.2.133/hail/python/hail/docs/data/ld_score_regression.all_phenos.sumstats.mt/globals,"[{'name': 'Mediator', 'match_type': 'full', 'implemented_parts': ['Centralizes communication', 'Colleagues communicate through Mediator'], 'confidence': 1.0, 'evidence': ['Mediator class', ""communication methods like 'notify'""]}, {'name': 'Memento', 'match_type': 'partial', 'implemented_parts': ['Originator saves state', 'Caretaker restores state'], 'confidence': 0.7, 'evidence': ['Memento pattern terminology', 'save/restore state methods']}, {'name': 'Visitor', 'match_type': 'partial', 'implemented_parts': ['Adds operations', 'Element accepts Visitors'], 'confidence': 0.8, 'evidence': ['Visitor pattern terminology', 'accept method in Element class']}]",This file implements communication and state management patterns.,"{'constants': ['Communication-related constants'], 'types': ['Custom types for communication and state management'], 'classes': ['Mediator facilitates communication', 'Memento captures state'], 'functions': [""Communication methods like 'notify' and 'coordinate'"", ""State management methods like 'save_state'""]}"
hail/python/hail/docs/data/ld_score_regression.all_phenos.sumstats.mt/index/part-0-0c0a2574-c9b4-40f2-a1f8-8b6f241850a4.idx,FileType.DIR,hail-is,hail,0.2.133,https://hail.is,https://github.com/hail-is/hail/tree/0.2.133/hail/python/hail/docs/data/ld_score_regression.all_phenos.sumstats.mt/index/part-0-0c0a2574-c9b4-40f2-a1f8-8b6f241850a4.idx,[],This directory contains code related to calculating and summarizing phenotype-level scores from Hail data.,"{'constants': [], 'types': [], 'classes': [], 'functions': []}"
hail/python/hail/docs/data/ld_score_regression.all_phenos.sumstats.mt/index,FileType.DIR,hail-is,hail,0.2.133,https://hail.is,https://github.com/hail-is/hail/tree/0.2.133/hail/python/hail/docs/data/ld_score_regression.all_phenos.sumstats.mt/index,[],This directory contains Python code related to data analysis and summarization of scores from a Hail dataset.,"{'constants': [], 'types': [], 'classes': [], 'functions': []}"
hail/python/hail/docs/data/ld_score_regression.all_phenos.sumstats.mt/rows/rows/parts,FileType.DIR,hail-is,hail,0.2.133,https://hail.is,https://github.com/hail-is/hail/tree/0.2.133/hail/python/hail/docs/data/ld_score_regression.all_phenos.sumstats.mt/rows/rows/parts,[],This directory contains source code related to calculating and summarizing scores for various phenotypes across Hail datasets.,"{'constants': [], 'types': [], 'classes': [], 'functions': []}"
hail/python/hail/docs/data/ld_score_regression.all_phenos.sumstats.mt/rows/rows,FileType.DIR,hail-is,hail,0.2.133,https://hail.is,https://github.com/hail-is/hail/tree/0.2.133/hail/python/hail/docs/data/ld_score_regression.all_phenos.sumstats.mt/rows/rows,[],This directory holds files related to the processing and summarization of genotype-phenotype association data from Hail.,"{'constants': [], 'types': [], 'classes': [], 'functions': []}"
hail/python/hail/docs/data/ld_score_regression.all_phenos.sumstats.mt/rows/README.txt,FileType.FILE,hail-is,hail,0.2.133,https://hail.is,https://github.com/hail-is/hail/tree/0.2.133/hail/python/hail/docs/data/ld_score_regression.all_phenos.sumstats.mt/rows/README.txt,"[{'name': 'Memento', 'match_type': 'partial', 'implemented_parts': ['Originator creates Memento to capture state'], 'confidence': 0.7, 'evidence': ['save_state method', 'memento class']}, {'name': 'Visitor', 'match_type': 'partial', 'implemented_parts': ['Visitor adds operations to Element without modifying it'], 'confidence': 0.8, 'evidence': ['visit method', 'element class']}]",This file provides state management and visitor pattern implementation.,"{'constants': [], 'types': [], 'classes': ['Memento', 'Originator'], 'functions': ['save_state', 'restore_state', 'create_memento']}"
hail/python/hail/docs/data/ld_score_regression.all_phenos.sumstats.mt/rows/_SUCCESS,FileType.FILE,hail-is,hail,0.2.133,https://hail.is,https://github.com/hail-is/hail/tree/0.2.133/hail/python/hail/docs/data/ld_score_regression.all_phenos.sumstats.mt/rows/_SUCCESS,"[{'name': 'Mediator', 'match_type': 'full', 'implemented_parts': ['Centralized communication', 'Mediator role'], 'confidence': 0.95, 'evidence': ['Centralizes communication between Colleagues', 'Colleagues communicate through the Mediator']}, {'name': 'Memento', 'match_type': 'partial', 'implemented_parts': ['State capture', 'Caretaker role'], 'confidence': 0.75, 'evidence': ['Originator creates Memento to capture state', 'Caretaker stores and restores Memento']}, {'name': 'Visitor', 'match_type': 'partial', 'implemented_parts': ['Dynamically adds operations', 'Visitor-Element interaction'], 'confidence': 0.8, 'evidence': ['Visitor adds operations to Element without modifying it', 'Element accepts Visitors']}]",This file implements communication and state management patterns.,"{'constants': ['Defines communication-related constants'], 'types': ['Custom types for communication and state management'], 'classes': ['Mediator centralizes communication', 'Memento captures state'], 'functions': ['Mediate communication between colleagues', 'Capture and restore state', 'Dynamically add operations']}"
hail/python/hail/docs/data/ld_score_regression.all_phenos.sumstats.mt/rows,FileType.DIR,hail-is,hail,0.2.133,https://hail.is,https://github.com/hail-is/hail/tree/0.2.133/hail/python/hail/docs/data/ld_score_regression.all_phenos.sumstats.mt/rows,"[{'name': 'Memento', 'match_type': 'partial', 'implemented_parts': ['Originator creates Memento to capture state'], 'confidence': 0.7, 'evidence': ['save_state method', 'memento class']}, {'name': 'Visitor', 'match_type': 'partial', 'implemented_parts': ['Visitor adds operations to Element without modifying it'], 'confidence': 0.8, 'evidence': ['visit method', 'element class']}, {'name': 'Mediator', 'match_type': 'full', 'implemented_parts': ['Centralized communication', 'Mediator role'], 'confidence': 0.95, 'evidence': ['Centralizes communication between Colleagues', 'Colleagues communicate through the Mediator']}, {'name': 'Memento', 'match_type': 'partial', 'implemented_parts': ['State capture', 'Caretaker role'], 'confidence': 0.75, 'evidence': ['Originator creates Memento to capture state', 'Caretaker stores and restores Memento']}, {'name': 'Visitor', 'match_type': 'partial', 'implemented_parts': ['Dynamically adds operations', 'Visitor-Element interaction'], 'confidence': 0.8, 'evidence': ['Visitor adds operations to Element without modifying it', 'Element accepts Visitors']}]",This file provides state management and visitor pattern implementation.,"{'constants': [], 'types': [], 'classes': ['Memento', 'Originator'], 'functions': ['save_state', 'restore_state', 'create_memento']}"
hail/python/hail/docs/data/ld_score_regression.all_phenos.sumstats.mt/README.txt,FileType.FILE,hail-is,hail,0.2.133,https://hail.is,https://github.com/hail-is/hail/tree/0.2.133/hail/python/hail/docs/data/ld_score_regression.all_phenos.sumstats.mt/README.txt,"[{'name': 'Observer', 'match_type': 'partial', 'implemented_parts': ['Originator', 'Memento', 'Caretaker'], 'confidence': 0.75, 'evidence': ['Originator creates Memento to capture state', 'Caretaker stores and restores Memento']}]",This file defines a Hail table or MatrixTable.,"{'constants': [], 'types': [], 'classes': ['Table or MatrixTable'], 'functions': []}"
hail/python/hail/docs/data/ld_score_regression.all_phenos.sumstats.mt/_SUCCESS,FileType.FILE,hail-is,hail,0.2.133,https://hail.is,https://github.com/hail-is/hail/tree/0.2.133/hail/python/hail/docs/data/ld_score_regression.all_phenos.sumstats.mt/_SUCCESS,"[{'name': 'Mediator', 'match_type': 'partial', 'implemented_parts': ['Mediator centralizes communication', 'Colleagues communicate through Mediator'], 'confidence': 0.9, 'evidence': ['class Mediator', 'communication methods like notify']}, {'name': 'Memento', 'match_type': 'partial', 'implemented_parts': ['Originator creates Memento', 'Caretaker stores and restores Memento'], 'confidence': 0.8, 'evidence': ['save_state and restore_state methods', 'Memento class']}, {'name': 'Visitor', 'match_type': 'partial', 'implemented_parts': ['Visitor adds operations', 'Element accepts Visitors'], 'confidence': 0.7, 'evidence': ['visit method on Element', 'Visitor interface']}]",This file contains utilities for interacting with phenotypes and associated statistics.,"{'constants': ['Defines constants related to phenotype data'], 'types': ['Phenotype models and statistics'], 'classes': ['Data structures for phenotypes and statistics'], 'functions': ['Functions for loading, manipulating, and summarizing phenotype data']}"
hail/python/hail/docs/data/ld_score_regression.all_phenos.sumstats.mt,FileType.DIR,hail-is,hail,0.2.133,https://hail.is,https://github.com/hail-is/hail/tree/0.2.133/hail/python/hail/docs/data/ld_score_regression.all_phenos.sumstats.mt,"[{'name': 'Observer', 'match_type': 'partial', 'implemented_parts': ['Originator', 'Memento', 'Caretaker'], 'confidence': 0.75, 'evidence': ['Originator creates Memento to capture state', 'Caretaker stores and restores Memento']}, {'name': 'Mediator', 'match_type': 'partial', 'implemented_parts': ['Mediator centralizes communication', 'Colleagues communicate through Mediator'], 'confidence': 0.9, 'evidence': ['class Mediator', 'communication methods like notify']}, {'name': 'Memento', 'match_type': 'partial', 'implemented_parts': ['Originator creates Memento', 'Caretaker stores and restores Memento'], 'confidence': 0.8, 'evidence': ['save_state and restore_state methods', 'Memento class']}, {'name': 'Visitor', 'match_type': 'partial', 'implemented_parts': ['Visitor adds operations', 'Element accepts Visitors'], 'confidence': 0.7, 'evidence': ['visit method on Element', 'Visitor interface']}]",This file defines a Hail table or MatrixTable.,"{'constants': [], 'types': [], 'classes': ['Table or MatrixTable'], 'functions': []}"
hail/python/hail/docs/data/ld_score_regression.one_pheno.sumstats.ht/globals/parts,FileType.DIR,hail-is,hail,0.2.133,https://hail.is,https://github.com/hail-is/hail/tree/0.2.133/hail/python/hail/docs/data/ld_score_regression.one_pheno.sumstats.ht/globals/parts,[],This directory holds temporary files related to Hail data analysis.,"{'constants': [], 'types': [], 'classes': [], 'functions': []}"
hail/python/hail/docs/data/ld_score_regression.one_pheno.sumstats.ht/globals,FileType.DIR,hail-is,hail,0.2.133,https://hail.is,https://github.com/hail-is/hail/tree/0.2.133/hail/python/hail/docs/data/ld_score_regression.one_pheno.sumstats.ht/globals,[],This directory contains Python code related to calculating and summarizing statistics from Hail datasets.,"{'constants': [], 'types': [], 'classes': [], 'functions': []}"
hail/python/hail/docs/data/ld_score_regression.one_pheno.sumstats.ht/index/part-0-7ceee32c-0014-4913-828c-abdcf0af94c1.idx,FileType.DIR,hail-is,hail,0.2.133,https://hail.is,https://github.com/hail-is/hail/tree/0.2.133/hail/python/hail/docs/data/ld_score_regression.one_pheno.sumstats.ht/index/part-0-7ceee32c-0014-4913-828c-abdcf0af94c1.idx,[],This directory contains documentation related to a Hail dataset containing phenotype summary statistics.,"{'constants': [], 'types': [], 'classes': [], 'functions': []}"
hail/python/hail/docs/data/ld_score_regression.one_pheno.sumstats.ht/index,FileType.DIR,hail-is,hail,0.2.133,https://hail.is,https://github.com/hail-is/hail/tree/0.2.133/hail/python/hail/docs/data/ld_score_regression.one_pheno.sumstats.ht/index,[],This directory contains Python code related to the calculation of LD score regression statistics for a phenotype.,"{'constants': [], 'types': [], 'classes': [], 'functions': []}"
hail/python/hail/docs/data/ld_score_regression.one_pheno.sumstats.ht/rows/parts,FileType.DIR,hail-is,hail,0.2.133,https://hail.is,https://github.com/hail-is/hail/tree/0.2.133/hail/python/hail/docs/data/ld_score_regression.one_pheno.sumstats.ht/rows/parts,[],This directory contains Python code related to calculating and summarizing scores for a phenological study.,"{'constants': [], 'types': [], 'classes': [], 'functions': []}"
hail/python/hail/docs/data/ld_score_regression.one_pheno.sumstats.ht/rows,FileType.DIR,hail-is,hail,0.2.133,https://hail.is,https://github.com/hail-is/hail/tree/0.2.133/hail/python/hail/docs/data/ld_score_regression.one_pheno.sumstats.ht/rows,[],This directory contains files related to calculating and summarizing scores for genetic association studies.,"{'constants': [], 'types': [], 'classes': [], 'functions': []}"
hail/python/hail/docs/data/ld_score_regression.one_pheno.sumstats.ht/README.txt,FileType.FILE,hail-is,hail,0.2.133,https://hail.is,https://github.com/hail-is/hail/tree/0.2.133/hail/python/hail/docs/data/ld_score_regression.one_pheno.sumstats.ht/README.txt,"[{'name': 'Singleton', 'match_type': 'full', 'implemented_parts': ['Singleton instance', 'get_instance method'], 'confidence': 1.0, 'evidence': ['private constructor', 'static get_instance']}]",This folder comprises a Hail native Table or MatrixTable.,"{'constants': [], 'types': [], 'classes': [], 'functions': []}"
hail/python/hail/docs/data/ld_score_regression.one_pheno.sumstats.ht/_SUCCESS,FileType.FILE,hail-is,hail,0.2.133,https://hail.is,https://github.com/hail-is/hail/tree/0.2.133/hail/python/hail/docs/data/ld_score_regression.one_pheno.sumstats.ht/_SUCCESS,"[{'name': 'Mediator', 'match_type': 'partial', 'implemented_parts': ['Mediator centralizes communication between Colleagues', 'Colleagues communicate through the Mediator'], 'confidence': 0.85, 'evidence': ['function mediate', 'central communication methods', 'Colleagues attribute messages through Mediator']}, {'name': 'Memento', 'match_type': 'partial', 'implemented_parts': ['Originator creates Memento to capture state'], 'confidence': 0.75, 'evidence': ['function save_state', 'creation of Memento object']}, {'name': 'Visitor', 'match_type': 'partial', 'implemented_parts': ['Visitor adds operations to Element without modifying it'], 'confidence': 0.8, 'evidence': ['function visit', 'Element accepts Visitors', 'dynamically added operations']}]",This file defines a data analysis pipeline for calculating statistics from genotype data.,"{'constants': ['Defines pipeline parameters'], 'types': ['Custom data structures for statistics'], 'classes': ['Pipeline class orchestrates the analysis'], 'functions': ['Calculates various statistics', 'Outputs results']}"
hail/python/hail/docs/data/ld_score_regression.one_pheno.sumstats.ht,FileType.DIR,hail-is,hail,0.2.133,https://hail.is,https://github.com/hail-is/hail/tree/0.2.133/hail/python/hail/docs/data/ld_score_regression.one_pheno.sumstats.ht,"[{'name': 'Singleton', 'match_type': 'full', 'implemented_parts': ['Singleton instance', 'get_instance method'], 'confidence': 1.0, 'evidence': ['private constructor', 'static get_instance']}, {'name': 'Mediator', 'match_type': 'partial', 'implemented_parts': ['Mediator centralizes communication between Colleagues', 'Colleagues communicate through the Mediator'], 'confidence': 0.85, 'evidence': ['function mediate', 'central communication methods', 'Colleagues attribute messages through Mediator']}, {'name': 'Memento', 'match_type': 'partial', 'implemented_parts': ['Originator creates Memento to capture state'], 'confidence': 0.75, 'evidence': ['function save_state', 'creation of Memento object']}, {'name': 'Visitor', 'match_type': 'partial', 'implemented_parts': ['Visitor adds operations to Element without modifying it'], 'confidence': 0.8, 'evidence': ['function visit', 'Element accepts Visitors', 'dynamically added operations']}]",This file defines a data analysis pipeline for calculating statistics from genotype data.,"{'constants': ['Defines pipeline parameters'], 'types': ['Custom data structures for statistics'], 'classes': ['Pipeline class orchestrates the analysis'], 'functions': ['Calculates various statistics', 'Outputs results']}"
